Brad Pitt, Time, In 2007, he appeared on Time 100 Time 100 list, a compilation of 100 most influential people in world, as selected annually by Time (magazine) Time magazine.
Brad Pitt, Time, Pitt will next star alongside his Once Upon a Time in Hollywood co star Margot Robbie in Babylon directed by Damien Chazelle and in Bullet Train (film)
Brad Pitt, Aldo Raine, Pitt played Lieutenant Aldo Raine, an American resistance fighter battling Nazis in German occupied France.
Brad Pitt, Nazis, Pitt played Lieutenant Aldo Raine, an American resistance fighter battling Nazis in German occupied France.
Brad Pitt, German, In 2016, Pitt starred in Robert Zemeckis's romantic thriller Allied (film) Allied, in which he plays a spy assassin who falls in love with a French spy (played by Marion Cotillard) during a mission to kill a German official in World War II.
Brad Pitt, German, Pitt played Lieutenant Aldo Raine, an American resistance fighter battling Nazis in German occupied France.
Brad Pitt, France, They were married on August 23, 2014, in a private ceremony in Château Miraval, Correns Var Château Miraval, France.
Brad Pitt, France, Set in Pitt's Château Miraval, Correns Var Chateau Miraval in South of France, Miraval Studios will re open in 2022 after two decades of inactivity.
Brad Pitt, France, Pitt played Lieutenant Aldo Raine, an American resistance fighter battling Nazis in German occupied France.
Brad Pitt, France, She gave birth to son Knox Léon and daughter Vivienne Marcheline on July 12, 2008 in Nice, France.
Brad Pitt, eight, The film received multiple List of accolades received by Inglourious Basterds awards and nominations, including eight Academy Award nominations and seven MTV Movie Award nominations, including MTV Movie Award for Best Performance Best Male Performance for Pitt.
Brad Pitt, eight, On November 22, 2001, Pitt made a guest appearance in The One with Rumor eighth season of television series Friends, playing a man with a grudge against Rachel Green, played by Jennifer Aniston, to whom Pitt was married at time.
Brad Pitt, MTV Movie Award, Despite his winning two MTV Movie Awards at 1995 MTV Movie Awards 1995 ceremony, his performance was poorly received.
Brad Pitt, MTV Movie Award, The film received multiple List of accolades received by Inglourious Basterds awards and nominations, including eight Academy Award nominations and seven MTV Movie Award nominations, including MTV Movie Award for Best Performance Best Male Performance for Pitt.
Brad Pitt, MTV Movie Award for Best Performance Best Male Performance, The film received multiple List of accolades received by Inglourious Basterds awards and nominations, including eight Academy Award nominations and seven MTV Movie Award nominations, including MTV Movie Award for Best Performance Best Male Performance for Pitt.
Brad Pitt, superhero, He next voiced superhero character Metro Man in 2010 animated feature Megamind.
Brad Pitt, Metro Man, He next voiced superhero character Metro Man in 2010 animated feature Megamind.
Brad Pitt, 2010, He next voiced superhero character Metro Man in 2010 animated feature Megamind.
Brad Pitt, 2010, In January 2010, foundation donated $1&nbsp;million to Doctors Without Borders for emergency medical assistance to help victims of 2010 Haiti earthquake Haiti earthquake.
Brad Pitt, Megamind, He next voiced superhero character Metro Man in 2010 animated feature Megamind.
Brad Pitt, Terrence Malick's, Pitt produced and appeared in Terrence Malick's experimental drama The Tree of Life (film)
Brad Pitt, Film Festival, The film was screened at a special presentation at 2006 Cannes Film Festival and was later featured at 2006 Toronto International Film Festival.
Brad Pitt, Film Festival, At 2008 Cannes Film Festival Cannes Film Festival in May 2008, Jolie confirmed that she was expecting twins.
Brad Pitt, Film Festival, The Tree of Life, co starring Sean Penn, which won Palme d'Or at 2011 Cannes Film Festival.
Brad Pitt, Film Festival, Fight Club premiered at 1999 Venice International Film Festival.
Brad Pitt, Film Festival, He eventually collected award one year later at 65th Venice International Film Festival 2008 festival.
Brad Pitt, Film Festival, Pitt's next leading role came in 2009 with Quentin Tarantino directed war film Inglourious Basterds, which premiered at 2009 Cannes Film Festival.
Brad Pitt, Film Festival, Directed by Andrew Dominik and produced by Pitt's company Plan B Entertainment, film premiered at 64th Venice International Film Festival 2007 Venice Film Festival, with Pitt playing a "scary and charismatic" role, according to Lewis Beale of Film Journal International, and earning Pitt Volpi Cup award for Best Actor at 64th Venice International Film Festival.
Brad Pitt, Oakland Athletics, In a performance that attracted strong praise, he portrayed Oakland Athletics general manager Billy Beane in drama Moneyball (film) Moneyball, which is based on 2003 Moneyball book of same name written by Michael Lewis.
Brad Pitt, Billy Beane, In a performance that attracted strong praise, he portrayed Oakland Athletics general manager Billy Beane in drama Moneyball (film) Moneyball, which is based on 2003 Moneyball book of same name written by Michael Lewis.
Brad Pitt, Michael Lewis, In a performance that attracted strong praise, he portrayed Oakland Athletics general manager Billy Beane in drama Moneyball (film) Moneyball, which is based on 2003 Moneyball book of same name written by Michael Lewis.
Brad Pitt, Best Picture and Best Actor, Moneyball received six Academy Award nominations including Best Picture and Best Actor for Pitt.
Brad Pitt, Jackie Cogan, His next role was as mob hitman Jackie Cogan in Andrew Dominik's 2012 Killing Them Softly, based on novel Cogan's Trade by George V. Higgins.
Brad Pitt, Andrew Dominik's, His next role was as mob hitman Jackie Cogan in Andrew Dominik's 2012 Killing Them Softly, based on novel Cogan's Trade by George V. Higgins.
Brad Pitt, Cogan, His next role was as mob hitman Jackie Cogan in Andrew Dominik's 2012 Killing Them Softly, based on novel Cogan's Trade by George V. Higgins.
Brad Pitt, George V. Higgins, His next role was as mob hitman Jackie Cogan in Andrew Dominik's 2012 Killing Them Softly, based on novel Cogan's Trade by George V. Higgins.
Brad Pitt, Max Brooks's, In 2013, Pitt starred in World War Z (film) World War Z, a thriller about a zombie apocalypse, based on Max Brooks's World War Z novel of same name.
Brad Pitt, 540&nbsp;million, World War Z grossed $540&nbsp;million at box office worldwide, becoming Pitt's highest grossing picture.
Brad Pitt, Solomon Northup, Next in 2013, he produced, and played a small role in, 12 Years a Slave (film) 12 Years a Slave, a historical drama based on autobiography of Solomon Northup.
Brad Pitt, nine, The film received critical acclaim and was nominated for nine Academy Awards, winning three, including Academy Award for Best Picture Best Picture.
Brad Pitt, Academy Award for Best Picture Best Picture, The film received critical acclaim and was nominated for nine Academy Awards, winning three, including Academy Award for Best Picture Best Picture.
Brad Pitt, Ridley Scott, After years of supporting roles in film and frequent television guest appearances, Pitt attracted wider recognition in his supporting role in Ridley Scott's 1991 road film Thelma & Louise.
Brad Pitt, Ridley Scott, Also in 2013, Pitt had a supporting role in Ridley Scott's The Counselor.
Brad Pitt, 2013–2014, Plan B Entertainment landed its first television series on 2013–2014 schedule, as their joint venture with ABC Studios, sci fi/fantasy drama Resurrection (U.S. TV series) Resurrection, was picked up by American Broadcasting Company ABC.
Brad Pitt, ABC Studios, Plan B Entertainment landed its first television series on 2013–2014 schedule, as their joint venture with ABC Studios, sci fi/fantasy drama Resurrection (U.S. TV series) Resurrection, was picked up by American Broadcasting Company ABC.
Brad Pitt, sci fi/fantasy, Plan B Entertainment landed its first television series on 2013–2014 schedule, as their joint venture with ABC Studios, sci fi/fantasy drama Resurrection (U.S. TV series) Resurrection, was picked up by American Broadcasting Company ABC.
Brad Pitt, Resurrection (U.S. TV, Plan B Entertainment landed its first television series on 2013–2014 schedule, as their joint venture with ABC Studios, sci fi/fantasy drama Resurrection (U.S. TV series) Resurrection, was picked up by American Broadcasting Company ABC.
Brad Pitt, War Machine, In 2017, he starred in Netflix satirical war comedy War Machine (film) War Machine, which he also produced.
Brad Pitt, Fury, Pitt starred in Fury (2014 film) Fury, a World War II film directed and written by David Ayer, and co starring Shia LaBeouf, Logan Lerman, Jon Bernthal, Michael Peña, and Jason Issacs.
Brad Pitt, Fury, By end of its run, Fury proved to be a commercial and critical success; it grossed more than $211&nbsp;million worldwide and received highly positive reviews from critics.
Brad Pitt, 2014, They were married on August 23, 2014, in a private ceremony in Château Miraval, Correns Var Château Miraval, France.
Brad Pitt, 2014, The film was released on October 17, 2014.
Brad Pitt, 2014, Pitt starred in Fury (2014 film) Fury, a World War II film directed and written by David Ayer, and co starring Shia LaBeouf, Logan Lerman, Jon Bernthal, Michael Peña, and Jason Issacs.
Brad Pitt, 2014, Plan B Entertainment landed its first television series on 2013–2014 schedule, as their joint venture with ABC Studios, sci fi/fantasy drama Resurrection (U.S. TV series) Resurrection, was picked up by American Broadcasting Company ABC.
Brad Pitt, World War II, In 2016, Pitt starred in Robert Zemeckis's romantic thriller Allied (film) Allied, in which he plays a spy assassin who falls in love with a French spy (played by Marion Cotillard) during a mission to kill a German official in World War II.
Brad Pitt, World War II, Pitt starred in Fury (2014 film) Fury, a World War II film directed and written by David Ayer, and co starring Shia LaBeouf, Logan Lerman, Jon Bernthal, Michael Peña, and Jason Issacs.
Brad Pitt, David Ayer, Pitt starred in Fury (2014 film) Fury, a World War II film directed and written by David Ayer, and co starring Shia LaBeouf, Logan Lerman, Jon Bernthal, Michael Peña, and Jason Issacs.
Brad Pitt, Shia LaBeouf, Pitt starred in Fury (2014 film) Fury, a World War II film directed and written by David Ayer, and co starring Shia LaBeouf, Logan Lerman, Jon Bernthal, Michael Peña, and Jason Issacs.
Brad Pitt, Logan Lerman, Pitt starred in Fury (2014 film) Fury, a World War II film directed and written by David Ayer, and co starring Shia LaBeouf, Logan Lerman, Jon Bernthal, Michael Peña, and Jason Issacs.
Brad Pitt, Jon Bernthal, Pitt starred in Fury (2014 film) Fury, a World War II film directed and written by David Ayer, and co starring Shia LaBeouf, Logan Lerman, Jon Bernthal, Michael Peña, and Jason Issacs.
Brad Pitt, Michael Peña, Pitt starred in Fury (2014 film) Fury, a World War II film directed and written by David Ayer, and co starring Shia LaBeouf, Logan Lerman, Jon Bernthal, Michael Peña, and Jason Issacs.
Brad Pitt, Jason Issacs, Pitt starred in Fury (2014 film) Fury, a World War II film directed and written by David Ayer, and co starring Shia LaBeouf, Logan Lerman, Jon Bernthal, Michael Peña, and Jason Issacs.
Brad Pitt, October 17, 2014, The film was released on October 17, 2014.
Brad Pitt, more than $211&nbsp;million, By end of its run, Fury proved to be a commercial and critical success; it grossed more than $211&nbsp;million worldwide and received highly positive reviews from critics.
Brad Pitt, By Sea, In 2015, Pitt starred opposite his wife, Jolie, in her third directorial effort, By Sea (2015 film)
Brad Pitt, By Sea, By Sea, a romantic drama about a marriage in crisis, based on her screenplay.
Brad Pitt, The Big Short, The Big Short, which he also produced and also co starred alongside Christian Bale, Steve Carell, and Ryan Gosling.
Brad Pitt, The Big Short, The Big Short (2015), all of which were nominated for Best Picture.
Brad Pitt, The Big Short, The Tree of Life (2011), Moneyball (2011) and The Big Short (film)
Brad Pitt, The Big Short, Pitt's next role came with biographical comedy drama The Big Short (film)
Brad Pitt, Christian Bale, The Big Short, which he also produced and also co starred alongside Christian Bale, Steve Carell, and Ryan Gosling.
Brad Pitt, Steve Carell, The Big Short, which he also produced and also co starred alongside Christian Bale, Steve Carell, and Ryan Gosling.
Brad Pitt, Ryan Gosling, The Big Short, which he also produced and also co starred alongside Christian Bale, Steve Carell, and Ryan Gosling.
Brad Pitt, $102 million, It went on to gross over $102 million worldwide and received positive reviews from critics.
Brad Pitt, five, The film was nominated for five Academy Awards, including Best Picture, earning Pitt his third Academy Award nomination as producer.
Brad Pitt, Robert Zemeckis's, In 2016, Pitt starred in Robert Zemeckis's romantic thriller Allied (film) Allied, in which he plays a spy assassin who falls in love with a French spy (played by Marion Cotillard) during a mission to kill a German official in World War II.
Brad Pitt, Allied, In 2016, Pitt starred in Robert Zemeckis's romantic thriller Allied (film) Allied, in which he plays a spy assassin who falls in love with a French spy (played by Marion Cotillard) during a mission to kill a German official in World War II.
Brad Pitt, French, In 2021, Pitt entered recording business by creating a company with French record producer Damien Quintard.
Brad Pitt, French, In 2016, Pitt starred in Robert Zemeckis's romantic thriller Allied (film) Allied, in which he plays a spy assassin who falls in love with a French spy (played by Marion Cotillard) during a mission to kill a German official in World War II.
Brad Pitt, Marion Cotillard, In 2016, Pitt starred in Robert Zemeckis's romantic thriller Allied (film) Allied, in which he plays a spy assassin who falls in love with a French spy (played by Marion Cotillard) during a mission to kill a German official in World War II.
Brad Pitt, Robert Zemeckis, In 2016, Pitt starred in Robert Zemeckis's romantic thriller Allied (film) Allied, in which he plays a spy assassin who falls in love with a French spy (played by Marion Cotillard) during a mission to kill a German official in World War II.
Brad Pitt, 5, In July 2005, Pitt accompanied Jolie to Addis Ababa, Ethiopia, where she adopted her second child, Zahara Marley.
Brad Pitt, 5, Despite his winning two MTV Movie Awards at 1995 MTV Movie Awards 1995 ceremony, his performance was poorly received.
Brad Pitt, 5, For U.S. market, he starred in a Heineken Pilsener Heineken commercial aired during Super Bowl XXXIX 2005 Super Bowl; it was directed by David Fincher, who had directed Pitt in Seven, Fight Club, and The Curious Case of Benjamin Button.
Brad Pitt, 5, Mr. & Mrs. Smith (2005), World War Z (film) World War Z (2013), and Once Upon a Time in Hollywood (2019), for which he won a second Golden Globe Award and Academy Award for Best Supporting Actor.
Brad Pitt, 5, He gave critically acclaimed performances in crime thriller Seven (1995 film) Seven (1995) and science fiction film 12 Monkeys (1995), latter earning him a Golden Globe Award for Best Supporting Actor – Motion Picture Golden Globe Award for Best Supporting Actor and an Academy Award nomination.
Brad Pitt, 5, Mr. & Mrs. Smith earned $478&nbsp;million worldwide, making it one of biggest hits of 2005.
Brad Pitt, 5, World War Z grossed $540&nbsp;million at box office worldwide, becoming Pitt's highest grossing picture.
Brad Pitt, 5, Pitt appeared on Forbes' annual Forbes Celebrity 100 Celebrity 100 list of 100 most powerful celebrities from 2006 to 2008 placing at numbers 20, 5 and 10, respectively.
Brad Pitt, 5, Right Foundation New Orleans Make It Right Foundation, organizing housing professionals in New Orleans to finance and construct 150&nbsp;sustainable, affordable new houses in New Orleans's Ninth Ward of New Orleans Ninth Ward following devastation caused by Hurricane Katrina.
Brad Pitt, 5, Pitt and Aniston's divorce was finalized by Los Angeles Superior Court on October 2, 2005.
Brad Pitt, 5, Throughout 2005, two were seen together with increasing frequency, and entertainment media dubbed couple "Brangelina".
Brad Pitt, 5, In 2015, Pitt starred opposite his wife, Jolie, in her third directorial effort, By Sea (2015 film)
Brad Pitt, 5, In April 2005, one month after Aniston filed for divorce, a set of paparazzi photographs emerged showing Pitt, Jolie, and her son Maddox at a beach in Kenya; press interpreted pictures as evidence of a relationship between Pitt and Jolie.
Brad Pitt, 5, The Big Short (2015), all of which were nominated for Best Picture.
Brad Pitt, 5, Pitt's public image is strongly tied to his perceived sex appeal, with Empire (film magazine) Empire magazine naming him one of 25 sexiest stars in film history in 1995.
Brad Pitt, 5, Pitt and philanthropist Steve Bing have each committed $5&nbsp;million in donations.
Brad Pitt, 5, In 1995, Pitt starred alongside Morgan Freeman, Gwyneth Paltrow, and Kevin Spacey in crime thriller Seven (1995 film) Seven, playing a detective on trail of a serial killer who preys on people he considers guilty of Seven Deadly Sins.
Brad Pitt, 5, On December 3, 2005, Pitt was in process of becoming adoptive father of Zahara, and Jolie's first adopted child, Maddox Chivan.
Brad Pitt, 5, Well received by critics, Ocean's Eleven was highly successful at box office, earning $450&nbsp;million worldwide.
Brad Pitt, 5, In January 2005, Pitt and Aniston announced they had decided to separate.
Brad Pitt, 5, Following success of Seven, Pitt played psychotic anarchy anarchist Jeffrey Goines in Terry Gilliam's 1995 science fiction film 12 Monkeys.
Brad Pitt, 5, Hello! obtained British rights for approximately $3.5&nbsp;million.
Brad Pitt, 5, According to federal filings, Pitt and Jolie invested $8.5&nbsp;million into foundation in 2006; it gave away $2.4&nbsp;million in 2006 and $3.4&nbsp;million in 2007.
Brad Pitt, 5, Beginning in 2005, Pitt's relationship with Angelina Jolie became one of world's most reported celebrity stories.
Brad Pitt, 5, Most recently, on January 5, 2022, he signed a deal with Apple Inc. Apple to create a racing film on Formula One.
Brad Pitt, 5, He eventually collected award one year later at 65th Venice International Film Festival 2008 festival.
Brad Pitt, 5, The film was their first collaboration since 2005's Mr. & Mrs. Smith.
Brad Pitt, 5, On March 15, 2007, Jolie adopted three year old Pax Thien from an orphanage in Ho Chi Minh City, Vietnam.
Brad Pitt, 5, His greatest commercial successes have been Ocean's Eleven (2001), Troy (film) Troy (2004), Mr. & Mrs. Smith (2005 film)
Brad Pitt, 5, In 2005, Pitt starred as John Smith in Doug Liman directed action comedy Mr. & Mrs. Smith (2005 film) Mr. & Mrs. Smith, in which a bored married couple discover that each is an assassin sent to kill other.
Brad Pitt, 5, On June 2, 2015, minor planet 29132 Bradpitt was named in his honor.
Brad Pitt, 5, He narrated 2005 Public Broadcasting Service PBS public television series Rx for Survival  A Global Health Challenge, which discusses current global health issues.
Brad Pitt, Robert Zemeckis', In 2016, Pitt starred in Robert Zemeckis's romantic thriller Allied (film) Allied, in which he plays a spy assassin who falls in love with a French spy (played by Marion Cotillard) during a mission to kill a German official in World War II.
Brad Pitt, Netflix, In 2017, he starred in Netflix satirical war comedy War Machine (film) War Machine, which he also produced.
Brad Pitt, New York Times, Janet Maslin of The New York Times called Twelve Monkeys "fierce and disturbing" and remarked on Pitt's "startlingly frenzied performance", concluding that he "electrifies Jeffrey with a weird magnetism that becomes important later in film."
Brad Pitt, New York Times, Janet Maslin of The New York Times said, "Pitt's diffident mix of acting and attitude works to such heartthrob perfection it's a shame film's superficiality gets in his way."
Brad Pitt, late night, Pitt played a recurring role as a weatherman on late night talk show The Jim Jefferies Show throughout 2017.
Brad Pitt, The Jim Jefferies Show, Pitt played a recurring role as a weatherman on late night talk show The Jim Jefferies Show throughout 2017.
Brad Pitt, Paramount, Troy was first film produced by Plan B Entertainment, a film production company he had founded two years earlier with Jennifer Aniston and Brad Grey, CEO of Paramount Pictures.
Brad Pitt, Forbes, Pitt appeared on Forbes' annual Forbes Celebrity 100 Celebrity 100 list of 100 most powerful celebrities from 2006 to 2008 placing at numbers 20, 5 and 10, respectively.
Brad Pitt, 27, Jolie gave birth to daughter Shiloh Nouvel in Swakopmund, Namibia, on May 27, 2006.
Brad Pitt, 27, Seven earned $327&nbsp;million at international box office.
Brad Pitt, Cliff Booth, Pitt starred as Cliff Booth, a stunt double, opposite Leonardo DiCaprio, in Quentin Tarantino's 2019 film Once Upon a Time in Hollywood.
Brad Pitt, Leonardo DiCaprio, Pitt starred as Cliff Booth, a stunt double, opposite Leonardo DiCaprio, in Quentin Tarantino's 2019 film Once Upon a Time in Hollywood.
Brad Pitt, Quentin Tarantino's, Pitt starred as Cliff Booth, a stunt double, opposite Leonardo DiCaprio, in Quentin Tarantino's 2019 film Once Upon a Time in Hollywood.
Brad Pitt, Best Supporting Actor, Category Best Supporting Actor Golden Globe (film) winners
Brad Pitt, Best Supporting Actor, Category Best Supporting Actor Academy Award winners
Brad Pitt, Best Supporting Actor, Mr. & Mrs. Smith (2005), World War Z (film) World War Z (2013), and Once Upon a Time in Hollywood (2019), for which he won a second Golden Globe Award and Academy Award for Best Supporting Actor.
Brad Pitt, Best Supporting Actor, He gave critically acclaimed performances in crime thriller Seven (1995 film) Seven (1995) and science fiction film 12 Monkeys (1995), latter earning him a Golden Globe Award for Best Supporting Actor – Motion Picture Golden Globe Award for Best Supporting Actor and an Academy Award nomination.
Brad Pitt, Best Supporting Actor, He won a Golden Globe Award for Golden Globe Award for Best Supporting Actor – Motion Picture Best Supporting Actor for film and received his first Academy Award nomination for Academy Award for Best Supporting Actor Best Supporting Actor.
Brad Pitt, Best Supporting Actor, Babel received seven Academy and Golden Globe award nominations, winning Golden Globe Award for Best Motion Picture&nbsp;– Drama Best Drama Golden Globe, and earned Pitt a nomination for Golden Globe Award for Best Supporting Actor – Motion Picture Best Supporting Actor Golden Globe.
Brad Pitt, Best Supporting Actor, Category Best Supporting Actor BAFTA Award winners
Brad Pitt, Best Supporting Actor, For his performance in film, he received awards for Best Supporting Actor at Academy Awards, Golden Globe Awards, BAFTA Award for Best Actor in a Supporting Role BAFTA Awards, Screen Actors Guild Award for Outstanding Performance by a Male Actor in a Supporting Role Screen Actors Guild Awards, and Critics' Choice Movie Award for Best Supporting Actor Critics' Choice Movie Awards.
Brad Pitt, Best Supporting Actor, Pitt is second actor to have won Academy Awards for both Best Supporting Actor and Best Picture.
Brad Pitt, Screen Actors Guild Award, The performance earned Pitt his first Screen Actors Guild Award nomination, as well as a fourth Golden Globe and second Academy Award nomination, all in category for Best Actor.
Brad Pitt, Screen Actors Guild Award, For his performance in film, he received awards for Best Supporting Actor at Academy Awards, Golden Globe Awards, BAFTA Award for Best Actor in a Supporting Role BAFTA Awards, Screen Actors Guild Award for Outstanding Performance by a Male Actor in a Supporting Role Screen Actors Guild Awards, and Critics' Choice Movie Award for Best Supporting Actor Critics' Choice Movie Awards.
Brad Pitt, Screen Actors Guild Award, Category Outstanding Performance by a Male Actor in a Supporting Role Screen Actors Guild Award winners
Brad Pitt, Screen Actors Guild Award, Category Outstanding Performance by a Cast in a Motion Picture Screen Actors Guild Award winners
Brad Pitt, 2020, In October 2020, he narrated an advertisement for Joe Biden's Joe Biden 2020 presidential campaign 2020 presidential campaign.
Brad Pitt, February 2, Despite media reports that Pitt and Aniston had an acrimonious relationship, Pitt said in a February 2009 interview that he and Aniston "check in with each other", adding that they were both big parts of each other's lives.
Brad Pitt, February 2, Pitt appeared in two episodes of MTV's reality series Jackass (franchise) Jackass in February 2002, first running through streets of Los Angeles with several cast members in gorilla suits, and in a subsequent episode participating in his own staged abduction .
Brad Pitt, February 2, Pitt adopted Pax in United States on February 21, 2008.
Brad Pitt, January 19, On January 19, 2006, a California judge granted Jolie's request to change children's surnames from "Jolie" to "Jolie Pitt".
Brad Pitt, 10, Pitt appeared on Forbes' annual Forbes Celebrity 100 Celebrity 100 list of 100 most powerful celebrities from 2006 to 2008 placing at numbers 20, 5 and 10, respectively.
Brad Pitt, 10, He next voiced superhero character Metro Man in 2010 animated feature Megamind.
