Title, Named Entity, Sentence
Brad Pitt, Brad Pitt, Brad Pitt filmography
Brad Pitt, Brad Pitt, Brad Pitt
Brad Pitt, Brad Pitt, List of awards and nominations received by Brad Pitt
Brad Pitt, Brad Pitt, Brad Pitt at Biography (TV series) Biography
Brad Pitt, Brad Pitt, Pitt first Brad Pitt filmography gained recognition as a cowboy hitchhiker in road film Thelma & Louise (1991).
Brad Pitt, Brad Pitt, This is second Academy Award for Brad Pitt, his first that he received for acting.
Brad Pitt, Brad Pitt, According to Dallas Observer, "Brad Pitt&nbsp;[...] is a large part of problem
Brad Pitt, Brad Pitt, Brad Pitt at The Huffington Post Huffington Post
Brad Pitt, Brad Pitt, He is recipient of list of awards and nominations received by Brad Pitt various accolades, including an Academy Award, a British Academy Film Award, and two Golden Globe Awards for his acting, in addition to a second Academy Award, a second British Academy Film Award, a third Golden Globe Award, and a Primetime Emmy Award as a producer under his production company, Plan B Entertainment.
Brad Pitt, American, Pitt made two motion picture appearances in 1989  first in a supporting role in comedy Happy Together (1989 American film)
Brad Pitt, American, The Dark Side of Sun (1988) gave Pitt his first leading film role, as a young American taken by his family to Adriatic Sea Adriatic to find a remedy for a skin condition.
Brad Pitt, American, William Bradley Pitt (born December 18, 1963) is an American actor and film producer.
Brad Pitt, American, Category 21st century American people
Brad Pitt, American, Category 21st century American male actors
Brad Pitt, American, The foundation made initial donations of $1&nbsp;million each to Global Action for Children and Doctors Without Borders, followed by an October 2006 donation of $100,000 to Daniel Pearl Foundation, an organization created in memory of late American journalist Daniel Pearl.
Brad Pitt, American, Category 20th century American people
Brad Pitt, American, Pitt's next film role was as American outlaw Jesse James in 2007 Western (genre) Western drama The Assassination of Jesse James by Coward Robert Ford, adapted from Ron Hansen (novelist) Ron Hansen's The Assassination of Jesse James by Coward Robert Ford (novel) 1983 novel of same name.
Brad Pitt, American, Portraying Tristan Ludlow, son of Colonel William Ludlow (Anthony Hopkins) a Cornish American Cornish immigrant, Pitt received his first Golden Globe Award nomination, in Golden Globe Award for Best Actor&nbsp;– Motion Picture Drama Best Actor category.
Brad Pitt, American, Category 20th century American male actors
Brad Pitt, American, In November of same year, Pitt had a guest appearance on Columbia Broadcasting System CBS sitcom Trial and Error (TV series) Trial and Error and American Broadcasting Company ABC sitcom Growing Pains.
Brad Pitt, American, As a public figure, Pitt has been cited as one of most powerful and influential people in American entertainment industry.
Brad Pitt, American, Category American male television actors
Brad Pitt, American, Pitt played Lieutenant Aldo Raine, an American resistance fighter battling Nazis in German occupied France.
Brad Pitt, American, Following release of Interview with Vampire, Pitt starred in Legends of Fall (1994), based on a novel by same name by Jim Harrison, set in American West during first four decades of twentieth century.
Brad Pitt, American, Category American male film actors
Brad Pitt, American, Plan B Entertainment landed its first television series on 2013–2014 schedule, as their joint venture with ABC Studios, sci fi/fantasy drama Resurrection (U.S. TV series) Resurrection, was picked up by American Broadcasting Company ABC.
Brad Pitt, American, The couple sold first pictures of Shiloh through distributor Getty Images; North American rights were purchased by People for over $4.1&nbsp;million, while Hello! (magazine)
Brad Pitt, American, Category American male voice actors
Brad Pitt, 2019, In 2019, he also starred in James Gray (film director)
Brad Pitt, 2019, Mr. & Mrs. Smith (2005), World War Z (film) World War Z (2013), and Once Upon a Time in Hollywood (2019), for which he won a second Golden Globe Award and Academy Award for Best Supporting Actor.
Brad Pitt, 2019, In December 2019, he wrote an article for
Brad Pitt, 2019, On April 12, 2019, court restored Jolie and Pitt to single status and they were declared divorced.
Brad Pitt, 2019, Pitt starred as Cliff Booth, a stunt double, opposite Leonardo DiCaprio, in Quentin Tarantino's 2019 film Once Upon a Time in Hollywood.
Brad Pitt, 2019, As of January 2019, it was his own favorite of his films.
Brad Pitt, Once Upon a Time, Mr. & Mrs. Smith (2005), World War Z (film) World War Z (2013), and Once Upon a Time in Hollywood (2019), for which he won a second Golden Globe Award and Academy Award for Best Supporting Actor.
Brad Pitt, Once Upon a Time, Pitt starred as Cliff Booth, a stunt double, opposite Leonardo DiCaprio, in Quentin Tarantino's 2019 film Once Upon a Time in Hollywood.
Brad Pitt, Once Upon a Time, Pitt will next star alongside his Once Upon a Time in Hollywood co star Margot Robbie in Babylon directed by Damien Chazelle and in Bullet Train (film)
Brad Pitt, Hollywood, Mr. & Mrs. Smith (2005), World War Z (film) World War Z (2013), and Once Upon a Time in Hollywood (2019), for which he won a second Golden Globe Award and Academy Award for Best Supporting Actor.
Brad Pitt, Hollywood, Pitt starred as Cliff Booth, a stunt double, opposite Leonardo DiCaprio, in Quentin Tarantino's 2019 film Once Upon a Time in Hollywood.
Brad Pitt, Hollywood, Pitt will next star alongside his Once Upon a Time in Hollywood co star Margot Robbie in Babylon directed by Damien Chazelle and in Bullet Train (film)
Brad Pitt, William Bradley, William Bradley Pitt (born December 18, 1963) is an American actor and film producer.
Brad Pitt, 18, William Bradley Pitt (born December 18, 1963) is an American actor and film producer.
Brad Pitt, 18, Pitt was born on December 18, 1963, in Shawnee, Oklahoma, to William Alvin Pitt, proprietor of a trucking company, and Jane Etta (née Hillhouse), a school counselor.
Brad Pitt, 18, This resulted in custody arrangement reverting to a previous November 2018 agreement where Jolie has full custody while Pitt has "custodial time" with their minor children.
Brad Pitt, Oklahoma, Category People from Shawnee, Oklahoma
Brad Pitt, Oklahoma, Pitt was born on December 18, 1963, in Shawnee, Oklahoma, to William Alvin Pitt, proprietor of a trucking company, and Jane Etta (née Hillhouse), a school counselor.
Brad Pitt, Oklahoma, Category Film producers from Oklahoma
Brad Pitt, Oklahoma, Category Male actors from Oklahoma
Brad Pitt, U.S., For U.S. market, he starred in a Heineken Pilsener Heineken commercial aired during Super Bowl XXXIX 2005 Super Bowl; it was directed by David Fincher, who had directed Pitt in Seven, Fight Club, and The Curious Case of Benjamin Button.
Brad Pitt, U.S., Pitt visited University of Missouri campus in October 2004 to encourage students to vote in 2004 United States presidential election 2004 U.S. presidential election, in which he supported John Kerry.
Brad Pitt, U.S., In same year, Yugoslavian–U.S. co production The Dark Side of Sun (film)
Brad Pitt, U.S., Plan B Entertainment landed its first television series on 2013–2014 schedule, as their joint venture with ABC Studios, sci fi/fantasy drama Resurrection (U.S. TV series) Resurrection, was picked up by American Broadcasting Company ABC.
Brad Pitt, U.S., The first six homes were completed in October 2008, and in September 2009 Pitt received an award in recognition of project from United States Green Building Council U.S. Green Building Council, a non profit trade organization that promotes sustainability in how buildings are designed, built and operated.
Brad Pitt, U.S., Pitt met with U.S. President Barack Obama and Speaker of House of Representatives Nancy Pelosi in March 2009 to promote his concept of green housing as a national model and to discuss federal funding possibilities.
Brad Pitt, University of Missouri, Pitt visited University of Missouri campus in October 2004 to encourage students to vote in 2004 United States presidential election 2004 U.S. presidential election, in which he supported John Kerry.
Brad Pitt, University of Missouri, Following his graduation from high school, Pitt enrolled in University of Missouri in 1982, majoring in journalism with a focus on advertising.
Brad Pitt, 1987, Less Than Zero (1987).
Brad Pitt, 1987, He appeared in four episodes of CBS primetime series Dallas (1978 TV series) Dallas between December 1987 and February 1988 as Randy, boyfriend of Charlie Wade (played by Shalane McCall).
Brad Pitt, 1987, No Way Out (1987), No Man's Land (1987 film)
Brad Pitt, 1987, No Man's Land (1987) and Less Than Zero (film)
Brad Pitt, 1987, No Way Out (1987 film)
Brad Pitt, 1987, 1987–1993  Early work
Brad Pitt, 1987, Pitt's acting career began in 1987, with uncredited parts in films
Brad Pitt, 1987, In May 1987, he made his television debut in a two episode role on NBC soap opera Another World (TV series) Another World.
Brad Pitt, Jennifer Aniston, On November 22, 2001, Pitt made a guest appearance in The One with Rumor eighth season of television series Friends, playing a man with a grudge against Rachel Green, played by Jennifer Aniston, to whom Pitt was married at time.
Brad Pitt, Jennifer Aniston, Troy was first film produced by Plan B Entertainment, a film production company he had founded two years earlier with Jennifer Aniston and Brad Grey, CEO of Paramount Pictures.
Brad Pitt, Jennifer Aniston, Pitt met actress Jennifer Aniston in 1998 and they married in a private wedding ceremony in Malibu, California Malibu on July 29, 2000.
Brad Pitt, Jennifer Aniston, He is divorced from actresses Jennifer Aniston and Angelina Jolie.
Brad Pitt, Angelina Jolie, The feature received reasonable reviews but was generally lauded for chemistry between Pitt and Angelina Jolie, who played his character's wife Jane Smith.
Brad Pitt, Angelina Jolie, During Pitt's divorce proceedings, his involvement with his Mr. & Mrs. Smith co star Angelina Jolie attracted media attention.
Brad Pitt, Angelina Jolie, Beginning in 2005, Pitt's relationship with Angelina Jolie became one of world's most reported celebrity stories.
Brad Pitt, Angelina Jolie, He is divorced from actresses Jennifer Aniston and Angelina Jolie.
Brad Pitt, Guardian, The film received a positive reception from critics, with The Guardian calling it "a tightly wound, slickly plotted spy comedy", noting that Pitt's performance was one of funniest.
Brad Pitt, Douglas Pitt, The family soon moved to Springfield, Missouri, where he lived together with his younger siblings, Douglas Pitt Douglas Mitchell (born 1966) and Julie Neal (born 1969).
Brad Pitt, December 18, 1963, William Bradley Pitt (born December 18, 1963) is an American actor and film producer.
Brad Pitt, December 18, 1963, Pitt was born on December 18, 1963, in Shawnee, Oklahoma, to William Alvin Pitt, proprietor of a trucking company, and Jane Etta (née Hillhouse), a school counselor.
Brad Pitt, an Academy Award, He gave critically acclaimed performances in crime thriller Seven (1995 film) Seven (1995) and science fiction film 12 Monkeys (1995), latter earning him a Golden Globe Award for Best Supporting Actor – Motion Picture Golden Globe Award for Best Supporting Actor and an Academy Award nomination.
Brad Pitt, an Academy Award, He is recipient of list of awards and nominations received by Brad Pitt various accolades, including an Academy Award, a British Academy Film Award, and two Golden Globe Awards for his acting, in addition to a second Academy Award, a second British Academy Film Award, a third Golden Globe Award, and a Primetime Emmy Award as a producer under his production company, Plan B Entertainment.
Brad Pitt, British, Hello! obtained British rights for approximately $3.5&nbsp;million.
Brad Pitt, British, He is recipient of list of awards and nominations received by Brad Pitt various accolades, including an Academy Award, a British Academy Film Award, and two Golden Globe Awards for his acting, in addition to a second Academy Award, a second British Academy Film Award, a third Golden Globe Award, and a Primetime Emmy Award as a producer under his production company, Plan B Entertainment.
Brad Pitt, two, Pitt made two motion picture appearances in 1989  first in a supporting role in comedy Happy Together (1989 American film)
Brad Pitt, two, Despite his winning two MTV Movie Awards at 1995 MTV Movie Awards 1995 ceremony, his performance was poorly received.
Brad Pitt, two, Set in Pitt's Château Miraval, Correns Var Chateau Miraval in South of France, Miraval Studios will re open in 2022 after two decades of inactivity.
Brad Pitt, two, Similarly, intense media interest greeted announcement of Jolie's second pregnancy two years later; for two weeks Jolie spent in a seaside hospital in Nice, reporters and photographers camped outside on promenade to report on birth.
Brad Pitt, two, Throughout 2005, two were seen together with increasing frequency, and entertainment media dubbed couple "Brangelina".
Brad Pitt, two, While less lucrative than first two films, this sequel earned $311&nbsp;million at international box office.
Brad Pitt, two, Madame Tussauds in New York unveiled a wax figure of two month old Shiloh; it marked first time an infant was recreated in wax by Madame Tussauds.
Brad Pitt, two, Pitt appeared in two episodes of MTV's reality series Jackass (franchise) Jackass in February 2002, first running through streets of Los Angeles with several cast members in gorilla suits, and in a subsequent episode participating in his own staged abduction .
Brad Pitt, two, Pitt had two major film roles in 2004, starring as Achilles in Troy (film) Troy, and reprising his role, Rusty Ryan (character) Rusty Ryan, in sequel Ocean's Twelve.
Brad Pitt, two, Troy was first film produced by Plan B Entertainment, a film production company he had founded two years earlier with Jennifer Aniston and Brad Grey, CEO of Paramount Pictures.
Brad Pitt, two, He is recipient of list of awards and nominations received by Brad Pitt various accolades, including an Academy Award, a British Academy Film Award, and two Golden Globe Awards for his acting, in addition to a second Academy Award, a second British Academy Film Award, a third Golden Globe Award, and a Primetime Emmy Award as a producer under his production company, Plan B Entertainment.
Brad Pitt, two, In May 1987, he made his television debut in a two episode role on NBC soap opera Another World (TV series) Another World.
Brad Pitt, Golden Globe Awards, He is recipient of list of awards and nominations received by Brad Pitt various accolades, including an Academy Award, a British Academy Film Award, and two Golden Globe Awards for his acting, in addition to a second Academy Award, a second British Academy Film Award, a third Golden Globe Award, and a Primetime Emmy Award as a producer under his production company, Plan B Entertainment.
Brad Pitt, Golden Globe Awards, For his performance in film, he received awards for Best Supporting Actor at Academy Awards, Golden Globe Awards, BAFTA Award for Best Actor in a Supporting Role BAFTA Awards, Screen Actors Guild Award for Outstanding Performance by a Male Actor in a Supporting Role Screen Actors Guild Awards, and Critics' Choice Movie Award for Best Supporting Actor Critics' Choice Movie Awards.
Brad Pitt, second, In July 2005, Pitt accompanied Jolie to Addis Ababa, Ethiopia, where she adopted her second child, Zahara Marley.
Brad Pitt, second, Similarly, intense media interest greeted announcement of Jolie's second pregnancy two years later; for two weeks Jolie spent in a seaside hospital in Nice, reporters and photographers camped outside on promenade to report on birth.
Brad Pitt, second, Mr. & Mrs. Smith (2005), World War Z (film) World War Z (2013), and Once Upon a Time in Hollywood (2019), for which he won a second Golden Globe Award and Academy Award for Best Supporting Actor.
Brad Pitt, second, The performance earned Pitt his first Screen Actors Guild Award nomination, as well as a fourth Golden Globe and second Academy Award nomination, all in category for Best Actor.
Brad Pitt, second, This is second Academy Award for Brad Pitt, his first that he received for acting.
Brad Pitt, second, He made guest appearances on television series Head of Class, Freddy's Nightmares, Thirtysomething, and (for a second time)
Brad Pitt, second, Happy Together; second a featured role in horror film Cutting Class, first of Pitt's films to reach theaters.
Brad Pitt, second, He is recipient of list of awards and nominations received by Brad Pitt various accolades, including an Academy Award, a British Academy Film Award, and two Golden Globe Awards for his acting, in addition to a second Academy Award, a second British Academy Film Award, a third Golden Globe Award, and a Primetime Emmy Award as a producer under his production company, Plan B Entertainment.
Brad Pitt, second, Pitt is second actor to have won Academy Awards for both Best Supporting Actor and Best Picture.
Brad Pitt, Academy Award, Moneyball received six Academy Award nominations including Best Picture and Best Actor for Pitt.
Brad Pitt, Academy Award, That same year, Pitt's company Plan B Entertainment produced The Departed, which won Academy Award for Best Picture.
Brad Pitt, Academy Award, Category Best Supporting Actor Academy Award winners
Brad Pitt, Academy Award, Mr. & Mrs. Smith (2005), World War Z (film) World War Z (2013), and Once Upon a Time in Hollywood (2019), for which he won a second Golden Globe Award and Academy Award for Best Supporting Actor.
Brad Pitt, Academy Award, He gave critically acclaimed performances in crime thriller Seven (1995 film) Seven (1995) and science fiction film 12 Monkeys (1995), latter earning him a Golden Globe Award for Best Supporting Actor – Motion Picture Golden Globe Award for Best Supporting Actor and an Academy Award nomination.
Brad Pitt, Academy Award, The performance earned Pitt his first Screen Actors Guild Award nomination, as well as a fourth Golden Globe and second Academy Award nomination, all in category for Best Actor.
Brad Pitt, Academy Award, He won a Golden Globe Award for Golden Globe Award for Best Supporting Actor – Motion Picture Best Supporting Actor for film and received his first Academy Award nomination for Academy Award for Best Supporting Actor Best Supporting Actor.
Brad Pitt, Academy Award, The film received multiple List of accolades received by Inglourious Basterds awards and nominations, including eight Academy Award nominations and seven MTV Movie Award nominations, including MTV Movie Award for Best Performance Best Male Performance for Pitt.
Brad Pitt, Academy Award, This is second Academy Award for Brad Pitt, his first that he received for acting.
Brad Pitt, Academy Award, The film was nominated for five Academy Awards, including Best Picture, earning Pitt his third Academy Award nomination as producer.
Brad Pitt, Academy Award, He produced The Departed (2006) and 12 Years a Slave (film) 12 Years a Slave (2013), both of which won Academy Award for Best Picture, and also The Tree of Life (film)
Brad Pitt, Academy Award, Pitt's other Academy Award nominated performances were in The Curious Case of Benjamin Button (film)
Brad Pitt, Academy Award, The film received critical acclaim and was nominated for nine Academy Awards, winning three, including Academy Award for Best Picture Best Picture.
Brad Pitt, Academy Award, The film received thirteen Academy Award nominations, and grossed $329&nbsp;million at box office worldwide.
Brad Pitt, Academy Award, He is recipient of list of awards and nominations received by Brad Pitt various accolades, including an Academy Award, a British Academy Film Award, and two Golden Globe Awards for his acting, in addition to a second Academy Award, a second British Academy Film Award, a third Golden Globe Award, and a Primetime Emmy Award as a producer under his production company, Plan B Entertainment.
Brad Pitt, Academy Award, For his performance in film, he received awards for Best Supporting Actor at Academy Awards, Golden Globe Awards, BAFTA Award for Best Actor in a Supporting Role BAFTA Awards, Screen Actors Guild Award for Outstanding Performance by a Male Actor in a Supporting Role Screen Actors Guild Awards, and Critics' Choice Movie Award for Best Supporting Actor Critics' Choice Movie Awards.
Brad Pitt, Academy Award, Category Producers who won Best Picture Academy Award
Brad Pitt, Academy Award, Pitt is second actor to have won Academy Awards for both Best Supporting Actor and Best Picture.
Brad Pitt, British Academy Film Award, He is recipient of list of awards and nominations received by Brad Pitt various accolades, including an Academy Award, a British Academy Film Award, and two Golden Globe Awards for his acting, in addition to a second Academy Award, a second British Academy Film Award, a third Golden Globe Award, and a Primetime Emmy Award as a producer under his production company, Plan B Entertainment.
Brad Pitt, third, In 2015, Pitt starred opposite his wife, Jolie, in her third directorial effort, By Sea (2015 film)
Brad Pitt, third, The film was nominated for five Academy Awards, including Best Picture, earning Pitt his third Academy Award nomination as producer.
Brad Pitt, third, Reprising his role as Rusty Ryan in a third picture,
Brad Pitt, third, He is recipient of list of awards and nominations received by Brad Pitt various accolades, including an Academy Award, a British Academy Film Award, and two Golden Globe Awards for his acting, in addition to a second Academy Award, a second British Academy Film Award, a third Golden Globe Award, and a Primetime Emmy Award as a producer under his production company, Plan B Entertainment.
Brad Pitt, Golden Globe Award, Mr. & Mrs. Smith (2005), World War Z (film) World War Z (2013), and Once Upon a Time in Hollywood (2019), for which he won a second Golden Globe Award and Academy Award for Best Supporting Actor.
Brad Pitt, Golden Globe Award, He gave critically acclaimed performances in crime thriller Seven (1995 film) Seven (1995) and science fiction film 12 Monkeys (1995), latter earning him a Golden Globe Award for Best Supporting Actor – Motion Picture Golden Globe Award for Best Supporting Actor and an Academy Award nomination.
Brad Pitt, Golden Globe Award, He won a Golden Globe Award for Golden Globe Award for Best Supporting Actor – Motion Picture Best Supporting Actor for film and received his first Academy Award nomination for Academy Award for Best Supporting Actor Best Supporting Actor.
Brad Pitt, Golden Globe Award, Babel received seven Academy and Golden Globe award nominations, winning Golden Globe Award for Best Motion Picture&nbsp;– Drama Best Drama Golden Globe, and earned Pitt a nomination for Golden Globe Award for Best Supporting Actor – Motion Picture Best Supporting Actor Golden Globe.
Brad Pitt, Golden Globe Award, Portraying Tristan Ludlow, son of Colonel William Ludlow (Anthony Hopkins) a Cornish American Cornish immigrant, Pitt received his first Golden Globe Award nomination, in Golden Globe Award for Best Actor&nbsp;– Motion Picture Drama Best Actor category.
Brad Pitt, Golden Globe Award, Category Golden Globe Award winning producers
Brad Pitt, Golden Globe Award, He is recipient of list of awards and nominations received by Brad Pitt various accolades, including an Academy Award, a British Academy Film Award, and two Golden Globe Awards for his acting, in addition to a second Academy Award, a second British Academy Film Award, a third Golden Globe Award, and a Primetime Emmy Award as a producer under his production company, Plan B Entertainment.
Brad Pitt, Golden Globe Award, For his performance in film, he received awards for Best Supporting Actor at Academy Awards, Golden Globe Awards, BAFTA Award for Best Actor in a Supporting Role BAFTA Awards, Screen Actors Guild Award for Outstanding Performance by a Male Actor in a Supporting Role Screen Actors Guild Awards, and Critics' Choice Movie Award for Best Supporting Actor Critics' Choice Movie Awards.
Brad Pitt, Plan B Entertainment, That same year, Pitt's company Plan B Entertainment produced The Departed, which won Academy Award for Best Picture.
Brad Pitt, Plan B Entertainment, Troy was first film produced by Plan B Entertainment, a film production company he had founded two years earlier with Jennifer Aniston and Brad Grey, CEO of Paramount Pictures.
Brad Pitt, Plan B Entertainment, He is recipient of list of awards and nominations received by Brad Pitt various accolades, including an Academy Award, a British Academy Film Award, and two Golden Globe Awards for his acting, in addition to a second Academy Award, a second British Academy Film Award, a third Golden Globe Award, and a Primetime Emmy Award as a producer under his production company, Plan B Entertainment.
Brad Pitt, Plan B Entertainment, Directed by Andrew Dominik and produced by Pitt's company Plan B Entertainment, film premiered at 64th Venice International Film Festival 2007 Venice Film Festival, with Pitt playing a "scary and charismatic" role, according to Lewis Beale of Film Journal International, and earning Pitt Volpi Cup award for Best Actor at 64th Venice International Film Festival.
Brad Pitt, Plan B Entertainment, Plan B Entertainment landed its first television series on 2013–2014 schedule, as their joint venture with ABC Studios, sci fi/fantasy drama Resurrection (U.S. TV series) Resurrection, was picked up by American Broadcasting Company ABC.
Brad Pitt, 1991, Pitt first Brad Pitt filmography gained recognition as a cowboy hitchhiker in road film Thelma & Louise (1991).
