Brad Pitt, 2009, The first six homes were completed in October 2008, and in September 2009 Pitt received an award in recognition of project from United States Green Building Council U.S. Green Building Council, a non profit trade organization that promotes sustainability in how buildings are designed, built and operated.
Brad Pitt, 2009, Pitt met with U.S. President Barack Obama and Speaker of House of Representatives Nancy Pelosi in March 2009 to promote his concept of green housing as a national model and to discuss federal funding possibilities.
Brad Pitt, Springfield, Pitt attended Kickapoo High School (Springfield, Missouri) Kickapoo High School, where he was a member of golf, swimming and tennis teams.
Brad Pitt, Springfield, The family soon moved to Springfield, Missouri, where he lived together with his younger siblings, Douglas Pitt Douglas Mitchell (born 1966) and Julie Neal (born 1969).
Brad Pitt, Springfield, Category People from Springfield, Missouri
Brad Pitt, Springfield, Pitt has described Springfield as "Mark Twain country, Jesse James country," having grown up with "a lot of hills, a lot of lakes.
Brad Pitt, Missouri, Pitt attended Kickapoo High School (Springfield, Missouri) Kickapoo High School, where he was a member of golf, swimming and tennis teams.
Brad Pitt, Missouri, The family soon moved to Springfield, Missouri, where he lived together with his younger siblings, Douglas Pitt Douglas Mitchell (born 1966) and Julie Neal (born 1969).
Brad Pitt, Missouri, He loved films—"a portal into different worlds for me"—and, since films were not made in Missouri, he decided to go to where they were made.
Brad Pitt, Missouri, Category Male actors from Missouri
Brad Pitt, Missouri, Category People from Springfield, Missouri
Brad Pitt, Missouri, Pitt visited University of Missouri campus in October 2004 to encourage students to vote in 2004 United States presidential election 2004 U.S. presidential election, in which he supported John Kerry.
Brad Pitt, Missouri, Category Film producers from Missouri
Brad Pitt, Missouri, Category Missouri School of Journalism alumni
Brad Pitt, Missouri, Following his graduation from high school, Pitt enrolled in University of Missouri in 1982, majoring in journalism with a focus on advertising.
Brad Pitt, Douglas Mitchell, The family soon moved to Springfield, Missouri, where he lived together with his younger siblings, Douglas Pitt Douglas Mitchell (born 1966) and Julie Neal (born 1969).
Brad Pitt, 1966, The family soon moved to Springfield, Missouri, where he lived together with his younger siblings, Douglas Pitt Douglas Mitchell (born 1966) and Julie Neal (born 1969).
Brad Pitt, Julie Neal, The family soon moved to Springfield, Missouri, where he lived together with his younger siblings, Douglas Pitt Douglas Mitchell (born 1966) and Julie Neal (born 1969).
Brad Pitt, 1969, The family soon moved to Springfield, Missouri, where he lived together with his younger siblings, Douglas Pitt Douglas Mitchell (born 1966) and Julie Neal (born 1969).
Brad Pitt, four, He appeared in four episodes of CBS primetime series Dallas (1978 TV series) Dallas between December 1987 and February 1988 as Randy, boyfriend of Charlie Wade (played by Shalane McCall).
Brad Pitt, four, Jolie had full custody until May 2021 when Pitt was granted joint custody, over four and a half years after proceedings began.
Brad Pitt, four, The performance earned Pitt his first Screen Actors Guild Award nomination, as well as a fourth Golden Globe and second Academy Award nomination, all in category for Best Actor.
Brad Pitt, four, Following release of Interview with Vampire, Pitt starred in Legends of Fall (1994), based on a novel by same name by Jim Harrison, set in American West during first four decades of twentieth century.
Brad Pitt, Christian, The Big Short, which he also produced and also co starred alongside Christian Bale, Steve Carell, and Ryan Gosling.
Brad Pitt, Christian, He was part of an ensemble cast that included Tom Cruise, Kirsten Dunst, Christian Slater, and Antonio Banderas.
Brad Pitt, Christian, Born into a conservative Christian household, he was raised as Southern Baptist Convention Southern Baptist and later "oscillate[d] between agnosticism and atheism."
Brad Pitt, Leonardo, Pitt starred as Cliff Booth, a stunt double, opposite Leonardo DiCaprio, in Quentin Tarantino's 2019 film Once Upon a Time in Hollywood.
Brad Pitt, Southern Baptist Convention Southern Baptist, Born into a conservative Christian household, he was raised as Southern Baptist Convention Southern Baptist and later "oscillate[d] between agnosticism and atheism."
Brad Pitt, Jesse James, Pitt has described Springfield as "Mark Twain country, Jesse James country," having grown up with "a lot of hills, a lot of lakes.
Brad Pitt, Jesse James, Pitt's next film role was as American outlaw Jesse James in 2007 Western (genre) Western drama The Assassination of Jesse James by Coward Robert Ford, adapted from Ron Hansen (novelist) Ron Hansen's The Assassination of Jesse James by Coward Robert Ford (novel) 1983 novel of same name.
Brad Pitt, 2012, Pitt and Jolie announced their engagement in April 2012 after seven years together.
Brad Pitt, 2012, In September 2012, Pitt reaffirmed his support of President Obama, saying, "I am an Obama supporter and I'm backing his US election campaign."
Brad Pitt, 2012, His next role was as mob hitman Jackie Cogan in Andrew Dominik's 2012 Killing Them Softly, based on novel Cogan's Trade by George V. Higgins.
Brad Pitt, 2012, In March 2012, Pitt was featured in a performance of Dustin Lance Black's play, 8 (play) 8&nbsp;– a staged reenactment of Perry v. Brown federal trial that overturned California's Proposition 8 Prop 8 ban on same sex marriage&nbsp;– as Judge Vaughn Walker.
Brad Pitt, Kickapoo High School, Pitt attended Kickapoo High School (Springfield, Missouri) Kickapoo High School, where he was a member of golf, swimming and tennis teams.
Brad Pitt, Key Club Key, He participated in school's Key Club Key and Forensics (public speaking) Forensics clubs, in school debates, and in musicals.
Brad Pitt, 1982, Following his graduation from high school, Pitt enrolled in University of Missouri in 1982, majoring in journalism with a focus on advertising.
Brad Pitt, me"—and, He loved films—"a portal into different worlds for me"—and, since films were not made in Missouri, he decided to go to where they were made.
Brad Pitt, Two weeks, Two weeks short of completing coursework for a degree, Pitt left university and moved to Los Angeles, where he took acting lessons and worked odd jobs.
Brad Pitt, Los Angeles, Pitt and Aniston's divorce was finalized by Los Angeles Superior Court on October 2, 2005.
Brad Pitt, Los Angeles, Pitt appeared in two episodes of MTV's reality series Jackass (franchise) Jackass in February 2002, first running through streets of Los Angeles with several cast members in gorilla suits, and in a subsequent episode participating in his own staged abduction .
Brad Pitt, Los Angeles, Pitt has a sustained interest in architecture, even taking time away from film to study computer aided design at Los Angeles offices of renowned architect Frank Gehry.
Brad Pitt, Los Angeles, However, in July, Los Angeles superior court judge John W. Ouderkirk was removed from case due to concerns over his impartiality as he did not sufficiently disclose business relationships with Pitt's lawyers.
Brad Pitt, Los Angeles, While struggling to establish himself in Los Angeles, Pitt took lessons from acting coach Roy London.
Brad Pitt, Los Angeles, In September 2016, FBI and Los Angeles Department of Children and Family Services investigated Pitt for child abuse following an incident on a plane, where Pitt was accused by an anonymous person of being "verbally abusive" and "physical" towards one of his children.
Brad Pitt, Los Angeles, Two weeks short of completing coursework for a degree, Pitt left university and moved to Los Angeles, where he took acting lessons and worked odd jobs.
Brad Pitt, Los Angeles, In its final report on investigation, Los Angeles County Department of Children and Family Services ruled that Pitt did not physically abuse any of his children.
Brad Pitt, Gary Oldman, He has named Gary Oldman, Sean Penn, and Mickey Rourke as his early acting heroes.
Brad Pitt, Sean Penn, He has named Gary Oldman, Sean Penn, and Mickey Rourke as his early acting heroes.
Brad Pitt, Sean Penn, The Tree of Life, co starring Sean Penn, which won Palme d'Or at 2011 Cannes Film Festival.
Brad Pitt, Mickey Rourke, He has named Gary Oldman, Sean Penn, and Mickey Rourke as his early acting heroes.
Brad Pitt, MTV, Despite his winning two MTV Movie Awards at 1995 MTV Movie Awards 1995 ceremony, his performance was poorly received.
Brad Pitt, MTV, The film received multiple List of accolades received by Inglourious Basterds awards and nominations, including eight Academy Award nominations and seven MTV Movie Award nominations, including MTV Movie Award for Best Performance Best Male Performance for Pitt.
Brad Pitt, MTV, Pitt appeared in two episodes of MTV's reality series Jackass (franchise) Jackass in February 2002, first running through streets of Los Angeles with several cast members in gorilla suits, and in a subsequent episode participating in his own staged abduction .
Brad Pitt, 1987–1993, 1987–1993  Early work
Brad Pitt, Roy London, While struggling to establish himself in Los Angeles, Pitt took lessons from acting coach Roy London.
Brad Pitt, No Way Out, No Way Out (1987), No Man's Land (1987 film)
Brad Pitt, No Way Out, No Way Out (1987 film)
Brad Pitt, No Man's Land, No Way Out (1987), No Man's Land (1987 film)
Brad Pitt, No Man's Land, No Man's Land (1987) and Less Than Zero (film)
Brad Pitt, Less Than Zero, Less Than Zero (1987).
Brad Pitt, Less Than Zero, No Man's Land (1987) and Less Than Zero (film)
Brad Pitt, May 1987, In May 1987, he made his television debut in a two episode role on NBC soap opera Another World (TV series) Another World.
Brad Pitt, NBC, Pitt was cast as Billy Canton, a drug addict who takes advantage of a young runaway (played by Juliette Lewis) in 1990 NBC television movie Too Young to Die?, story of an abused teenager sentenced to death for a murder.
Brad Pitt, NBC, In May 1987, he made his television debut in a two episode role on NBC soap opera Another World (TV series) Another World.
Brad Pitt, Another World, In May 1987, he made his television debut in a two episode role on NBC soap opera Another World (TV series) Another World.
Brad Pitt, November of same year, In November of same year, Pitt had a guest appearance on Columbia Broadcasting System CBS sitcom Trial and Error (TV series) Trial and Error and American Broadcasting Company ABC sitcom Growing Pains.
Brad Pitt, Columbia Broadcasting System CBS, In November of same year, Pitt had a guest appearance on Columbia Broadcasting System CBS sitcom Trial and Error (TV series) Trial and Error and American Broadcasting Company ABC sitcom Growing Pains.
Brad Pitt, Trial and Error, In November of same year, Pitt had a guest appearance on Columbia Broadcasting System CBS sitcom Trial and Error (TV series) Trial and Error and American Broadcasting Company ABC sitcom Growing Pains.
Brad Pitt, 150, Right Foundation New Orleans Make It Right Foundation, organizing housing professionals in New Orleans to finance and construct 150&nbsp;sustainable, affordable new houses in New Orleans's Ninth Ward of New Orleans Ninth Ward following devastation caused by Hurricane Katrina.
Brad Pitt, 2016, On September 19, 2016, Jolie filed for divorce from Pitt, citing irreconcilable differences.
Brad Pitt, 2016, Since Jolie filed for divorce from Pitt on September 19, 2016, they have been embroiled in a custody battle over their children.
Brad Pitt, 2016, In 2016, Pitt starred in Robert Zemeckis's romantic thriller Allied (film) Allied, in which he plays a spy assassin who falls in love with a French spy (played by Marion Cotillard) during a mission to kill a German official in World War II.
Brad Pitt, 2016, A 2017 sequel to World War Z was in announced in 2016, before film was briefly delayed, then confirmed to be directed by David Fincher and then ultimately shelved due to budget issues.
Brad Pitt, 2016, In September 2016, FBI and Los Angeles Department of Children and Family Services investigated Pitt for child abuse following an incident on a plane, where Pitt was accused by an anonymous person of being "verbally abusive" and "physical" towards one of his children.
Brad Pitt, 2016, In September 2016, Pitt got sober and began attending Alcoholics Anonymous meetings.
Brad Pitt, American Broadcasting Company ABC, In November of same year, Pitt had a guest appearance on Columbia Broadcasting System CBS sitcom Trial and Error (TV series) Trial and Error and American Broadcasting Company ABC sitcom Growing Pains.
Brad Pitt, American Broadcasting Company ABC, Plan B Entertainment landed its first television series on 2013–2014 schedule, as their joint venture with ABC Studios, sci fi/fantasy drama Resurrection (U.S. TV series) Resurrection, was picked up by American Broadcasting Company ABC.
Brad Pitt, Growing Pains, In November of same year, Pitt had a guest appearance on Columbia Broadcasting System CBS sitcom Trial and Error (TV series) Trial and Error and American Broadcasting Company ABC sitcom Growing Pains.
Brad Pitt, Growing Pains, Growing Pains.
Brad Pitt, 1, The film was shelved at outbreak of Croatian War of Independence, and was not released until 1997.
Brad Pitt, 1, In September 2021, it was revealed that he will reteam with George Clooney in a thriller film written and directed by Jon Watts.
Brad Pitt, 1, Pitt had lead role in 1998's fantasy romance film Meet Joe Black.
Brad Pitt, 1, Less Than Zero (1987).
Brad Pitt, 1, They were married on August 23, 2014, in a private ceremony in Château Miraval, Correns Var Château Miraval, France.
Brad Pitt, 1, Pitt made two motion picture appearances in 1989  first in a supporting role in comedy Happy Together (1989 American film)
Brad Pitt, 1, The family soon moved to Springfield, Missouri, where he lived together with his younger siblings, Douglas Pitt Douglas Mitchell (born 1966) and Julie Neal (born 1969).
Brad Pitt, 1, Despite his winning two MTV Movie Awards at 1995 MTV Movie Awards 1995 ceremony, his performance was poorly received.
Brad Pitt, 1, In 2019, he also starred in James Gray (film director)
Brad Pitt, 1, In 1999, Pitt portrayed The Narrator (Fight Club) Tyler Durden in Fight Club, a film adaptation of Chuck Palahniuk's Fight Club (novel) novel of same name, directed by David Fincher.
Brad Pitt, 1, On September 19, 2016, Jolie filed for divorce from Pitt, citing irreconcilable differences.
Brad Pitt, 1, The Dark Side of Sun (1988) gave Pitt his first leading film role, as a young American taken by his family to Adriatic Sea Adriatic to find a remedy for a skin condition.
Brad Pitt, 1, He appeared in four episodes of CBS primetime series Dallas (1978 TV series) Dallas between December 1987 and February 1988 as Randy, boyfriend of Charlie Wade (played by Shalane McCall).
Brad Pitt, 1, file SevenYearsInTibeta.jpg thumb upright 0.8 Pitt with Losang Thonden in Argentina on set of Seven Years in Tibet (1997 film)
Brad Pitt, 1, Since Jolie filed for divorce from Pitt on September 19, 2016, they have been embroiled in a custody battle over their children.
Brad Pitt, 1, The project involves 13 architectural firms and environmental organization Global Green USA, with several of firms donating their services.
Brad Pitt, 1, Pitt and Jolie announced their engagement in April 2012 after seven years together.
Brad Pitt, 1, Mr. & Mrs. Smith (2005), World War Z (film) World War Z (2013), and Once Upon a Time in Hollywood (2019), for which he won a second Golden Globe Award and Academy Award for Best Supporting Actor.
Brad Pitt, 1, Jolie had full custody until May 2021 when Pitt was granted joint custody, over four and a half years after proceedings began.
Brad Pitt, 1, He gave critically acclaimed performances in crime thriller Seven (1995 film) Seven (1995) and science fiction film 12 Monkeys (1995), latter earning him a Golden Globe Award for Best Supporting Actor – Motion Picture Golden Globe Award for Best Supporting Actor and an Academy Award nomination.
Brad Pitt, 1, On January 11, 2006, Jolie confirmed to People that she was pregnant with Pitt's child, thereby publicly acknowledging their relationship for first time.
Brad Pitt, 1, In June 2009, Jolie Pitt Foundation donated $1&nbsp;million to a U.N. refugee agency to help Pakistanis displaced by fighting between troops and Taliban militants.
Brad Pitt, 1, In 2013, Pitt starred in World War Z (film) World War Z, a thriller about a zombie apocalypse, based on Max Brooks's World War Z novel of same name.
Brad Pitt, 1, William Bradley Pitt (born December 18, 1963) is an American actor and film producer.
Brad Pitt, 1, No Way Out (1987), No Man's Land (1987 film)
Brad Pitt, 1, Category 21st century American people
Brad Pitt, 1, Pitt played a recurring role as a weatherman on late night talk show The Jim Jefferies Show throughout 2017.
Brad Pitt, 1, Pitt appeared on Forbes' annual Forbes Celebrity 100 Celebrity 100 list of 100 most powerful celebrities from 2006 to 2008 placing at numbers 20, 5 and 10, respectively.
Brad Pitt, 1, Right Foundation New Orleans Make It Right Foundation, organizing housing professionals in New Orleans to finance and construct 150&nbsp;sustainable, affordable new houses in New Orleans's Ninth Ward of New Orleans Ninth Ward following devastation caused by Hurricane Katrina.
Brad Pitt, 1, Category 21st century American male actors
Brad Pitt, 1, He next voiced superhero character Metro Man in 2010 animated feature Megamind.
Brad Pitt, 1, Category 1963 births
Brad Pitt, 1, The foundation made initial donations of $1&nbsp;million each to Global Action for Children and Doctors Without Borders, followed by an October 2006 donation of $100,000 to Daniel Pearl Foundation, an organization created in memory of late American journalist Daniel Pearl.
Brad Pitt, 1, In December 2019, he wrote an article for
Brad Pitt, 1, It went on to gross over $102 million worldwide and received positive reviews from critics.
Brad Pitt, 1, No Man's Land (1987) and Less Than Zero (film)
Brad Pitt, 1, In December 2001, Pitt played Rusty Ryan (character) Rusty Ryan in heist film Ocean's Eleven (2001 film)
Brad Pitt, 1, While less lucrative than first two films, this sequel earned $311&nbsp;million at international box office.
Brad Pitt, 1, No Way Out (1987 film)
Brad Pitt, 1, The Devil's Own grossed $140&nbsp;million worldwide, but was a critical failure.
Brad Pitt, 1, Sleepers (1996), based on Lorenzo Carcaterra's novel of same name.
Brad Pitt, 1, Pitt first Brad Pitt filmography gained recognition as a cowboy hitchhiker in road film Thelma & Louise (1991).
Brad Pitt, 1, In 2015, Pitt starred opposite his wife, Jolie, in her third directorial effort, By Sea (2015 film)
Brad Pitt, 1, The Curious Case of Benjamin Button (2008) and Moneyball (film) Moneyball (2011).
Brad Pitt, 1, He was again included on Time 100 in 2009, this time in "Builders and Titans" list.
Brad Pitt, 1, Pitt was born on December 18, 1963, in Shawnee, Oklahoma, to William Alvin Pitt, proprietor of a trucking company, and Jane Etta (née Hillhouse), a school counselor.
Brad Pitt, 1, He produced The Departed (2006) and 12 Years a Slave (film) 12 Years a Slave (2013), both of which won Academy Award for Best Picture, and also The Tree of Life (film)
Brad Pitt, 1, The Big Short (2015), all of which were nominated for Best Picture.
Brad Pitt, 1, Pitt was cast as Billy Canton, a drug addict who takes advantage of a young runaway (played by Juliette Lewis) in 1990 NBC television movie Too Young to Die?, story of an abused teenager sentenced to death for a murder.
Brad Pitt, 1, Pitt's public image is strongly tied to his perceived sex appeal, with Empire (film magazine) Empire magazine naming him one of 25 sexiest stars in film history in 1995.
Brad Pitt, 1, Subsequently, Pitt had a much publicized romance and engagement to his Seven co star, Gwyneth Paltrow, whom he dated from 1994 to 1997.
Brad Pitt, 1, On April 12, 2019, court restored Jolie and Pitt to single status and they were declared divorced.
Brad Pitt, 1, Pitt took on role of Paul Maclean in 1992 biographical film A River Runs Through It (film)
Brad Pitt, 1, In 1995, Pitt starred alongside Morgan Freeman, Gwyneth Paltrow, and Kevin Spacey in crime thriller Seven (1995 film) Seven, playing a detective on trail of a serial killer who preys on people he considers guilty of Seven Deadly Sins.
Brad Pitt, 1, The Curious Case of Benjamin Button, a loosely adapted version of a 1921 The Curious Case of Benjamin Button (short story) short story by F. Scott Fitzgerald.
Brad Pitt, 1, In 2021, Pitt entered recording business by creating a company with French record producer Damien Quintard.
Brad Pitt, 1, Pitt's next film role was as American outlaw Jesse James in 2007 Western (genre) Western drama The Assassination of Jesse James by Coward Robert Ford, adapted from Ron Hansen (novelist) Ron Hansen's The Assassination of Jesse James by Coward Robert Ford (novel) 1983 novel of same name.
Brad Pitt, 1, Pitt starred as Cliff Booth, a stunt double, opposite Leonardo DiCaprio, in Quentin Tarantino's 2019 film Once Upon a Time in Hollywood.
Brad Pitt, 1, The Tree of Life (2011), Moneyball (2011) and The Big Short (film)
Brad Pitt, 1, The Tree of Life, co starring Sean Penn, which won Palme d'Or at 2011 Cannes Film Festival.
Brad Pitt, 1, In January 2010, foundation donated $1&nbsp;million to Doctors Without Borders for emergency medical assistance to help victims of 2010 Haiti earthquake Haiti earthquake.
Brad Pitt, 1, In 2016, Pitt starred in Robert Zemeckis's romantic thriller Allied (film) Allied, in which he plays a spy assassin who falls in love with a French spy (played by Marion Cotillard) during a mission to kill a German official in World War II.
Brad Pitt, 1, Ocean's Eleven, a remake of 1960 Ocean's Eleven (1960 film)
Brad Pitt, 1, On January 19, 2006, a California judge granted Jolie's request to change children's surnames from "Jolie" to "Jolie Pitt".
Brad Pitt, 1, On November 22, 2001, Pitt made a guest appearance in The One with Rumor eighth season of television series Friends, playing a man with a grudge against Rachel Green, played by Jennifer Aniston, to whom Pitt was married at time.
Brad Pitt, 1, In September 2012, Pitt reaffirmed his support of President Obama, saying, "I am an Obama supporter and I'm backing his US election campaign."
Brad Pitt, 1, 1987–1993  Early work
Brad Pitt, 1, His next role was as mob hitman Jackie Cogan in Andrew Dominik's 2012 Killing Them Softly, based on novel Cogan's Trade by George V. Higgins.
Brad Pitt, 1, Following success of Seven, Pitt played psychotic anarchy anarchist Jeffrey Goines in Terry Gilliam's 1995 science fiction film 12 Monkeys.
Brad Pitt, 1, Next in 2013, he produced, and played a small role in, 12 Years a Slave (film) 12 Years a Slave, a historical drama based on autobiography of Solomon Northup.
Brad Pitt, 1, A 2017 sequel to World War Z was in announced in 2016, before film was briefly delayed, then confirmed to be directed by David Fincher and then ultimately shelved due to budget issues.
Brad Pitt, 1, After Thelma & Louise, Pitt starred in 1991 film Johnny Suede, a low budget picture about an aspiring rock star, and 1992 live action/animated fantasy film Cool World, although neither furthered his career, having poor reviews and box office performance.
Brad Pitt, 1, His next appearance came in 1991 film Across Tracks; Pitt portrayed Joe Maloney, a high school Running runner with a criminal brother, played by Ricky Schroder Rick Schroder.
Brad Pitt, 1, This resulted in custody arrangement reverting to a previous November 2018 agreement where Jolie has full custody while Pitt has "custodial time" with their minor children.
Brad Pitt, 1, In March 2012, Pitt was featured in a performance of Dustin Lance Black's play, 8 (play) 8&nbsp;– a staged reenactment of Perry v. Brown federal trial that overturned California's Proposition 8 Prop 8 ban on same sex marriage&nbsp;– as Judge Vaughn Walker.
Brad Pitt, 1, Category Time 100
Brad Pitt, 1, From late 1980s to early 1990s,
Brad Pitt, 1, Following his graduation from high school, Pitt enrolled in University of Missouri in 1982, majoring in journalism with a focus on advertising.
Brad Pitt, 1, In September 2016, FBI and Los Angeles Department of Children and Family Services investigated Pitt for child abuse following an incident on a plane, where Pitt was accused by an anonymous person of being "verbally abusive" and "physical" towards one of his children.
Brad Pitt, 1, After years of supporting roles in film and frequent television guest appearances, Pitt attracted wider recognition in his supporting role in Ridley Scott's 1991 road film Thelma & Louise.
Brad Pitt, 1, In May 2007, Pitt and Jolie donated $1&nbsp;million to three organizations in Chad and Sudan dedicated to those affected by crisis in Darfur region.
Brad Pitt, 1, In 1997 film The Devil's Own Pitt starred, opposite Harrison Ford, as Provisional Irish Republican Army Irish Republican Army terrorist Rory Devany, a role for which he was required to learn an Irish accent.
Brad Pitt, 1, Later in 1988, Pitt made a guest appearance on Fox Broadcasting Company Fox police drama 21 Jump Street.
Brad Pitt, 1, 1999–2003  Rise to prominence
Brad Pitt, 1, In 2007, he appeared on Time 100 Time 100 list, a compilation of 100 most influential people in world, as selected annually by Time (magazine) Time magazine.
Brad Pitt, 1, Fight Club premiered at 1999 Venice International Film Festival.
Brad Pitt, 1, The film was released on October 17, 2014.
