Brad Pitt, Dallas Observer, According to Dallas Observer, "Brad Pitt&nbsp;[...] is a large part of problem
Brad Pitt, Brad Pitt&nbsp, According to Dallas Observer, "Brad Pitt&nbsp;[...] is a large part of problem
Brad Pitt, side&nbsp, When directors play up his cocky, hunkish, folksy side&nbsp;[...] he's a joy to watch.
Brad Pitt, Louis, But there's nothing about him that suggests inner torment or even self awareness, which makes him a boring Louis."
Brad Pitt, Louis, Pitt first Brad Pitt filmography gained recognition as a cowboy hitchhiker in road film Thelma & Louise (1991).
Brad Pitt, Louis, Paul Clinton of CNN noted risky yet successful nature of film, while Variety remarked upon Pitt's ability to be "cool, charismatic and more dynamically physical, perhaps than [...] his breakthrough role in Thelma and Louise".
Brad Pitt, Louis, After Thelma & Louise, Pitt starred in 1991 film Johnny Suede, a low budget picture about an aspiring rock star, and 1992 live action/animated fantasy film Cool World, although neither furthered his career, having poor reviews and box office performance.
Brad Pitt, Louis, After years of supporting roles in film and frequent television guest appearances, Pitt attracted wider recognition in his supporting role in Ridley Scott's 1991 road film Thelma & Louise.
Brad Pitt, Louis, In 1994, Pitt portrayed vampire Louis de Pointe du Lac in horror film Interview with Vampire (film) Interview with Vampire  The Vampire Chronicles, based on Anne Rice's 1976 Interview with Vampire novel of same name.
Brad Pitt, Interview, Interview (magazine) Interview in which he talked with his Legends of Fall and Meet Joe Black costar and fellow recovering alcoholic Anthony Hopkins about their experiences with addiction and recovery.
Brad Pitt, Interview, A River Runs Through It (1992) and Legends of Fall (1994), and horror film Interview with Vampire (film) Interview with Vampire (1994).
Brad Pitt, Interview, Following release of Interview with Vampire, Pitt starred in Legends of Fall (1994), based on a novel by same name by Jim Harrison, set in American West during first four decades of twentieth century.
Brad Pitt, Interview, In 1994, Pitt portrayed vampire Louis de Pointe du Lac in horror film Interview with Vampire (film) Interview with Vampire  The Vampire Chronicles, based on Anne Rice's 1976 Interview with Vampire novel of same name.
Brad Pitt, Jim Harrison, Following release of Interview with Vampire, Pitt starred in Legends of Fall (1994), based on a novel by same name by Jim Harrison, set in American West during first four decades of twentieth century.
Brad Pitt, first four decades of twentieth century, Following release of Interview with Vampire, Pitt starred in Legends of Fall (1994), based on a novel by same name by Jim Harrison, set in American West during first four decades of twentieth century.
Brad Pitt, Tristan Ludlow, Portraying Tristan Ludlow, son of Colonel William Ludlow (Anthony Hopkins) a Cornish American Cornish immigrant, Pitt received his first Golden Globe Award nomination, in Golden Globe Award for Best Actor&nbsp;– Motion Picture Drama Best Actor category.
Brad Pitt, William Ludlow, Portraying Tristan Ludlow, son of Colonel William Ludlow (Anthony Hopkins) a Cornish American Cornish immigrant, Pitt received his first Golden Globe Award nomination, in Golden Globe Award for Best Actor&nbsp;– Motion Picture Drama Best Actor category.
Brad Pitt, Anthony Hopkins, Portraying Tristan Ludlow, son of Colonel William Ludlow (Anthony Hopkins) a Cornish American Cornish immigrant, Pitt received his first Golden Globe Award nomination, in Golden Globe Award for Best Actor&nbsp;– Motion Picture Drama Best Actor category.
Brad Pitt, Anthony Hopkins, Interview (magazine) Interview in which he talked with his Legends of Fall and Meet Joe Black costar and fellow recovering alcoholic Anthony Hopkins about their experiences with addiction and recovery.
Brad Pitt, Cornish American, Portraying Tristan Ludlow, son of Colonel William Ludlow (Anthony Hopkins) a Cornish American Cornish immigrant, Pitt received his first Golden Globe Award nomination, in Golden Globe Award for Best Actor&nbsp;– Motion Picture Drama Best Actor category.
Brad Pitt, Cornish, Portraying Tristan Ludlow, son of Colonel William Ludlow (Anthony Hopkins) a Cornish American Cornish immigrant, Pitt received his first Golden Globe Award nomination, in Golden Globe Award for Best Actor&nbsp;– Motion Picture Drama Best Actor category.
Brad Pitt, Golden Globe Award for Best Actor&nbsp, Portraying Tristan Ludlow, son of Colonel William Ludlow (Anthony Hopkins) a Cornish American Cornish immigrant, Pitt received his first Golden Globe Award nomination, in Golden Globe Award for Best Actor&nbsp;– Motion Picture Drama Best Actor category.
Brad Pitt, Motion Picture Drama Best Actor, Portraying Tristan Ludlow, son of Colonel William Ludlow (Anthony Hopkins) a Cornish American Cornish immigrant, Pitt received his first Golden Globe Award nomination, in Golden Globe Award for Best Actor&nbsp;– Motion Picture Drama Best Actor category.
Brad Pitt, Aidan Quinn, Aidan Quinn and Henry Thomas co starred as Pitt's brothers.
Brad Pitt, Henry Thomas, Aidan Quinn and Henry Thomas co starred as Pitt's brothers.
Brad Pitt, Janet Maslin, Janet Maslin of The New York Times called Twelve Monkeys "fierce and disturbing" and remarked on Pitt's "startlingly frenzied performance", concluding that he "electrifies Jeffrey with a weird magnetism that becomes important later in film."
Brad Pitt, Janet Maslin, Janet Maslin of The New York Times said, "Pitt's diffident mix of acting and attitude works to such heartthrob perfection it's a shame film's superficiality gets in his way."
Brad Pitt, Legends of Fall, The Deseret News predicted that Legends of Fall would solidify Pitt's reputation as a lead actor.
Brad Pitt, Legends of Fall, Interview (magazine) Interview in which he talked with his Legends of Fall and Meet Joe Black costar and fellow recovering alcoholic Anthony Hopkins about their experiences with addiction and recovery.
Brad Pitt, Legends of Fall, A River Runs Through It (1992) and Legends of Fall (1994), and horror film Interview with Vampire (film) Interview with Vampire (1994).
Brad Pitt, Legends of Fall, Following release of Interview with Vampire, Pitt starred in Legends of Fall (1994), based on a novel by same name by Jim Harrison, set in American West during first four decades of twentieth century.
Brad Pitt, Morgan Freeman, In 1995, Pitt starred alongside Morgan Freeman, Gwyneth Paltrow, and Kevin Spacey in crime thriller Seven (1995 film) Seven, playing a detective on trail of a serial killer who preys on people he considers guilty of Seven Deadly Sins.
Brad Pitt, Gwyneth Paltrow, Subsequently, Pitt had a much publicized romance and engagement to his Seven co star, Gwyneth Paltrow, whom he dated from 1994 to 1997.
Brad Pitt, Gwyneth Paltrow, In 1995, Pitt starred alongside Morgan Freeman, Gwyneth Paltrow, and Kevin Spacey in crime thriller Seven (1995 film) Seven, playing a detective on trail of a serial killer who preys on people he considers guilty of Seven Deadly Sins.
Brad Pitt, Kevin Spacey, In 1995, Pitt starred alongside Morgan Freeman, Gwyneth Paltrow, and Kevin Spacey in crime thriller Seven (1995 film) Seven, playing a detective on trail of a serial killer who preys on people he considers guilty of Seven Deadly Sins.
Brad Pitt, seven, Pitt and Jolie announced their engagement in April 2012 after seven years together.
Brad Pitt, seven, The film received multiple List of accolades received by Inglourious Basterds awards and nominations, including eight Academy Award nominations and seven MTV Movie Award nominations, including MTV Movie Award for Best Performance Best Male Performance for Pitt.
Brad Pitt, seven, Babel received seven Academy and Golden Globe award nominations, winning Golden Globe Award for Best Motion Picture&nbsp;– Drama Best Drama Golden Globe, and earned Pitt a nomination for Golden Globe Award for Best Supporting Actor – Motion Picture Best Supporting Actor Golden Globe.
Brad Pitt, Variety, His performance was critically well received, with Variety (magazine) Variety saying that it was screen acting at its best, further remarking on Pitt's ability to turn in a "determined, energetic, creditable job" as detective.
Brad Pitt, Variety, Paul Clinton of CNN noted risky yet successful nature of film, while Variety remarked upon Pitt's ability to be "cool, charismatic and more dynamically physical, perhaps than [...] his breakthrough role in Thelma and Louise".
Brad Pitt, 327&nbsp;million, Seven earned $327&nbsp;million at international box office.
Brad Pitt, Jeffrey Goines, Following success of Seven, Pitt played psychotic anarchy anarchist Jeffrey Goines in Terry Gilliam's 1995 science fiction film 12 Monkeys.
Brad Pitt, Terry Gilliam's, Following success of Seven, Pitt played psychotic anarchy anarchist Jeffrey Goines in Terry Gilliam's 1995 science fiction film 12 Monkeys.
Brad Pitt, Jeffrey, Janet Maslin of The New York Times called Twelve Monkeys "fierce and disturbing" and remarked on Pitt's "startlingly frenzied performance", concluding that he "electrifies Jeffrey with a weird magnetism that becomes important later in film."
Brad Pitt, Jeffrey, Following success of Seven, Pitt played psychotic anarchy anarchist Jeffrey Goines in Terry Gilliam's 1995 science fiction film 12 Monkeys.
Brad Pitt, Academy Award for Best Supporting Actor Best Supporting Actor, He won a Golden Globe Award for Golden Globe Award for Best Supporting Actor – Motion Picture Best Supporting Actor for film and received his first Academy Award nomination for Academy Award for Best Supporting Actor Best Supporting Actor.
Brad Pitt, 1996, Sleepers (1996), based on Lorenzo Carcaterra's novel of same name.
Brad Pitt, Lorenzo Carcaterra's, Sleepers (1996), based on Lorenzo Carcaterra's novel of same name.
Brad Pitt, Harrison Ford, In 1997 film The Devil's Own Pitt starred, opposite Harrison Ford, as Provisional Irish Republican Army Irish Republican Army terrorist Rory Devany, a role for which he was required to learn an Irish accent.
Brad Pitt, Provisional Irish Republican Army Irish Republican Army, In 1997 film The Devil's Own Pitt starred, opposite Harrison Ford, as Provisional Irish Republican Army Irish Republican Army terrorist Rory Devany, a role for which he was required to learn an Irish accent.
Brad Pitt, Rory Devany, In 1997 film The Devil's Own Pitt starred, opposite Harrison Ford, as Provisional Irish Republican Army Irish Republican Army terrorist Rory Devany, a role for which he was required to learn an Irish accent.
Brad Pitt, Irish, Critical opinion was divided on his accent; "Pitt finds right tone of moral ambiguity, but at times his Irish brogue is too convincing&nbsp;– it's hard to understand what he's saying", wrote San Francisco Chronicle.
Brad Pitt, Irish, Mick LaSalle of San Francisco Chronicle said Pitt was "ideally cast as an Irishman whose accent is so thick even Brits can't understand him", going on to say that, before Snatch, Pitt had been "shackled by roles that called for brooding introspection, but recently he has found his calling in black comic outrageousness and flashy extroversion;" while Amy Taubin of The Village Voice claimed that "Pitt gets maximum comic mileage out of a one joke role".
Brad Pitt, Irish, In 1997 film The Devil's Own Pitt starred, opposite Harrison Ford, as Provisional Irish Republican Army Irish Republican Army terrorist Rory Devany, a role for which he was required to learn an Irish accent.
Brad Pitt, Irish, Pitt was cast as an Irish Travellers Irish Traveller boxing boxer with a barely intelligible accent in Guy Ritchie's 2000 gangster film Snatch (film) Snatch.
Brad Pitt, Ford, Pitt's next film role was as American outlaw Jesse James in 2007 Western (genre) Western drama The Assassination of Jesse James by Coward Robert Ford, adapted from Ron Hansen (novelist) Ron Hansen's The Assassination of Jesse James by Coward Robert Ford (novel) 1983 novel of same name.
Brad Pitt, Ford, In 1997 film The Devil's Own Pitt starred, opposite Harrison Ford, as Provisional Irish Republican Army Irish Republican Army terrorist Rory Devany, a role for which he was required to learn an Irish accent.
Brad Pitt, Devil, The Devil's Own grossed $140&nbsp;million worldwide, but was a critical failure.
Brad Pitt, Devil, In 1997 film The Devil's Own Pitt starred, opposite Harrison Ford, as Provisional Irish Republican Army Irish Republican Army terrorist Rory Devany, a role for which he was required to learn an Irish accent.
Brad Pitt, New York, Madame Tussauds in New York unveiled a wax figure of two month old Shiloh; it marked first time an infant was recreated in wax by Madame Tussauds.
Brad Pitt, New York, Janet Maslin of The New York Times called Twelve Monkeys "fierce and disturbing" and remarked on Pitt's "startlingly frenzied performance", concluding that he "electrifies Jeffrey with a weird magnetism that becomes important later in film."
Brad Pitt, New York, Janet Maslin of The New York Times said, "Pitt's diffident mix of acting and attitude works to such heartthrob perfection it's a shame film's superficiality gets in his way."
Brad Pitt, convincing&nbsp, Critical opinion was divided on his accent; "Pitt finds right tone of moral ambiguity, but at times his Irish brogue is too convincing&nbsp;– it's hard to understand what he's saying", wrote San Francisco Chronicle.
Brad Pitt, San Francisco Chronicle, Critical opinion was divided on his accent; "Pitt finds right tone of moral ambiguity, but at times his Irish brogue is too convincing&nbsp;– it's hard to understand what he's saying", wrote San Francisco Chronicle.
Brad Pitt, San Francisco Chronicle, Mick LaSalle of San Francisco Chronicle said Pitt was "ideally cast as an Irishman whose accent is so thick even Brits can't understand him", going on to say that, before Snatch, Pitt had been "shackled by roles that called for brooding introspection, but recently he has found his calling in black comic outrageousness and flashy extroversion;" while Amy Taubin of The Village Voice claimed that "Pitt gets maximum comic mileage out of a one joke role".
Brad Pitt, San Francisco Chronicle, According to Mick LaSalle of San Francisco Chronicle, Pitt was unable to "make an audience believe that he knows all mysteries of death and eternity."
Brad Pitt, The Charleston Gazette, The Charleston Gazette opined that it had favored Pitt's accent over movie.
Brad Pitt, Later that year, Later that year, he led as Austrian mountaineer Heinrich Harrer in Jean Jacques Annaud film Seven Years in Tibet (1997 film)
Brad Pitt, Austrian, Later that year, he led as Austrian mountaineer Heinrich Harrer in Jean Jacques Annaud film Seven Years in Tibet (1997 film)
Brad Pitt, Heinrich Harrer, Later that year, he led as Austrian mountaineer Heinrich Harrer in Jean Jacques Annaud film Seven Years in Tibet (1997 film)
Brad Pitt, Jean Jacques Annaud, Later that year, he led as Austrian mountaineer Heinrich Harrer in Jean Jacques Annaud film Seven Years in Tibet (1997 film)
Brad Pitt, Salon.com, Mark Holcomb of Salon.com enjoyed film, although he noted that neither Pitt nor Redford provided "much of an emotional connection for audience".
Brad Pitt, months, Two months later, Aniston filed for divorce, citing irreconcilable differences.
Brad Pitt, months, Pitt trained for months for role, which demanded significant mountain climbing and trekking practice, including rock climbing in California and European Alps with his co star David Thewlis.
Brad Pitt, months, He spent six months sword training before filming of Troy, based on Iliad.
Brad Pitt, California, On January 19, 2006, a California judge granted Jolie's request to change children's surnames from "Jolie" to "Jolie Pitt".
Brad Pitt, California, In March 2012, Pitt was featured in a performance of Dustin Lance Black's play, 8 (play) 8&nbsp;– a staged reenactment of Perry v. Brown federal trial that overturned California's Proposition 8 Prop 8 ban on same sex marriage&nbsp;– as Judge Vaughn Walker.
Brad Pitt, California, In support of this he endorsed California Constitution Article XXXV Proposition 71, a California ballot initiative intended to provide state government funding for stem cell research.
Brad Pitt, California, Pitt trained for months for role, which demanded significant mountain climbing and trekking practice, including rock climbing in California and European Alps with his co star David Thewlis.
Brad Pitt, California, In September 2008, he donated $100,000 to campaign against California's 2008 ballot proposition California Proposition 8 (2008) Proposition 8, an initiative to overturn In re Marriage Cases state Supreme Court decision that had Same sex marriage in California legalized same sex marriage.
Brad Pitt, California, Pitt met actress Jennifer Aniston in 1998 and they married in a private wedding ceremony in Malibu, California Malibu on July 29, 2000.
Brad Pitt, European, Pitt trained for months for role, which demanded significant mountain climbing and trekking practice, including rock climbing in California and European Alps with his co star David Thewlis.
Brad Pitt, David Thewlis, Pitt trained for months for role, which demanded significant mountain climbing and trekking practice, including rock climbing in California and European Alps with his co star David Thewlis.
Brad Pitt, 1998, Pitt had lead role in 1998's fantasy romance film Meet Joe Black.
Brad Pitt, 1998, 1994–1998  Breakthrough
Brad Pitt, 1998, Pitt met actress Jennifer Aniston in 1998 and they married in a private wedding ceremony in Malibu, California Malibu on July 29, 2000.
Brad Pitt, Meet Joe Black, Pitt had lead role in 1998's fantasy romance film Meet Joe Black.
Brad Pitt, Meet Joe Black, Interview (magazine) Interview in which he talked with his Legends of Fall and Meet Joe Black costar and fellow recovering alcoholic Anthony Hopkins about their experiences with addiction and recovery.
Brad Pitt, Mick LaSalle, Mick LaSalle of San Francisco Chronicle said Pitt was "ideally cast as an Irishman whose accent is so thick even Brits can't understand him", going on to say that, before Snatch, Pitt had been "shackled by roles that called for brooding introspection, but recently he has found his calling in black comic outrageousness and flashy extroversion;" while Amy Taubin of The Village Voice claimed that "Pitt gets maximum comic mileage out of a one joke role".
Brad Pitt, Mick LaSalle, According to Mick LaSalle of San Francisco Chronicle, Pitt was unable to "make an audience believe that he knows all mysteries of death and eternity."
Brad Pitt, Roger Ebert, Roger Ebert remarked, "Pitt is a fine actor, but this performance is a miscalculation."
Brad Pitt, Joe Black, Pitt had lead role in 1998's fantasy romance film Meet Joe Black.
Brad Pitt, Joe Black, Interview (magazine) Interview in which he talked with his Legends of Fall and Meet Joe Black costar and fellow recovering alcoholic Anthony Hopkins about their experiences with addiction and recovery.
Brad Pitt, Chuck Palahniuk, In 1999, Pitt portrayed The Narrator (Fight Club) Tyler Durden in Fight Club, a film adaptation of Chuck Palahniuk's Fight Club (novel) novel of same name, directed by David Fincher.
Brad Pitt, 25, Pitt's public image is strongly tied to his perceived sex appeal, with Empire (film magazine) Empire magazine naming him one of 25 sexiest stars in film history in 1995.
Brad Pitt, Chuck Palahniuk's, In 1999, Pitt portrayed The Narrator (Fight Club) Tyler Durden in Fight Club, a film adaptation of Chuck Palahniuk's Fight Club (novel) novel of same name, directed by David Fincher.
Brad Pitt, David Fincher, He was later cast as Benjamin Button, lead in David Fincher's 2008 film The Curious Case of Benjamin Button (film)
Brad Pitt, David Fincher, In 1999, Pitt portrayed The Narrator (Fight Club) Tyler Durden in Fight Club, a film adaptation of Chuck Palahniuk's Fight Club (novel) novel of same name, directed by David Fincher.
Brad Pitt, David Fincher, For U.S. market, he starred in a Heineken Pilsener Heineken commercial aired during Super Bowl XXXIX 2005 Super Bowl; it was directed by David Fincher, who had directed Pitt in Seven, Fight Club, and The Curious Case of Benjamin Button.
Brad Pitt, David Fincher, A 2017 sequel to World War Z was in announced in 2016, before film was briefly delayed, then confirmed to be directed by David Fincher and then ultimately shelved due to budget issues.
Brad Pitt, Michael Sragow, The story follows a man who is born an octogenarian and ages in reverse, with Pitt's "sensitive" performance making Benjamin Button a "timeless masterpiece", according to Michael Sragow of The Baltimore Sun.
Brad Pitt, Venice International Film Festival, Fight Club premiered at 1999 Venice International Film Festival.
Brad Pitt, Venice International Film Festival, He eventually collected award one year later at 65th Venice International Film Festival 2008 festival.
Brad Pitt, Venice International Film Festival, Directed by Andrew Dominik and produced by Pitt's company Plan B Entertainment, film premiered at 64th Venice International Film Festival 2007 Venice Film Festival, with Pitt playing a "scary and charismatic" role, according to Lewis Beale of Film Journal International, and earning Pitt Volpi Cup award for Best Actor at 64th Venice International Film Festival.
Brad Pitt, Venice, Fight Club premiered at 1999 Venice International Film Festival.
Brad Pitt, Venice, He eventually collected award one year later at 65th Venice International Film Festival 2008 festival.
Brad Pitt, Venice, Directed by Andrew Dominik and produced by Pitt's company Plan B Entertainment, film premiered at 64th Venice International Film Festival 2007 Venice Film Festival, with Pitt playing a "scary and charismatic" role, according to Lewis Beale of Film Journal International, and earning Pitt Volpi Cup award for Best Actor at 64th Venice International Film Festival.
Brad Pitt, Paul Clinton, Ocean's Twelve earned $362&nbsp;million worldwide, and Pitt and Clooney's dynamic was described by CNN's Paul Clinton as "best male chemistry since Paul Newman and Robert Redford."
Brad Pitt, Paul Clinton, Paul Clinton of CNN noted risky yet successful nature of film, while Variety remarked upon Pitt's ability to be "cool, charismatic and more dynamically physical, perhaps than [...] his breakthrough role in Thelma and Louise".
Brad Pitt, Louise, Pitt first Brad Pitt filmography gained recognition as a cowboy hitchhiker in road film Thelma & Louise (1991).
Brad Pitt, Louise, Paul Clinton of CNN noted risky yet successful nature of film, while Variety remarked upon Pitt's ability to be "cool, charismatic and more dynamically physical, perhaps than [...] his breakthrough role in Thelma and Louise".
Brad Pitt, Louise, After Thelma & Louise, Pitt starred in 1991 film Johnny Suede, a low budget picture about an aspiring rock star, and 1992 live action/animated fantasy film Cool World, although neither furthered his career, having poor reviews and box office performance.
Brad Pitt, Louise, After years of supporting roles in film and frequent television guest appearances, Pitt attracted wider recognition in his supporting role in Ridley Scott's 1991 road film Thelma & Louise.
Brad Pitt, Cult, In spite of a worse than expected box office performance, Fight Club became a Cult following cult classic after its DVD release in 2000.
Brad Pitt, 2000, In 2000, he co authored an architectural book on Robert R. Blacker House Blacker House with architects Thomas A. Heinz and Randell Makinson.
Brad Pitt, 2000, The same year, he was named People's Sexiest Man Alive, an accolade he received again in 2000.
Brad Pitt, 2000, Pitt was cast as an Irish Travellers Irish Traveller boxing boxer with a barely intelligible accent in Guy Ritchie's 2000 gangster film Snatch (film) Snatch.
Brad Pitt, 2000, In spite of a worse than expected box office performance, Fight Club became a Cult following cult classic after its DVD release in 2000.
Brad Pitt, 2000, Pitt met actress Jennifer Aniston in 1998 and they married in a private wedding ceremony in Malibu, California Malibu on July 29, 2000.
Brad Pitt, Guy Ritchie's, Pitt was cast as an Irish Travellers Irish Traveller boxing boxer with a barely intelligible accent in Guy Ritchie's 2000 gangster film Snatch (film) Snatch.
Brad Pitt, Irishman, Mick LaSalle of San Francisco Chronicle said Pitt was "ideally cast as an Irishman whose accent is so thick even Brits can't understand him", going on to say that, before Snatch, Pitt had been "shackled by roles that called for brooding introspection, but recently he has found his calling in black comic outrageousness and flashy extroversion;" while Amy Taubin of The Village Voice claimed that "Pitt gets maximum comic mileage out of a one joke role".
Brad Pitt, Brits, Mick LaSalle of San Francisco Chronicle said Pitt was "ideally cast as an Irishman whose accent is so thick even Brits can't understand him", going on to say that, before Snatch, Pitt had been "shackled by roles that called for brooding introspection, but recently he has found his calling in black comic outrageousness and flashy extroversion;" while Amy Taubin of The Village Voice claimed that "Pitt gets maximum comic mileage out of a one joke role".
Brad Pitt, Amy Taubin, Mick LaSalle of San Francisco Chronicle said Pitt was "ideally cast as an Irishman whose accent is so thick even Brits can't understand him", going on to say that, before Snatch, Pitt had been "shackled by roles that called for brooding introspection, but recently he has found his calling in black comic outrageousness and flashy extroversion;" while Amy Taubin of The Village Voice claimed that "Pitt gets maximum comic mileage out of a one joke role".
