Ed Sheeran, one, Inspired by a scene from festive romantic comedy film Love Actually, song's music video sees duo pay homage to scenes from British Christmas hits from past, including "Last Christmas", "Walking in Air", "Merry Christmas Everyone",  and "Stay Another Day".
Ed Sheeran, one, By 11 March 2017 Sheeran had accumulated ten top 10 singles from ÷ on UK Singles Chart, breaking Scottish DJ Calvin Harris's record of nine top 10 singles from one album.
Ed Sheeran, one, Shivers" dethroned "Bad Habits" at top of UK and Irish singles charts.
Ed Sheeran, one, On 17 January, "Shape of You" debuted at number one on US Billboard Hot 100 Billboard Hot 100, while "Castle on Hill" entered at number six; this made Sheeran first artist ever to have two songs simultaneously debut in US top 10.
Ed Sheeran, one, Both singles went on to break Spotify day one streaming record, with a combined total of over 13 million streams in 24 hours.
Ed Sheeran, one, As of 9 August 2019, his four albums have spent a combined 41 weeks at number one in UK, List of UK Albums Chart number ones of 2010s most weeks at number one in UK Album Charts in 2010s, five weeks more than Adele in second.
Ed Sheeran, one, The tartan shirt worn by Sheeran when he met Renee Zellweger's character, Bridget, in Bridget Jones's Baby, was auctioned online to raise further funds for hospice.
Ed Sheeran, one, Elton John, who runs Sheeran's management company, canvassed award organisers to get Sheeran a performance slot at ceremony but was told that Sheeran alone was not high profile enough.
Ed Sheeran, one, In 2008, he auditioned for ITV series Britannia High.
Ed Sheeran, one, Sheeran made his acting debut in 2014, a cameo role as himself on New Zealand soap opera Shortland Street, filmed while he was in country for a one off performance.
Ed Sheeran, one, Sheeran also cited Taylor Swift as one of his influences, suggesting in 2015 their respective success drives each other on.
Ed Sheeran, one, The Rolling Stones's Zip Code Tour (Kansas City only)
Ed Sheeran, one, In 2017, BBC named him second best performing artist of decade, after Adele, while in 2021, The Independent said he had "one of biggest pop careers of this generation."
Ed Sheeran, one, In July 2017, Sheeran appeared in a scene on Game of Thrones (season 7) Game of Thrones opposite Maisie Williams, who plays Arya Stark.
Ed Sheeran, one, In November Sheeran sold one of his paintings, marking first and only time his art has been made available for sale, which he titled "Dab 2 2020", to same auction.
Ed Sheeran, one, The song debuted at number one in UK Singles Chart on 10 December to become Sheeran's 12th number one.
Ed Sheeran, one, By March 2017, Sheeran had accumulated ten top 10 singles from ÷ on UK Singles Chart, breaking record for most top 10 UK singles from one album.
Ed Sheeran, one, Eight of his songs featured in Official Chart Company's chart of decade with three songs inside top 5 – "Shape of You" was named number one.
Ed Sheeran, one, "It's good to show insight that these people are real people with real emotions and they deserve same charity work as anyone else," Sheeran said.
Ed Sheeran, one, Make It Rain" for Sons of Anarchy, Sheeran was cast by creator Kurt Sutter to play Sir Cormac in medieval drama The Bastard Executioner on FX (TV channel) FX.
Ed Sheeran, one, Sheeran's charity, Framlingham Foundation Trust, is reported to have donated money to give a primary school teacher to take an imperative course to help children create songs with untraditional instruments which will benefit children with learning difficulties.
Ed Sheeran, one, Perfect", reached number one in US, Australia and UK, where it became List of UK Singles Chart Christmas number ones Christmas number one in 2017.
Ed Sheeran, one, The same day he also became first artist to debut at number one and number two on GfK Entertainment Charts German Single Charts.
Ed Sheeran, one, Sheeran was one of nearly thirty celebrities, which included Helen Mirren, Jeremy Irons and Hugh Laurie, to donate items of winter clothing to campaign, with proceeds used to help people in country struggling to keep their home warm in winter.
Ed Sheeran, one, It became his second single to reach number one in UK, and it also spent eight weeks at number two on US Billboard Hot 100 Billboard Hot 100 (with only "Uptown Funk" by Mark Ronson featuring Bruno Mars keeping it from top spot).
Ed Sheeran, one, The album received generally favourable reviews from music critics and debuted at number one on UK Albums Chart for sales of 102,000 copies.
Ed Sheeran, one, Sheeran also appeared as himself in 2016 film Bridget Jones's Baby in a scene where Bridget Jones, played by Renée Zellweger, encounters singer at Glastonbury Festival.
Ed Sheeran, one, Released in 2019, his fourth studio album No.6 Collaborations Project debuted at number one in most major markets, and spawned three UK number one singles, "I Don't Care (Ed Sheeran and Justin Bieber song)
Ed Sheeran, fourth, Drunk", released on 19 February 2012, became Sheeran's fourth consecutive top ten single in UK, peaking at number nine.
Ed Sheeran, fourth, The fourth single from ÷, "Perfect (Ed Sheeran song)
Ed Sheeran, fourth, I Don't Care", a duet with Justin Bieber, from his fourth studio album No.6 Collaborations Project.
Ed Sheeran, fourth, Topping charts in most major markets,   became his fifth UK number one album, and fourth US number one.
Ed Sheeran, fourth, He later co wrote and provided vocals for "Everything Has Changed", a single featured on Swift's fourth studio album, Red (Taylor Swift album)
Ed Sheeran, fourth, In 2015, Sheeran wrote "Love Yourself" for Justin Bieber's fourth album.
Ed Sheeran, fourth, Although he regards Suffolk as home having moved to county as a young child, Sheeran was recognised by his county of birth in a 2018 poll when he was ranked fourth greatest Yorkshireman ever behind Monty Python comedian Michael Palin, and actors Sean Bean and Patrick Stewart.
Ed Sheeran, fourth, Vance's fourth album Joy of Nothing.
Ed Sheeran, fourth, His fourth single from ÷, "Perfect (Ed Sheeran song)
Ed Sheeran, fourth, Released in 2019, his fourth studio album No.6 Collaborations Project debuted at number one in most major markets, and spawned three UK number one singles, "I Don't Care (Ed Sheeran and Justin Bieber song)
Ed Sheeran, Perfect (, She is inspiration of song "Perfect (Ed Sheeran song)
Ed Sheeran, Perfect (, The fourth single from ÷, "Perfect (Ed Sheeran song)
Ed Sheeran, Perfect (, His fourth single from ÷, "Perfect (Ed Sheeran song)
Ed Sheeran, Australia, The album also reached top five in Australia, Canada, Ireland, New Zealand and US.
Ed Sheeran, Australia, His 10th UK number one single, song spent eleven consecutive weeks at top of UK Singles Chart and Irish Singles Chart, topped charts in Australia, Canada and Germany among others, and peaked at number two on Billboard Hot 100 Billboard Hot 100 in US.
Ed Sheeran, Australia, The song debuted at number one in UK, Australia and other markets, and number two in US.
Ed Sheeran, Australia, The album debuted at number one in UK, US, Germany, Australia, Canada and other major markets.
Ed Sheeran, Australia, Perfect", reached number one in UK and Australia, and a stripped down acoustic version of song titled "Perfect Duet", a collaboration with Beyoncé, reached number one in US and UK, becoming year's List of UK Singles Chart Christmas number ones UK Christmas number one.
Ed Sheeran, Australia, The album debuted at number one in UK, US, Australia and other markets.
Ed Sheeran, Australia, Taylor Swift contacted Sheeran after hearing his music while touring Australia in March 2012.
Ed Sheeran, Australia, On 15 January, songs debuted at number one and number two on ARIA Singles Chart, first time this has been achieved in history of Australian chart.
Ed Sheeran, Australia, "Lego House" was released as third single, reaching top ten on Australian, Irish and New Zealand Singles Charts.
Ed Sheeran, Australia, The lead single also became a top ten hit in Australia, Germany, Ireland, Japan, Luxembourg, New Zealand, Norway and Netherlands.
Ed Sheeran, Australia, Sheeran played to over 950,000 people in Australia and New Zealand in March and April, making it biggest concert tour in Australasian music history, overtaking previous record set by Dire Straits in 1986.
Ed Sheeran, Australia, Later that year, while in Australia, he recorded scenes for soap Home and Away, as a character based on himself.
Ed Sheeran, Australia, Khalid debuted at number 3 in UK and number 4 in Australia.
Ed Sheeran, Australia, Perfect", reached number one in US, Australia and UK, where it became List of UK Singles Chart Christmas number ones Christmas number one in 2017.
Ed Sheeran, Christmas, Perfect", reached number one in UK and Australia, and a stripped down acoustic version of song titled "Perfect Duet", a collaboration with Beyoncé, reached number one in US and UK, becoming year's List of UK Singles Chart Christmas number ones UK Christmas number one.
Ed Sheeran, Christmas, It's Christmas?"
Ed Sheeran, Christmas, Inspired by a scene from festive romantic comedy film Love Actually, song's music video sees duo pay homage to scenes from British Christmas hits from past, including "Last Christmas", "Walking in Air", "Merry Christmas Everyone",  and "Stay Another Day".
Ed Sheeran, Christmas, On 29 November 2021, Sheeran and Elton John announced their new single "Merry Christmas (song)
Ed Sheeran, Christmas, Perfect", reached number one in US, Australia and UK, where it became List of UK Singles Chart Christmas number ones Christmas number one in 2017.
Ed Sheeran, Christmas, Merry Christmas", a festive duet for charity.
Ed Sheeran, Global Recording Artist, The world's best selling artist of 2017, he was named Global Recording Artist of Year.
Ed Sheeran, Global Recording Artist, As best selling artist worldwide for 2017 International Federation of Phonographic Industry IFPI named him Global Recording Artist of Year.
Ed Sheeran, 2019, As of 2019, he has received four Grammy Awards (including Grammy Award for Song of Year Song of Year in 2016 for "Thinking Out Loud"), five Brit Awards (including Brit Award for British Male Solo Artist British Male Solo Artist in 2015), and six Billboard Music Award Billboard Music Awards (including Billboard Music Award for Top Artist Top Artist in 2018).
Ed Sheeran, 2019, Similarly, The Guardian writer Laura Snapes cited him as "godfather of current crop of singer songwriters" in 2019, stating that Sheeran inspired "troubadours" to enter music charts, and marked "calcification of everyman male pop star", and end of record labels marketing them "exclusively to teenage girls and their mums."
Ed Sheeran, 2019, In December 2019, he launched his own music foundation, Ed Sheeran Suffolk Music Foundation (ESSMF).
Ed Sheeran, 2019, Released on 28 June 2019, "Beautiful People (Ed Sheeran song)
Ed Sheeran, 2019, In December 2019, Official Charts Company named him artist of decade, with most combined success in UK album and singles charts in 2010s.
Ed Sheeran, 2019, ÷ Tour (2017–2019)
Ed Sheeran, 2019, Beginning in March 2017, his ÷ Tour became List of highest grossing concert tours highest grossing of all time in August 2019.
Ed Sheeran, 2019, In June 2019, Sheeran made his debut appearance in an advertisement for Heinz Tomato Ketchup.
Ed Sheeran, 2019, As of 9 August 2019, his four albums have spent a combined 41 weeks at number one in UK, List of UK Albums Chart number ones of 2010s most weeks at number one in UK Album Charts in 2010s, five weeks more than Adele in second.
Ed Sheeran, 2019, An alumnus of National Youth Theatre in London, Sheeran's acting roles include appearing in 2019 film Yesterday (2019 film) Yesterday.
Ed Sheeran, 2019, On 10 May 2019, Sheeran released single "I Don't Care (Ed Sheeran and Justin Bieber song)
Ed Sheeran, 2019, On 29 September 2019, Sheeran announced he was teaming up with his manager Stuart Camp to open a bar located on Portobello Road in Notting Hill.
Ed Sheeran, 2019, Released in June 2019, Sheeran appeared as himself in a supporting role in Richard Curtis/Danny Boyle film Yesterday (2019 film)
Ed Sheeran, 2019, According to The Sunday Times (UK) The Sunday Times Sunday Times Rich List Rich List of 2019, Sheeran is worth £160 million ($207 million) as 17th richest musician in UK.
Ed Sheeran, 2019, In 2019, Sheeran co wrote country music singer Kenny Chesney's single "Tip of My Tongue (Kenny Chesney song)
Ed Sheeran, 2019, In December 2019, Sheeran was named artist of decade by Official Charts Company for being most successful performer in UK album and singles charts of 2010s.
Ed Sheeran, 2019, No.6 Collaborations Project (2019)
Ed Sheeran, 2019, Released in 2019, his fourth studio album No.6 Collaborations Project debuted at number one in most major markets, and spawned three UK number one singles, "I Don't Care (Ed Sheeran and Justin Bieber song)
Ed Sheeran, 2019, US District Judge Louis Stanton rejected Sheeran's call for a legal case accusing him of copying parts of song in "Thinking Out Loud" to be dismissed in January 2019.
Ed Sheeran, No.6 Collaborations Project, I Don't Care", a duet with Justin Bieber, from his fourth studio album No.6 Collaborations Project.
Ed Sheeran, No.6 Collaborations Project, No.6 Collaborations Project (2019)
Ed Sheeran, No.6 Collaborations Project, Released in 2019, his fourth studio album No.6 Collaborations Project debuted at number one in most major markets, and spawned three UK number one singles, "I Don't Care (Ed Sheeran and Justin Bieber song)
Ed Sheeran, number one, Little Things" became group's second number one in UK.
Ed Sheeran, number one, × peaked at number one in both UK Albums Chart and US Billboard 200.
Ed Sheeran, number one, His 10th UK number one single, song spent eleven consecutive weeks at top of UK Singles Chart and Irish Singles Chart, topped charts in Australia, Canada and Germany among others, and peaked at number two on Billboard Hot 100 Billboard Hot 100 in US.
Ed Sheeran, number one, On 30 August, seventh single from album, "Take Me Back to London" featuring Stormzy, reached number one in UK.
Ed Sheeran, number one, On 13 January, "Shape of You" and "Castle on Hill" entered UK Singles Chart at number one and number two, first time in history an artist has taken top two UK chart positions with new songs.
Ed Sheeran, number one, On 3 January 2018, "Shape of You" was named List of UK top ten singles in 2017 best selling single of 2017 in UK, and List of Billboard Hot 100 number one singles of 2017 best selling single of 2017 on Billboard Hot 100 in US.
Ed Sheeran, number one, The song debuted at number one in UK, Australia and other markets, and number two in US.
Ed Sheeran, number one, The album debuted at number one in UK, US, Germany, Australia, Canada and other major markets.
Ed Sheeran, number one, His eleventh week at number one in UK saw him become first British solo artist to notch up 52 weeks at Number 1 across his catalogue, with only Elvis Presley (80 weeks) and The Beatles (69 weeks) achieving more weeks at summit.
Ed Sheeran, number one, Topping charts in most major markets,   became his fifth UK number one album, and fourth US number one.
Ed Sheeran, number one, List of Official Subscription Plays Chart number one songs of 2010s
Ed Sheeran, number one, Perfect", reached number one in UK and Australia, and a stripped down acoustic version of song titled "Perfect Duet", a collaboration with Beyoncé, reached number one in US and UK, becoming year's List of UK Singles Chart Christmas number ones UK Christmas number one.
Ed Sheeran, number one, Lawson released his Jamie Lawson (album) self titled debut album on 9 October 2015, which has earned him a number one in UK Albums Chart.
Ed Sheeran, number one, The album debuted at number one in UK, US, Australia and other markets.
Ed Sheeran, number one, By early June 2014, "Sing" had earned Sheeran his first number one single in UK.
Ed Sheeran, number one, On 15 January, songs debuted at number one and number two on ARIA Singles Chart, first time this has been achieved in history of Australian chart.
Ed Sheeran, number one, On 17 January, "Shape of You" debuted at number one on US Billboard Hot 100 Billboard Hot 100, while "Castle on Hill" entered at number six; this made Sheeran first artist ever to have two songs simultaneously debut in US top 10.
Ed Sheeran, number one, As of 9 August 2019, his four albums have spent a combined 41 weeks at number one in UK, List of UK Albums Chart number ones of 2010s most weeks at number one in UK Album Charts in 2010s, five weeks more than Adele in second.
Ed Sheeran, number one, The song debuted at number one in UK Singles Chart on 10 December to become Sheeran's 12th number one.
Ed Sheeran, number one, Eight of his songs featured in Official Chart Company's chart of decade with three songs inside top 5 – "Shape of You" was named number one.
Ed Sheeran, number one, Perfect", reached number one in US, Australia and UK, where it became List of UK Singles Chart Christmas number ones Christmas number one in 2017.
Ed Sheeran, number one, The same day he also became first artist to debut at number one and number two on GfK Entertainment Charts German Single Charts.
Ed Sheeran, number one, It became his second single to reach number one in UK, and it also spent eight weeks at number two on US Billboard Hot 100 Billboard Hot 100 (with only "Uptown Funk" by Mark Ronson featuring Bruno Mars keeping it from top spot).
Ed Sheeran, number one, The album received generally favourable reviews from music critics and debuted at number one on UK Albums Chart for sales of 102,000 copies.
Ed Sheeran, number one, Released in 2019, his fourth studio album No.6 Collaborations Project debuted at number one in most major markets, and spawned three UK number one singles, "I Don't Care (Ed Sheeran and Justin Bieber song)
Ed Sheeran, three UK number one, Released in 2019, his fourth studio album No.6 Collaborations Project debuted at number one in most major markets, and spawned three UK number one singles, "I Don't Care (Ed Sheeran and Justin Bieber song)
Ed Sheeran, Beautiful People (, I Don't Care", "Beautiful People (Ed Sheeran song)
Ed Sheeran, Beautiful People (, Released on 28 June 2019, "Beautiful People (Ed Sheeran song)
Ed Sheeran, Take Me Back, On 30 August, seventh single from album, "Take Me Back to London" featuring Stormzy, reached number one in UK.
Ed Sheeran, Take Me Back, Beautiful People" and "Take Me Back to London".
Ed Sheeran, London, He was accepted at National Youth Theatre in London as a teenager.
Ed Sheeran, London, On 30 August, seventh single from album, "Take Me Back to London" featuring Stormzy, reached number one in UK.
Ed Sheeran, London, at Sarm West Studios in Notting Hill, London, to raise money for West African Ebola virus epidemic.
Ed Sheeran, London, At 2018 Brit Awards held at The O2 Arena O2 Arena in London on 21 February, Sheeran performed "Supermarket Flowers", and received Global Success Award from Elton John and Rolling Stones guitarist Ronnie Wood.
Ed Sheeran, London, Sheeran's parents, John and Imogen, are from London.
Ed Sheeran, London, Jamie Lawson (musician) Jamie Lawson, label's first signee, met Sheeran while they were both in London's folk circuit.
Ed Sheeran, London, Sheeran performed "The A Team" at Diamond Jubilee of Elizabeth II Diamond Jubilee of Queen Elizabeth II Diamond Jubilee Concert concert held on The Mall, London The Mall outside Buckingham Palace on 4 June 2012 and a cover of Pink Floyd's "Wish You Were Here (Pink Floyd song)
Ed Sheeran, London, In 2014, he bought a house in South London.
Ed Sheeran, London, On 10–12 July 2015, Sheeran performed sold out shows at London's Wembley Stadium.
Ed Sheeran, London, An alumnus of National Youth Theatre in London, Sheeran's acting roles include appearing in 2019 film Yesterday (2019 film) Yesterday.
Ed Sheeran, London, He moved to London in 2008 and began playing in small venues.
Ed Sheeran, London, Wish You Were Here" at 2012 Summer Olympics closing ceremony closing ceremony of 2012 Summer Olympics in London on 12 August 2012.
Ed Sheeran, London, On 24 March 2014, Sheeran performed at Teenage Cancer Trust charity concert at Royal Albert Hall in London where he unveiled "Take It Back", a track that would appear on deluxe version of second album.
Ed Sheeran, London, Beautiful People" and "Take Me Back to London".
Ed Sheeran, fifth, On 24 October 2021, Sheeran tested positive for COVID 19 less than a week before release of his   (album) fifth album.
Ed Sheeran, fifth, Topping charts in most major markets,   became his fifth UK number one album, and fourth US number one.
Ed Sheeran, fifth, On 19 August, Sheeran announced that his fifth studio album would be called   (album)   (pronounced "equals") and released on 29 October 2021 with a total of 14 songs.
Ed Sheeran, fifth, His fifth studio album,   (album)   (pronounced "equals"), topped charts in most major markets in 2021.
Ed Sheeran, fifth, Bad Habits", lead single from his upcoming fifth studio album.
Ed Sheeran, 2021, On 24 October 2021, Sheeran tested positive for COVID 19 less than a week before release of his   (album) fifth album.
Ed Sheeran, 2021, (album)   (2021)
Ed Sheeran, 2021, On 19 August, Sheeran announced that his fifth studio album would be called   (album)   (pronounced "equals") and released on 29 October 2021 with a total of 14 songs.
Ed Sheeran, 2021, His fifth studio album,   (album)   (pronounced "equals"), topped charts in most major markets in 2021.
Ed Sheeran, 2021, On 29 November 2021, Sheeran and Elton John announced their new single "Merry Christmas (song)
Ed Sheeran, 2021, On 25 June 2021, Sheeran released "Bad Habits (Ed Sheeran song)
Ed Sheeran, 2021, On 9 September he was part of 2021 Kickoff Experience ahead of American NFL season opening game.
Ed Sheeran, 2021, In 2017, BBC named him second best performing artist of decade, after Adele, while in 2021, The Independent said he had "one of biggest pop careers of this generation."
Ed Sheeran, 2021, In 2021, Sheeran, along with several other celebrities, urged United States Congress to pass proposed Equality Act (United States) Equality Act, which would expand Civil Rights Act of 1964 Civil Rights Act in order to outlaw discrimination against LGBT people.
Ed Sheeran, 2021, Maisie Peters also signed with label in 2021.
Ed Sheeran, 2021, Ipswich Town, and his +– ÷x Tour kit sponsored their 2021–22 Ipswich Town F.C. season 2021–22 season.
Ed Sheeran, more than 150 million, In addition to having List of highest grossing concert tours highest grossing concert tour and being one of List of best selling music artists world's best selling music artists with more than 150 million records sold, Sheeran has received a number of awards.
Ed Sheeran, more than 150 million, Sheeran has sold more than 150 million records worldwide, making him one of List of best selling music artists world's best selling music artists.
Ed Sheeran, Ivor Novello, At Ivor Novello Awards in May 2012, Sheeran's "The A Team" bested Adele's "Rolling in Deep" and Florence and Machine's "Shake It Out" for Best Song Musically and Lyrically.
Ed Sheeran, Ivor Novello, Category Ivor Novello Award winners
Ed Sheeran, Ivor Novello, In 2015 and 2018, he received Ivor Novello Awards Ivor Novello Award for Songwriter of Year from British Academy of Songwriters, Composers, and Authors.
Ed Sheeran, Ivor Novello, In same year, × won 2015 Brit Awards#Nominees and winners Album of Year at 2015 Brit Awards, and he received Ivor Novello Awards Ivor Novello Award for Songwriter of Year from British Academy of Songwriters, Composers and Authors.
Ed Sheeran, Ivor Novello, On 21 May he received Ivor Novello Award for Songwriter of Year.
Ed Sheeran, 84.5 million, He has 84.5 million Riaa RIAA certified units in US, and two of his albums are in list of List of best selling albums in United Kingdom best selling albums in UK chart history.
Ed Sheeran, RIAA, He has 84.5 million Riaa RIAA certified units in US, and two of his albums are in list of List of best selling albums in United Kingdom best selling albums in UK chart history.
Ed Sheeran, June 2020, In June 2020, Sheeran made a "founding gift" to launch Suffolk Community Foundation's "Rebuilding Local Lives Appeal" in response to COVID 19 pandemic on celebration day of county, "Suffolk Day".
Ed Sheeran, United Kingdom, With first week sales of 672,000 it is fastest selling album by a male solo artist in UK, and Lists of fastest selling albums#United Kingdom third fastest in UK chart history behind 25 (Adele album) 25 by Adele and Be Here Now (album) Be Here Now by Oasis (band) Oasis.
Ed Sheeran, United Kingdom, A lifelong fan of product — he has it with everything from fish and chips to his morning Sausage sandwich#United Kingdom sausage "butty" to upmarket dinners, carries a bottle on tour, and has a Heinz Ketchup tattoo on his arm — he put forward an idea he had written for their next TV campaign, and company responded.
Ed Sheeran, United Kingdom, Following 2016 United Kingdom European Union membership referendum June 2016 referendum result where British public voted to leave, Sheeran was among a group of British musicians (which included Sting (musician) Sting, Queen (band)
Ed Sheeran, United Kingdom, In December 1995 he moved with his family from Hebden Bridge to Framlingham in Suffolk, where he attended independent Brandeston Hall Preparatory school (United Kingdom) preparatory school (now Framlingham College Prep School), then Thomas Mills High School, also in Framlingham.
Ed Sheeran, United Kingdom, Sheeran publicly opposed Brexit (United Kingdom leaving European Union), and supported "remain".
