Title, Named Entity, Sentence
Ed Sheeran, Ed Sheeran, x (Ed Sheeran album) × (2014)
Ed Sheeran, Ed Sheeran, She is inspiration of song "Perfect (Ed Sheeran song)
Ed Sheeran, Ed Sheeran, Ed Sheeran's musical style has been described as Pop music pop folk pop, and soft rock.
Ed Sheeran, Ed Sheeran, It contained his first hit single "The A Team (Ed Sheeran song)
Ed Sheeran, Ed Sheeran, Sheeran was in a relationship with Scottish singer songwriter Nina Nesbitt (who was in his music video for "Drunk (Ed Sheeran song)
Ed Sheeran, Ed Sheeran, The fourth single from ÷, "Perfect (Ed Sheeran song)
Ed Sheeran, Ed Sheeran, On 21 December 2020, after being on hiatus after having his first child with Cherry Seaborn in August, he released surprise single, "Afterglow (Ed Sheeran song)
Ed Sheeran, Ed Sheeran, Nesbitt is subject of Sheeran's songs "Nina" and "Photograph (Ed Sheeran song) Photograph", while most of Nesbitt's album, Peroxide (Nina Nesbitt album) Peroxide, is about Sheeran.
Ed Sheeran, Ed Sheeran, The company released a limited edition ketchup product known as Ed Sheeran X Heinz ketchup, also known as "Heinz Edchup".
Ed Sheeran, Ed Sheeran, "Sing (Ed Sheeran song)
Ed Sheeran, Ed Sheeran, "Sing" was intended to create hype over album release, but from concern that this might alienate Sheeran's fan base, "One (Ed Sheeran song)
Ed Sheeran, Ed Sheeran, In December 2019, he launched his own music foundation, Ed Sheeran Suffolk Music Foundation (ESSMF).
Ed Sheeran, Ed Sheeran, Music journalist Alexis Petridis has stated that Ed Sheeran "brought pop back down to earth" with his music style, introducing himself "touting an even more austere version of Coldplay's dressed down authenticity  one unassuming man, his guitar and a Live looping loop pedal".
Ed Sheeran, Ed Sheeran, Sheeran's second studio album, x (Ed Sheeran album) × (pronounced "multiply"), was released worldwide on 23 June 2014.
Ed Sheeran, Ed Sheeran, The concert was documented and aired on 16 August 2015 on NBC; one hour special Ed Sheeran – Live at Wembley Stadium also included behind the scenes footage.
Ed Sheeran, Ed Sheeran, All of UK profits from song will go to Ed Sheeran Suffolk Music Foundation and Elton John AIDS Foundation.
Ed Sheeran, Ed Sheeran, I Don't Care", "Beautiful People (Ed Sheeran song)
Ed Sheeran, Ed Sheeran, The donations, which have been made over a two year period via Ed Sheeran Suffolk Music Foundation, helped school to purchase items such as MacBooks, cameras and a photography darkroom.
Ed Sheeran, Ed Sheeran, Released on 28 June 2019, "Beautiful People (Ed Sheeran song)
Ed Sheeran, Ed Sheeran, Noting him as "one of most influential" artists of his generation, as he spawned "endless imitators", Petridis remarked that music charts were "packed with Sheeran alikes" after x (Ed Sheeran album) ×, describing it as "wave of earnest, dressed down, boy next door troubadours" that reached critical mass.
Ed Sheeran, Ed Sheeran, To support album, Sheeran embarked on x Tour (Ed Sheeran tour) a world tour starting on 6 August 2014 at Osaka, Japan.
Ed Sheeran, Ed Sheeran, At 2018 Billboard Music Awards 2018 Billboard Music Awards on 20 May, Sheeran performed "Galway Girl (Ed Sheeran song)
Ed Sheeran, Ed Sheeran, Category Ed Sheeran
Ed Sheeran, Ed Sheeran, Ed Sheeran
Ed Sheeran, Ed Sheeran, On 5 July, Sheeran released two new songs, "Best Part of Me" featuring Yebba, and "Blow (Ed Sheeran, Chris Stapleton and Bruno Mars song) Blow" with Bruno Mars and Chris Stapleton.
Ed Sheeran, Ed Sheeran, Some of episode is on their Facebook page Sheeran also self released two other EPs in 2010, Ed Sheeran  Live at Bedford and Songs I Wrote with Amy, which is a collection of love songs he wrote in Wales with Amy Wadge.
Ed Sheeran, Ed Sheeran, Following "Don't (Ed Sheeran song) Don't", "Thinking Out Loud" was released on 24 September 2014 as album's third single.
Ed Sheeran, Ed Sheeran, On 25 June 2021, Sheeran released "Bad Habits (Ed Sheeran song)
Ed Sheeran, Ed Sheeran, On 10 May 2019, Sheeran released single "I Don't Care (Ed Sheeran and Justin Bieber song)
Ed Sheeran, Ed Sheeran, X Tour (Ed Sheeran) × Tour (2014–2015)
Ed Sheeran, Ed Sheeran, Released on 10 September, "Shivers (Ed Sheeran song)
Ed Sheeran, Ed Sheeran, Sheeran's parents organised The Ed Sheeran Made in Suffolk Legacy Auction on 23 October 2020 which ran until 8 November.
Ed Sheeran, Ed Sheeran, "Drunk (Ed Sheeran song)
Ed Sheeran, Ed Sheeran, In same month, he also released his critically acclaimed Loose Change EP, which featured his future debut single, "The A Team (Ed Sheeran song)
Ed Sheeran, Ed Sheeran, His song, "Give Me Love (Ed Sheeran song)
Ed Sheeran, Ed Sheeran, On 12 July, he released album, along with "Antisocial (Ed Sheeran and Travis Scott song) Antisocial" with Travis Scott.
Ed Sheeran, Ed Sheeran, I did something for his record, and I was credited as 'Angelo Mysterioso,' appearing as a guest on Clapton's "I Will Be There", in addition to performing song with Clapton on stage, and he did something for my record performing a guitar solo on "Dive (Ed Sheeran song) Dive" on Sheeran's album ÷ and was credited as 'Angelo Mysterioso.'"
Ed Sheeran, Ed Sheeran, On 21 June, Sheeran co hosted 2015 Much Music Video Awards in Toronto, where he performed singles, "Thinking Out Loud" and "Photograph (Ed Sheeran song) Photograph"; he also won two awards, Best International Artist and Most Buzzworthy International Artist or Group.
Ed Sheeran, Ed Sheeran, His fourth single from ÷, "Perfect (Ed Sheeran song)
Ed Sheeran, Ed Sheeran, Sheeran's second studio album, x (Ed Sheeran album) × (pronounced "multiply"), topped charts around world upon its release in June 2014.
Ed Sheeran, Ed Sheeran, Released in 2019, his fourth studio album No.6 Collaborations Project debuted at number one in most major markets, and spawned three UK number one singles, "I Don't Care (Ed Sheeran and Justin Bieber song)
Ed Sheeran, English, Category English male guitarists
Ed Sheeran, English, In November 2015 Sheeran released DVD Jumpers for Goalposts  Live at Wembley Stadium; title is a nod to playing concerts at Wembley Stadium, home of English football.
Ed Sheeran, English, Category English male singer songwriters
Ed Sheeran, English, Category 21st century English male actors
Ed Sheeran, English, Category English people of Irish descent
Ed Sheeran, English, Sheeran and his work have influenced various recording artists, including Shawn Mendes, Louis Tomlinson, Camila Cabello, and Cody Simpson, while English singer Hrvy has called him "such a good songwriter".
Ed Sheeran, English, Category English record producers
Ed Sheeran, English, He has been friends with fellow English singer,
Ed Sheeran, English, Category English male singers
Ed Sheeran, English, Category English pop guitarists
Ed Sheeran, English, Category 21st century English singers
Ed Sheeran, English, Category English philanthropists
Ed Sheeran, English, Edward Christopher Sheeran  (; born 17 February 1991) is an English singer songwriter.
Ed Sheeran, English, Category English pop singers
Ed Sheeran, British, As of 2019, he has received four Grammy Awards (including Grammy Award for Song of Year Song of Year in 2016 for "Thinking Out Loud"), five Brit Awards (including Brit Award for British Male Solo Artist British Male Solo Artist in 2015), and six Billboard Music Award Billboard Music Awards (including Billboard Music Award for Top Artist Top Artist in 2018).
Ed Sheeran, British, On 15 November 2014, Sheeran joined charity supergroup Band Aid 30 along with other British and Irish pop acts, recording latest version of track "Do They Know
Ed Sheeran, British, Category British hip hop singers
Ed Sheeran, British, On 25 February, Sheeran won Brit Award for British Male Solo Artist British Male Solo Artist and British Album of Year for × at 2015 Brit Awards.
Ed Sheeran, British, Billboard, The Financial Express (India) The Financial Express, Brandon Sun, and Arab News have cited him as a "British music icon".
Ed Sheeran, British, His eleventh week at number one in UK saw him become first British solo artist to notch up 52 weeks at Number 1 across his catalogue, with only Elvis Presley (80 weeks) and The Beatles (69 weeks) achieving more weeks at summit.
Ed Sheeran, British, At 2012 Brit Awards on 21 February, Sheeran won Brit Awards for Brit Award for British Male Solo Artist Best British Male Solo Artist, and Brit Award for British Breakthrough Act British Breakthrough Act of Year.
Ed Sheeran, British, He was appointed Member of Order of British Empire (MBE) in 2017 Birthday Honours for "services to music and charity".
Ed Sheeran, British, Category British folk pop singers
Ed Sheeran, British, Following 2016 United Kingdom European Union membership referendum June 2016 referendum result where British public voted to leave, Sheeran was among a group of British musicians (which included Sting (musician) Sting, Queen (band)
Ed Sheeran, British, Category Alumni of British Youth Music Theatre
Ed Sheeran, British, Inspired by a scene from festive romantic comedy film Love Actually, song's music video sees duo pay homage to scenes from British Christmas hits from past, including "Last Christmas", "Walking in Air", "Merry Christmas Everyone",  and "Stay Another Day".
Ed Sheeran, British, In 2017, Sheeran publicly endorsed Centre left politics centre left British Labour Party (UK) Labour Party and described himself as a "fan" of its then leader Jeremy Corbyn, while adding that "I'm not Mr Political.
Ed Sheeran, British, In February 2010, Sheeran posted a video through SB.TV – a channel launched by British entrepreneur Jamal Edwards – and rapper Example (musician) Example invited Sheeran to tour with him.
Ed Sheeran, British, The album has been certified platinum six times by British Phonographic Industry, denoting shipments of 1,800,000 copies.
Ed Sheeran, British, He is a patron of Youth Music Theatre UK (now renamed British Youth Music Theatre) and of Access to Music, where he studied Artist Development.
Ed Sheeran, British, Category Members of Order of British Empire
Ed Sheeran, British, In 2012, Sheeran won Brit Awards for Brit Award for British Male Solo Artist Best British Male Solo Artist and Brit Award for British Breakthrough Act British Breakthrough Act.
Ed Sheeran, British, On 8 January 2011, Sheeran released another independent EP, No. 5 Collaborations Project, featuring grime artists such as Wiley (rapper) Wiley, Jme (MC) Jme, Devlin (rapper) Devlin, Sway (British musician) Sway and Ghetts.
Ed Sheeran, British, Sheeran is a second cousin of Northern Irish broadcaster Gordon Burns, who hosted British game show The Krypton Factor.
Ed Sheeran, British, Sheeran has donated some of his personal items including handwritten lyrics from his song "Perfect", lego bricks he played with as a kid, handmade You Need Me EP from 2009 and a £3 ticket to his first gig at British Legion in Framlingham.
Ed Sheeran, British, In 2015 and 2018, he received Ivor Novello Awards Ivor Novello Award for Songwriter of Year from British Academy of Songwriters, Composers, and Authors.
Ed Sheeran, British, In same year, × won 2015 Brit Awards#Nominees and winners Album of Year at 2015 Brit Awards, and he received Ivor Novello Awards Ivor Novello Award for Songwriter of Year from British Academy of Songwriters, Composers and Authors.
Ed Sheeran, December 2017, On 5 December 2017, hip hop artist Eminem announced that Sheeran had collaborated on song "River (Eminem song) River" for his ninth studio album Revival (Eminem album) Revival.
Ed Sheeran, December 2017, In December 2017, Sheeran appeared on BBC Radio 1's Live Lounge, performing his song "Perfect" and a duet of The Pogues' festive classic "Fairytale of New York" with Anne Marie (singer)
Ed Sheeran, December 2017, Sheeran received award from Prince Charles at Buckingham Palace on 7 December 2017.
Ed Sheeran, April 2022, On 6 April 2022, Sheeran won case, with a judge ruling that Sheeran had not plagiarised song.
Ed Sheeran, Sheeran, On 15 November 2014, Sheeran joined charity supergroup Band Aid 30 along with other British and Irish pop acts, recording latest version of track "Do They Know
Ed Sheeran, Sheeran, In July 2018, Forbes named Sheeran 9th on their list of highest paid celebrities.
Ed Sheeran, Sheeran, In 2018 Sheeran wrote songs for boy bands.
Ed Sheeran, Sheeran, x (Ed Sheeran album) × (2014)
Ed Sheeran, Sheeran, On 24 October 2021, Sheeran tested positive for COVID 19 less than a week before release of his   (album) fifth album.
Ed Sheeran, Sheeran, She is inspiration of song "Perfect (Ed Sheeran song)
Ed Sheeran, Sheeran, Ed Sheeran's musical style has been described as Pop music pop folk pop, and soft rock.
Ed Sheeran, Sheeran, In March 2015, Sheeran announced he was setting up a record label, Gingerbread Man Records, which is a deal with Warner Music Group.
Ed Sheeran, Sheeran, It contained his first hit single "The A Team (Ed Sheeran song)
Ed Sheeran, Sheeran, Drunk", released on 19 February 2012, became Sheeran's fourth consecutive top ten single in UK, peaking at number nine.
Ed Sheeran, Sheeran, On 25 June, Sheeran headlined final night of Glastonbury Festival Glastonbury, performing in front of 135,000 people.
Ed Sheeran, Sheeran, Sheeran was in a relationship with Scottish singer songwriter Nina Nesbitt (who was in his music video for "Drunk (Ed Sheeran song)
Ed Sheeran, Sheeran, The fourth single from ÷, "Perfect (Ed Sheeran song)
Ed Sheeran, Sheeran, In 2022, during full scale 2022 Russian invasion of Ukraine Russian invasion of Ukraine, Sheeran expressed support for Ukraine and participated in Concert for Ukraine.
Ed Sheeran, Sheeran, On 21 December 2020, after being on hiatus after having his first child with Cherry Seaborn in August, he released surprise single, "Afterglow (Ed Sheeran song)
Ed Sheeran, Sheeran, Nesbitt is subject of Sheeran's songs "Nina" and "Photograph (Ed Sheeran song) Photograph", while most of Nesbitt's album, Peroxide (Nina Nesbitt album) Peroxide, is about Sheeran.
Ed Sheeran, Sheeran, On working with Eminem, Sheeran stated, "He is one of reasons I started writing songs, and was such a pleasure to work with him."
Ed Sheeran, Sheeran, The company released a limited edition ketchup product known as Ed Sheeran X Heinz ketchup, also known as "Heinz Edchup".
Ed Sheeran, Sheeran, Later that month, Sheeran was signed to Asylum Records.
Ed Sheeran, Sheeran, Spanning three years, Sheeran wrote more than 120 songs for album.
Ed Sheeran, Sheeran, The Financial Times considered that scale of Sheeran's commercial accomplishments has "broken through to such a wide and lucrative extent, far beyond achievements of any of other singer songwriters in market" in UK.
Ed Sheeran, Sheeran, On 25 February, Sheeran won Brit Award for British Male Solo Artist British Male Solo Artist and British Album of Year for × at 2015 Brit Awards.
Ed Sheeran, Sheeran, On 27 September 2014, Sheeran was one of headline acts at Melbourne Cricket Ground prior to 2014 AFL Grand Final.
Ed Sheeran, Sheeran, Sheeran commented  "Suffolk is very much where I call home.
Ed Sheeran, Sheeran, In 2018, legal action was brought against Sheeran, Sony/ATV Music Publishing and Atlantic Records by estate and heirs of late producer Ed Townsend, who co wrote song "Let's Get It On" with Marvin Gaye.
Ed Sheeran, Sheeran, Additionally, Sheeran was named in club's squad list and given squad number of 17.
Ed Sheeran, Sheeran, In November 2015 Sheeran released DVD Jumpers for Goalposts  Live at Wembley Stadium; title is a nod to playing concerts at Wembley Stadium, home of English football.
Ed Sheeran, Sheeran, GQ's George Chesterton deemed Sheeran "de facto voice of a generation" as a consequence of his music reflecting his personality and "defining characteristics of his audience", with such recurring qualities of his discography corresponding "with those that his own generation, millennials, most value  authenticity, realness, earnestness, sincerity."
Ed Sheeran, Sheeran, On influence of Clapton, Sheeran states, "He's reason I started playing guitar".
Ed Sheeran, Sheeran, "Sing (Ed Sheeran song)
Ed Sheeran, Sheeran, At 2012 Brit Awards on 21 February, Sheeran won Brit Awards for Brit Award for British Male Solo Artist Best British Male Solo Artist, and Brit Award for British Breakthrough Act British Breakthrough Act of Year.
Ed Sheeran, Sheeran, On 26 April 2011, Sheeran appeared on BBC music show Later... with Jools Holland, where he performed his debut single "The A Team".
Ed Sheeran, Sheeran, Sheeran also incorporate rap into his music.
Ed Sheeran, Sheeran, In early 2011, after securing recording and publishing deals, Sheeran purchased and renovated a farm near Framlingham, Suffolk, where he was raised.
Ed Sheeran, Sheeran, On 5 December 2017, hip hop artist Eminem announced that Sheeran had collaborated on song "River (Eminem song) River" for his ninth studio album Revival (Eminem album) Revival.
Ed Sheeran, Sheeran, In June 2020, Sheeran made a "founding gift" to launch Suffolk Community Foundation's "Rebuilding Local Lives Appeal" in response to COVID 19 pandemic on celebration day of county, "Suffolk Day".
Ed Sheeran, Sheeran, His paternal grandparents are Irish, and Sheeran has stated that his father is from a "very large" Irish Catholic Catholic family.
Ed Sheeran, Sheeran, Similarly, The Guardian writer Laura Snapes cited him as "godfather of current crop of singer songwriters" in 2019, stating that Sheeran inspired "troubadours" to enter music charts, and marked "calcification of everyman male pop star", and end of record labels marketing them "exclusively to teenage girls and their mums."
Ed Sheeran, Sheeran, "Sing" was intended to create hype over album release, but from concern that this might alienate Sheeran's fan base, "One (Ed Sheeran song)
Ed Sheeran, Sheeran, Moments", on Up All Night (One Direction album) debut album by boy band One Direction, released in November 2011, was co written by Sheeran.
Ed Sheeran, Sheeran, In December 2019, he launched his own music foundation, Ed Sheeran Suffolk Music Foundation (ESSMF).
Ed Sheeran, Sheeran, In addition to having List of highest grossing concert tours highest grossing concert tour and being one of List of best selling music artists world's best selling music artists with more than 150 million records sold, Sheeran has received a number of awards.
Ed Sheeran, Sheeran, Sheeran signed his second artist, Foy Vance, in November 2015.
Ed Sheeran, Sheeran, Sheeran stated in open letter that Act is "essential to protect [...] most marginalized communities.
Ed Sheeran, Sheeran, Sheeran and his co writers, Steven McCutcheon and John McDaid, have been barred by music licensing body PRS for Music from collecting an estimated £20m in royalties from performances or broadcasts of "Shape of You".
Ed Sheeran, Sheeran, Music journalist Alexis Petridis has stated that Ed Sheeran "brought pop back down to earth" with his music style, introducing himself "touting an even more austere version of Coldplay's dressed down authenticity  one unassuming man, his guitar and a Live looping loop pedal".
Ed Sheeran, Sheeran, At 2018 Brit Awards held at The O2 Arena O2 Arena in London on 21 February, Sheeran performed "Supermarket Flowers", and received Global Success Award from Elton John and Rolling Stones guitarist Ronnie Wood.
Ed Sheeran, Sheeran, On 26 August, Sheeran wrapped up 260 show Divide Tour with last of four homecoming gigs in Ipswich, Suffolk; tour included, for example, his performance for over 100,000 people at Malmi Airport in Helsinki, Finland on 24 July.
Ed Sheeran, Sheeran, Edward Christopher Sheeran was born in Halifax, West Yorkshire, England on 17 February 1991.
Ed Sheeran, Sheeran, John decided to appear with Sheeran to circumvent this problem.
Ed Sheeran, Sheeran, Over 1,000 fans turned up, so Sheeran played four different shows to ensure everyone saw a gig, including a gig outside on street after venue had closed.
Ed Sheeran, Sheeran, Sheeran's second studio album, x (Ed Sheeran album) × (pronounced "multiply"), was released worldwide on 23 June 2014.
Ed Sheeran, Sheeran, Appearing as a guest on BBC Radio 4's Desert Island Discs on 7 May 2017, Sheeran chose His Dark Materials by Philip Pullman as his book of choice, and a lifetime supply of ketchup as one inanimate luxury item that he would take with him on a desert island.
Ed Sheeran, Sheeran, The concert was documented and aired on 16 August 2015 on NBC; one hour special Ed Sheeran – Live at Wembley Stadium also included behind the scenes footage.
Ed Sheeran, Sheeran, Sheeran won Breakthrough award at 2015 Billboard Touring Awards Billboard Touring Awards.
Ed Sheeran, Sheeran, Sheeran released "I See Fire" on 5 November 2013.
Ed Sheeran, Sheeran, Sheeran began recording music in 2004 and independently released his first collection of work, tiled Spinning Man.
Ed Sheeran, Sheeran, All of UK profits from song will go to Ed Sheeran Suffolk Music Foundation and Elton John AIDS Foundation.
Ed Sheeran, Sheeran, Sheeran's album peaked at No. 5 on Billboard 200 Billboard 200, while "The A Team" reached No. 16 on US Billboard Hot 100 Billboard Hot 100.
Ed Sheeran, Sheeran, According to Vox (website) Vox, Sheeran has reached "global pop culture ubiquity".
Ed Sheeran, Sheeran, https //en.wikipedia.org/wiki/Ed_Sheeran
Ed Sheeran, Sheeran, I Don't Care", "Beautiful People (Ed Sheeran song)
Ed Sheeran, Sheeran, Sheeran was taken to court in March 2022 for a copyright lawsuit over "Shape of You".
Ed Sheeran, Sheeran, In 2014, Sheeran was in a relationship with Athina Andrelos, who works for chef Jamie Oliver.
Ed Sheeran, Sheeran, Sheeran performed a gig in Bristol, which raised £40,000 for a charity that reaches out to prostitution street sex workers.
Ed Sheeran, Sheeran, Taylor Swift contacted Sheeran after hearing his music while touring Australia in March 2012.
Ed Sheeran, Sheeran, The donations, which have been made over a two year period via Ed Sheeran Suffolk Music Foundation, helped school to purchase items such as MacBooks, cameras and a photography darkroom.
Ed Sheeran, Sheeran, Three months later, Sheeran put on a free show to fans at Barfly in Camden Town.
Ed Sheeran, Sheeran, Following 2016 United Kingdom European Union membership referendum June 2016 referendum result where British public voted to leave, Sheeran was among a group of British musicians (which included Sting (musician) Sting, Queen (band)
Ed Sheeran, Sheeran, On 1 September, Sheeran announced on Instagram that Seaborn had given birth to a baby girl previous week.
Ed Sheeran, Sheeran, Released on 28 June 2019, "Beautiful People (Ed Sheeran song)
Ed Sheeran, Sheeran, On 19 August, Sheeran announced that his fifth studio album would be called   (album)   (pronounced "equals") and released on 29 October 2021 with a total of 14 songs.
Ed Sheeran, Sheeran, By early June 2014, "Sing" had earned Sheeran his first number one single in UK.
Ed Sheeran, Sheeran, Noting him as "one of most influential" artists of his generation, as he spawned "endless imitators", Petridis remarked that music charts were "packed with Sheeran alikes" after x (Ed Sheeran album) ×, describing it as "wave of earnest, dressed down, boy next door troubadours" that reached critical mass.
Ed Sheeran, Sheeran, Sheeran's parents, John and Imogen, are from London.
Ed Sheeran, Sheeran, Legal proceedings began in May 2018, with Sheeran and his co writers asking high court to declare they had not infringed Chokri and O'Donoghue's copyright.
Ed Sheeran, Sheeran, On 27 June, Sheeran performed as opening act for The Rolling Stones in their Zip Code Tour date in Kansas City's Arrowhead Stadium.
Ed Sheeran, Sheeran, To support album, Sheeran embarked on x Tour (Ed Sheeran tour) a world tour starting on 6 August 2014 at Osaka, Japan.
Ed Sheeran, Sheeran, Sheeran has sold more than 150 million records worldwide, making him one of List of best selling music artists world's best selling music artists.
Ed Sheeran, Sheeran, At 2018 Billboard Music Awards 2018 Billboard Music Awards on 20 May, Sheeran performed "Galway Girl (Ed Sheeran song)
Ed Sheeran, Sheeran, On 17 February, Sheeran released "How Would You Feel (Paean)".
Ed Sheeran, Sheeran, Sheeran frequently gives away his clothes to charity shops around Suffolk, his home county.
Ed Sheeran, Sheeran, By 11 March 2017 Sheeran had accumulated ten top 10 singles from ÷ on UK Singles Chart, breaking Scottish DJ Calvin Harris's record of nine top 10 singles from one album.
Ed Sheeran, Sheeran, BBC Radio 1 executive George Ergatoudis has stated that his "lyrical candour" and his "professional hunger" resonated with younger listeners, giving him a "very clear edge" to breakthrough in a music industry that  is "saturated with singer songwriters", while Sheeran's "niche combination" has made him able to perform at hip hop, grime and underground events and "convince urban crowd that he was authentic".
Ed Sheeran, Sheeran, Sheeran and his work have influenced various recording artists, including Shawn Mendes, Louis Tomlinson, Camila Cabello, and Cody Simpson, while English singer Hrvy has called him "such a good songwriter".
Ed Sheeran, Sheeran, In 2017, Sheeran publicly endorsed Centre left politics centre left British Labour Party (UK) Labour Party and described himself as a "fan" of its then leader Jeremy Corbyn, while adding that "I'm not Mr Political.
Ed Sheeran, Sheeran, Jamie Lawson (musician) Jamie Lawson, label's first signee, met Sheeran while they were both in London's folk circuit.
Ed Sheeran, Sheeran, In statement, Sheeran stated it will help artists aged under 18 with "small but hopefully useful grants".
