Ed Sheeran, Breakthrough, In 2012, Sheeran won Brit Awards for Brit Award for British Male Solo Artist Best British Male Solo Artist and Brit Award for British Breakthrough Act British Breakthrough Act.
Ed Sheeran, 58th, His single from ×, "Thinking Out Loud", earned him two Grammy Awards at 58th Annual Grammy Awards 2016 ceremony  Grammy Award for Song of Year Song of Year and Grammy Award for Best Pop Solo Performance Best Pop Solo Performance.
Ed Sheeran, 2016, As of 2019, he has received four Grammy Awards (including Grammy Award for Song of Year Song of Year in 2016 for "Thinking Out Loud"), five Brit Awards (including Brit Award for British Male Solo Artist British Male Solo Artist in 2015), and six Billboard Music Award Billboard Music Awards (including Billboard Music Award for Top Artist Top Artist in 2018).
Ed Sheeran, 2016, In 2016 he donated 13 bags of clothes to shop.
Ed Sheeran, 2016, A single from ×, "Thinking Out Loud", earned him 2016 Grammy Awards for Grammy Award for Song of Year Song of Year and Grammy Award for Best Pop Solo Performance Best Pop Solo Performance.
Ed Sheeran, 2016, Following 2016 United Kingdom European Union membership referendum June 2016 referendum result where British public voted to leave, Sheeran was among a group of British musicians (which included Sting (musician) Sting, Queen (band)
Ed Sheeran, 2016, His single from ×, "Thinking Out Loud", earned him two Grammy Awards at 58th Annual Grammy Awards 2016 ceremony  Grammy Award for Song of Year Song of Year and Grammy Award for Best Pop Solo Performance Best Pop Solo Performance.
Ed Sheeran, 2016, 2016–present  ÷ and
Ed Sheeran, 2016, Sheeran also appeared as himself in 2016 film Bridget Jones's Baby in a scene where Bridget Jones, played by Renée Zellweger, encounters singer at Glastonbury Festival.
Ed Sheeran, 2016, On 13 December 2016, after a year long hiatus and social media break, Sheeran tweeted a picture and changed his Twitter, Facebook and Instagram to a light blue, implying release of a new album – each of Sheeran's previous albums were a single coloured background with a solid mathematical symbol.
Ed Sheeran, 2016, Sheeran collaborated with his idol Eric Clapton in April 2016, with Sheeran stating to People (magazine) People magazine, "I sang on Eric Clapton's album I Still Do.
Ed Sheeran, 2016, In May 2016, × was named second best selling album worldwide in 2015, behind 25 (Adele album) 25 by Adele.
Ed Sheeran, May 2016, In May 2016, × was named second best selling album worldwide in 2015, behind 25 (Adele album) 25 by Adele.
Ed Sheeran, 13 December 2016, On 13 December 2016, after a year long hiatus and social media break, Sheeran tweeted a picture and changed his Twitter, Facebook and Instagram to a light blue, implying release of a new album – each of Sheeran's previous albums were a single coloured background with a solid mathematical symbol.
Ed Sheeran, Twitter, On 2 January, he posted a 10 second video on Twitter and other social media showing what was cover design of his forthcoming album entitled ÷ (album) ÷ (pronounced "divide") which was released on 3 March 2017.
Ed Sheeran, Twitter, On 13 December 2016, after a year long hiatus and social media break, Sheeran tweeted a picture and changed his Twitter, Facebook and Instagram to a light blue, implying release of a new album – each of Sheeran's previous albums were a single coloured background with a solid mathematical symbol.
Ed Sheeran, Instagram, He announced on his Instagram that he provided hot breakfasts for "anyone who is normally entitled to a free school meal or who is struggling in these strange times".
Ed Sheeran, Instagram, On 1 September, Sheeran announced on Instagram that Seaborn had given birth to a baby girl previous week.
Ed Sheeran, Instagram, A representative from Heinz started that "1/3 of @HEINZ Instagram posts include people mentioning or tagging Ed, dating all way back to 2014."
Ed Sheeran, Instagram, On 13 December 2016, after a year long hiatus and social media break, Sheeran tweeted a picture and changed his Twitter, Facebook and Instagram to a light blue, implying release of a new album – each of Sheeran's previous albums were a single coloured background with a solid mathematical symbol.
Ed Sheeran, December 2016, On 13 December 2016, after a year long hiatus and social media break, Sheeran tweeted a picture and changed his Twitter, Facebook and Instagram to a light blue, implying release of a new album – each of Sheeran's previous albums were a single coloured background with a solid mathematical symbol.
Ed Sheeran, 2 January, On 2 January, he posted a 10 second video on Twitter and other social media showing what was cover design of his forthcoming album entitled ÷ (album) ÷ (pronounced "divide") which was released on 3 March 2017.
Ed Sheeran, 3 March 2017, On 2 January, he posted a 10 second video on Twitter and other social media showing what was cover design of his forthcoming album entitled ÷ (album) ÷ (pronounced "divide") which was released on 3 March 2017.
Ed Sheeran, 672,000, With first week sales of 672,000 it is fastest selling album by a male solo artist in UK, and Lists of fastest selling albums#United Kingdom third fastest in UK chart history behind 25 (Adele album) 25 by Adele and Be Here Now (album) Be Here Now by Oasis (band) Oasis.
Ed Sheeran, Lists, With first week sales of 672,000 it is fastest selling album by a male solo artist in UK, and Lists of fastest selling albums#United Kingdom third fastest in UK chart history behind 25 (Adele album) 25 by Adele and Be Here Now (album) Be Here Now by Oasis (band) Oasis.
Ed Sheeran, Kingdom, With first week sales of 672,000 it is fastest selling album by a male solo artist in UK, and Lists of fastest selling albums#United Kingdom third fastest in UK chart history behind 25 (Adele album) 25 by Adele and Be Here Now (album) Be Here Now by Oasis (band) Oasis.
Ed Sheeran, Kingdom, A lifelong fan of product — he has it with everything from fish and chips to his morning Sausage sandwich#United Kingdom sausage "butty" to upmarket dinners, carries a bottle on tour, and has a Heinz Ketchup tattoo on his arm — he put forward an idea he had written for their next TV campaign, and company responded.
Ed Sheeran, Kingdom, Following 2016 United Kingdom European Union membership referendum June 2016 referendum result where British public voted to leave, Sheeran was among a group of British musicians (which included Sting (musician) Sting, Queen (band)
Ed Sheeran, Kingdom, In December 1995 he moved with his family from Hebden Bridge to Framlingham in Suffolk, where he attended independent Brandeston Hall Preparatory school (United Kingdom) preparatory school (now Framlingham College Prep School), then Thomas Mills High School, also in Framlingham.
Ed Sheeran, Kingdom, Sheeran publicly opposed Brexit (United Kingdom leaving European Union), and supported "remain".
Ed Sheeran, Kingdom, He has 84.5 million Riaa RIAA certified units in US, and two of his albums are in list of List of best selling albums in United Kingdom best selling albums in UK chart history.
Ed Sheeran, Taylor Swift's, It had biggest first week sales of 2017 in US, until it was surpassed by Taylor Swift's Reputation (Taylor Swift album) Reputation.
Ed Sheeran, Taylor Swift's, Taylor Swift's The Red Tour (all North American dates) (2013)
Ed Sheeran, 6 January, On 6 January, Sheeran released two singles, "Shape of You" and "Castle on Hill"; theme of latter single Sheeran's upbringing in his home town of Framlingham in Suffolk, with castle referring to Framlingham Castle.
Ed Sheeran, 6 January, On 26 January, Sheeran announced dates for beginning of Divide Tour with shows in Europe, South America and North America from 17 March until 14 June 2017.
Ed Sheeran, Framlingham in Suffolk, In December 1995 he moved with his family from Hebden Bridge to Framlingham in Suffolk, where he attended independent Brandeston Hall Preparatory school (United Kingdom) preparatory school (now Framlingham College Prep School), then Thomas Mills High School, also in Framlingham.
Ed Sheeran, Framlingham in Suffolk, On 6 January, Sheeran released two singles, "Shape of You" and "Castle on Hill"; theme of latter single Sheeran's upbringing in his home town of Framlingham in Suffolk, with castle referring to Framlingham Castle.
Ed Sheeran, Two, Two months later, Chokri and O'Donoghue issued their own claim for "copyright infringement, damages and an account of profits in relation to alleged infringement."
Ed Sheeran, Two, Two days later I bought a black Stratocaster copy for £30 that came with an amp.
Ed Sheeran, Hill, On 13 January, "Shape of You" and "Castle on Hill" entered UK Singles Chart at number one and number two, first time in history an artist has taken top two UK chart positions with new songs.
Ed Sheeran, Hill, at Sarm West Studios in Notting Hill, London, to raise money for West African Ebola virus epidemic.
Ed Sheeran, Hill, The first two singles from album, "Shape of You" and "Castle on Hill", broke records in a number of countries by debuting in top two positions of charts.
Ed Sheeran, Hill, On 17 January, "Shape of You" debuted at number one on US Billboard Hot 100 Billboard Hot 100, while "Castle on Hill" entered at number six; this made Sheeran first artist ever to have two songs simultaneously debut in US top 10.
Ed Sheeran, Hill, On 29 September 2019, Sheeran announced he was teaming up with his manager Stuart Camp to open a bar located on Portobello Road in Notting Hill.
Ed Sheeran, Hill, On 6 January, Sheeran released two singles, "Shape of You" and "Castle on Hill"; theme of latter single Sheeran's upbringing in his home town of Framlingham in Suffolk, with castle referring to Framlingham Castle.
Ed Sheeran, Hill, Later that month, Sheeran backed footballer Marcus Rashford's free school meals campaign and opened his own breakfast club at his Notting Hill restaurant, Bertie Blossoms.
Ed Sheeran, BBC Radio, Appearing as a guest on BBC Radio 4's Desert Island Discs on 7 May 2017, Sheeran chose His Dark Materials by Philip Pullman as his book of choice, and a lifetime supply of ketchup as one inanimate luxury item that he would take with him on a desert island.
Ed Sheeran, BBC Radio, BBC Radio 1 executive George Ergatoudis has stated that his "lyrical candour" and his "professional hunger" resonated with younger listeners, giving him a "very clear edge" to breakthrough in a music industry that  is "saturated with singer songwriters", while Sheeran's "niche combination" has made him able to perform at hip hop, grime and underground events and "convince urban crowd that he was authentic".
Ed Sheeran, BBC Radio, In December 2017, Sheeran appeared on BBC Radio 1's Live Lounge, performing his song "Perfect" and a duet of The Pogues' festive classic "Fairytale of New York" with Anne Marie (singer)
Ed Sheeran, BBC Radio, Following release of these singles, Sheeran co hosted BBC Radio 1 Breakfast Show with Scott Mills where it was implied that he would possibly make an appearance at Glastonbury Festival in 2017.
Ed Sheeran, 1 Breakfast Show, Following release of these singles, Sheeran co hosted BBC Radio 1 Breakfast Show with Scott Mills where it was implied that he would possibly make an appearance at Glastonbury Festival in 2017.
Ed Sheeran, Scott Mills, Following release of these singles, Sheeran co hosted BBC Radio 1 Breakfast Show with Scott Mills where it was implied that he would possibly make an appearance at Glastonbury Festival in 2017.
Ed Sheeran, Glastonbury Festival, On 25 June, Sheeran headlined final night of Glastonbury Festival Glastonbury, performing in front of 135,000 people.
Ed Sheeran, Glastonbury Festival, During a headline set in BBC Introducing tent at Glastonbury Festival 2011, Sheeran announced that "You Need Me, I Don't Need You" would be released on 26 August as second single from album.
Ed Sheeran, Glastonbury Festival, Following release of these singles, Sheeran co hosted BBC Radio 1 Breakfast Show with Scott Mills where it was implied that he would possibly make an appearance at Glastonbury Festival in 2017.
Ed Sheeran, Glastonbury Festival, Sheeran also appeared as himself in 2016 film Bridget Jones's Baby in a scene where Bridget Jones, played by Renée Zellweger, encounters singer at Glastonbury Festival.
Ed Sheeran, Martin Guitars Martin, It was also during this show that Sheeran used a new Martin Guitars Martin guitar that featured ÷ logo (of his new album) on both headstock and body of acoustic guitar.
Ed Sheeran, Radio 1, BBC Radio 1 executive George Ergatoudis has stated that his "lyrical candour" and his "professional hunger" resonated with younger listeners, giving him a "very clear edge" to breakthrough in a music industry that  is "saturated with singer songwriters", while Sheeran's "niche combination" has made him able to perform at hip hop, grime and underground events and "convince urban crowd that he was authentic".
Ed Sheeran, Radio 1, In December 2017, Sheeran appeared on BBC Radio 1's Live Lounge, performing his song "Perfect" and a duet of The Pogues' festive classic "Fairytale of New York" with Anne Marie (singer)
Ed Sheeran, Radio 1, Following release of these singles, Sheeran co hosted BBC Radio 1 Breakfast Show with Scott Mills where it was implied that he would possibly make an appearance at Glastonbury Festival in 2017.
Ed Sheeran, over 13 million, Both singles went on to break Spotify day one streaming record, with a combined total of over 13 million streams in 24 hours.
Ed Sheeran, 24 hours, Both singles went on to break Spotify day one streaming record, with a combined total of over 13 million streams in 24 hours.
Ed Sheeran, 13 January, On 13 January, "Shape of You" and "Castle on Hill" entered UK Singles Chart at number one and number two, first time in history an artist has taken top two UK chart positions with new songs.
Ed Sheeran, GfK Entertainment Charts German Single Charts, The same day he also became first artist to debut at number one and number two on GfK Entertainment Charts German Single Charts.
Ed Sheeran, German, His 10th UK number one single, song spent eleven consecutive weeks at top of UK Singles Chart and Irish Singles Chart, topped charts in Australia, Canada and Germany among others, and peaked at number two on Billboard Hot 100 Billboard Hot 100 in US.
Ed Sheeran, German, The album debuted at number one in UK, US, Germany, Australia, Canada and other major markets.
Ed Sheeran, German, The lead single also became a top ten hit in Australia, Germany, Ireland, Japan, Luxembourg, New Zealand, Norway and Netherlands.
Ed Sheeran, German, The same day he also became first artist to debut at number one and number two on GfK Entertainment Charts German Single Charts.
Ed Sheeran, 15 January, On 15 January, songs debuted at number one and number two on ARIA Singles Chart, first time this has been achieved in history of Australian chart.
Ed Sheeran, ARIA Singles Chart, On 15 January, songs debuted at number one and number two on ARIA Singles Chart, first time this has been achieved in history of Australian chart.
Ed Sheeran, 17 January, On 17 January, "Shape of You" debuted at number one on US Billboard Hot 100 Billboard Hot 100, while "Castle on Hill" entered at number six; this made Sheeran first artist ever to have two songs simultaneously debut in US top 10.
Ed Sheeran, number six, On 17 January, "Shape of You" debuted at number one on US Billboard Hot 100 Billboard Hot 100, while "Castle on Hill" entered at number six; this made Sheeran first artist ever to have two songs simultaneously debut in US top 10.
Ed Sheeran, TLC, TLC's song "No Scrubs" were given writing credits on "Shape of You" after fans and critics found similarities between elements of two songs.
Ed Sheeran, TLC, The team behind TLC (group)
Ed Sheeran, Scrubs, TLC's song "No Scrubs" were given writing credits on "Shape of You" after fans and critics found similarities between elements of two songs.
Ed Sheeran, Divide Tour, On 26 August, Sheeran wrapped up 260 show Divide Tour with last of four homecoming gigs in Ipswich, Suffolk; tour included, for example, his performance for over 100,000 people at Malmi Airport in Helsinki, Finland on 24 July.
Ed Sheeran, Divide Tour, On 26 January, Sheeran announced dates for beginning of Divide Tour with shows in Europe, South America and North America from 17 March until 14 June 2017.
Ed Sheeran, 26 January, On 26 January, Sheeran announced dates for beginning of Divide Tour with shows in Europe, South America and North America from 17 March until 14 June 2017.
Ed Sheeran, Europe, Category MTV Europe Music Award winners
Ed Sheeran, Europe, Following 2016 United Kingdom European Union membership referendum June 2016 referendum result where British public voted to leave, Sheeran was among a group of British musicians (which included Sting (musician) Sting, Queen (band)
Ed Sheeran, Europe, From touring to sales, to copyright legislation to royalty collation", letter adds  "We dominate market and our bands, singers, musicians, writers, producers and engineers work all over Europe and world and in turn, Europe and world come to us.
Ed Sheeran, Europe, Sheeran publicly opposed Brexit (United Kingdom leaving European Union), and supported "remain".
Ed Sheeran, Europe, On 26 January, Sheeran announced dates for beginning of Divide Tour with shows in Europe, South America and North America from 17 March until 14 June 2017.
Ed Sheeran, Europe, Sheeran co hosted 2015 MTV Europe Music Awards on 25 October in Milan, Italy.
Ed Sheeran, South America, On 26 January, Sheeran announced dates for beginning of Divide Tour with shows in Europe, South America and North America from 17 March until 14 June 2017.
Ed Sheeran, 17 March, On 26 January, Sheeran announced dates for beginning of Divide Tour with shows in Europe, South America and North America from 17 March until 14 June 2017.
Ed Sheeran, 14 June 2017, On 26 January, Sheeran announced dates for beginning of Divide Tour with shows in Europe, South America and North America from 17 March until 14 June 2017.
Ed Sheeran, 17 February, Edward Christopher Sheeran was born in Halifax, West Yorkshire, England on 17 February 1991.
Ed Sheeran, 17 February, On 17 February, Sheeran released "How Would You Feel (Paean)".
Ed Sheeran, 17 February, Edward Christopher Sheeran  (; born 17 February 1991) is an English singer songwriter.
Ed Sheeran, "How Would You Feel, On 17 February, Sheeran released "How Would You Feel (Paean)".
Ed Sheeran, Paean, On 17 February, Sheeran released "How Would You Feel (Paean)".
Ed Sheeran, 21, On 24 October 2021, Sheeran tested positive for COVID 19 less than a week before release of his   (album) fifth album.
Ed Sheeran, 21, On 21 December 2020, after being on hiatus after having his first child with Cherry Seaborn in August, he released surprise single, "Afterglow (Ed Sheeran song)
Ed Sheeran, 21, At 2012 Brit Awards on 21 February, Sheeran won Brit Awards for Brit Award for British Male Solo Artist Best British Male Solo Artist, and Brit Award for British Breakthrough Act British Breakthrough Act of Year.
Ed Sheeran, 21, "Trust Fund Baby", by Why Don't We, was released on 1 February 2018, and "Summer On You", by PrettyMuch, was released on 21 June 2018.
Ed Sheeran, 21, At 2018 Brit Awards held at The O2 Arena O2 Arena in London on 21 February, Sheeran performed "Supermarket Flowers", and received Global Success Award from Elton John and Rolling Stones guitarist Ronnie Wood.
Ed Sheeran, 21, (album)   (2021)
Ed Sheeran, 21, On 19 August, Sheeran announced that his fifth studio album would be called   (album)   (pronounced "equals") and released on 29 October 2021 with a total of 14 songs.
Ed Sheeran, 21, Category 21st century English male actors
Ed Sheeran, 21, His fifth studio album,   (album)   (pronounced "equals"), topped charts in most major markets in 2021.
Ed Sheeran, 21, On 29 November 2021, Sheeran and Elton John announced their new single "Merry Christmas (song)
Ed Sheeran, 21, On 25 June 2021, Sheeran released "Bad Habits (Ed Sheeran song)
Ed Sheeran, 21, As of March 2012, album had sold 1,021,072 copies in UK.
Ed Sheeran, 21, On 9 September he was part of 2021 Kickoff Experience ahead of American NFL season opening game.
Ed Sheeran, 21, In 2017, BBC named him second best performing artist of decade, after Adele, while in 2021, The Independent said he had "one of biggest pop careers of this generation."
Ed Sheeran, 21, In 2021, Sheeran, along with several other celebrities, urged United States Congress to pass proposed Equality Act (United States) Equality Act, which would expand Civil Rights Act of 1964 Civil Rights Act in order to outlaw discrimination against LGBT people.
Ed Sheeran, 21, Category 21st century English singers
Ed Sheeran, 21, On 21 June, Sheeran co hosted 2015 Much Music Video Awards in Toronto, where he performed singles, "Thinking Out Loud" and "Photograph (Ed Sheeran song) Photograph"; he also won two awards, Best International Artist and Most Buzzworthy International Artist or Group.
Ed Sheeran, 21, Maisie Peters also signed with label in 2021.
Ed Sheeran, 21, Ipswich Town, and his +– ÷x Tour kit sponsored their 2021–22 Ipswich Town F.C. season 2021–22 season.
Ed Sheeran, 21, On 21 May he received Ivor Novello Award for Songwriter of Year.
Ed Sheeran, 11 March 2017, By 11 March 2017 Sheeran had accumulated ten top 10 singles from ÷ on UK Singles Chart, breaking Scottish DJ Calvin Harris's record of nine top 10 singles from one album.
Ed Sheeran, Scottish, Sheeran was in a relationship with Scottish singer songwriter Nina Nesbitt (who was in his music video for "Drunk (Ed Sheeran song)
Ed Sheeran, Scottish, By 11 March 2017 Sheeran had accumulated ten top 10 singles from ÷ on UK Singles Chart, breaking Scottish DJ Calvin Harris's record of nine top 10 singles from one album.
Ed Sheeran, Calvin Harris, By 11 March 2017 Sheeran had accumulated ten top 10 singles from ÷ on UK Singles Chart, breaking Scottish DJ Calvin Harris's record of nine top 10 singles from one album.
Ed Sheeran, nine, Drunk", released on 19 February 2012, became Sheeran's fourth consecutive top ten single in UK, peaking at number nine.
Ed Sheeran, nine, By 11 March 2017 Sheeran had accumulated ten top 10 singles from ÷ on UK Singles Chart, breaking Scottish DJ Calvin Harris's record of nine top 10 singles from one album.
Ed Sheeran, 22, In 2022, during full scale 2022 Russian invasion of Ukraine Russian invasion of Ukraine, Sheeran expressed support for Ukraine and participated in Concert for Ukraine.
Ed Sheeran, 22, +– ÷x Tour (2022–2023)
Ed Sheeran, 22, Sheeran was taken to court in March 2022 for a copyright lawsuit over "Shape of You".
Ed Sheeran, 22, The auction had 220 lots, including items donated by other celebrities such as David Beckham, Kylie Minogue and Usain Bolt.
Ed Sheeran, 22, In March 2022, Sheeran was taken to court by musicians Sami Chokri and Ross O'Donoghue who allege "Shape Of You" infringes "particular lines and phrases" of their 2015 composition "Oh Why".
Ed Sheeran, 22, On 6 April 2022, Sheeran won case, with a judge ruling that Sheeran had not plagiarised song.
Ed Sheeran, 22, Ipswich Town, and his +– ÷x Tour kit sponsored their 2021–22 Ipswich Town F.C. season 2021–22 season.
Ed Sheeran, 25 June, On 25 June, Sheeran headlined final night of Glastonbury Festival Glastonbury, performing in front of 135,000 people.
Ed Sheeran, 25 June, On 25 June 2021, Sheeran released "Bad Habits (Ed Sheeran song)
Ed Sheeran, Glastonbury Festival Glastonbury, On 25 June, Sheeran headlined final night of Glastonbury Festival Glastonbury, performing in front of 135,000 people.
Ed Sheeran, 135,000, On 25 June, Sheeran headlined final night of Glastonbury Festival Glastonbury, performing in front of 135,000 people.
Ed Sheeran, Sunday, According to The Sunday Times (UK) The Sunday Times Sunday Times Rich List Rich List of 2019, Sheeran is worth £160 million ($207 million) as 17th richest musician in UK.
Ed Sheeran, MTV Video Music Awards, At 2017 MTV Video Music Awards Sheeran was named Artist of Year.
Ed Sheeran, Artist of Year, The world's best selling artist of 2017, he was named Global Recording Artist of Year.
Ed Sheeran, Artist of Year, At 2017 MTV Video Music Awards Sheeran was named Artist of Year.
Ed Sheeran, Artist of Year, As best selling artist worldwide for 2017 International Federation of Phonographic Industry IFPI named him Global Recording Artist of Year.
Ed Sheeran, May 2018, Legal proceedings began in May 2018, with Sheeran and his co writers asking high court to declare they had not infringed Chokri and O'Donoghue's copyright.
Ed Sheeran, Perfect Duet, Perfect", reached number one in UK and Australia, and a stripped down acoustic version of song titled "Perfect Duet", a collaboration with Beyoncé, reached number one in US and UK, becoming year's List of UK Singles Chart Christmas number ones UK Christmas number one.
Ed Sheeran, Perfect, She is inspiration of song "Perfect (Ed Sheeran song)
Ed Sheeran, Perfect, The fourth single from ÷, "Perfect (Ed Sheeran song)
Ed Sheeran, Perfect, Perfect".
Ed Sheeran, Perfect, Perfect", reached number one in UK and Australia, and a stripped down acoustic version of song titled "Perfect Duet", a collaboration with Beyoncé, reached number one in US and UK, becoming year's List of UK Singles Chart Christmas number ones UK Christmas number one.
Ed Sheeran, Perfect, In December 2017, Sheeran appeared on BBC Radio 1's Live Lounge, performing his song "Perfect" and a duet of The Pogues' festive classic "Fairytale of New York" with Anne Marie (singer)
Ed Sheeran, Perfect, Perfect", reached number one in US, Australia and UK, where it became List of UK Singles Chart Christmas number ones Christmas number one in 2017.
