Ed Sheeran, four, As of 2019, he has received four Grammy Awards (including Grammy Award for Song of Year Song of Year in 2016 for "Thinking Out Loud"), five Brit Awards (including Brit Award for British Male Solo Artist British Male Solo Artist in 2015), and six Billboard Music Award Billboard Music Awards (including Billboard Music Award for Top Artist Top Artist in 2018).
Ed Sheeran, four, Drunk", released on 19 February 2012, became Sheeran's fourth consecutive top ten single in UK, peaking at number nine.
Ed Sheeran, four, The fourth single from ÷, "Perfect (Ed Sheeran song)
Ed Sheeran, four, I Don't Care", a duet with Justin Bieber, from his fourth studio album No.6 Collaborations Project.
Ed Sheeran, four, Topping charts in most major markets,   became his fifth UK number one album, and fourth US number one.
Ed Sheeran, four, On 26 August, Sheeran wrapped up 260 show Divide Tour with last of four homecoming gigs in Ipswich, Suffolk; tour included, for example, his performance for over 100,000 people at Malmi Airport in Helsinki, Finland on 24 July.
Ed Sheeran, four, Over 1,000 fans turned up, so Sheeran played four different shows to ensure everyone saw a gig, including a gig outside on street after venue had closed.
Ed Sheeran, four, As of 9 August 2019, his four albums have spent a combined 41 weeks at number one in UK, List of UK Albums Chart number ones of 2010s most weeks at number one in UK Album Charts in 2010s, five weeks more than Adele in second.
Ed Sheeran, four, He later co wrote and provided vocals for "Everything Has Changed", a single featured on Swift's fourth studio album, Red (Taylor Swift album)
Ed Sheeran, four, In 2015, Sheeran wrote "Love Yourself" for Justin Bieber's fourth album.
Ed Sheeran, four, The second single peaked at number four on UK Singles Chart.
Ed Sheeran, four, Although he regards Suffolk as home having moved to county as a young child, Sheeran was recognised by his county of birth in a 2018 poll when he was ranked fourth greatest Yorkshireman ever behind Monty Python comedian Michael Palin, and actors Sean Bean and Patrick Stewart.
Ed Sheeran, four, Vance's fourth album Joy of Nothing.
Ed Sheeran, four, His fourth single from ÷, "Perfect (Ed Sheeran song)
Ed Sheeran, four, Sheeran sang at a local church choir at age of four, learned how to play guitar at age eleven, and began writing songs while at Thomas Mills High School in Framlingham.
Ed Sheeran, four, The cover was painted by him during first COVID 19 lockdowns COVID 19 lockdown, and is based on changes his life had during last four years, including marriage, having a child and losing friends.
Ed Sheeran, four, Released in 2019, his fourth studio album No.6 Collaborations Project debuted at number one in most major markets, and spawned three UK number one singles, "I Don't Care (Ed Sheeran and Justin Bieber song)
Ed Sheeran, Later that month, Later that month, Sheeran was signed to Asylum Records.
Ed Sheeran, Later that month, Later that month, Sheeran backed footballer Marcus Rashford's free school meals campaign and opened his own breakfast club at his Notting Hill restaurant, Bertie Blossoms.
Ed Sheeran, ×, x (Ed Sheeran album) × (2014)
Ed Sheeran, ×, × peaked at number one in both UK Albums Chart and US Billboard 200.
Ed Sheeran, ×, A single from ×, "Thinking Out Loud", earned him 2016 Grammy Awards for Grammy Award for Song of Year Song of Year and Grammy Award for Best Pop Solo Performance Best Pop Solo Performance.
Ed Sheeran, ×, On 25 February, Sheeran won Brit Award for British Male Solo Artist British Male Solo Artist and British Album of Year for × at 2015 Brit Awards.
Ed Sheeran, ×, Sheeran's second studio album, x (Ed Sheeran album) × (pronounced "multiply"), was released worldwide on 23 June 2014.
Ed Sheeran, ×, Noting him as "one of most influential" artists of his generation, as he spawned "endless imitators", Petridis remarked that music charts were "packed with Sheeran alikes" after x (Ed Sheeran album) ×, describing it as "wave of earnest, dressed down, boy next door troubadours" that reached critical mass.
Ed Sheeran, ×, His single from ×, "Thinking Out Loud", earned him two Grammy Awards at 58th Annual Grammy Awards 2016 ceremony  Grammy Award for Song of Year Song of Year and Grammy Award for Best Pop Solo Performance Best Pop Solo Performance.
Ed Sheeran, ×, 2011–2015  + and ×
Ed Sheeran, ×, × was nominated for Album of Year at 57th Annual Grammy Awards 57th
Ed Sheeran, ×, X Tour (Ed Sheeran) × Tour (2014–2015)
Ed Sheeran, ×, In 2014, combined streaming media streams on Sheeran's catalogue in Spotify reached 860 million; Spotify named him most streamed artist and × most streamed album.
Ed Sheeran, ×, Sheeran's second studio album, x (Ed Sheeran album) × (pronounced "multiply"), topped charts around world upon its release in June 2014.
Ed Sheeran, ×, In same year, × won 2015 Brit Awards#Nominees and winners Album of Year at 2015 Brit Awards, and he received Ivor Novello Awards Ivor Novello Award for Songwriter of Year from British Academy of Songwriters, Composers and Authors.
Ed Sheeran, ×, In May 2016, × was named second best selling album worldwide in 2015, behind 25 (Adele album) 25 by Adele.
Ed Sheeran, 26 April 2011, On 26 April 2011, Sheeran appeared on BBC music show Later... with Jools Holland, where he performed his debut single "The A Team".
Ed Sheeran, Jools Holland, On 26 April 2011, Sheeran appeared on BBC music show Later... with Jools Holland, where he performed his debut single "The A Team".
Ed Sheeran, Six weeks later, Six weeks later, "The A Team" was released as a digital download in UK.
Ed Sheeran, Lipshutz, Billboard (magazine) Billboard writer Jason Lipshutz noticed that his appeal and performance style had influenced up and coming soloists, impacting "a significant number of pop artists who crave his type of singular success."
Ed Sheeran, November 2015, In November 2015 Sheeran released DVD Jumpers for Goalposts  Live at Wembley Stadium; title is a nod to playing concerts at Wembley Stadium, home of English football.
Ed Sheeran, November 2015, Sheeran signed his second artist, Foy Vance, in November 2015.
Ed Sheeran, November 2015, In November 2015, Sheeran supported No Cold Homes campaign by UK charity, Turn2us.
Ed Sheeran, 23 June 2014, Sheeran's second studio album, x (Ed Sheeran album) × (pronounced "multiply"), was released worldwide on 23 June 2014.
Ed Sheeran, UK Singles Chart, "The A Team" entered UK Singles Chart at number three, selling over 58,000 copies in first week.
Ed Sheeran, UK Singles Chart, His 10th UK number one single, song spent eleven consecutive weeks at top of UK Singles Chart and Irish Singles Chart, topped charts in Australia, Canada and Germany among others, and peaked at number two on Billboard Hot 100 Billboard Hot 100 in US.
Ed Sheeran, UK Singles Chart, On 13 January, "Shape of You" and "Castle on Hill" entered UK Singles Chart at number one and number two, first time in history an artist has taken top two UK chart positions with new songs.
Ed Sheeran, UK Singles Chart, Perfect", reached number one in UK and Australia, and a stripped down acoustic version of song titled "Perfect Duet", a collaboration with Beyoncé, reached number one in US and UK, becoming year's List of UK Singles Chart Christmas number ones UK Christmas number one.
Ed Sheeran, UK Singles Chart, By 11 March 2017 Sheeran had accumulated ten top 10 singles from ÷ on UK Singles Chart, breaking Scottish DJ Calvin Harris's record of nine top 10 singles from one album.
Ed Sheeran, UK Singles Chart, The second single peaked at number four on UK Singles Chart.
Ed Sheeran, UK Singles Chart, The song debuted at number one in UK Singles Chart on 10 December to become Sheeran's 12th number one.
Ed Sheeran, UK Singles Chart, By March 2017, Sheeran had accumulated ten top 10 singles from ÷ on UK Singles Chart, breaking record for most top 10 UK singles from one album.
Ed Sheeran, UK Singles Chart, Perfect", reached number one in US, Australia and UK, where it became List of UK Singles Chart Christmas number ones Christmas number one in 2017.
Ed Sheeran, number three, "The A Team" entered UK Singles Chart at number three, selling over 58,000 copies in first week.
Ed Sheeran, over 58,000, "The A Team" entered UK Singles Chart at number three, selling over 58,000 copies in first week.
Ed Sheeran, eighth, It was best selling debut single and overall eighth best selling single of 2011, selling 801,000 copies.
Ed Sheeran, 2011, On 26 April 2011, Sheeran appeared on BBC music show Later... with Jools Holland, where he performed his debut single "The A Team".
Ed Sheeran, 2011, In early 2011, after securing recording and publishing deals, Sheeran purchased and renovated a farm near Framlingham, Suffolk, where he was raised.
Ed Sheeran, 2011, Moments", on Up All Night (One Direction album) debut album by boy band One Direction, released in November 2011, was co written by Sheeran.
Ed Sheeran, 2011, It was best selling debut single and overall eighth best selling single of 2011, selling 801,000 copies.
Ed Sheeran, 2011, + Tour (2011–2013)
Ed Sheeran, 2011, + (album) + (2011)
Ed Sheeran, 2011, 2011–2015  + and ×
Ed Sheeran, 2011, During a headline set in BBC Introducing tent at Glastonbury Festival 2011, Sheeran announced that "You Need Me, I Don't Need You" would be released on 26 August as second single from album.
Ed Sheeran, 2011, Sheeran released + on 12 September 2011.
Ed Sheeran, 2011, On 8 January 2011, Sheeran released another independent EP, No. 5 Collaborations Project, featuring grime artists such as Wiley (rapper) Wiley, Jme (MC) Jme, Devlin (rapper) Devlin, Sway (British musician) Sway and Ghetts.
Ed Sheeran, 2011, Sheeran's debut album, + (album) + (pronounced "plus"), was released in September 2011 and topped UK Albums Chart.
Ed Sheeran, 2011, In early 2011, Sheeran independently released extended play, No. 5 Collaborations Project.
Ed Sheeran, 2011, By end of 2011, sales of album in UK stand at 791,000; it became second best selling debut album and ninth biggest selling album there.
Ed Sheeran, 801,000, It was best selling debut single and overall eighth best selling single of 2011, selling 801,000 copies.
Ed Sheeran, Germany, His 10th UK number one single, song spent eleven consecutive weeks at top of UK Singles Chart and Irish Singles Chart, topped charts in Australia, Canada and Germany among others, and peaked at number two on Billboard Hot 100 Billboard Hot 100 in US.
Ed Sheeran, Germany, The album debuted at number one in UK, US, Germany, Australia, Canada and other major markets.
Ed Sheeran, Germany, The lead single also became a top ten hit in Australia, Germany, Ireland, Japan, Luxembourg, New Zealand, Norway and Netherlands.
Ed Sheeran, Ireland, The album also reached top five in Australia, Canada, Ireland, New Zealand and US.
Ed Sheeran, Ireland, Galway Girl" from Phoenix Park in Dublin, Ireland, and picked up six awards, including Billboard Music Award for Top Artist Top Artist and Billboard Music Award for Top Hot 100 Artist Top Hot 100 Artist.
Ed Sheeran, Ireland, He was also inspired by "Cannonball (Damien Rice song) Cannonball" singer songwriter Damien Rice in 2002, with Sheeran stating, "seeing him play this small club in Ireland, I was able to meet him, and he was unbelievably cool.
Ed Sheeran, Ireland, The lead single also became a top ten hit in Australia, Germany, Ireland, Japan, Luxembourg, New Zealand, Norway and Netherlands.
Ed Sheeran, Ireland, In same year, album made Sheeran iTunes' best selling artist in UK, Ireland and New Zealand.
Ed Sheeran, Japan, To support album, Sheeran embarked on x Tour (Ed Sheeran tour) a world tour starting on 6 August 2014 at Osaka, Japan.
Ed Sheeran, Japan, The lead single also became a top ten hit in Australia, Germany, Ireland, Japan, Luxembourg, New Zealand, Norway and Netherlands.
Ed Sheeran, Luxembourg, The lead single also became a top ten hit in Australia, Germany, Ireland, Japan, Luxembourg, New Zealand, Norway and Netherlands.
Ed Sheeran, New Zealand, The album also reached top five in Australia, Canada, Ireland, New Zealand and US.
Ed Sheeran, New Zealand, "Lego House" was released as third single, reaching top ten on Australian, Irish and New Zealand Singles Charts.
Ed Sheeran, New Zealand, Sheeran made his acting debut in 2014, a cameo role as himself on New Zealand soap opera Shortland Street, filmed while he was in country for a one off performance.
Ed Sheeran, New Zealand, The lead single also became a top ten hit in Australia, Germany, Ireland, Japan, Luxembourg, New Zealand, Norway and Netherlands.
Ed Sheeran, New Zealand, Sheeran played to over 950,000 people in Australia and New Zealand in March and April, making it biggest concert tour in Australasian music history, overtaking previous record set by Dire Straits in 1986.
Ed Sheeran, New Zealand, In same year, album made Sheeran iTunes' best selling artist in UK, Ireland and New Zealand.
Ed Sheeran, Norway, The lead single also became a top ten hit in Australia, Germany, Ireland, Japan, Luxembourg, New Zealand, Norway and Netherlands.
Ed Sheeran, Netherlands, The lead single also became a top ten hit in Australia, Germany, Ireland, Japan, Luxembourg, New Zealand, Norway and Netherlands.
Ed Sheeran, BBC Introducing, During a headline set in BBC Introducing tent at Glastonbury Festival 2011, Sheeran announced that "You Need Me, I Don't Need You" would be released on 26 August as second single from album.
Ed Sheeran, Glastonbury Festival 2011, During a headline set in BBC Introducing tent at Glastonbury Festival 2011, Sheeran announced that "You Need Me, I Don't Need You" would be released on 26 August as second single from album.
Ed Sheeran, You Need Me, He released another EP in 2009, You Need Me, and also collaborated several times with Essex singer Leddra Chapman, including CeeLo Green's "Fuck You (CeeLo Green song)
Ed Sheeran, You Need Me, During a headline set in BBC Introducing tent at Glastonbury Festival 2011, Sheeran announced that "You Need Me, I Don't Need You" would be released on 26 August as second single from album.
Ed Sheeran, You Need Me, Sheeran has donated some of his personal items including handwritten lyrics from his song "Perfect", lego bricks he played with as a kid, handmade You Need Me EP from 2009 and a £3 ticket to his first gig at British Legion in Framlingham.
Ed Sheeran, 26 August, On 26 August, Sheeran wrapped up 260 show Divide Tour with last of four homecoming gigs in Ipswich, Suffolk; tour included, for example, his performance for over 100,000 people at Malmi Airport in Helsinki, Finland on 24 July.
Ed Sheeran, 26 August, During a headline set in BBC Introducing tent at Glastonbury Festival 2011, Sheeran announced that "You Need Me, I Don't Need You" would be released on 26 August as second single from album.
Ed Sheeran, number four, The second single peaked at number four on UK Singles Chart.
Ed Sheeran, 40, Tickets were available to those taking part in charity's Give it up for One25 campaign by giving something up for 125 hours and hitting £40,000 fundraising mark.
Ed Sheeran, 40, Sheeran performed a gig in Bristol, which raised £40,000 for a charity that reaches out to prostitution street sex workers.
Ed Sheeran, Australian, On 15 January, songs debuted at number one and number two on ARIA Singles Chart, first time this has been achieved in history of Australian chart.
Ed Sheeran, Australian, "Lego House" was released as third single, reaching top ten on Australian, Irish and New Zealand Singles Charts.
Ed Sheeran, Lego House, "Lego House" was released as third single, reaching top ten on Australian, Irish and New Zealand Singles Charts.
Ed Sheeran, Lego House, The music video for "Lego House" features actor Rupert Grint, as a play on their similar appearance.
Ed Sheeran, Rupert Grint, The music video for "Lego House" features actor Rupert Grint, as a play on their similar appearance.
Ed Sheeran, 19 February 2012, Drunk", released on 19 February 2012, became Sheeran's fourth consecutive top ten single in UK, peaking at number nine.
Ed Sheeran, number nine, Drunk", released on 19 February 2012, became Sheeran's fourth consecutive top ten single in UK, peaking at number nine.
Ed Sheeran, August 2012, Wish You Were Here" at 2012 Summer Olympics closing ceremony closing ceremony of 2012 Summer Olympics in London on 12 August 2012.
Ed Sheeran, 12 September 2011, Sheeran released + on 12 September 2011.
Ed Sheeran, 102,000, The album received generally favourable reviews from music critics and debuted at number one on UK Albums Chart for sales of 102,000 copies.
Ed Sheeran, 791,000, By end of 2011, sales of album in UK stand at 791,000; it became second best selling debut album and ninth biggest selling album there.
Ed Sheeran, ninth, On 5 December 2017, hip hop artist Eminem announced that Sheeran had collaborated on song "River (Eminem song) River" for his ninth studio album Revival (Eminem album) Revival.
Ed Sheeran, ninth, By end of 2011, sales of album in UK stand at 791,000; it became second best selling debut album and ninth biggest selling album there.
Ed Sheeran, six, As of 2019, he has received four Grammy Awards (including Grammy Award for Song of Year Song of Year in 2016 for "Thinking Out Loud"), five Brit Awards (including Brit Award for British Male Solo Artist British Male Solo Artist in 2015), and six Billboard Music Award Billboard Music Awards (including Billboard Music Award for Top Artist Top Artist in 2018).
Ed Sheeran, six, Galway Girl" from Phoenix Park in Dublin, Ireland, and picked up six awards, including Billboard Music Award for Top Artist Top Artist and Billboard Music Award for Top Hot 100 Artist Top Hot 100 Artist.
Ed Sheeran, six, On 17 January, "Shape of You" debuted at number one on US Billboard Hot 100 Billboard Hot 100, while "Castle on Hill" entered at number six; this made Sheeran first artist ever to have two songs simultaneously debut in US top 10.
Ed Sheeran, six, The album has been certified platinum six times by British Phonographic Industry, denoting shipments of 1,800,000 copies.
Ed Sheeran, six, End Game" for her sixth studio album Reputation (Taylor Swift album) Reputation.
Ed Sheeran, British Phonographic Industry, The album has been certified platinum six times by British Phonographic Industry, denoting shipments of 1,800,000 copies.
Ed Sheeran, 1,800,000, The album has been certified platinum six times by British Phonographic Industry, denoting shipments of 1,800,000 copies.
Ed Sheeran, March 2012, Taylor Swift contacted Sheeran after hearing his music while touring Australia in March 2012.
Ed Sheeran, March 2012, As of March 2012, album had sold 1,021,072 copies in UK.
Ed Sheeran, 1,021,072, As of March 2012, album had sold 1,021,072 copies in UK.
Ed Sheeran, five, As of 2019, he has received four Grammy Awards (including Grammy Award for Song of Year Song of Year in 2016 for "Thinking Out Loud"), five Brit Awards (including Brit Award for British Male Solo Artist British Male Solo Artist in 2015), and six Billboard Music Award Billboard Music Awards (including Billboard Music Award for Top Artist Top Artist in 2018).
Ed Sheeran, five, The album also reached top five in Australia, Canada, Ireland, New Zealand and US.
Ed Sheeran, five, As of 9 August 2019, his four albums have spent a combined 41 weeks at number one in UK, List of UK Albums Chart number ones of 2010s most weeks at number one in UK Album Charts in 2010s, five weeks more than Adele in second.
Ed Sheeran, Canada, The album also reached top five in Australia, Canada, Ireland, New Zealand and US.
Ed Sheeran, Canada, His 10th UK number one single, song spent eleven consecutive weeks at top of UK Singles Chart and Irish Singles Chart, topped charts in Australia, Canada and Germany among others, and peaked at number two on Billboard Hot 100 Billboard Hot 100 in US.
Ed Sheeran, Canada, The album debuted at number one in UK, US, Germany, Australia, Canada and other major markets.
Ed Sheeran, 200, × peaked at number one in both UK Albums Chart and US Billboard 200.
Ed Sheeran, 200, He successfully auditioned for Youth Music Theatre UK in 2007 and joined their production of Frankenstein – A New Musical in Plymouth.
Ed Sheeran, 200, He released another EP in 2009, You Need Me, and also collaborated several times with Essex singer Leddra Chapman, including CeeLo Green's "Fuck You (CeeLo Green song)
Ed Sheeran, 200, A 2004 school report described him as a "natural performer", and his classmates also voted him "most likely to be famous".
Ed Sheeran, 200, Sheeran began recording music in 2004 and independently released his first collection of work, tiled Spinning Man.
Ed Sheeran, 200, Sheeran's album peaked at No. 5 on Billboard 200 Billboard 200, while "The A Team" reached No. 16 on US Billboard Hot 100 Billboard Hot 100.
Ed Sheeran, 200, He also opened for Nizlopi in Norwich in April 2008, after being one of their guitar technicians.
Ed Sheeran, 200, He was also inspired by "Cannonball (Damien Rice song) Cannonball" singer songwriter Damien Rice in 2002, with Sheeran stating, "seeing him play this small club in Ireland, I was able to meet him, and he was unbelievably cool.
Ed Sheeran, 200, Sheeran's net worth is estimated at £200 million in 2020.
Ed Sheeran, 200, In 2008, he auditioned for ITV series Britannia High.
Ed Sheeran, 200, He moved to London in 2008 and began playing in small venues.
Ed Sheeran, 200, In autumn of 2009, Sheeran began studying music at Academy of Contemporary Music (ACM) in Guildford, Surrey as an undergraduate at age 18, but left without permission in same year to support hip hop artist Just Jack.
Ed Sheeran, 200, 2004–2010  Career beginnings
Ed Sheeran, 200, Sheeran has donated some of his personal items including handwritten lyrics from his song "Perfect", lego bricks he played with as a kid, handmade You Need Me EP from 2009 and a £3 ticket to his first gig at British Legion in Framlingham.
Ed Sheeran, 200, He singled out Clapton's performance at Party at Palace in grounds of Buckingham Palace, "I was eleven when I saw Eric Clapton play at Golden Jubilee of Queen Elizabeth II Queen's Golden Jubilee concert in June 2002.
Ed Sheeran, Chart, "The A Team" entered UK Singles Chart at number three, selling over 58,000 copies in first week.
Ed Sheeran, Chart, × peaked at number one in both UK Albums Chart and US Billboard 200.
Ed Sheeran, Chart, His 10th UK number one single, song spent eleven consecutive weeks at top of UK Singles Chart and Irish Singles Chart, topped charts in Australia, Canada and Germany among others, and peaked at number two on Billboard Hot 100 Billboard Hot 100 in US.
Ed Sheeran, Chart, On 13 January, "Shape of You" and "Castle on Hill" entered UK Singles Chart at number one and number two, first time in history an artist has taken top two UK chart positions with new songs.
Ed Sheeran, Chart, List of Official Subscription Plays Chart number one songs of 2010s
Ed Sheeran, Chart, Perfect", reached number one in UK and Australia, and a stripped down acoustic version of song titled "Perfect Duet", a collaboration with Beyoncé, reached number one in US and UK, becoming year's List of UK Singles Chart Christmas number ones UK Christmas number one.
Ed Sheeran, Chart, Lawson released his Jamie Lawson (album) self titled debut album on 9 October 2015, which has earned him a number one in UK Albums Chart.
Ed Sheeran, Chart, On 15 January, songs debuted at number one and number two on ARIA Singles Chart, first time this has been achieved in history of Australian chart.
Ed Sheeran, Chart, In December 2019, Official Charts Company named him artist of decade, with most combined success in UK album and singles charts in 2010s.
Ed Sheeran, Chart, By 11 March 2017 Sheeran had accumulated ten top 10 singles from ÷ on UK Singles Chart, breaking Scottish DJ Calvin Harris's record of nine top 10 singles from one album.
Ed Sheeran, Chart, "Lego House" was released as third single, reaching top ten on Australian, Irish and New Zealand Singles Charts.
Ed Sheeran, Chart, As of 9 August 2019, his four albums have spent a combined 41 weeks at number one in UK, List of UK Albums Chart number ones of 2010s most weeks at number one in UK Album Charts in 2010s, five weeks more than Adele in second.
Ed Sheeran, Chart, The second single peaked at number four on UK Singles Chart.
Ed Sheeran, Chart, The song debuted at number one in UK Singles Chart on 10 December to become Sheeran's 12th number one.
Ed Sheeran, Chart, By March 2017, Sheeran had accumulated ten top 10 singles from ÷ on UK Singles Chart, breaking record for most top 10 UK singles from one album.
Ed Sheeran, Chart, Eight of his songs featured in Official Chart Company's chart of decade with three songs inside top 5 – "Shape of You" was named number one.
Ed Sheeran, Chart, Perfect", reached number one in US, Australia and UK, where it became List of UK Singles Chart Christmas number ones Christmas number one in 2017.
Ed Sheeran, Chart, Sheeran's debut album, + (album) + (pronounced "plus"), was released in September 2011 and topped UK Albums Chart.
Ed Sheeran, Chart, The same day he also became first artist to debut at number one and number two on GfK Entertainment Charts German Single Charts.
Ed Sheeran, Chart, In December 2019, Sheeran was named artist of decade by Official Charts Company for being most successful performer in UK album and singles charts of 2010s.
Ed Sheeran, Chart, The album received generally favourable reviews from music critics and debuted at number one on UK Albums Chart for sales of 102,000 copies.
Ed Sheeran, Up All Night, Moments", on Up All Night (One Direction album) debut album by boy band One Direction, released in November 2011, was co written by Sheeran.
