Shawn Mendes, third, In My Blood" from his upcoming third studio album, followed up by second single "Lost in Japan" on March 23.
Shawn Mendes, third, The campaign was relaunched for a third year in a row in 2016.
Shawn Mendes, third, He expressed that his second studio album was influenced by Mayer's work while his third album was inspired by Timberlake, Kings of Leon, Kanye West, and Daniel Caesar.
Shawn Mendes, third, The album's number one debut in US made Mendes third youngest artist to achieve three number one albums.
Shawn Mendes, 2018, Mendes performed remix version of single during 2018 American Music Award held in Los Angeles on October 9.
Shawn Mendes, 2018, In 2018, Time (magazine) Time named Mendes as one of 100 most influential people in world on their Time 100 annual list.
Shawn Mendes, 2018, His Shawn Mendes (album) self titled studio album was released on May 25, 2018, to positive critical reviews, with particular praise towards his songwriting and artistic growth.
Shawn Mendes, 2018, In October 2018, Mendes, together with producer Teddy Geiger, released a cover of "Under Pressure" by British rock band Queen (band) Queen and David Bowie.
Shawn Mendes, 2018, 2018–2019  Shawn Mendes
Shawn Mendes, 2018, He launched his second fragrance, Shawn Signature II, also made for both men and women in August 2018.
Shawn Mendes, 2018, In June 2017, Mendes walked runway during "Armani Emporio Armani Spring 2018" show held in Milan, Italy.
Shawn Mendes, 2018, In July 2018, photographs of Mendes wearing new EA Connected smartwatches were published on social media.
Shawn Mendes, 2018, On June 6, 2018, Mendes was announced as ambassador for Emporio Armani's entire "Fall Winter 2018 2019" watch collection.
Shawn Mendes, 2018, His Shawn Mendes (album) self titled third studio album (2018) was supported by lead single "In My Blood (Shawn Mendes song)
Shawn Mendes, 2018, On October 20, 2018, Mendes performed along with other artists such as Khalid, NF, Marshmello, Meghan Trainor, and Ella Mai at The Hollywood Bowl, Los Angeles for "We Can Survive" event.
Shawn Mendes, 2018, On November 1, Mendes was announced as one of musical performers for 2018 Victoria's Secret Fashion Show which was recorded in New York City in November and aired in December.
Shawn Mendes, 2018, On March 22, 2018, Mendes released lead single "In My Blood (Shawn Mendes song)
Shawn Mendes, 2018, Shawn Mendes (2018)
Shawn Mendes, 2018, Mendes was listed on Billboard "21 Under 21 2018", topping list for second year in a row for his chart performance, having three consecutive number one albums.
Shawn Mendes, 2018, Jingle Ball Tour 2018 (with various artists) (2018)
Shawn Mendes, 2018, He performed at a televised concert honouring 92nd birthday of Queen Elizabeth II on April 21, 2018.
Shawn Mendes, 2018, In September 2018, Mendes took part in annual Global Citizen festival held at Central Park, New York City.
Shawn Mendes, 2018, In 2018, Mendes worked with Omaze to raise funds through donations to support WE Schools program, a movement aiming to support youth through educational services and mentorship.
Shawn Mendes, In My Blood (Shawn Mendes, His Shawn Mendes (album) self titled third studio album (2018) was supported by lead single "In My Blood (Shawn Mendes song)
Shawn Mendes, In My Blood (Shawn Mendes, On March 22, 2018, Mendes released lead single "In My Blood (Shawn Mendes song)
Shawn Mendes, In My Blood (Shawn Mendes, Mendes has been open about his struggles with anxiety disorder anxiety, which he disclosed publicly through "In My Blood (Shawn Mendes song)
Shawn Mendes, three, He released a three song remix EP on December 21 entitled The Album (Remixes).
Shawn Mendes, three, He has been nominated for three Grammy Awards and one Brit Award.
Shawn Mendes, three, It debuted at number one on US Billboard 200, making Mendes third youngest artist to collect three number one albums.
Shawn Mendes, three, He won 18 Society of Composers, Authors and Music Publishers of Canada (SOCAN) awards, twelve Juno Awards, eleven MTV Europe Music Awards (EMA), eight iHeartRadio Much Music Video Awards (MMVA), five BMI Awards, three American Music Awards, two MTV Video Music Awards, and Allan Slaight Honour from Canada's Walk of Fame.
Shawn Mendes, three, In August 2017, he became first artist under 20 years old to have three number one songs on Billboard Adult Pop Songs chart.
Shawn Mendes, three, In November 2017, Mendes became first artist to have three number one songs on Billboard Adult Contemporary chart before turning 20 years old, an unprecedented feat since founding of chart more than 50 years ago.
Shawn Mendes, three, Among List of awards and nominations received by Shawn Mendes his accolades, Mendes has won 13 Society of Composers, Authors and Music Publishers of Canada SOCAN awards, 10 MTV Europe Music Awards, eight Juno Awards, eight iHeartRadio MMVAs, two American Music Awards, and received three nominations for a Grammy Award and one nomination for a Brit Award.
Shawn Mendes, three, Mendes was listed on Billboard "21 Under 21 2018", topping list for second year in a row for his chart performance, having three consecutive number one albums.
Shawn Mendes, three, The album's number one debut in US made Mendes third youngest artist to achieve three number one albums.
Shawn Mendes, 2019, In August 2019, Mendes announced launch of Shawn Mendes Foundation, with aim to "inspire and empower his fans and today's youth to bring about positive change in world and advocate for issues they care most about."
Shawn Mendes, 2019, Shawn Mendes  The Tour (2019)
Shawn Mendes, 2019, The deluxe edition of Shawn Mendes was released on July 27, 2019, and includes songs "If I Can't Have You" and "Señorita".
Shawn Mendes, 2019, A concert film titled, "Shawn Mendes  Live in Concert", was also released on Netflix on November 25, following his first ever performance at Rogers Centre on September 6, 2019.
Shawn Mendes, 2019, 2018–2019  Shawn Mendes
Shawn Mendes, 2019, Mendes began dating Cuban Americans Cuban American singer Camila Cabello in July 2019.
Shawn Mendes, 2019, On June 6, 2018, Mendes was announced as ambassador for Emporio Armani's entire "Fall Winter 2018 2019" watch collection.
Shawn Mendes, 2019, On May 3, 2019, Mendes released single "If I Can't Have You (Shawn Mendes song)
Shawn Mendes, 2019, On June 21, 2019, he released "Señorita (Shawn Mendes and Camila Cabello song) Señorita" with Cuban singer Camila Cabello, along with music video.
Shawn Mendes, 2019, In 2019, he released hit singles "If I Can't Have You (Shawn Mendes song)
Shawn Mendes, 2019, To promote album, Mendes embarked on his self titled world tour in 2019.
Shawn Mendes, 2019, On August 26, 2019, "Señorita" peaked at number one, making it Mendes' first chart topping single on Hot 100.
Shawn Mendes, 2019, In August 2019, Mendes announced a partnership with Canadian based food chain, Tim Hortons, in which he features in a commercial and on beverage cups, followed by a partnership with Roots Canada in September.
Shawn Mendes, 2019, On February 16, 2019, Mendes announced that he was latest brand ambassador for Calvin Klein's #MyCalvins campaign.
Shawn Mendes, Señorita, The deluxe edition of Shawn Mendes was released on July 27, 2019, and includes songs "If I Can't Have You" and "Señorita".
Shawn Mendes, Señorita, On June 21, 2019, he released "Señorita (Shawn Mendes and Camila Cabello song) Señorita" with Cuban singer Camila Cabello, along with music video.
Shawn Mendes, Señorita, On August 26, 2019, "Señorita" peaked at number one, making it Mendes' first chart topping single on Hot 100.
Shawn Mendes, Señorita, If I Can't Have You" and "Señorita (Shawn Mendes and Camila Cabello song) Señorita", with latter peaking atop US Billboard Hot 100 Billboard Hot 100.
Shawn Mendes, 100, The single debuted at number two in US Billboard Hot 100, becoming his highest charting single on chart.
Shawn Mendes, 100, On January 21, 2016, Mendes made his acting debut on The CW's The 100 (TV series)
Shawn Mendes, 100, In September 2017, after witnessing devastation of Central Mexico earthquake earthquake in Mexico City, Mendes created Mexico Earthquake Relief Fund in conjunction with American Red Cross and donated $100,000 towards relief efforts.
Shawn Mendes, 100, In 2018, Time (magazine) Time named Mendes as one of 100 most influential people in world on their Time 100 annual list.
Shawn Mendes, 100, The 100 third season premiere.
Shawn Mendes, 100, The song peaked at number eight on US Billboard Hot 100.
Shawn Mendes, 100, The song debuted at number two on US Billboard Hot 100 chart and marks Mendes and Cabello's second collaboration, following "I Know What You Did Last Summer (song)
Shawn Mendes, 100, "Wonder" debuted and peaked at number 18 on US Billboard Hot 100.
Shawn Mendes, 100, Stitches", peaked at number four on US Billboard Hot 100, becoming his first top 10 single in US, and became his first number one on Adult Pop Songs and Adult Contemporary charts.
Shawn Mendes, 100, On August 26, 2019, "Señorita" peaked at number one, making it Mendes' first chart topping single on Hot 100.
Shawn Mendes, 100, In US, single reached top 10 on Billboard Hot 100, became his second single to peak atop both Adult Contemporary and Adult Pop Songs chart, and was certified triple platinum.
Shawn Mendes, 100, Mendes was listed among Time (magazine) Time's "25 Most Influential Teens of 2014", debuting in list after being youngest ever artist to debut in top 25 of Billboard Hot 100.
Shawn Mendes, 100, If I Can't Have You" and "Señorita (Shawn Mendes and Camila Cabello song) Señorita", with latter peaking atop US Billboard Hot 100 Billboard Hot 100.
Shawn Mendes, 100, He became youngest to debut in top 25 on US The Hot 100 Billboard Hot 100, making it to number 24 for week ending July 12, 2014.
Shawn Mendes, 100, He topped Billboard's 21 Under 21 list in 2017, after his two albums topped Billboard 200 and his single "There's Nothing Holding Me Back" became his fifth top 20 on Billboard Hot 100.
Shawn Mendes, fourth, On September 30, 2020, Mendes announced that his fourth studio album, Wonder (Shawn Mendes album)
Shawn Mendes, fourth, His fourth studio album, Wonder (Shawn Mendes album)
Shawn Mendes, Wonder, Wonder  World Tour Wonder  The World Tour (2022 2023)
Shawn Mendes, Wonder, 2020–present  Wonder
Shawn Mendes, Wonder, On November 16, 2020, Mendes announced a that second single from Wonder was a collaboration with Justin Bieber on a track entitled "Monster (Shawn Mendes and Justin Bieber song)
Shawn Mendes, Wonder, On October 13, Mendes announced that a documentary titled In Wonder, which chronicles past few years of his life, was to be released on Netflix on November 23.
Shawn Mendes, Wonder, On December 6, Mendes held a concert event titled, Wonder  The Experience, where he did a Q&A session, performed songs from album, and talked about behind scenes of making of record.
Shawn Mendes, Wonder, Wonder (Shawn Mendes album) Wonder (2020)
Shawn Mendes, Wonder, On December 4, album Wonder was released, debuting at number one in US as well as Canada.
Shawn Mendes, Wonder, "Wonder" debuted and peaked at number 18 on US Billboard Hot 100.
Shawn Mendes, Wonder, Wonder", would be released on October 2.
Shawn Mendes, Wonder, Mendes performed "Monster" live for first time with Bieber at American Music Awards of 2020 2020 American Music Awards; he also performed "Wonder".
Shawn Mendes, Wonder, On September 30, 2020, Mendes announced that his fourth studio album, Wonder (Shawn Mendes album)
Shawn Mendes, Wonder, Wonder (2020), made Mendes youngest male artist ever to top Billboard 200 with four studio albums.
Shawn Mendes, Wonder, On September 23, 2021, Mendes announced that he would be embarking on Wonder  The World Tour, across North America, United Kingdom, and Europe, consisting of 64 dates and starting on March 14, 2022, at Royal Arena in Copenhagen.
Shawn Mendes, Wonder, His fourth studio album, Wonder (Shawn Mendes album)
Shawn Mendes, Wonder, Wonder, would be released on December 4, along with announcing that album's lead single, also called "Wonder (Shawn Mendes song)
Shawn Mendes, Billboard 200, It debuted at number one on US Billboard 200, making Mendes third youngest artist to collect three number one albums.
Shawn Mendes, Billboard 200, Handwritten debuted atop US Billboard 200 Billboard 200, making Mendes one of five artists ever to debut at number one before age of 18.
Shawn Mendes, Billboard 200, He was listed in Time's "The 30 Most Influential Teens of 2015", making list after his debut album topped Billboard 200 and his single "Stitches" made top 10 in US and other countries.
Shawn Mendes, Billboard 200, The EP debuted and peaked at number five on Billboard 200 Billboard 200, selling 48,000 copies in its first week.
Shawn Mendes, Billboard 200, The album, Illuminate (Shawn Mendes album) Illuminate, was released on September 23, 2016, and debuted at number one on US Billboard 200 with 145,000 equivalent album units, including 121,000 in pure album sales and was certified platinum.
Shawn Mendes, Billboard 200, Wonder (2020), made Mendes youngest male artist ever to top Billboard 200 with four studio albums.
Shawn Mendes, Billboard 200, On April 14, 2015, Mendes released his full length album Handwritten, which debuted at number one on Billboard 200 chart with 119,000 Top Album Sales equivalent album units, selling 106,000 copies in its first week and was certified platinum.
Shawn Mendes, Billboard 200, He topped Billboard's 21 Under 21 list in 2017, after his two albums topped Billboard 200 and his single "There's Nothing Holding Me Back" became his fifth top 20 on Billboard Hot 100.
Shawn Mendes, four, On September 30, 2020, Mendes announced that his fourth studio album, Wonder (Shawn Mendes album)
Shawn Mendes, four, Wonder (2020), made Mendes youngest male artist ever to top Billboard 200 with four studio albums.
Shawn Mendes, four, Stitches", peaked at number four on US Billboard Hot 100, becoming his first top 10 single in US, and became his first number one on Adult Pop Songs and Adult Contemporary charts.
Shawn Mendes, four, He has also performed his latest singles on iHeartRadio MMVAs in Canada on August 27, where he received eight nominations and won four awards.
Shawn Mendes, four, His fourth studio album, Wonder (Shawn Mendes album)
Shawn Mendes, four, "In My Blood" topped Billboard Adult Pop Songs chart, making Mendes first and only artist to have four number one singles in chart before turning 20 years old.
Shawn Mendes, 13, On October 13, Mendes announced that a documentary titled In Wonder, which chronicles past few years of his life, was to be released on Netflix on November 23.
Shawn Mendes, 13, 2013–2015  Handwritten
Shawn Mendes, 13, He gained a following in 2013, posting song covers on video sharing application Vine (software) Vine.
Shawn Mendes, 13, Artist manager Andrew Gertler discovered Mendes online in November 2013, bringing him to Island Records in January 2014.
Shawn Mendes, 13, Among List of awards and nominations received by Shawn Mendes his accolades, Mendes has won 13 Society of Composers, Authors and Music Publishers of Canada SOCAN awards, 10 MTV Europe Music Awards, eight Juno Awards, eight iHeartRadio MMVAs, two American Music Awards, and received three nominations for a Grammy Award and one nomination for a Brit Award.
Shawn Mendes, 13, As Long as You Love Me" on social video app Vine (service) Vine in 2013 and got 10,000 likes and as many followers next day.
Shawn Mendes, Society of Composers, He won 18 Society of Composers, Authors and Music Publishers of Canada (SOCAN) awards, twelve Juno Awards, eleven MTV Europe Music Awards (EMA), eight iHeartRadio Much Music Video Awards (MMVA), five BMI Awards, three American Music Awards, two MTV Video Music Awards, and Allan Slaight Honour from Canada's Walk of Fame.
Shawn Mendes, Society of Composers, Among List of awards and nominations received by Shawn Mendes his accolades, Mendes has won 13 Society of Composers, Authors and Music Publishers of Canada SOCAN awards, 10 MTV Europe Music Awards, eight Juno Awards, eight iHeartRadio MMVAs, two American Music Awards, and received three nominations for a Grammy Award and one nomination for a Brit Award.
Shawn Mendes, Music Publishers of Canada SOCAN, Among List of awards and nominations received by Shawn Mendes his accolades, Mendes has won 13 Society of Composers, Authors and Music Publishers of Canada SOCAN awards, 10 MTV Europe Music Awards, eight Juno Awards, eight iHeartRadio MMVAs, two American Music Awards, and received three nominations for a Grammy Award and one nomination for a Brit Award.
Shawn Mendes, MTV Europe Music Awards, He won 18 Society of Composers, Authors and Music Publishers of Canada (SOCAN) awards, twelve Juno Awards, eleven MTV Europe Music Awards (EMA), eight iHeartRadio Much Music Video Awards (MMVA), five BMI Awards, three American Music Awards, two MTV Video Music Awards, and Allan Slaight Honour from Canada's Walk of Fame.
Shawn Mendes, MTV Europe Music Awards, Among List of awards and nominations received by Shawn Mendes his accolades, Mendes has won 13 Society of Composers, Authors and Music Publishers of Canada SOCAN awards, 10 MTV Europe Music Awards, eight Juno Awards, eight iHeartRadio MMVAs, two American Music Awards, and received three nominations for a Grammy Award and one nomination for a Brit Award.
Shawn Mendes, eight, He won 18 Society of Composers, Authors and Music Publishers of Canada (SOCAN) awards, twelve Juno Awards, eleven MTV Europe Music Awards (EMA), eight iHeartRadio Much Music Video Awards (MMVA), five BMI Awards, three American Music Awards, two MTV Video Music Awards, and Allan Slaight Honour from Canada's Walk of Fame.
Shawn Mendes, eight, The song peaked at number eight on US Billboard Hot 100.
Shawn Mendes, eight, Among List of awards and nominations received by Shawn Mendes his accolades, Mendes has won 13 Society of Composers, Authors and Music Publishers of Canada SOCAN awards, 10 MTV Europe Music Awards, eight Juno Awards, eight iHeartRadio MMVAs, two American Music Awards, and received three nominations for a Grammy Award and one nomination for a Brit Award.
Shawn Mendes, eight, He has also performed his latest singles on iHeartRadio MMVAs in Canada on August 27, where he received eight nominations and won four awards.
Shawn Mendes, Juno Awards, He won 18 Society of Composers, Authors and Music Publishers of Canada (SOCAN) awards, twelve Juno Awards, eleven MTV Europe Music Awards (EMA), eight iHeartRadio Much Music Video Awards (MMVA), five BMI Awards, three American Music Awards, two MTV Video Music Awards, and Allan Slaight Honour from Canada's Walk of Fame.
Shawn Mendes, Juno Awards, Among List of awards and nominations received by Shawn Mendes his accolades, Mendes has won 13 Society of Composers, Authors and Music Publishers of Canada SOCAN awards, 10 MTV Europe Music Awards, eight Juno Awards, eight iHeartRadio MMVAs, two American Music Awards, and received three nominations for a Grammy Award and one nomination for a Brit Award.
Shawn Mendes, two, The single debuted at number two in US Billboard Hot 100, becoming his highest charting single on chart.
Shawn Mendes, two, He won 18 Society of Composers, Authors and Music Publishers of Canada (SOCAN) awards, twelve Juno Awards, eleven MTV Europe Music Awards (EMA), eight iHeartRadio Much Music Video Awards (MMVA), five BMI Awards, three American Music Awards, two MTV Video Music Awards, and Allan Slaight Honour from Canada's Walk of Fame.
Shawn Mendes, two, The song debuted at number two on US Billboard Hot 100 chart and marks Mendes and Cabello's second collaboration, following "I Know What You Did Last Summer (song)
Shawn Mendes, two, Among List of awards and nominations received by Shawn Mendes his accolades, Mendes has won 13 Society of Composers, Authors and Music Publishers of Canada SOCAN awards, 10 MTV Europe Music Awards, eight Juno Awards, eight iHeartRadio MMVAs, two American Music Awards, and received three nominations for a Grammy Award and one nomination for a Brit Award.
Shawn Mendes, two, He topped Billboard's 21 Under 21 list in 2017, after his two albums topped Billboard 200 and his single "There's Nothing Holding Me Back" became his fifth top 20 on Billboard Hot 100.
Shawn Mendes, American Music Awards, He won 18 Society of Composers, Authors and Music Publishers of Canada (SOCAN) awards, twelve Juno Awards, eleven MTV Europe Music Awards (EMA), eight iHeartRadio Much Music Video Awards (MMVA), five BMI Awards, three American Music Awards, two MTV Video Music Awards, and Allan Slaight Honour from Canada's Walk of Fame.
Shawn Mendes, American Music Awards, Mendes performed "Monster" live for first time with Bieber at American Music Awards of 2020 2020 American Music Awards; he also performed "Wonder".
Shawn Mendes, American Music Awards, Among List of awards and nominations received by Shawn Mendes his accolades, Mendes has won 13 Society of Composers, Authors and Music Publishers of Canada SOCAN awards, 10 MTV Europe Music Awards, eight Juno Awards, eight iHeartRadio MMVAs, two American Music Awards, and received three nominations for a Grammy Award and one nomination for a Brit Award.
Shawn Mendes, a Brit Award, Among List of awards and nominations received by Shawn Mendes his accolades, Mendes has won 13 Society of Composers, Authors and Music Publishers of Canada SOCAN awards, 10 MTV Europe Music Awards, eight Juno Awards, eight iHeartRadio MMVAs, two American Music Awards, and received three nominations for a Grammy Award and one nomination for a Brit Award.
Shawn Mendes, Time, For Brittany Spanos of Rolling Stone, Mendes incorporates "catchy acoustic folk pop tunes" in his catalogue, while for Joe Coscarelli of The New York Times, "his soft, sometimes soulful pop rock plays primarily to tweens and teenagers, but has also found traction on adult contemporary radio stations".
Shawn Mendes, Time, In 2018, Time (magazine) Time named Mendes as one of 100 most influential people in world on their Time 100 annual list.
Shawn Mendes, Time, He was listed in Time's "The 30 Most Influential Teens of 2015", making list after his debut album topped Billboard 200 and his single "Stitches" made top 10 in US and other countries.
Shawn Mendes, Time, Mendes was listed among Time's The 30 Most Influential Teens of 2016 and made his first appearance on Forbes's Forbes 30 Under 30 30
Shawn Mendes, Time, Mendes was listed among Time (magazine) Time's "25 Most Influential Teens of 2014", debuting in list after being youngest ever artist to debut in top 25 of Billboard Hot 100.
Shawn Mendes, annual, In 2018, Time (magazine) Time named Mendes as one of 100 most influential people in world on their Time 100 annual list.
Shawn Mendes, annual, In September 2018, Mendes took part in annual Global Citizen festival held at Central Park, New York City.
Shawn Mendes, Shawn Peter Raul Mendes, Shawn Peter Raul Mendes was born and raised in Pickering, Ontario, to Karen Mendes (née Rayment), a real estate agent, and Manuel Mendes, a businessman, who sells bar and restaurant supplies in Toronto.
Shawn Mendes, Shawn Peter Raul Mendes, Shawn Peter Raul Mendes (; born August 8, 1998) is a Canadian singer and songwriter.
Shawn Mendes, Pickering, Shawn Peter Raul Mendes was born and raised in Pickering, Ontario, to Karen Mendes (née Rayment), a real estate agent, and Manuel Mendes, a businessman, who sells bar and restaurant supplies in Toronto.
Shawn Mendes, Pickering, Category People from Pickering, Ontario
Shawn Mendes, Karen Mendes, Shawn Peter Raul Mendes was born and raised in Pickering, Ontario, to Karen Mendes (née Rayment), a real estate agent, and Manuel Mendes, a businessman, who sells bar and restaurant supplies in Toronto.
Shawn Mendes, Rayment, Shawn Peter Raul Mendes was born and raised in Pickering, Ontario, to Karen Mendes (née Rayment), a real estate agent, and Manuel Mendes, a businessman, who sells bar and restaurant supplies in Toronto.
Shawn Mendes, Manuel Mendes, Shawn Peter Raul Mendes was born and raised in Pickering, Ontario, to Karen Mendes (née Rayment), a real estate agent, and Manuel Mendes, a businessman, who sells bar and restaurant supplies in Toronto.
Shawn Mendes, Algarve, His father is from Algarve, Portugal, while his mother is from England.
Shawn Mendes, Portugal, His father is from Algarve, Portugal, while his mother is from England.
Shawn Mendes, England, His father is from Algarve, Portugal, while his mother is from England.
Shawn Mendes, Aaliyah, He has a younger sister named Aaliyah.
Shawn Mendes, June 21, 2019, On June 21, 2019, he released "Señorita (Shawn Mendes and Camila Cabello song) Señorita" with Cuban singer Camila Cabello, along with music video.
Shawn Mendes, American, Mendes performed remix version of single during 2018 American Music Award held in Los Angeles on October 9.
Shawn Mendes, American, He won 18 Society of Composers, Authors and Music Publishers of Canada (SOCAN) awards, twelve Juno Awards, eleven MTV Europe Music Awards (EMA), eight iHeartRadio Much Music Video Awards (MMVA), five BMI Awards, three American Music Awards, two MTV Video Music Awards, and Allan Slaight Honour from Canada's Walk of Fame.
Shawn Mendes, American, In September 2017, after witnessing devastation of Central Mexico earthquake earthquake in Mexico City, Mendes created Mexico Earthquake Relief Fund in conjunction with American Red Cross and donated $100,000 towards relief efforts.
Shawn Mendes, American, "Youth (Shawn Mendes song) Youth" was released on May 3, featuring American singer Khalid (singer) Khalid.
Shawn Mendes, American, Mendes began dating Cuban Americans Cuban American singer Camila Cabello in July 2019.
