Title, Named Entity, Sentence
Shawn Mendes, Shawn Mendes, In August 2019, Mendes announced launch of Shawn Mendes Foundation, with aim to "inspire and empower his fans and today's youth to bring about positive change in world and advocate for issues they care most about."
Shawn Mendes, Shawn Mendes, On March 20, 2022, he premiered a new song titled "When You're Gone (Shawn Mendes song)
Shawn Mendes, Shawn Mendes, He released his first single "Life of Party (Shawn Mendes song)
Shawn Mendes, Shawn Mendes, Shawn Mendes  The Tour (2019)
Shawn Mendes, Shawn Mendes, He released single "There's Nothing Holdin' Me Back" on April 20, 2017, included on his Illuminate (Shawn Mendes album) Illuminate deluxe edition.
Shawn Mendes, Shawn Mendes, The deluxe edition of Shawn Mendes was released on July 27, 2019, and includes songs "If I Can't Have You" and "Señorita".
Shawn Mendes, Shawn Mendes, Shawn Mendes (album)
Shawn Mendes, Shawn Mendes, On November 16, 2020, Mendes announced a that second single from Wonder was a collaboration with Justin Bieber on a track entitled "Monster (Shawn Mendes and Justin Bieber song)
Shawn Mendes, Shawn Mendes, His Shawn Mendes (album) self titled studio album was released on May 25, 2018, to positive critical reviews, with particular praise towards his songwriting and artistic growth.
Shawn Mendes, Shawn Mendes, Also in 2015, Mendes opened for Taylor Swift during 1989 World Tour dates for North America and recorded "Believe (Shawn Mendes song)
Shawn Mendes, Shawn Mendes, The EP includes remixes of songs from his self titled album such as "Where Were You in Morning?" with Kaytranada, "Why" with Leon Bridges, and "Youth (Shawn Mendes song) Youth" with Jessie Reyez.
Shawn Mendes, Shawn Mendes, A concert film titled, "Shawn Mendes  Live in Concert", was also released on Netflix on November 25, following his first ever performance at Rogers Centre on September 6, 2019.
Shawn Mendes, Shawn Mendes, On 8 January 2020, Mendes announced that both he and his Shawn Mendes Foundation will be donating an undisclosed sum of money to causes including Australia's Red Cross, New South Wales Rural Fire Service, and South Australia Country Fire Service, to help ease strain on those impacted by devastating fires that are tearing through parts of country.
Shawn Mendes, Shawn Mendes, Wonder (Shawn Mendes album) Wonder (2020)
Shawn Mendes, Shawn Mendes, 2018–2019  Shawn Mendes
Shawn Mendes, Shawn Mendes, "Youth (Shawn Mendes song) Youth" was released on May 3, featuring American singer Khalid (singer) Khalid.
Shawn Mendes, Shawn Mendes, He later announced his second world tour as a headliner, Shawn Mendes World Tour, which started in March 2016 and sold out 38 shows in North America and Europe within minutes.
Shawn Mendes, Shawn Mendes, Category Shawn Mendes
Shawn Mendes, Shawn Mendes, Shawn Mendes World Tour (2016)
Shawn Mendes, Shawn Mendes, "Mercy (Shawn Mendes song)
Shawn Mendes, Shawn Mendes, The third single from album, "Stitches (Shawn Mendes song)
Shawn Mendes, Shawn Mendes, His Shawn Mendes (album) self titled third studio album (2018) was supported by lead single "In My Blood (Shawn Mendes song)
Shawn Mendes, Shawn Mendes, In March 2020 Mendes and The Shawn Mendes Foundation donated $175,000 to support COVID 19 relief to Toronto's SickKids Foundation, largest charitable funder of child health research, learning and care in Canada.
Shawn Mendes, Shawn Mendes, Mendes released "Treat You Better (Shawn Mendes song)
Shawn Mendes, Shawn Mendes, On May 3, 2019, Mendes released single "If I Can't Have You (Shawn Mendes song)
Shawn Mendes, Shawn Mendes, Handwritten (Shawn Mendes album) Handwritten (2015)
Shawn Mendes, Shawn Mendes, The album, Illuminate (Shawn Mendes album) Illuminate, was released on September 23, 2016, and debuted at number one on US Billboard 200 with 145,000 equivalent album units, including 121,000 in pure album sales and was certified platinum.
Shawn Mendes, Shawn Mendes, Mendes's The Shawn Mendes EP self titled debut EP was released in 2014, followed by his debut studio album Handwritten (Shawn Mendes album) Handwritten in 2015.
Shawn Mendes, Shawn Mendes, On June 21, 2019, he released "Señorita (Shawn Mendes and Camila Cabello song) Señorita" with Cuban singer Camila Cabello, along with music video.
Shawn Mendes, Shawn Mendes, In 2019, he released hit singles "If I Can't Have You (Shawn Mendes song)
Shawn Mendes, Shawn Mendes, On March 22, 2018, Mendes released lead single "In My Blood (Shawn Mendes song)
Shawn Mendes, Shawn Mendes, On September 30, 2020, Mendes announced that his fourth studio album, Wonder (Shawn Mendes album)
Shawn Mendes, Shawn Mendes, Shawn Mendes (2018)
Shawn Mendes, Shawn Mendes, Illuminate (Shawn Mendes album) Illuminate (2016)
Shawn Mendes, Shawn Mendes, The documentary, Shawn Mendes – Artist Spotlight Stories, was published on September 28.
Shawn Mendes, Shawn Mendes, Shawn Mendes
Shawn Mendes, Shawn Mendes, Among List of awards and nominations received by Shawn Mendes his accolades, Mendes has won 13 Society of Composers, Authors and Music Publishers of Canada SOCAN awards, 10 MTV Europe Music Awards, eight Juno Awards, eight iHeartRadio MMVAs, two American Music Awards, and received three nominations for a Grammy Award and one nomination for a Brit Award.
Shawn Mendes, Shawn Mendes, His fourth studio album, Wonder (Shawn Mendes album)
Shawn Mendes, Shawn Mendes, Mendes has been open about his struggles with anxiety disorder anxiety, which he disclosed publicly through "In My Blood (Shawn Mendes song)
Shawn Mendes, Shawn Mendes, On August 20, 2021, Mendes released "Summer of Love (Shawn Mendes and Tainy song)
Shawn Mendes, Shawn Mendes, His second studio album Illuminate (Shawn Mendes album) Illuminate (2016) also debuted at number one in US, with its singles "Treat You Better (Shawn Mendes song)
Shawn Mendes, Shawn Mendes, Wonder, would be released on December 4, along with announcing that album's lead single, also called "Wonder (Shawn Mendes song)
Shawn Mendes, Shawn Mendes, In August 2017, Mendes launched his first fragrance, Shawn Mendes Signature, a fragrance for women and men.
Shawn Mendes, Shawn Mendes, If I Can't Have You" and "Señorita (Shawn Mendes and Camila Cabello song) Señorita", with latter peaking atop US Billboard Hot 100 Billboard Hot 100.
Shawn Mendes, Shawn Mendes, The single "Stitches (Shawn Mendes song)
Shawn Mendes, Canadian, Category 21st century Canadian pianists
Shawn Mendes, Canadian, Category Canadian male singers
Shawn Mendes, Canadian, Shawn Peter Raul Mendes (; born August 8, 1998) is a Canadian singer and songwriter.
Shawn Mendes, Canadian, Category Canadian male voice actors
Shawn Mendes, Canadian, Category Canadian pop singers
Shawn Mendes, Canadian, Category Canadian people of Portuguese descent
Shawn Mendes, Canadian, Category Canadian pop pianists
Shawn Mendes, Canadian, Category Canadian male guitarists
Shawn Mendes, Canadian, Category 21st century Canadian male singers
Shawn Mendes, Canadian, Category Canadian people of English descent
Shawn Mendes, Canadian, Category Canadian child singers
Shawn Mendes, Canadian, Category Canadian male pianists
Shawn Mendes, Canadian, In August 2019, Mendes announced a partnership with Canadian based food chain, Tim Hortons, in which he features in a commercial and on beverage cups, followed by a partnership with Roots Canada in September.
Shawn Mendes, Canadian, Category Canadian pop guitarists
Shawn Mendes, English, Category Canadian people of English descent
Shawn Mendes, June 2016, Treat You Better", lead single from his second studio album, in June 2016.
Shawn Mendes, June 2016, Mendes graduated from Pine Ridge Secondary School in June 2016, where he played ice hockey and soccer, joined his high school glee club, and practised his stage presence in acting lessons (leading as Prince Charming at one point).
Shawn Mendes, 2020, 2020–present  Wonder
Shawn Mendes, 2020, On November 16, 2020, Mendes announced a that second single from Wonder was a collaboration with Justin Bieber on a track entitled "Monster (Shawn Mendes and Justin Bieber song)
Shawn Mendes, 2020, On 8 January 2020, Mendes announced that both he and his Shawn Mendes Foundation will be donating an undisclosed sum of money to causes including Australia's Red Cross, New South Wales Rural Fire Service, and South Australia Country Fire Service, to help ease strain on those impacted by devastating fires that are tearing through parts of country.
Shawn Mendes, 2020, Wonder (Shawn Mendes album) Wonder (2020)
Shawn Mendes, 2020, The single and music video were released on November 20, 2020.
Shawn Mendes, 2020, In March 2020 Mendes and The Shawn Mendes Foundation donated $175,000 to support COVID 19 relief to Toronto's SickKids Foundation, largest charitable funder of child health research, learning and care in Canada.
Shawn Mendes, 2020, Mendes performed "Monster" live for first time with Bieber at American Music Awards of 2020 2020 American Music Awards; he also performed "Wonder".
Shawn Mendes, 2020, In March 2020, Mendes participated in iHeart Media's iHeart Living Room Concert for America Living Room Concert for America, a benefit to raise awareness and funds for COVID 19 pandemic.
Shawn Mendes, 2020, On September 30, 2020, Mendes announced that his fourth studio album, Wonder (Shawn Mendes album)
Shawn Mendes, 2020, Wonder (2020), made Mendes youngest male artist ever to top Billboard 200 with four studio albums.
Shawn Mendes, 2020, In March and April 2020, Mendes participated in Global Citizen Festival's Together at Home virtual concert to raise awareness and funds for COVID 19 pandemic.
Shawn Mendes, 2020, In May 2020 he alongside Camila Cabello joined protests in Miami for racial justice after murder of George Floyd, and has had lent his Instagram to raise voice of Black activists.
Shawn Mendes, Raul Mendes, Shawn Peter Raul Mendes was born and raised in Pickering, Ontario, to Karen Mendes (née Rayment), a real estate agent, and Manuel Mendes, a businessman, who sells bar and restaurant supplies in Toronto.
Shawn Mendes, Raul Mendes, Shawn Peter Raul Mendes (; born August 8, 1998) is a Canadian singer and songwriter.
Shawn Mendes, Ontario, Shawn Peter Raul Mendes was born and raised in Pickering, Ontario, to Karen Mendes (née Rayment), a real estate agent, and Manuel Mendes, a businessman, who sells bar and restaurant supplies in Toronto.
Shawn Mendes, Ontario, Category People from Pickering, Ontario
Shawn Mendes, Canada, He won 18 Society of Composers, Authors and Music Publishers of Canada (SOCAN) awards, twelve Juno Awards, eleven MTV Europe Music Awards (EMA), eight iHeartRadio Much Music Video Awards (MMVA), five BMI Awards, three American Music Awards, two MTV Video Music Awards, and Allan Slaight Honour from Canada's Walk of Fame.
Shawn Mendes, Canada, It debuted atop charts in Canada, becoming his second number one album in his home country.
Shawn Mendes, Canada, Ahead of event, he took to social media to reach out to Canada's Prime Minister Justin Trudeau, thanking Prime Minister for leading initiative for Leave No Girl
Shawn Mendes, Canada, In March 2020 Mendes and The Shawn Mendes Foundation donated $175,000 to support COVID 19 relief to Toronto's SickKids Foundation, largest charitable funder of child health research, learning and care in Canada.
Shawn Mendes, Canada, On December 4, album Wonder was released, debuting at number one in US as well as Canada.
Shawn Mendes, Canada, It debuted at number one in Canada, making it his third number one album in his home country.
Shawn Mendes, Canada, Among List of awards and nominations received by Shawn Mendes his accolades, Mendes has won 13 Society of Composers, Authors and Music Publishers of Canada SOCAN awards, 10 MTV Europe Music Awards, eight Juno Awards, eight iHeartRadio MMVAs, two American Music Awards, and received three nominations for a Grammy Award and one nomination for a Brit Award.
Shawn Mendes, Canada, He has also performed his latest singles on iHeartRadio MMVAs in Canada on August 27, where he received eight nominations and won four awards.
Shawn Mendes, Canada, In August 2019, Mendes announced a partnership with Canadian based food chain, Tim Hortons, in which he features in a commercial and on beverage cups, followed by a partnership with Roots Canada in September.
Shawn Mendes, Canada, Stitches" reached number one in UK and top 10 in US and Canada.
Shawn Mendes, 2013, 2013–2015  Handwritten
Shawn Mendes, 2013, He gained a following in 2013, posting song covers on video sharing application Vine (software) Vine.
Shawn Mendes, 2013, Artist manager Andrew Gertler discovered Mendes online in November 2013, bringing him to Island Records in January 2014.
Shawn Mendes, 2013, As Long as You Love Me" on social video app Vine (service) Vine in 2013 and got 10,000 likes and as many followers next day.
Shawn Mendes, Toronto, Shawn Peter Raul Mendes was born and raised in Pickering, Ontario, to Karen Mendes (née Rayment), a real estate agent, and Manuel Mendes, a businessman, who sells bar and restaurant supplies in Toronto.
Shawn Mendes, Toronto, Category Musicians from Toronto
Shawn Mendes, Toronto, In March 2020 Mendes and The Shawn Mendes Foundation donated $175,000 to support COVID 19 relief to Toronto's SickKids Foundation, largest charitable funder of child health research, learning and care in Canada.
Shawn Mendes, Toronto, , Mendes resides in a condominium in downtown Toronto.
Shawn Mendes, Toronto, He also auditioned for Disney Channel in Toronto.
Shawn Mendes, Billboard, The single debuted at number two in US Billboard Hot 100, becoming his highest charting single on chart.
Shawn Mendes, Billboard, It debuted at number one on US Billboard 200, making Mendes third youngest artist to collect three number one albums.
Shawn Mendes, Billboard, Handwritten debuted atop US Billboard 200 Billboard 200, making Mendes one of five artists ever to debut at number one before age of 18.
Shawn Mendes, Billboard, The song peaked at number eight on US Billboard Hot 100.
Shawn Mendes, Billboard, In August 2017, he became first artist under 20 years old to have three number one songs on Billboard Adult Pop Songs chart.
Shawn Mendes, Billboard, He was listed in Time's "The 30 Most Influential Teens of 2015", making list after his debut album topped Billboard 200 and his single "Stitches" made top 10 in US and other countries.
Shawn Mendes, Billboard, The EP debuted and peaked at number five on Billboard 200 Billboard 200, selling 48,000 copies in its first week.
Shawn Mendes, Billboard, The song debuted at number two on US Billboard Hot 100 chart and marks Mendes and Cabello's second collaboration, following "I Know What You Did Last Summer (song)
Shawn Mendes, Billboard, "Wonder" debuted and peaked at number 18 on US Billboard Hot 100.
Shawn Mendes, Billboard, The album, Illuminate (Shawn Mendes album) Illuminate, was released on September 23, 2016, and debuted at number one on US Billboard 200 with 145,000 equivalent album units, including 121,000 in pure album sales and was certified platinum.
Shawn Mendes, Billboard, In November 2017, Mendes became first artist to have three number one songs on Billboard Adult Contemporary chart before turning 20 years old, an unprecedented feat since founding of chart more than 50 years ago.
Shawn Mendes, Billboard, Wonder (2020), made Mendes youngest male artist ever to top Billboard 200 with four studio albums.
Shawn Mendes, Billboard, Stitches", peaked at number four on US Billboard Hot 100, becoming his first top 10 single in US, and became his first number one on Adult Pop Songs and Adult Contemporary charts.
Shawn Mendes, Billboard, Mendes was listed on Billboard "21 Under 21 2018", topping list for second year in a row for his chart performance, having three consecutive number one albums.
Shawn Mendes, Billboard, In US, single reached top 10 on Billboard Hot 100, became his second single to peak atop both Adult Contemporary and Adult Pop Songs chart, and was certified triple platinum.
Shawn Mendes, Billboard, "In My Blood" topped Billboard Adult Pop Songs chart, making Mendes first and only artist to have four number one singles in chart before turning 20 years old.
Shawn Mendes, Billboard, Mendes was listed among Time (magazine) Time's "25 Most Influential Teens of 2014", debuting in list after being youngest ever artist to debut in top 25 of Billboard Hot 100.
Shawn Mendes, Billboard, If I Can't Have You" and "Señorita (Shawn Mendes and Camila Cabello song) Señorita", with latter peaking atop US Billboard Hot 100 Billboard Hot 100.
Shawn Mendes, Billboard, He became youngest to debut in top 25 on US The Hot 100 Billboard Hot 100, making it to number 24 for week ending July 12, 2014.
Shawn Mendes, Billboard, On April 14, 2015, Mendes released his full length album Handwritten, which debuted at number one on Billboard 200 chart with 119,000 Top Album Sales equivalent album units, selling 106,000 copies in its first week and was certified platinum.
Shawn Mendes, Billboard, He topped Billboard's 21 Under 21 list in 2017, after his two albums topped Billboard 200 and his single "There's Nothing Holding Me Back" became his fifth top 20 on Billboard Hot 100.
Shawn Mendes, Teddy Geiger, In October 2018, Mendes, together with producer Teddy Geiger, released a cover of "Under Pressure" by British rock band Queen (band) Queen and David Bowie.
Shawn Mendes, Mendes, Shawn Peter Raul Mendes was born and raised in Pickering, Ontario, to Karen Mendes (née Rayment), a real estate agent, and Manuel Mendes, a businessman, who sells bar and restaurant supplies in Toronto.
Shawn Mendes, Mendes, On January 21, 2016, Mendes made his acting debut on The CW's The 100 (TV series)
Shawn Mendes, Mendes, Mendes performed remix version of single during 2018 American Music Award held in Los Angeles on October 9.
Shawn Mendes, Mendes, In August 2019, Mendes announced launch of Shawn Mendes Foundation, with aim to "inspire and empower his fans and today's youth to bring about positive change in world and advocate for issues they care most about."
Shawn Mendes, Mendes, Mendes has received several nominations and awards.
Shawn Mendes, Mendes, On March 20, 2022, he premiered a new song titled "When You're Gone (Shawn Mendes song)
Shawn Mendes, Mendes, It debuted at number one on US Billboard 200, making Mendes third youngest artist to collect three number one albums.
Shawn Mendes, Mendes, For Brittany Spanos of Rolling Stone, Mendes incorporates "catchy acoustic folk pop tunes" in his catalogue, while for Joe Coscarelli of The New York Times, "his soft, sometimes soulful pop rock plays primarily to tweens and teenagers, but has also found traction on adult contemporary radio stations".
Shawn Mendes, Mendes, On April 22, 2021, Mendes hosted a NASA video conference with crew of Expedition 65 on board International Space Station.
Shawn Mendes, Mendes, Mendes made an appearance on late night talk show The Tonight Show Starring Jimmy Fallon in October and performed Lost in Japan.
Shawn Mendes, Mendes, He released his first single "Life of Party (Shawn Mendes song)
Shawn Mendes, Mendes, On December 7, Mendes did an interview alongside Matthew McConaughey and performed "Dream" for first time on television during his appearance on The Late Late Show with James Corden
Shawn Mendes, Mendes, Shawn Mendes  The Tour (2019)
Shawn Mendes, Mendes, Mendes starred in a documentary directed by YouTube star Casey Neistat.
Shawn Mendes, Mendes, In September 2017, after witnessing devastation of Central Mexico earthquake earthquake in Mexico City, Mendes created Mexico Earthquake Relief Fund in conjunction with American Red Cross and donated $100,000 towards relief efforts.
Shawn Mendes, Mendes, Mendes saw Bieber as a career model at time.
Shawn Mendes, Mendes, He released single "There's Nothing Holdin' Me Back" on April 20, 2017, included on his Illuminate (Shawn Mendes album) Illuminate deluxe edition.
Shawn Mendes, Mendes, The deluxe edition of Shawn Mendes was released on July 27, 2019, and includes songs "If I Can't Have You" and "Señorita".
Shawn Mendes, Mendes, That same month, it was announced that Mendes would serve as an executive producervia his production banner, Permanent Contentfor Legendary's TV adaptation of Square Enix's video game Life Is Strange.
Shawn Mendes, Mendes, In an interview with Clash (magazine) Clash magazine, Mendes stated  "I want to create anthems for people.
Shawn Mendes, Mendes, Shawn Mendes (album)
Shawn Mendes, Mendes, On November 16, 2020, Mendes announced a that second single from Wonder was a collaboration with Justin Bieber on a track entitled "Monster (Shawn Mendes and Justin Bieber song)
Shawn Mendes, Mendes, Prior to his signing, Mendes toured as a member of Magcon Tour alongside other young Viners with a large following on social media.
Shawn Mendes, Mendes, In 2018, Time (magazine) Time named Mendes as one of 100 most influential people in world on their Time 100 annual list.
Shawn Mendes, Mendes, Growing up, Mendes listened to reggae music, Led Zeppelin, Garth Brooks, and country music thanks to his parents.
Shawn Mendes, Mendes, His Shawn Mendes (album) self titled studio album was released on May 25, 2018, to positive critical reviews, with particular praise towards his songwriting and artistic growth.
Shawn Mendes, Mendes, Also in 2015, Mendes opened for Taylor Swift during 1989 World Tour dates for North America and recorded "Believe (Shawn Mendes song)
Shawn Mendes, Mendes, The EP includes remixes of songs from his self titled album such as "Where Were You in Morning?" with Kaytranada, "Why" with Leon Bridges, and "Youth (Shawn Mendes song) Youth" with Jessie Reyez.
Shawn Mendes, Mendes, A concert film titled, "Shawn Mendes  Live in Concert", was also released on Netflix on November 25, following his first ever performance at Rogers Centre on September 6, 2019.
Shawn Mendes, Mendes, On October 13, Mendes announced that a documentary titled In Wonder, which chronicles past few years of his life, was to be released on Netflix on November 23.
Shawn Mendes, Mendes, On December 6, Mendes held a concert event titled, Wonder  The Experience, where he did a Q&A session, performed songs from album, and talked about behind scenes of making of record.
Shawn Mendes, Mendes, In October 2018, Mendes, together with producer Teddy Geiger, released a cover of "Under Pressure" by British rock band Queen (band) Queen and David Bowie.
Shawn Mendes, Mendes, On 8 January 2020, Mendes announced that both he and his Shawn Mendes Foundation will be donating an undisclosed sum of money to causes including Australia's Red Cross, New South Wales Rural Fire Service, and South Australia Country Fire Service, to help ease strain on those impacted by devastating fires that are tearing through parts of country.
Shawn Mendes, Mendes, Wonder (Shawn Mendes album) Wonder (2020)
Shawn Mendes, Mendes, 2018–2019  Shawn Mendes
Shawn Mendes, Mendes, "Youth (Shawn Mendes song) Youth" was released on May 3, featuring American singer Khalid (singer) Khalid.
Shawn Mendes, Mendes, He later announced his second world tour as a headliner, Shawn Mendes World Tour, which started in March 2016 and sold out 38 shows in North America and Europe within minutes.
Shawn Mendes, Mendes, Category Shawn Mendes
Shawn Mendes, Mendes, Mendes signed with Wilhelmina Models in 2016.
Shawn Mendes, Mendes, On September 5, 2014, "Oh Cecilia (Breaking My Heart)" featuring Mendes was released as fifth single from The Vamps (British band)
Shawn Mendes, Mendes, Shawn Peter Raul Mendes (; born August 8, 1998) is a Canadian singer and songwriter.
Shawn Mendes, Mendes, The song was included on Mendes' Handwritten Revisited reissue.
Shawn Mendes, Mendes, The short film is part of YouTube's Artist Spotlight Story series, featuring an interview with Mendes and backstage and behind the scene footage of Mendes during one of his tours.
Shawn Mendes, Mendes, Mendes and Zac Brown Band performed nine songs, where they sang parts of each other's songs and covered Michael Jackson's "Man in Mirror".
Shawn Mendes, Mendes, Shawn Mendes World Tour (2016)
Shawn Mendes, Mendes, "Mercy (Shawn Mendes song)
Shawn Mendes, Mendes, The artists, including Mendes, said of Act that it would "protect ... most marginalized communities".
Shawn Mendes, Mendes, Handwritten debuted atop US Billboard 200 Billboard 200, making Mendes one of five artists ever to debut at number one before age of 18.
Shawn Mendes, Mendes, In June 2017, Mendes walked runway during "Armani Emporio Armani Spring 2018" show held in Milan, Italy.
Shawn Mendes, Mendes, The third single from album, "Stitches (Shawn Mendes song)
Shawn Mendes, Mendes, Mendes began dating Cuban Americans Cuban American singer Camila Cabello in July 2019.
Shawn Mendes, Mendes, In July 2018, photographs of Mendes wearing new EA Connected smartwatches were published on social media.
Shawn Mendes, Mendes, On June 6, 2018, Mendes was announced as ambassador for Emporio Armani's entire "Fall Winter 2018 2019" watch collection.
Shawn Mendes, Mendes, His Shawn Mendes (album) self titled third studio album (2018) was supported by lead single "In My Blood (Shawn Mendes song)
Shawn Mendes, Mendes, In March 2020 Mendes and The Shawn Mendes Foundation donated $175,000 to support COVID 19 relief to Toronto's SickKids Foundation, largest charitable funder of child health research, learning and care in Canada.
Shawn Mendes, Mendes, During 61st Annual Grammy Awards, SmileDirectClub released an advertisement showcasing a campaign between company and Mendes with some of proceeds going to "organizations that seek to improve children's health as well as mental and emotional well being."
