Shawn Mendes, Camila Cabello, Mendes began dating Cuban Americans Cuban American singer Camila Cabello in July 2019.
Shawn Mendes, Camila Cabello, On June 21, 2019, he released "Señorita (Shawn Mendes and Camila Cabello song) Señorita" with Cuban singer Camila Cabello, along with music video.
Shawn Mendes, Camila Cabello, In May 2020 he alongside Camila Cabello joined protests in Miami for racial justice after murder of George Floyd, and has had lent his Instagram to raise voice of Black activists.
Shawn Mendes, Camila Cabello, If I Can't Have You" and "Señorita (Shawn Mendes and Camila Cabello song) Señorita", with latter peaking atop US Billboard Hot 100 Billboard Hot 100.
Shawn Mendes, Camila Cabello, In late 2015, Mendes and Camila Cabello, who was at time a member of group Fifth Harmony, released their collaborative single "I Know What You Did Last Summer (song)
Shawn Mendes, Cabello, Mendes began dating Cuban Americans Cuban American singer Camila Cabello in July 2019.
Shawn Mendes, Cabello, The song debuted at number two on US Billboard Hot 100 chart and marks Mendes and Cabello's second collaboration, following "I Know What You Did Last Summer (song)
Shawn Mendes, Cabello, On June 21, 2019, he released "Señorita (Shawn Mendes and Camila Cabello song) Señorita" with Cuban singer Camila Cabello, along with music video.
Shawn Mendes, Cabello, In May 2021, Mendes joined Cabello and Bollywood actors to help fight COVID 19 pandemic in India, during its peak of cases.
Shawn Mendes, Cabello, In May 2020 he alongside Camila Cabello joined protests in Miami for racial justice after murder of George Floyd, and has had lent his Instagram to raise voice of Black activists.
Shawn Mendes, Cabello, If I Can't Have You" and "Señorita (Shawn Mendes and Camila Cabello song) Señorita", with latter peaking atop US Billboard Hot 100 Billboard Hot 100.
Shawn Mendes, Cabello, In late 2015, Mendes and Camila Cabello, who was at time a member of group Fifth Harmony, released their collaborative single "I Know What You Did Last Summer (song)
Shawn Mendes, 2, By August 2014, he was third most followed musician on Vine.
Shawn Mendes, 2, On January 21, 2016, Mendes made his acting debut on The CW's The 100 (TV series)
Shawn Mendes, 2, Mendes performed remix version of single during 2018 American Music Award held in Los Angeles on October 9.
Shawn Mendes, 2, In August 2019, Mendes announced launch of Shawn Mendes Foundation, with aim to "inspire and empower his fans and today's youth to bring about positive change in world and advocate for issues they care most about."
Shawn Mendes, 2, Category 21st century Canadian pianists
Shawn Mendes, 2, On March 20, 2022, he premiered a new song titled "When You're Gone (Shawn Mendes song)
Shawn Mendes, 2, He released a three song remix EP on December 21 entitled The Album (Remixes).
Shawn Mendes, 2, Life of Party" on June 26, 2014.
Shawn Mendes, 2, It debuted at number one on US Billboard 200, making Mendes third youngest artist to collect three number one albums.
Shawn Mendes, 2, On April 22, 2021, Mendes hosted a NASA video conference with crew of Expedition 65 on board International Space Station.
Shawn Mendes, 2, Jingle Ball Tour 2014 (with various artists) (2014)
Shawn Mendes, 2, He officially signed to Island in May 2014.
Shawn Mendes, 2, He won a Teen Choice award in 2014 for Webstar in Music.
Shawn Mendes, 2, Shawn Mendes  The Tour (2019)
Shawn Mendes, 2, Wonder  World Tour Wonder  The World Tour (2022 2023)
Shawn Mendes, 2, 2020–present  Wonder
Shawn Mendes, 2, In September 2017, after witnessing devastation of Central Mexico earthquake earthquake in Mexico City, Mendes created Mexico Earthquake Relief Fund in conjunction with American Red Cross and donated $100,000 towards relief efforts.
Shawn Mendes, 2, He released single "There's Nothing Holdin' Me Back" on April 20, 2017, included on his Illuminate (Shawn Mendes album) Illuminate deluxe edition.
Shawn Mendes, 2, The deluxe edition of Shawn Mendes was released on July 27, 2019, and includes songs "If I Can't Have You" and "Señorita".
Shawn Mendes, 2, On November 16, 2020, Mendes announced a that second single from Wonder was a collaboration with Justin Bieber on a track entitled "Monster (Shawn Mendes and Justin Bieber song)
Shawn Mendes, 2, In 2018, Time (magazine) Time named Mendes as one of 100 most influential people in world on their Time 100 annual list.
Shawn Mendes, 2, His Shawn Mendes (album) self titled studio album was released on May 25, 2018, to positive critical reviews, with particular praise towards his songwriting and artistic growth.
Shawn Mendes, 2, Also in 2015, Mendes opened for Taylor Swift during 1989 World Tour dates for North America and recorded "Believe (Shawn Mendes song)
Shawn Mendes, 2, A concert film titled, "Shawn Mendes  Live in Concert", was also released on Netflix on November 25, following his first ever performance at Rogers Centre on September 6, 2019.
Shawn Mendes, 2, On October 13, Mendes announced that a documentary titled In Wonder, which chronicles past few years of his life, was to be released on Netflix on November 23.
Shawn Mendes, 2, In October 2018, Mendes, together with producer Teddy Geiger, released a cover of "Under Pressure" by British rock band Queen (band) Queen and David Bowie.
Shawn Mendes, 2, On 8 January 2020, Mendes announced that both he and his Shawn Mendes Foundation will be donating an undisclosed sum of money to causes including Australia's Red Cross, New South Wales Rural Fire Service, and South Australia Country Fire Service, to help ease strain on those impacted by devastating fires that are tearing through parts of country.
Shawn Mendes, 2, Wonder (Shawn Mendes album) Wonder (2020)
Shawn Mendes, 2, 2018–2019  Shawn Mendes
Shawn Mendes, 2, He later announced his second world tour as a headliner, Shawn Mendes World Tour, which started in March 2016 and sold out 38 shows in North America and Europe within minutes.
Shawn Mendes, 2, Mendes signed with Wilhelmina Models in 2016.
Shawn Mendes, 2, On September 5, 2014, "Oh Cecilia (Breaking My Heart)" featuring Mendes was released as fifth single from The Vamps (British band)
Shawn Mendes, 2, 2013–2015  Handwritten
Shawn Mendes, 2, He launched his second fragrance, Shawn Signature II, also made for both men and women in August 2018.
Shawn Mendes, 2, Shawn Mendes World Tour (2016)
Shawn Mendes, 2, Handwritten debuted atop US Billboard 200 Billboard 200, making Mendes one of five artists ever to debut at number one before age of 18.
Shawn Mendes, 2, In June 2017, Mendes walked runway during "Armani Emporio Armani Spring 2018" show held in Milan, Italy.
Shawn Mendes, 2, The single and music video were released on November 20, 2020.
Shawn Mendes, 2, In August 2017, he became first artist under 20 years old to have three number one songs on Billboard Adult Pop Songs chart.
Shawn Mendes, 2, Mendes began dating Cuban Americans Cuban American singer Camila Cabello in July 2019.
Shawn Mendes, 2, Shawn's First Headlines (2014–2015)
Shawn Mendes, 2, He was listed in Time's "The 30 Most Influential Teens of 2015", making list after his debut album topped Billboard 200 and his single "Stitches" made top 10 in US and other countries.
Shawn Mendes, 2, In July 2018, photographs of Mendes wearing new EA Connected smartwatches were published on social media.
Shawn Mendes, 2, On June 6, 2018, Mendes was announced as ambassador for Emporio Armani's entire "Fall Winter 2018 2019" watch collection.
Shawn Mendes, 2, His Shawn Mendes (album) self titled third studio album (2018) was supported by lead single "In My Blood (Shawn Mendes song)
Shawn Mendes, 2, In March 2020 Mendes and The Shawn Mendes Foundation donated $175,000 to support COVID 19 relief to Toronto's SickKids Foundation, largest charitable funder of child health research, learning and care in Canada.
Shawn Mendes, 2, The EP debuted and peaked at number five on Billboard 200 Billboard 200, selling 48,000 copies in its first week.
Shawn Mendes, 2, In April 2017, Mendes embarked on his Illuminate World Tour, which sold out arenas around world such as Los Angeles' Staples Center and London's The O2 Arena.
Shawn Mendes, 2, Treat You Better", lead single from his second studio album, in June 2016.
Shawn Mendes, 2, On November 6, 2014, "Something Big (song)
Shawn Mendes, 2, On October 20, 2018, Mendes performed along with other artists such as Khalid, NF, Marshmello, Meghan Trainor, and Ella Mai at The Hollywood Bowl, Los Angeles for "We Can Survive" event.
Shawn Mendes, 2, He gained a following in 2013, posting song covers on video sharing application Vine (software) Vine.
Shawn Mendes, 2, Mercy" was released as second single on August 18, 2016, which entered top 20 in US and UK and was certified double platinum.
Shawn Mendes, 2, On November 1, Mendes was announced as one of musical performers for 2018 Victoria's Secret Fashion Show which was recorded in New York City in November and aired in December.
Shawn Mendes, 2, Wonder", would be released on October 2.
Shawn Mendes, 2, On May 3, 2019, Mendes released single "If I Can't Have You (Shawn Mendes song)
Shawn Mendes, 2, He has also worked with Pencils of Promise, a non profit organization that builds schools and helps raise quality of education for developing countries, raising $25,000 to build a school in Ghana.
Shawn Mendes, 2, The remixed version of "Lost in Japan", by Russian German DJ Zedd, was released on September 27.
Shawn Mendes, 2, Mendes performed "Monster" live for first time with Bieber at American Music Awards of 2020 2020 American Music Awards; he also performed "Wonder".
Shawn Mendes, 2, Handwritten (Shawn Mendes album) Handwritten (2015)
Shawn Mendes, 2, He partnered with BlendApp with goal of raising up to $25,000, where $1 was raised for every signup and positive message shared on application.
Shawn Mendes, 2, The album, Illuminate (Shawn Mendes album) Illuminate, was released on September 23, 2016, and debuted at number one on US Billboard 200 with 145,000 equivalent album units, including 121,000 in pure album sales and was certified platinum.
Shawn Mendes, 2, Mendes's The Shawn Mendes EP self titled debut EP was released in 2014, followed by his debut studio album Handwritten (Shawn Mendes album) Handwritten in 2015.
Shawn Mendes, 2, In November 2017, Mendes became first artist to have three number one songs on Billboard Adult Contemporary chart before turning 20 years old, an unprecedented feat since founding of chart more than 50 years ago.
Shawn Mendes, 2, On June 21, 2019, he released "Señorita (Shawn Mendes and Camila Cabello song) Señorita" with Cuban singer Camila Cabello, along with music video.
Shawn Mendes, 2, When You're Gone" during his performance at South by Southwest SXSW 2022.
Shawn Mendes, 2, In 2019, he released hit singles "If I Can't Have You (Shawn Mendes song)
Shawn Mendes, 2, They relaunched their campaign for second year in a row in 2015, where campaign was hashtagged online as NotesFromShawn.
Shawn Mendes, 2, The episode was aired on October 24 and was taped a month before scheduled airing date.
Shawn Mendes, 2, On March 22, 2018, Mendes released lead single "In My Blood (Shawn Mendes song)
Shawn Mendes, 2, In March 2020, Mendes participated in iHeart Media's iHeart Living Room Concert for America Living Room Concert for America, a benefit to raise awareness and funds for COVID 19 pandemic.
Shawn Mendes, 2, Artist manager Andrew Gertler discovered Mendes online in November 2013, bringing him to Island Records in January 2014.
Shawn Mendes, 2, On September 30, 2020, Mendes announced that his fourth studio album, Wonder (Shawn Mendes album)
Shawn Mendes, 2, Wonder (2020), made Mendes youngest male artist ever to top Billboard 200 with four studio albums.
Shawn Mendes, 2, To promote album, Mendes embarked on his self titled world tour in 2019.
Shawn Mendes, 2, Shawn Mendes (2018)
Shawn Mendes, 2, Category 21st century Canadian male singers
Shawn Mendes, 2, Under 30 2016  Music.
Shawn Mendes, 2, On September 23, 2021, Mendes announced that he would be embarking on Wonder  The World Tour, across North America, United Kingdom, and Europe, consisting of 64 dates and starting on March 14, 2022, at Royal Arena in Copenhagen.
Shawn Mendes, 2, Mendes was listed among Time's The 30 Most Influential Teens of 2016 and made his first appearance on Forbes's Forbes 30 Under 30 30
Shawn Mendes, 2, On August 26, 2019, "Señorita" peaked at number one, making it Mendes' first chart topping single on Hot 100.
Shawn Mendes, 2, Illuminate (Shawn Mendes album) Illuminate (2016)
Shawn Mendes, 2, I Know What You Did Last Summer" released in 2015.
Shawn Mendes, 2, The documentary, Shawn Mendes – Artist Spotlight Stories, was published on September 28.
Shawn Mendes, 2, In May 2021, Mendes joined Cabello and Bollywood actors to help fight COVID 19 pandemic in India, during its peak of cases.
Shawn Mendes, 2, Mendes graduated from Pine Ridge Secondary School in June 2016, where he played ice hockey and soccer, joined his high school glee club, and practised his stage presence in acting lessons (leading as Prince Charming at one point).
Shawn Mendes, 2, Austin Mahone  Live on Tour (Austin Mahone) (North America) (2014)
Shawn Mendes, 2, Mendes then became youngest artist to debut at number one since release of Justin Bieber's My World 2.0.
Shawn Mendes, 2, Mendes released live album Live at Madison Square Garden in December 2016.
Shawn Mendes, 2, In June 2021, Mendes, along with several other celebrities, signed an open letter to United States Congress, urging lawmakers to pass Equality Act (United States) Equality Act.
Shawn Mendes, 2, He has also performed his latest singles on iHeartRadio MMVAs in Canada on August 27, where he received eight nominations and won four awards.
Shawn Mendes, 2, The 1989 World Tour (Taylor Swift) (North America) (2015)
Shawn Mendes, 2, On August 20, 2021, Mendes released "Summer of Love (Shawn Mendes and Tainy song)
Shawn Mendes, 2, Mendes learned to play guitar by watching YouTube tutorial videos at age of 14 in 2012.
Shawn Mendes, 2, His second studio album Illuminate (Shawn Mendes album) Illuminate (2016) also debuted at number one in US, with its singles "Treat You Better (Shawn Mendes song)
Shawn Mendes, 2, In March and April 2020, Mendes participated in Global Citizen Festival's Together at Home virtual concert to raise awareness and funds for COVID 19 pandemic.
Shawn Mendes, 2, Mendes was listed on Billboard "21 Under 21 2018", topping list for second year in a row for his chart performance, having three consecutive number one albums.
Shawn Mendes, 2, In My Blood" from his upcoming third studio album, followed up by second single "Lost in Japan" on March 23.
Shawn Mendes, 2, Jingle Ball Tour 2018 (with various artists) (2018)
Shawn Mendes, 2, The trailer was released on YouTube on September 22 to officially announce upcoming documentary.
Shawn Mendes, 2, He performed at a televised concert honouring 92nd birthday of Queen Elizabeth II on April 21, 2018.
Shawn Mendes, 2, Believe" for soundtrack of Disney Channel Original Movie Descendants (2015 film) Descendants.
Shawn Mendes, 2, In August 2019, Mendes announced a partnership with Canadian based food chain, Tim Hortons, in which he features in a commercial and on beverage cups, followed by a partnership with Roots Canada in September.
Shawn Mendes, 2, On November 30, 2021, Mendes announced a new single, titled "It'll Be Okay", would be released on December 1.
Shawn Mendes, 2, 2016–2017  Illuminate
Shawn Mendes, 2, The campaign was relaunched for a third year in a row in 2016.
Shawn Mendes, 2, In September 2018, Mendes took part in annual Global Citizen festival held at Central Park, New York City.
Shawn Mendes, 2, Illuminate World Tour (2017)
Shawn Mendes, 2, As Long as You Love Me" on social video app Vine (service) Vine in 2013 and got 10,000 likes and as many followers next day.
Shawn Mendes, 2, In 2014, Mendes and DoSomething.org launched their campaign called "Notes from Shawn" where fans were encouraged to write positive notes and leave them in unexpected places.
Shawn Mendes, 2, He appeared as musical guest on Saturday Night Live, December 3, 2016.
Shawn Mendes, 2, In 2018, Mendes worked with Omaze to raise funds through donations to support WE Schools program, a movement aiming to support youth through educational services and mentorship.
Shawn Mendes, 2, The couple announced their split in November 2021.
Shawn Mendes, 2, In May 2020 he alongside Camila Cabello joined protests in Miami for racial justice after murder of George Floyd, and has had lent his Instagram to raise voice of Black activists.
Shawn Mendes, 2, Jingle Ball Tour 2015 (with various artists) (2015)
Shawn Mendes, 2, "In My Blood" topped Billboard Adult Pop Songs chart, making Mendes first and only artist to have four number one singles in chart before turning 20 years old.
Shawn Mendes, 2, Mendes was listed among Time (magazine) Time's "25 Most Influential Teens of 2014", debuting in list after being youngest ever artist to debut in top 25 of Billboard Hot 100.
Shawn Mendes, 2, In August 2017, Mendes launched his first fragrance, Shawn Mendes Signature, a fragrance for women and men.
Shawn Mendes, 2, On February 16, 2019, Mendes announced that he was latest brand ambassador for Calvin Klein's #MyCalvins campaign.
Shawn Mendes, 2, He became youngest to debut in top 25 on US The Hot 100 Billboard Hot 100, making it to number 24 for week ending July 12, 2014.
Shawn Mendes, 2, In late 2015, Mendes and Camila Cabello, who was at time a member of group Fifth Harmony, released their collaborative single "I Know What You Did Last Summer (song)
Shawn Mendes, 2, On April 14, 2015, Mendes released his full length album Handwritten, which debuted at number one on Billboard 200 chart with 119,000 Top Album Sales equivalent album units, selling 106,000 copies in its first week and was certified platinum.
Shawn Mendes, 2, He topped Billboard's 21 Under 21 list in 2017, after his two albums topped Billboard 200 and his single "There's Nothing Holding Me Back" became his fifth top 20 on Billboard Hot 100.
Shawn Mendes, August 26, 2019, On August 26, 2019, "Señorita" peaked at number one, making it Mendes' first chart topping single on Hot 100.
Shawn Mendes, July 27, 2019, The deluxe edition of Shawn Mendes was released on July 27, 2019, and includes songs "If I Can't Have You" and "Señorita".
Shawn Mendes, September 30, 2020, On September 30, 2020, Mendes announced that his fourth studio album, Wonder (Shawn Mendes album)
Shawn Mendes, December 4, On December 4, album Wonder was released, debuting at number one in US as well as Canada.
Shawn Mendes, December 4, Wonder, would be released on December 4, along with announcing that album's lead single, also called "Wonder (Shawn Mendes song)
Shawn Mendes, Wonder (Shawn Mendes, Wonder (Shawn Mendes album) Wonder (2020)
Shawn Mendes, Wonder (Shawn Mendes, On September 30, 2020, Mendes announced that his fourth studio album, Wonder (Shawn Mendes album)
Shawn Mendes, Wonder (Shawn Mendes, His fourth studio album, Wonder (Shawn Mendes album)
Shawn Mendes, Wonder (Shawn Mendes, Wonder, would be released on December 4, along with announcing that album's lead single, also called "Wonder (Shawn Mendes song)
Shawn Mendes, October 2, In October 2018, Mendes, together with producer Teddy Geiger, released a cover of "Under Pressure" by British rock band Queen (band) Queen and David Bowie.
Shawn Mendes, October 2, On October 20, 2018, Mendes performed along with other artists such as Khalid, NF, Marshmello, Meghan Trainor, and Ella Mai at The Hollywood Bowl, Los Angeles for "We Can Survive" event.
Shawn Mendes, October 2, Wonder", would be released on October 2.
Shawn Mendes, October 2, The episode was aired on October 24 and was taped a month before scheduled airing date.
Shawn Mendes, Intro, Through promotional videos, "Intro", first song from album, was also released.
Shawn Mendes, number 18, "Wonder" debuted and peaked at number 18 on US Billboard Hot 100.
Shawn Mendes, October 13, On October 13, Mendes announced that a documentary titled In Wonder, which chronicles past few years of his life, was to be released on Netflix on November 23.
Shawn Mendes, past few years, On October 13, Mendes announced that a documentary titled In Wonder, which chronicles past few years of his life, was to be released on Netflix on November 23.
Shawn Mendes, Netflix, A concert film titled, "Shawn Mendes  Live in Concert", was also released on Netflix on November 25, following his first ever performance at Rogers Centre on September 6, 2019.
Shawn Mendes, Netflix, On October 13, Mendes announced that a documentary titled In Wonder, which chronicles past few years of his life, was to be released on Netflix on November 23.
Shawn Mendes, November 23, On October 13, Mendes announced that a documentary titled In Wonder, which chronicles past few years of his life, was to be released on Netflix on November 23.
Shawn Mendes, Shawn Mendes  Live, A concert film titled, "Shawn Mendes  Live in Concert", was also released on Netflix on November 25, following his first ever performance at Rogers Centre on September 6, 2019.
Shawn Mendes, November 25, A concert film titled, "Shawn Mendes  Live in Concert", was also released on Netflix on November 25, following his first ever performance at Rogers Centre on September 6, 2019.
Shawn Mendes, Rogers Centre, A concert film titled, "Shawn Mendes  Live in Concert", was also released on Netflix on November 25, following his first ever performance at Rogers Centre on September 6, 2019.
Shawn Mendes, September 6, 2019, A concert film titled, "Shawn Mendes  Live in Concert", was also released on Netflix on November 25, following his first ever performance at Rogers Centre on September 6, 2019.
Shawn Mendes, November 16, 2020, On November 16, 2020, Mendes announced a that second single from Wonder was a collaboration with Justin Bieber on a track entitled "Monster (Shawn Mendes and Justin Bieber song)
Shawn Mendes, Monster (Shawn Mendes, On November 16, 2020, Mendes announced a that second single from Wonder was a collaboration with Justin Bieber on a track entitled "Monster (Shawn Mendes and Justin Bieber song)
Shawn Mendes, Bieber, Mendes saw Bieber as a career model at time.
Shawn Mendes, Bieber, On November 16, 2020, Mendes announced a that second single from Wonder was a collaboration with Justin Bieber on a track entitled "Monster (Shawn Mendes and Justin Bieber song)
Shawn Mendes, Bieber, Mendes performed "Monster" live for first time with Bieber at American Music Awards of 2020 2020 American Music Awards; he also performed "Wonder".
Shawn Mendes, Bieber, Mendes then became youngest artist to debut at number one since release of Justin Bieber's My World 2.0.
Shawn Mendes, Bieber, Mendes started attracting viewers after he posted a cover from Justin Bieber's "As Long as You Love Me (Justin Bieber song)
Shawn Mendes, November 20, 2020, The single and music video were released on November 20, 2020.
Shawn Mendes, 20, 2020, The single and music video were released on November 20, 2020.
Shawn Mendes, number eight, The song peaked at number eight on US Billboard Hot 100.
Shawn Mendes, December 6, On December 6, Mendes held a concert event titled, Wonder  The Experience, where he did a Q&A session, performed songs from album, and talked about behind scenes of making of record.
Shawn Mendes, Wonder  The Experience, On December 6, Mendes held a concert event titled, Wonder  The Experience, where he did a Q&A session, performed songs from album, and talked about behind scenes of making of record.
Shawn Mendes, December 7, On December 7, Mendes did an interview alongside Matthew McConaughey and performed "Dream" for first time on television during his appearance on The Late Late Show with James Corden
Shawn Mendes, Matthew McConaughey, On December 7, Mendes did an interview alongside Matthew McConaughey and performed "Dream" for first time on television during his appearance on The Late Late Show with James Corden
Shawn Mendes, The Late Late Show, The Late Late Show.
Shawn Mendes, The Late Late Show, On December 7, Mendes did an interview alongside Matthew McConaughey and performed "Dream" for first time on television during his appearance on The Late Late Show with James Corden
Shawn Mendes, The Late Late Show, He made TV show appearances on The Late Late Show with James Corden in June where he sang one of his latest singles each night for a week.
Shawn Mendes, August 20, 2021, On August 20, 2021, Mendes released "Summer of Love (Shawn Mendes and Tainy song)
Shawn Mendes, Summer of Love, On August 20, 2021, Mendes released "Summer of Love (Shawn Mendes and Tainy song)
Shawn Mendes, Summer of Love, Summer of Love" with Tainy.
Shawn Mendes, Square Enix's, That same month, it was announced that Mendes would serve as an executive producervia his production banner, Permanent Contentfor Legendary's TV adaptation of Square Enix's video game Life Is Strange.
Shawn Mendes, Life Is Strange, That same month, it was announced that Mendes would serve as an executive producervia his production banner, Permanent Contentfor Legendary's TV adaptation of Square Enix's video game Life Is Strange.
Shawn Mendes, 2021, On April 22, 2021, Mendes hosted a NASA video conference with crew of Expedition 65 on board International Space Station.
Shawn Mendes, 2021, On September 23, 2021, Mendes announced that he would be embarking on Wonder  The World Tour, across North America, United Kingdom, and Europe, consisting of 64 dates and starting on March 14, 2022, at Royal Arena in Copenhagen.
Shawn Mendes, 2021, In May 2021, Mendes joined Cabello and Bollywood actors to help fight COVID 19 pandemic in India, during its peak of cases.
