Shawn Mendes, 20, In September 2018, Mendes took part in annual Global Citizen festival held at Central Park, New York City.
Shawn Mendes, 20, Illuminate World Tour (2017)
Shawn Mendes, 20, As Long as You Love Me" on social video app Vine (service) Vine in 2013 and got 10,000 likes and as many followers next day.
Shawn Mendes, 20, In 2014, Mendes and DoSomething.org launched their campaign called "Notes from Shawn" where fans were encouraged to write positive notes and leave them in unexpected places.
Shawn Mendes, 20, He appeared as musical guest on Saturday Night Live, December 3, 2016.
Shawn Mendes, 20, In 2018, Mendes worked with Omaze to raise funds through donations to support WE Schools program, a movement aiming to support youth through educational services and mentorship.
Shawn Mendes, 20, The couple announced their split in November 2021.
Shawn Mendes, 20, In May 2020 he alongside Camila Cabello joined protests in Miami for racial justice after murder of George Floyd, and has had lent his Instagram to raise voice of Black activists.
Shawn Mendes, 20, Jingle Ball Tour 2015 (with various artists) (2015)
Shawn Mendes, 20, "In My Blood" topped Billboard Adult Pop Songs chart, making Mendes first and only artist to have four number one singles in chart before turning 20 years old.
Shawn Mendes, 20, Mendes was listed among Time (magazine) Time's "25 Most Influential Teens of 2014", debuting in list after being youngest ever artist to debut in top 25 of Billboard Hot 100.
Shawn Mendes, 20, In August 2017, Mendes launched his first fragrance, Shawn Mendes Signature, a fragrance for women and men.
Shawn Mendes, 20, On February 16, 2019, Mendes announced that he was latest brand ambassador for Calvin Klein's #MyCalvins campaign.
Shawn Mendes, 20, He became youngest to debut in top 25 on US The Hot 100 Billboard Hot 100, making it to number 24 for week ending July 12, 2014.
Shawn Mendes, 20, In late 2015, Mendes and Camila Cabello, who was at time a member of group Fifth Harmony, released their collaborative single "I Know What You Did Last Summer (song)
Shawn Mendes, 20, On April 14, 2015, Mendes released his full length album Handwritten, which debuted at number one on Billboard 200 chart with 119,000 Top Album Sales equivalent album units, selling 106,000 copies in its first week and was certified platinum.
Shawn Mendes, 20, He topped Billboard's 21 Under 21 list in 2017, after his two albums topped Billboard 200 and his single "There's Nothing Holding Me Back" became his fifth top 20 on Billboard Hot 100.
Shawn Mendes, Adult Contemporary, In November 2017, Mendes became first artist to have three number one songs on Billboard Adult Contemporary chart before turning 20 years old, an unprecedented feat since founding of chart more than 50 years ago.
Shawn Mendes, Adult Contemporary, The song was Mendes' third single to reach top 10 in US and third single to reach number one on both Adult Contemporary and Adult Pop Songs chart.
Shawn Mendes, Adult Contemporary, Stitches", peaked at number four on US Billboard Hot 100, becoming his first top 10 single in US, and became his first number one on Adult Pop Songs and Adult Contemporary charts.
Shawn Mendes, Adult Contemporary, In US, single reached top 10 on Billboard Hot 100, became his second single to peak atop both Adult Contemporary and Adult Pop Songs chart, and was certified triple platinum.
Shawn Mendes, September 2018, In September 2018, Mendes took part in annual Global Citizen festival held at Central Park, New York City.
Shawn Mendes, Taylor Swift, Also in 2015, Mendes opened for Taylor Swift during 1989 World Tour dates for North America and recorded "Believe (Shawn Mendes song)
Shawn Mendes, Taylor Swift, The 1989 World Tour (Taylor Swift) (North America) (2015)
Shawn Mendes, Taylor Swift, Mendes has cited John Mayer, Ed Sheeran, Taylor Swift, Justin Timberlake, and Bruno Mars as his main musical influences.
Shawn Mendes, 1989, Also in 2015, Mendes opened for Taylor Swift during 1989 World Tour dates for North America and recorded "Believe (Shawn Mendes song)
Shawn Mendes, 1989, The 1989 World Tour (Taylor Swift) (North America) (2015)
Shawn Mendes, World Tour, Wonder  World Tour Wonder  The World Tour (2022 2023)
Shawn Mendes, World Tour, Also in 2015, Mendes opened for Taylor Swift during 1989 World Tour dates for North America and recorded "Believe (Shawn Mendes song)
Shawn Mendes, World Tour, He later announced his second world tour as a headliner, Shawn Mendes World Tour, which started in March 2016 and sold out 38 shows in North America and Europe within minutes.
Shawn Mendes, World Tour, Shawn Mendes World Tour (2016)
Shawn Mendes, World Tour, In April 2017, Mendes embarked on his Illuminate World Tour, which sold out arenas around world such as Los Angeles' Staples Center and London's The O2 Arena.
Shawn Mendes, World Tour, On September 23, 2021, Mendes announced that he would be embarking on Wonder  The World Tour, across North America, United Kingdom, and Europe, consisting of 64 dates and starting on March 14, 2022, at Royal Arena in Copenhagen.
Shawn Mendes, World Tour, The 1989 World Tour (Taylor Swift) (North America) (2015)
Shawn Mendes, World Tour, Illuminate World Tour (2017)
Shawn Mendes, North America, Also in 2015, Mendes opened for Taylor Swift during 1989 World Tour dates for North America and recorded "Believe (Shawn Mendes song)
Shawn Mendes, North America, He later announced his second world tour as a headliner, Shawn Mendes World Tour, which started in March 2016 and sold out 38 shows in North America and Europe within minutes.
Shawn Mendes, North America, On September 23, 2021, Mendes announced that he would be embarking on Wonder  The World Tour, across North America, United Kingdom, and Europe, consisting of 64 dates and starting on March 14, 2022, at Royal Arena in Copenhagen.
Shawn Mendes, North America, Austin Mahone  Live on Tour (Austin Mahone) (North America) (2014)
Shawn Mendes, North America, The 1989 World Tour (Taylor Swift) (North America) (2015)
Shawn Mendes, North America, Besides tour, he performed at music festivals across Europe, North America, and South America.
Shawn Mendes, Believe (, Also in 2015, Mendes opened for Taylor Swift during 1989 World Tour dates for North America and recorded "Believe (Shawn Mendes song)
Shawn Mendes, Disney Channel Original Movie Descendants, Believe" for soundtrack of Disney Channel Original Movie Descendants (2015 film) Descendants.
Shawn Mendes, Disney, Believe" for soundtrack of Disney Channel Original Movie Descendants (2015 film) Descendants.
Shawn Mendes, Disney, He also auditioned for Disney Channel in Toronto.
Shawn Mendes, late 2015, In late 2015, Mendes and Camila Cabello, who was at time a member of group Fifth Harmony, released their collaborative single "I Know What You Did Last Summer (song)
Shawn Mendes, Fifth Harmony, In late 2015, Mendes and Camila Cabello, who was at time a member of group Fifth Harmony, released their collaborative single "I Know What You Did Last Summer (song)
Shawn Mendes, I Know What You Did Last Summer, The song debuted at number two on US Billboard Hot 100 chart and marks Mendes and Cabello's second collaboration, following "I Know What You Did Last Summer (song)
Shawn Mendes, I Know What You Did Last Summer, I Know What You Did Last Summer" released in 2015.
Shawn Mendes, I Know What You Did Last Summer, I Know What You Did Last Summer".
Shawn Mendes, I Know What You Did Last Summer, In late 2015, Mendes and Camila Cabello, who was at time a member of group Fifth Harmony, released their collaborative single "I Know What You Did Last Summer (song)
Shawn Mendes, Last Summer, The song debuted at number two on US Billboard Hot 100 chart and marks Mendes and Cabello's second collaboration, following "I Know What You Did Last Summer (song)
Shawn Mendes, Last Summer, I Know What You Did Last Summer" released in 2015.
Shawn Mendes, Last Summer, I Know What You Did Last Summer".
Shawn Mendes, Last Summer, In late 2015, Mendes and Camila Cabello, who was at time a member of group Fifth Harmony, released their collaborative single "I Know What You Did Last Summer (song)
Shawn Mendes, Mendes' Handwritten Revisited, The song was included on Mendes' Handwritten Revisited reissue.
Shawn Mendes, The 30 Most Influential Teens, He was listed in Time's "The 30 Most Influential Teens of 2015", making list after his debut album topped Billboard 200 and his single "Stitches" made top 10 in US and other countries.
Shawn Mendes, The 30 Most Influential Teens, Mendes was listed among Time's The 30 Most Influential Teens of 2016 and made his first appearance on Forbes's Forbes 30 Under 30 30
Shawn Mendes, 30, Under 30 recipients
Shawn Mendes, 30, He was listed in Time's "The 30 Most Influential Teens of 2015", making list after his debut album topped Billboard 200 and his single "Stitches" made top 10 in US and other countries.
Shawn Mendes, 30, On September 30, 2020, Mendes announced that his fourth studio album, Wonder (Shawn Mendes album)
Shawn Mendes, 30, Category Forbes 30
Shawn Mendes, 30, Under 30 2016  Music.
Shawn Mendes, 30, Mendes was listed among Time's The 30 Most Influential Teens of 2016 and made his first appearance on Forbes's Forbes 30 Under 30 30
Shawn Mendes, 30, On November 30, 2021, Mendes announced a new single, titled "It'll Be Okay", would be released on December 1.
Shawn Mendes, 2016–2017, 2016–2017  Illuminate
Shawn Mendes, 2017, In September 2017, after witnessing devastation of Central Mexico earthquake earthquake in Mexico City, Mendes created Mexico Earthquake Relief Fund in conjunction with American Red Cross and donated $100,000 towards relief efforts.
Shawn Mendes, 2017, He released single "There's Nothing Holdin' Me Back" on April 20, 2017, included on his Illuminate (Shawn Mendes album) Illuminate deluxe edition.
Shawn Mendes, 2017, In June 2017, Mendes walked runway during "Armani Emporio Armani Spring 2018" show held in Milan, Italy.
Shawn Mendes, 2017, In August 2017, he became first artist under 20 years old to have three number one songs on Billboard Adult Pop Songs chart.
Shawn Mendes, 2017, In April 2017, Mendes embarked on his Illuminate World Tour, which sold out arenas around world such as Los Angeles' Staples Center and London's The O2 Arena.
Shawn Mendes, 2017, In November 2017, Mendes became first artist to have three number one songs on Billboard Adult Contemporary chart before turning 20 years old, an unprecedented feat since founding of chart more than 50 years ago.
Shawn Mendes, 2017, 2016–2017  Illuminate
Shawn Mendes, 2017, Illuminate World Tour (2017)
Shawn Mendes, 2017, In August 2017, Mendes launched his first fragrance, Shawn Mendes Signature, a fragrance for women and men.
Shawn Mendes, 2017, He topped Billboard's 21 Under 21 list in 2017, after his two albums topped Billboard 200 and his single "There's Nothing Holding Me Back" became his fifth top 20 on Billboard Hot 100.
Shawn Mendes, January 21, 2016, On January 21, 2016, Mendes made his acting debut on The CW's The 100 (TV series)
Shawn Mendes, 100 third season, The 100 third season premiere.
Shawn Mendes, Shawn Mendes World Tour, He later announced his second world tour as a headliner, Shawn Mendes World Tour, which started in March 2016 and sold out 38 shows in North America and Europe within minutes.
Shawn Mendes, Shawn Mendes World Tour, Shawn Mendes World Tour (2016)
Shawn Mendes, March 2016, He later announced his second world tour as a headliner, Shawn Mendes World Tour, which started in March 2016 and sold out 38 shows in North America and Europe within minutes.
Shawn Mendes, Spanos, For Brittany Spanos of Rolling Stone, Mendes incorporates "catchy acoustic folk pop tunes" in his catalogue, while for Joe Coscarelli of The New York Times, "his soft, sometimes soulful pop rock plays primarily to tweens and teenagers, but has also found traction on adult contemporary radio stations".
Shawn Mendes, 38, He later announced his second world tour as a headliner, Shawn Mendes World Tour, which started in March 2016 and sold out 38 shows in North America and Europe within minutes.
Shawn Mendes, Europe, Category MTV Europe Music Award winners
Shawn Mendes, Europe, He won 18 Society of Composers, Authors and Music Publishers of Canada (SOCAN) awards, twelve Juno Awards, eleven MTV Europe Music Awards (EMA), eight iHeartRadio Much Music Video Awards (MMVA), five BMI Awards, three American Music Awards, two MTV Video Music Awards, and Allan Slaight Honour from Canada's Walk of Fame.
Shawn Mendes, Europe, He later announced his second world tour as a headliner, Shawn Mendes World Tour, which started in March 2016 and sold out 38 shows in North America and Europe within minutes.
Shawn Mendes, Europe, On September 23, 2021, Mendes announced that he would be embarking on Wonder  The World Tour, across North America, United Kingdom, and Europe, consisting of 64 dates and starting on March 14, 2022, at Royal Arena in Copenhagen.
Shawn Mendes, Europe, Among List of awards and nominations received by Shawn Mendes his accolades, Mendes has won 13 Society of Composers, Authors and Music Publishers of Canada SOCAN awards, 10 MTV Europe Music Awards, eight Juno Awards, eight iHeartRadio MMVAs, two American Music Awards, and received three nominations for a Grammy Award and one nomination for a Brit Award.
Shawn Mendes, Europe, Besides tour, he performed at music festivals across Europe, North America, and South America.
Shawn Mendes, minutes, He later announced his second world tour as a headliner, Shawn Mendes World Tour, which started in March 2016 and sold out 38 shows in North America and Europe within minutes.
Shawn Mendes, 22, On March 20, 2022, he premiered a new song titled "When You're Gone (Shawn Mendes song)
Shawn Mendes, 22, On April 22, 2021, Mendes hosted a NASA video conference with crew of Expedition 65 on board International Space Station.
Shawn Mendes, 22, Wonder  World Tour Wonder  The World Tour (2022 2023)
Shawn Mendes, 22, When You're Gone" during his performance at South by Southwest SXSW 2022.
Shawn Mendes, 22, On March 22, 2018, Mendes released lead single "In My Blood (Shawn Mendes song)
Shawn Mendes, 22, On September 23, 2021, Mendes announced that he would be embarking on Wonder  The World Tour, across North America, United Kingdom, and Europe, consisting of 64 dates and starting on March 14, 2022, at Royal Arena in Copenhagen.
Shawn Mendes, 22, The trailer was released on YouTube on September 22 to officially announce upcoming documentary.
Shawn Mendes, August, By August 2014, he was third most followed musician on Vine.
Shawn Mendes, August, In August 2019, Mendes announced launch of Shawn Mendes Foundation, with aim to "inspire and empower his fans and today's youth to bring about positive change in world and advocate for issues they care most about."
Shawn Mendes, August, Shawn Peter Raul Mendes (; born August 8, 1998) is a Canadian singer and songwriter.
Shawn Mendes, August, He launched his second fragrance, Shawn Signature II, also made for both men and women in August 2018.
Shawn Mendes, August, In August 2017, he became first artist under 20 years old to have three number one songs on Billboard Adult Pop Songs chart.
Shawn Mendes, August, Mercy" was released as second single on August 18, 2016, which entered top 20 in US and UK and was certified double platinum.
Shawn Mendes, August, On August 26, 2019, "Señorita" peaked at number one, making it Mendes' first chart topping single on Hot 100.
Shawn Mendes, August, He has also performed his latest singles on iHeartRadio MMVAs in Canada on August 27, where he received eight nominations and won four awards.
Shawn Mendes, August, On August 20, 2021, Mendes released "Summer of Love (Shawn Mendes and Tainy song)
Shawn Mendes, August, In August 2019, Mendes announced a partnership with Canadian based food chain, Tim Hortons, in which he features in a commercial and on beverage cups, followed by a partnership with Roots Canada in September.
Shawn Mendes, August, In August 2017, Mendes launched his first fragrance, Shawn Mendes Signature, a fragrance for women and men.
Shawn Mendes, September 23, 2016, The album, Illuminate (Shawn Mendes album) Illuminate, was released on September 23, 2016, and debuted at number one on US Billboard 200 with 145,000 equivalent album units, including 121,000 in pure album sales and was certified platinum.
Shawn Mendes, 200, It debuted at number one on US Billboard 200, making Mendes third youngest artist to collect three number one albums.
Shawn Mendes, 200, Handwritten debuted atop US Billboard 200 Billboard 200, making Mendes one of five artists ever to debut at number one before age of 18.
Shawn Mendes, 200, He was listed in Time's "The 30 Most Influential Teens of 2015", making list after his debut album topped Billboard 200 and his single "Stitches" made top 10 in US and other countries.
Shawn Mendes, 200, The EP debuted and peaked at number five on Billboard 200 Billboard 200, selling 48,000 copies in its first week.
Shawn Mendes, 200, The album, Illuminate (Shawn Mendes album) Illuminate, was released on September 23, 2016, and debuted at number one on US Billboard 200 with 145,000 equivalent album units, including 121,000 in pure album sales and was certified platinum.
Shawn Mendes, 200, Wonder (2020), made Mendes youngest male artist ever to top Billboard 200 with four studio albums.
Shawn Mendes, 200, On April 14, 2015, Mendes released his full length album Handwritten, which debuted at number one on Billboard 200 chart with 119,000 Top Album Sales equivalent album units, selling 106,000 copies in its first week and was certified platinum.
Shawn Mendes, 200, He topped Billboard's 21 Under 21 list in 2017, after his two albums topped Billboard 200 and his single "There's Nothing Holding Me Back" became his fifth top 20 on Billboard Hot 100.
Shawn Mendes, 145,000, The album, Illuminate (Shawn Mendes album) Illuminate, was released on September 23, 2016, and debuted at number one on US Billboard 200 with 145,000 equivalent album units, including 121,000 in pure album sales and was certified platinum.
Shawn Mendes, 121,000, The album, Illuminate (Shawn Mendes album) Illuminate, was released on September 23, 2016, and debuted at number one on US Billboard 200 with 145,000 equivalent album units, including 121,000 in pure album sales and was certified platinum.
Shawn Mendes, Second, Second of all, it shouldn't make a difference if I was or if I wasn't.
Shawn Mendes, Second, Mendes graduated from Pine Ridge Secondary School in June 2016, where he played ice hockey and soccer, joined his high school glee club, and practised his stage presence in acting lessons (leading as Prince Charming at one point).
Shawn Mendes, August 18, 2016, Mercy" was released as second single on August 18, 2016, which entered top 20 in US and UK and was certified double platinum.
Shawn Mendes, Madison Square Garden, Mendes released live album Live at Madison Square Garden in December 2016.
Shawn Mendes, December 2016, Mendes released live album Live at Madison Square Garden in December 2016.
Shawn Mendes, Saturday Night Live, He appeared as musical guest on Saturday Night Live, December 3, 2016.
Shawn Mendes, December 3, 2016, He appeared as musical guest on Saturday Night Live, December 3, 2016.
Shawn Mendes, April 2017, In April 2017, Mendes embarked on his Illuminate World Tour, which sold out arenas around world such as Los Angeles' Staples Center and London's The O2 Arena.
Shawn Mendes, Los Angeles', In April 2017, Mendes embarked on his Illuminate World Tour, which sold out arenas around world such as Los Angeles' Staples Center and London's The O2 Arena.
Shawn Mendes, Staples Center, In April 2017, Mendes embarked on his Illuminate World Tour, which sold out arenas around world such as Los Angeles' Staples Center and London's The O2 Arena.
Shawn Mendes, London, In April 2017, Mendes embarked on his Illuminate World Tour, which sold out arenas around world such as Los Angeles' Staples Center and London's The O2 Arena.
Shawn Mendes, The O2 Arena, In April 2017, Mendes embarked on his Illuminate World Tour, which sold out arenas around world such as Los Angeles' Staples Center and London's The O2 Arena.
Shawn Mendes, 8, 2016, Mercy" was released as second single on August 18, 2016, which entered top 20 in US and UK and was certified double platinum.
Shawn Mendes, June 2017, In June 2017, Mendes walked runway during "Armani Emporio Armani Spring 2018" show held in Milan, Italy.
Shawn Mendes, April 20, 2017, He released single "There's Nothing Holdin' Me Back" on April 20, 2017, included on his Illuminate (Shawn Mendes album) Illuminate deluxe edition.
Shawn Mendes, 17, In September 2017, after witnessing devastation of Central Mexico earthquake earthquake in Mexico City, Mendes created Mexico Earthquake Relief Fund in conjunction with American Red Cross and donated $100,000 towards relief efforts.
Shawn Mendes, 17, He released single "There's Nothing Holdin' Me Back" on April 20, 2017, included on his Illuminate (Shawn Mendes album) Illuminate deluxe edition.
Shawn Mendes, 17, In June 2017, Mendes walked runway during "Armani Emporio Armani Spring 2018" show held in Milan, Italy.
Shawn Mendes, 17, In August 2017, he became first artist under 20 years old to have three number one songs on Billboard Adult Pop Songs chart.
Shawn Mendes, 17, In March 2020 Mendes and The Shawn Mendes Foundation donated $175,000 to support COVID 19 relief to Toronto's SickKids Foundation, largest charitable funder of child health research, learning and care in Canada.
Shawn Mendes, 17, In April 2017, Mendes embarked on his Illuminate World Tour, which sold out arenas around world such as Los Angeles' Staples Center and London's The O2 Arena.
Shawn Mendes, 17, In November 2017, Mendes became first artist to have three number one songs on Billboard Adult Contemporary chart before turning 20 years old, an unprecedented feat since founding of chart more than 50 years ago.
Shawn Mendes, 17, 2016–2017  Illuminate
Shawn Mendes, 17, Illuminate World Tour (2017)
Shawn Mendes, 17, In August 2017, Mendes launched his first fragrance, Shawn Mendes Signature, a fragrance for women and men.
Shawn Mendes, 17, He topped Billboard's 21 Under 21 list in 2017, after his two albums topped Billboard 200 and his single "There's Nothing Holding Me Back" became his fifth top 20 on Billboard Hot 100.
Shawn Mendes, under 20 years old, In August 2017, he became first artist under 20 years old to have three number one songs on Billboard Adult Pop Songs chart.
Shawn Mendes, Trust, The proceeds from single were donated to Mercury Phoenix Trust, an organization founded by Queen bandmembers after Freddie Mercury's death, which helps fight against HIV/AIDS.
Shawn Mendes, 28, The documentary, Shawn Mendes – Artist Spotlight Stories, was published on September 28.
Shawn Mendes, November 2017, In November 2017, Mendes became first artist to have three number one songs on Billboard Adult Contemporary chart before turning 20 years old, an unprecedented feat since founding of chart more than 50 years ago.
Shawn Mendes, 20 years old, In August 2017, he became first artist under 20 years old to have three number one songs on Billboard Adult Pop Songs chart.
Shawn Mendes, 20 years old, In November 2017, Mendes became first artist to have three number one songs on Billboard Adult Contemporary chart before turning 20 years old, an unprecedented feat since founding of chart more than 50 years ago.
Shawn Mendes, 20 years old, "In My Blood" topped Billboard Adult Pop Songs chart, making Mendes first and only artist to have four number one singles in chart before turning 20 years old.
Shawn Mendes, more than 50 years ago, In November 2017, Mendes became first artist to have three number one songs on Billboard Adult Contemporary chart before turning 20 years old, an unprecedented feat since founding of chart more than 50 years ago.
Shawn Mendes, Forbes, Category Forbes 30
Shawn Mendes, Forbes, Mendes was listed among Time's The 30 Most Influential Teens of 2016 and made his first appearance on Forbes's Forbes 30 Under 30 30
Shawn Mendes, Forbes 30, Category Forbes 30
Shawn Mendes, Forbes 30, Mendes was listed among Time's The 30 Most Influential Teens of 2016 and made his first appearance on Forbes's Forbes 30 Under 30 30
Shawn Mendes, Under 30, Under 30 recipients
Shawn Mendes, Under 30, Under 30 2016  Music.
Shawn Mendes, Under 30, Mendes was listed among Time's The 30 Most Influential Teens of 2016 and made his first appearance on Forbes's Forbes 30 Under 30 30
Shawn Mendes, 21, On January 21, 2016, Mendes made his acting debut on The CW's The 100 (TV series)
Shawn Mendes, 21, Category 21st century Canadian pianists
Shawn Mendes, 21, He released a three song remix EP on December 21 entitled The Album (Remixes).
Shawn Mendes, 21, On April 22, 2021, Mendes hosted a NASA video conference with crew of Expedition 65 on board International Space Station.
Shawn Mendes, 21, The album, Illuminate (Shawn Mendes album) Illuminate, was released on September 23, 2016, and debuted at number one on US Billboard 200 with 145,000 equivalent album units, including 121,000 in pure album sales and was certified platinum.
Shawn Mendes, 21, On June 21, 2019, he released "Señorita (Shawn Mendes and Camila Cabello song) Señorita" with Cuban singer Camila Cabello, along with music video.
Shawn Mendes, 21, Category 21st century Canadian male singers
Shawn Mendes, 21, On September 23, 2021, Mendes announced that he would be embarking on Wonder  The World Tour, across North America, United Kingdom, and Europe, consisting of 64 dates and starting on March 14, 2022, at Royal Arena in Copenhagen.
Shawn Mendes, 21, In May 2021, Mendes joined Cabello and Bollywood actors to help fight COVID 19 pandemic in India, during its peak of cases.
