Volkswagen, 6, On 9 December 2019, Environment and Climate Change Canada charged Volkswagen AG with importing nearly 128,000 cars into Canada that did not meet its emissions standards, but reached a plea deal with agency in a case involving 60 charges stemming from devices installed to defeat emissions testing.
Volkswagen, 6, On 28 June 2016, Volkswagen agreed to pay a settlement of $15.3&nbsp;billion, largest auto related consumer class action lawsuit in United States history.
Volkswagen, 6, Volkswagen set plans to add a compact SUV with styling influences from "Concept A" concept vehicle introduced at 2006 Geneva Auto Show, and on 20 July 2006, Volkswagen announced that new vehicle called Volkswagen Tiguan Tiguan.
Volkswagen, 6, (The 914 6 had a 6 cylinder Porsche engine, and standard 914 had a Volkswagen engine.)
Volkswagen, 6, Total cumulative sales of all Volkswagen brand electric vehicle electrified cars since start of their respective production is expected to reach about 103,000 by end of 2016.
Volkswagen, 6, In 1969 larger Volkswagen Type 4 Type 4 (411 and 412) models were introduced.
Volkswagen, 6, The momentum continued for fiscal 2006, as Volkswagen's North American sales for year were 235,140 vehicles, a 4.9 percent increase over 2005, despite a slump in domestic North American manufacturer's sales.
Volkswagen, 6, VW's American sales broke 200,000 in 1985 and 1986 before resuming downward trend from earlier in decade.
Volkswagen, 6, In 2003, Hanover based team entered with a 2WD buggy named Tarek, finishing 6th overall and 1st in 2WD and Diesel class.
Volkswagen, 6, Although car was becoming outdated, during 1960s and early 1970s, American exports, innovative advertising, and a growing reputation for reliability helped production figures surpass levels of previous record holder, Ford Model T.
Volkswagen, 6, Founded in 1937 by German Labour Front, known for their iconic Volkswagen Beetle Beetle, it is flagship brand of Volkswagen Group, largest car maker by worldwide sales in 2016 and 2017.
Volkswagen, 6, Apart from introduction of Volkswagen Type 2 commercial vehicle (van, pick up, and camper), and Volkswagen Karmann Ghia VW Karmann Ghia sports car, Nordhoff pursued one model policy until shortly before his death in 1968.
Volkswagen, 6, In 2019, brand sold 1.6 million of them in China.
Volkswagen, 6, In 1964, Volkswagen acquired Auto Union, and in 1969, NSU Motorenwerke AG (NSU).
Volkswagen, 6, 1948–1961  Icon of post war West Germany
Volkswagen, 6, More than a year later, on 16 September 1938, it was renamed to Volkswagenwerk GmbH.
Volkswagen, 6, The first Porsche car, Porsche 64 of 1938, used many components from Volkswagen Beetle.
Volkswagen, 6, The 1961 Type 1 Beetle had a 36&nbsp;hp 1200cc four cylinder air cooled flat four opposed OHV engine made of aluminium alloy block and heads.
Volkswagen, 6, In July 2006, Porsche increased their ownership again to 25.1%.
Volkswagen, 6, In July 2019, Volkswagen invested $2.6 billion in Argo AI, a startup focused on developing Autonomous car self driving vehicles.
Volkswagen, 6, Heinrich Nordhoff (1899–1968), a former senior manager at Opel who had overseen civilian and military vehicle production in 1930s and 1940s, was recruited to run factory in 1948.
Volkswagen, 6, In 2008, Volkswagen became third largest car maker in world, and, as of 2016, Volkswagen was second largest manufacturer worldwide.
Volkswagen, 6, On 6 March 2017 at Geneva Motor Show Volkswagen presented its prototype for a fully autonomous car, Sedric.
Volkswagen, 6, In June 2016, VW launched a program to develop 30 all electric cars in 10 years, and sell 2–3&nbsp;million electric cars per year by 2025.
Volkswagen, 6, In 1963, Formula Vee circuit racing, with cars built from easily available Volkswagen Beetle#Power Beetle parts, started in United States.
Volkswagen, 6, In 2010, Volkswagen posted record sales of 6.29&nbsp;million vehicles, with its global market share at 11.4%.
Volkswagen, 6, 1961–1973  Beetle to Golf
Volkswagen, 6, In November 2016, Volkswagen and its labour unions agreed to reduce workforce by 30,000 people until 2021 as a result of costs from violations.
Volkswagen, 6, The intention was that German families could buy car through a savings scheme ("Fünf Mark die Woche musst du sparen, willst du im eigenen Wagen fahren"&nbsp;– "Five Marks a week you must set aside, if in your own car you wish to ride"), which around 336,000 people eventually paid into.
Volkswagen, 6, In fall 2016, VW commissioned an expert review of situation due end of 2017.
Volkswagen, 6, In March of that year, on its fiftieth anniversary, Volkswagen do Brasil launched in local market Volkswagen Gol Gol 1.6 Total Flex, first Brazilian commercial flexible fuel vehicle capable of running on any mix of E20 fuel E20 E25 petrol and up to 100% [ethanol fuel (Common ethanol fuel mixtures#E100 E100]).
Volkswagen, 6, VW expanded its product line in 1961 with introduction of four Volkswagen Type 3 Type 3 models (Karmann Ghia, Notchback, Fastback, and Variant) based on new Type 3 mechanical underpinnings.
Volkswagen, 6, In 2015, activists and former VW employees in Brazil spoke out in public accusing company of being silent about persecution of its workers, which was during Brazilian military government Brazil's military dictatorship from 1964 to 1985.
Volkswagen, 6, Sales soared throughout 1960s, peaking at end of decade thanks in part to famous advertising campaigns by New York advertising agency DDB Worldwide Doyle, Dane Bernbach.
Volkswagen, 6, In 2006, revised Race Touareg entered, with driver Giniel de Villiers finishing 2nd overall and 1st in Diesel class.
Volkswagen, 6, Allied dismantling policy changed in late 1946 to mid 1947, though heavy industry continued to be dismantled until 1951.
Volkswagen, 6, This again opened possibility of a hostile takeover of VW and so on 26 March of same year Porsche took its holding of Volkswagen shares to 30.9%.
Volkswagen, 6, On 22 August 1960, Volkswagenwerk GmbH was renamed to Volkswagenwerk AG.
Volkswagen, 6, VW began marketing Golf under Rabbit name once again in US and Canada in 2006.
Volkswagen, 6, In 1996, Volkswagen first implemented its seven environmental goals in Technical Development with themes involving climate protection, resource conservation, and healthcare, through objectives such as reducing greenhouse emissions and fuel consumption, enabling alternative fuels, and avoiding hazardous materials.
Volkswagen, 6, JPG typ 266, a project for a mid engined car to replace Beetle, and to focus on front wheel drive, water cooled cars.
Volkswagen, 6, On 2 November 2016, EPA issued a second notice of violation (NOV) pertaining to certain diesel 3.0 liter V6 equipped Audis, Volkswagen Touaregs and Porsche Cayennes.
Volkswagen, 6, The two companies continued their collaboration in 1969 to make Porsche 914 VW Porsche 914 and Porsche 914 6.
Volkswagen, 6, In 2021 review of 's annual World Intellectual Property Indicators VW ranked 6th in world for its 84 industrial design registrations that were published under Hague Agreement Concerning International Deposit of Industrial Designs Hague System during 2020.
Volkswagen, 6, On 26 October 2008, Porsche revealed its plan to assume control of VW.
Volkswagen, 6, On 23 January 2017, a US judge approved a $1.2&nbsp;billion settlement in which 650 American dealers, "who, like consumers, were blindsided by brazen fraud that VW perpetrated," would receive an average of $1.85&nbsp;million.
Volkswagen, 6, Owing to success and rapid consumer acceptance of flex fuel versions, by 2005 VW had sold 293,523 flex fuel cars and light duty trucks, and only 53,074 petrol only automobiles, jumping to 525,838 flex fuel vehicles and only 13,572 petrol only cars and 248 petrol only light trucks in 2007, and reaching new car sales of 564,959 flex fuel vehicles in 2008, representing 96% of all new cars and light duty trucks sold in that year.
Volkswagen, 6, In 2019, 3.16 million Volkswagen branded vehicles were delivered in country.
Volkswagen, 6, By 1966, Type 1 came with a 1300cc engine.
Volkswagen, 6, This was followed by a formal announcement of admission to regulators on 3 September which took place immediately after EPA threatened to withhold approval for their 2016 cars.
Volkswagen, 6, VW do Brasil stopped manufacturing gasoline only vehicles models for local market in 2006, and all of remaining petrol only Volkswagen models sold in Brazil are imported.
Volkswagen, 6, Consumer Reports tested a 2011 Jetta SportWagen TDI and found in emissions mode its 0–60&nbsp;mph time slowed down by 0.6 seconds and its highway fuel economy dropped from 50 mpg to 46 mpg.
Volkswagen, 6, Model year 2017 VW vehicles sold in US average 26.5 mpgUS, about 6% better than average for all manufacturers.
Volkswagen, 6, The "People's Car" would be available through a savings plan at Reichsmark RM990  (US$396 in 1938)—about price of a small motorcycle (average income being around RM32 a week).
Volkswagen, 6, In 1976, mass arrests occurred and some VW employees were tortured.
Volkswagen, 6, By 1967 Type 1 had a 1500cc engine, and 1600cc in 1970.
Volkswagen, 6, (At least one Type 1 from this first shipment still exists, and was driven on a nationwide tour for Volkswagen Canada's 60th year of business festivities in 2012).
Volkswagen, 6, United States  In 1976, Volkswagen entered under 2000 cc Trans Am Series, with Scirocco, and they won their class outright.
Volkswagen, 6, VW 276 Schlepperfahrzeug, military use 1944
Volkswagen, 6, Volkswagen Motorsport won World Rally Championship with Sébastien Ogier and co driver Julien Ingrassia four years in a row from 2013 to 2016 in Volkswagen Polo R WRC.
Volkswagen, 6, Austria  From 1967 until 1974, Austrian sole distributor Porsche Salzburg entered VW Beetle (1500, 1302S and 1303S) in Europe wide rallies.
Volkswagen, 6, In 1986, Hirst said that factory workers were, after many years of Nazi conditioning, initially reluctant to follow his orders; to counter this, he had his military uniform brought back from Britain and wore it in factory, after which he reported having no problems even though he was no longer a soldier at time but a civilian member of military government.
Volkswagen, 6, By late 1972, Volkswagen had decided to cancel nearly finished  File Volkswagen EA266 prototype Beetle replacement.
Volkswagen, 6, In November 2006 Bernd Pischetsrieder announced his resignation as Volkswagen Group CEO and was replaced by Audi worldwide CEO Martin Winterkorn at beginning of 2007.
Volkswagen, 6, In September 2020, Volkswagen announced that it signed a settlement with Brazilian state prosecutors, including compensation and donations amounting to 36 million reais (US$6.7 million), to atone for its collaboration with dictatorship.
Volkswagen, 6, In March 2016, US Federal Trade Commission sued Volkswagen for false advertising, because Volkswagen's "clean diesel" vehicles were less environmentally friendly than advertised.
Volkswagen, 6, In November 2020, Volkswagen announced that, trying to remain world's largest carmaker in green era, it has increased its investment in electric and self driving cars to $86 billion over next five years.
Volkswagen, 6, Volkswagen announced at Geneva Motor Show#010 2010 Geneva Motor Show launch of 2012 Volkswagen Touareg#Touareg V6 TSI Hybrid (2009)
Volkswagen, 6, To commemorate its passing Ford Model T's record sales mark and its victories in Baja 1000 Mexican races from 1967 to 1971, Volkswagen produced its first limited edition Beetle.
Volkswagen, 6, In September 2006, Volkswagen began offering Volkswagen Golf Mk4#Mk4 "City Golf (Golf City in 2009)" in Canada, South America & Bora HS in China City Golf and City Jetta only for Canadian market.
Volkswagen, 6, The final chapters in Volkswagen Racing UK's rallying story were 'one make' Castrol Polo Challenge, and Polo GTI 'Super 1600' in 2001.
Volkswagen, 6, By 1946, factory produced 1,000 cars a month even though it was still in disrepair.
Volkswagen, 6, On 14 September 2016, Volkswagen announced its partnership with three Israeli Computer security cybersecurity experts to create a new company, Cymotive, dedicated to automotive security.
Volkswagen, 6, In addition, all Volkswagen TDI diesel engines produced from 1996 to 2006 can be driven on 100% biodiesel fuel.
Volkswagen, 6, By January 2009, Porsche had a 50.76% holding in Volkswagen AG, although "Volkswagen Law" prevented it from taking control of company.
Volkswagen, 6, The EPA found beginning with 2009 model year all vehicles powered by V6 were non compliant.
Volkswagen, 6, As of that day, it held 42.6% of Volkswagen's ordinary shares and stock options on another 31.5%.
Volkswagen, 6, Meanwhile, four years after signing a cooperation agreement with Spanish car maker SEAT in 1982, Hahn expanded company by purchasing a majority share of SEAT up to 75% by end of 1986, which VW bought outright in 1990.
Volkswagen, USA, Volkswagen and Porsche would collaborate again in 1976 on Porsche 912 E (USA only) and Porsche 924, which used many Audi components and was built at Audi's Neckarsulm facilities.
Volkswagen, Neckarsulm, Volkswagen and Porsche would collaborate again in 1976 on Porsche 912 E (USA only) and Porsche 924, which used many Audi components and was built at Audi's Neckarsulm facilities.
Volkswagen, 924, Volkswagen and Porsche would collaborate again in 1976 on Porsche 912 E (USA only) and Porsche 924, which used many Audi components and was built at Audi's Neckarsulm facilities.
Volkswagen, 924, The 924 was originally designated for AUDI.
Volkswagen, 944, Most Porsche 944 models were built there, although they used far fewer VW components.
Volkswagen, 944, None were actually delivered to any holder of completed saving stamp books, though one Type 1 Cabriolet was presented to Hitler on 20 April 1944 (his 55th birthday).
Volkswagen, 944, VW 276 Schlepperfahrzeug, military use 1944
Volkswagen, 944, 1939–1944  Wartime production and concentration camp labour
Volkswagen, Audi Q7, The Porsche Cayenne, introduced in 2002, shares its entire chassis with Volkswagen Touareg and Audi Q7, and is built at same Volkswagen factory in Bratislava that other SUVs are built.
Volkswagen, Audi Q7, , Volkswagen Group offers for retails customers nine plug in electric cars, of which, three are all electric cars  Volkswagen e Up!, Volkswagen e Golf e Golf and Audi R8 e tron, and six are plug in hybrids  Volkswagen Golf GTE, Volkswagen Passat GTE Passat GTE, Audi A3 Sportback e tron, Audi Q7 e tron Q7 e tron quattro, Porsche Panamera S E Hybrid and Porsche Cayenne S E Hybrid Cayenne S E Hybrid.
Volkswagen, Audi Q7, Volkswagen long resisted adding a sport utility vehicle SUV to its lineup, but relented with introduction of Volkswagen Touareg Touareg, made in partnership with Porsche, while they worked on Porsche Cayenne and later Audi Q7.
Volkswagen, Bratislava, The Porsche Cayenne, introduced in 2002, shares its entire chassis with Volkswagen Touareg and Audi Q7, and is built at same Volkswagen factory in Bratislava that other SUVs are built.
Volkswagen, September 2005, Volkswagen was first car manufacturer to apply ISO 14000 during its drafting stage and was re certified in September 2005.
Volkswagen, September 2005, In September 2005, Porsche announced it would increase its 5% stake in Volkswagen to 20% at a cost of €3&nbsp;billion, with intention that combined stakes of Porsche and government of Lower Saxony would ensure that any hostile takeover by foreign investors would be impossible.
Volkswagen, 20%, On 4 March 2005, European Commission brought an action against Federal Republic of Germany before European Court of Justice, claiming that Volkswagen Law, which prevents any shareholder in Volkswagen from executing more than 20% of total voting rights in firm, was illegally restricting flow of capital in Europe.
Volkswagen, 20%, On first business day after news, Volkswagen's stock price declined 20% and declined another 17% following day, same day a social media advertisement with Wired (magazine) Wired about "how diesel was re engineered" was removed as well as a series of YouTube ads titled "Diesel Old Wives' Tales".
Volkswagen, 20%, In September 2005, Porsche announced it would increase its 5% stake in Volkswagen to 20% at a cost of €3&nbsp;billion, with intention that combined stakes of Porsche and government of Lower Saxony would ensure that any hostile takeover by foreign investors would be impossible.
Volkswagen, DaimlerChrysler, Speculated suitors included DaimlerChrysler, BMW, and Renault.
Volkswagen, July 2006, Volkswagen set plans to add a compact SUV with styling influences from "Concept A" concept vehicle introduced at 2006 Geneva Auto Show, and on 20 July 2006, Volkswagen announced that new vehicle called Volkswagen Tiguan Tiguan.
Volkswagen, July 2006, In July 2006, Porsche increased their ownership again to 25.1%.
Volkswagen, 25.1%, In July 2006, Porsche increased their ownership again to 25.1%.
Volkswagen, 4 March 2005, On 4 March 2005, European Commission brought an action against Federal Republic of Germany before European Court of Justice, claiming that Volkswagen Law, which prevents any shareholder in Volkswagen from executing more than 20% of total voting rights in firm, was illegally restricting flow of capital in Europe.
Volkswagen, European Commission, On 4 March 2005, European Commission brought an action against Federal Republic of Germany before European Court of Justice, claiming that Volkswagen Law, which prevents any shareholder in Volkswagen from executing more than 20% of total voting rights in firm, was illegally restricting flow of capital in Europe.
Volkswagen, Federal Republic of Germany, On 4 March 2005, European Commission brought an action against Federal Republic of Germany before European Court of Justice, claiming that Volkswagen Law, which prevents any shareholder in Volkswagen from executing more than 20% of total voting rights in firm, was illegally restricting flow of capital in Europe.
Volkswagen, European Court of Justice, On 4 March 2005, European Commission brought an action against Federal Republic of Germany before European Court of Justice, claiming that Volkswagen Law, which prevents any shareholder in Volkswagen from executing more than 20% of total voting rights in firm, was illegally restricting flow of capital in Europe.
Volkswagen, European Court of Justice, As expected, on 22 October 2007, European Court of Justice ruled in agreement with Ruiz Jarabo and law was struck down.
Volkswagen, European Court of Justice, In October 2007, European Court of Justice ruled that VW law was illegal because it was Protectionism protectionist.
Volkswagen, more than 20%, On 4 March 2005, European Commission brought an action against Federal Republic of Germany before European Court of Justice, claiming that Volkswagen Law, which prevents any shareholder in Volkswagen from executing more than 20% of total voting rights in firm, was illegally restricting flow of capital in Europe.
Volkswagen, Court of Justice, On 4 March 2005, European Commission brought an action against Federal Republic of Germany before European Court of Justice, claiming that Volkswagen Law, which prevents any shareholder in Volkswagen from executing more than 20% of total voting rights in firm, was illegally restricting flow of capital in Europe.
Volkswagen, Court of Justice, In October 2013, EU Court of Justice in Luxembourg ruled that rewritten Volkswagen law "complied in full" with EU rules.
Volkswagen, Court of Justice, As expected, on 22 October 2007, European Court of Justice ruled in agreement with Ruiz Jarabo and law was struck down.
Volkswagen, Court of Justice, In October 2007, European Court of Justice ruled that VW law was illegal because it was Protectionism protectionist.
Volkswagen, 13 February 2007, On 13 February 2007, Advocate General Dámaso Ruiz Jarabo Colomer submitted an opinion to court in support of action.
Volkswagen, EU, In October 2013, EU Court of Justice in Luxembourg ruled that rewritten Volkswagen law "complied in full" with EU rules.
Volkswagen, 26 March of same year, This again opened possibility of a hostile takeover of VW and so on 26 March of same year Porsche took its holding of Volkswagen shares to 30.9%.
Volkswagen, 30.9%, This again opened possibility of a hostile takeover of VW and so on 26 March of same year Porsche took its holding of Volkswagen shares to 30.9%.
Volkswagen, 22 October 2007, As expected, on 22 October 2007, European Court of Justice ruled in agreement with Ruiz Jarabo and law was struck down.
Volkswagen, Ruiz Jarabo, On 13 February 2007, Advocate General Dámaso Ruiz Jarabo Colomer submitted an opinion to court in support of action.
Volkswagen, Ruiz Jarabo, As expected, on 22 October 2007, European Court of Justice ruled in agreement with Ruiz Jarabo and law was struck down.
Volkswagen, 23, Of 81 million vehicles produced over six decades in Brazil, 23 million of it was built by Volkswagen, which was produced by four passenger car factories in country.
Volkswagen, 23, The momentum continued for fiscal 2006, as Volkswagen's North American sales for year were 235,140 vehicles, a 4.9 percent increase over 2005, despite a slump in domestic North American manufacturer's sales.
Volkswagen, 23, In January 2021, Volkswagen announced that its sales in 2020 dropped by 9.9% in China, 23.4% in western Europe and 17.1% in North America.
Volkswagen, 23, The order consisted of 12 vehicles, (3) model 11C, a black, green, and sand colour (3) 11GS, a chestnut brown and two azure blue, (2) 24A M51 in red, (1) 21A in blue, (1) 23A in blue, (1) 22A beige colour, and one ambulance.
Volkswagen, 23, On 23 January 2017, a US judge approved a $1.2&nbsp;billion settlement in which 650 American dealers, "who, like consumers, were blindsided by brazen fraud that VW perpetrated," would receive an average of $1.85&nbsp;million.
Volkswagen, 23, Owing to success and rapid consumer acceptance of flex fuel versions, by 2005 VW had sold 293,523 flex fuel cars and light duty trucks, and only 53,074 petrol only automobiles, jumping to 525,838 flex fuel vehicles and only 13,572 petrol only cars and 248 petrol only light trucks in 2007, and reaching new car sales of 564,959 flex fuel vehicles in 2008, representing 96% of all new cars and light duty trucks sold in that year.
Volkswagen, 23, On Wednesday, 23 September, Volkswagen chief executive officer Martin Winterkorn resigned.
Volkswagen, October 2007, As expected, on 22 October 2007, European Court of Justice ruled in agreement with Ruiz Jarabo and law was struck down.
Volkswagen, October 2007, In October 2007, European Court of Justice ruled that VW law was illegal because it was Protectionism protectionist.
Volkswagen, 31%, At that time, Porsche held 31% of VW shares&nbsp;– although a smaller proportion of voting rights, due to Volkswagen Law&nbsp;– and there had been speculation that Porsche would be interested in taking over VW if law did not stand in its way.
Volkswagen, VW shares&nbsp, At that time, Porsche held 31% of VW shares&nbsp;– although a smaller proportion of voting rights, due to Volkswagen Law&nbsp;– and there had been speculation that Porsche would be interested in taking over VW if law did not stand in its way.
Volkswagen, Parliament, German politician Reinhard Bütikofer, chair of European Parliament's delegation for relations with China, criticised Volkswagen on these grounds.
Volkswagen, October 2013, In October 2013, EU Court of Justice in Luxembourg ruled that rewritten Volkswagen law "complied in full" with EU rules.
Volkswagen, EU Court of Justice, In October 2013, EU Court of Justice in Luxembourg ruled that rewritten Volkswagen law "complied in full" with EU rules.
Volkswagen, Luxembourg, In October 2013, EU Court of Justice in Luxembourg ruled that rewritten Volkswagen law "complied in full" with EU rules.
Volkswagen, 26 October 2008, On 26 October 2008, Porsche revealed its plan to assume control of VW.
Volkswagen, that day, As of that day, it held 42.6% of Volkswagen's ordinary shares and stock options on another 31.5%.
Volkswagen, 42.6%, As of that day, it held 42.6% of Volkswagen's ordinary shares and stock options on another 31.5%.
Volkswagen, another 31.5%, As of that day, it held 42.6% of Volkswagen's ordinary shares and stock options on another 31.5%.
Volkswagen, Lower Saxony's, Combined with state of Lower Saxony's 20.1% stake, this left only 5.8% of shares on market—mostly with index funds that could not legally sell.
Volkswagen, 20.1%, Combined with state of Lower Saxony's 20.1% stake, this left only 5.8% of shares on market—mostly with index funds that could not legally sell.
Volkswagen, only 5.8%, Combined with state of Lower Saxony's 20.1% stake, this left only 5.8% of shares on market—mostly with index funds that could not legally sell.
Volkswagen, 75%, Within six years, around 75% of all Brazilian passenger cars were manufactured with ethanol engines.
Volkswagen, 75%, Meanwhile, four years after signing a cooperation agreement with Spanish car maker SEAT in 1982, Hahn expanded company by purchasing a majority share of SEAT up to 75% by end of 1986, which VW bought outright in 1990.
Volkswagen, one thousand euros, Hedge funds desperate to cover their short (finance) short positions forced Volkswagen stock above one thousand euros per share, briefly making it world's largest company by market capitalisation on 28 October 2008.
Volkswagen, 28 October 2008, Hedge funds desperate to cover their short (finance) short positions forced Volkswagen stock above one thousand euros per share, briefly making it world's largest company by market capitalisation on 28 October 2008.
