Volkswagen, Mexico, It continued in smaller numbers at other German factories (Hanover] and Emden) until 1978, but mainstream production shifted to Brazil and Mexico.
Volkswagen, Mexico, All Golfs/Rabbits and GTIs as of 2006 are manufactured in Wolfsburg, Germany, rather than Puebla, Mexico, where Golfs and GTIs for North American market were produced from 1989 to 1998, and Brazilian factory in Curitiba, where Golfs and GTIs were produced from 1999 to 2006 (Volkswagen Jetta Jetta has been primarily manufactured in Mexico since 1989).
Volkswagen, Mexico, VW production equipment was eventually moved to Mexico where vehicle emissions were not regulated.
Volkswagen, Mexico, In addition to plants in Germany, Volkswagen has manufacturing or assembly facilities in Mexico, United States, Slovakia, China, India, Russia, Malaysia, Brazil, Argentina, Portugal, Spain, Poland, Czech Republic, Bosnia and Herzegovina, Kenya and South Africa.
Volkswagen, West Coast, Beetles were popularised on US West Coast as beach buggies and dune buggies.
Volkswagen, West Coast, Beetles were popular on US West Coast where limited capacity cabin heating was less inconvenient.
Volkswagen, Notchback, VW expanded its product line in 1961 with introduction of four Volkswagen Type 3 Type 3 models (Karmann Ghia, Notchback, Fastback, and Variant) based on new Type 3 mechanical underpinnings.
Volkswagen, Fastback, VW expanded its product line in 1961 with introduction of four Volkswagen Type 3 Type 3 models (Karmann Ghia, Notchback, Fastback, and Variant) based on new Type 3 mechanical underpinnings.
Volkswagen, Variant, The name 'Squareback' was used in United States for Variant.
Volkswagen, Variant, VW expanded its product line in 1961 with introduction of four Volkswagen Type 3 Type 3 models (Karmann Ghia, Notchback, Fastback, and Variant) based on new Type 3 mechanical underpinnings.
Volkswagen, Variant, Variant/Variant II, Volkswagen Karmann Ghia#Karmann Ghia TC Karmann Ghia TC, Volkswagen Parati Parati and Volkswagen Suran Suran.
Volkswagen, United States for Variant, The name 'Squareback' was used in United States for Variant.
Volkswagen, 1969, In 1969 larger Volkswagen Type 4 Type 4 (411 and 412) models were introduced.
Volkswagen, 1969, In 1964, Volkswagen acquired Auto Union, and in 1969, NSU Motorenwerke AG (NSU).
Volkswagen, 1969, The two companies continued their collaboration in 1969 to make Porsche 914 VW Porsche 914 and Porsche 914 6.
Volkswagen, 411, In 1969 larger Volkswagen Type 4 Type 4 (411 and 412) models were introduced.
Volkswagen, 412, In 1969 larger Volkswagen Type 4 Type 4 (411 and 412) models were introduced.
Volkswagen, 1964, In 1964, Volkswagen acquired Auto Union, and in 1969, NSU Motorenwerke AG (NSU).
Volkswagen, 1964, In 2015, activists and former VW employees in Brazil spoke out in public accusing company of being silent about persecution of its workers, which was during Brazilian military government Brazil's military dictatorship from 1964 to 1985.
Volkswagen, NSU Motorenwerke AG, The Type 3 and Type 4 models had sold in much smaller numbers than Beetle and NSU Motorenwerke AG NSU based K70 also failed to sell.
Volkswagen, NSU Motorenwerke AG, In 1964, Volkswagen acquired Auto Union, and in 1969, NSU Motorenwerke AG (NSU).
Volkswagen, Audi, First in series was Volkswagen Passat (Dasher in US), introduced in 1973, a fastback version of Audi 80, using many identical body and mechanical parts.
Volkswagen, Audi, Volkswagen and Porsche would collaborate again in 1976 on Porsche 912 E (USA only) and Porsche 924, which used many Audi components and was built at Audi's Neckarsulm facilities.
Volkswagen, Audi, It was a re badged Audi 50, which was soon discontinued in 1978.
Volkswagen, Audi, The Porsche Cayenne, introduced in 2002, shares its entire chassis with Volkswagen Touareg and Audi Q7, and is built at same Volkswagen factory in Bratislava that other SUVs are built.
Volkswagen, Audi, Volkswagen is founding and namesake member of Volkswagen Group, a large international corporation in charge of multiple car and truck brands, including Audi, SEAT, Porsche, Lamborghini, Bentley, Bugatti, Scania AB Scania, MAN SE MAN, and Škoda Auto Škoda.
Volkswagen, Audi, , Volkswagen Group offers for retails customers nine plug in electric cars, of which, three are all electric cars  Volkswagen e Up!, Volkswagen e Golf e Golf and Audi R8 e tron, and six are plug in hybrids  Volkswagen Golf GTE, Volkswagen Passat GTE Passat GTE, Audi A3 Sportback e tron, Audi Q7 e tron Q7 e tron quattro, Porsche Panamera S E Hybrid and Porsche Cayenne S E Hybrid Cayenne S E Hybrid.
Volkswagen, Audi, Audi influences paved way for this new generation of Volkswagens  Passat, Scirocco, Volkswagen Golf Golf, and Polo.
Volkswagen, Audi, The former company owned historic Audi brand, which had disappeared after Second World War.
Volkswagen, Audi, The Group plans to expand its plug in range with 20 new pure electric and plug in hybrid cars, including two cars to compete with Tesla, Inc., Porsche Mission E all electric car and Audi e tron (2018)
Volkswagen, Audi, VW ultimately merged Auto Union and NSU to create modern Audi company, and would go on to develop it as its luxury vehicle marque.
Volkswagen, Audi, In 1980, Volkswagen competed with Audi developed Volkswagen Iltis Iltis, placing 1st, 2nd, 4th and 9th overall.
Volkswagen, Audi, VW Jetta, VW Scirocco, SEAT León, SEAT Toledo, Škoda Octavia and Audi A3 hatchback ranges, as well as a new mini Multi purpose vehicle MPV, SEAT Altea.
Volkswagen, Audi, Volkswagen long resisted adding a sport utility vehicle SUV to its lineup, but relented with introduction of Volkswagen Touareg Touareg, made in partnership with Porsche, while they worked on Porsche Cayenne and later Audi Q7.
Volkswagen, Audi, On 2 November 2016, EPA issued a second notice of violation (NOV) pertaining to certain diesel 3.0 liter V6 equipped Audis, Volkswagen Touaregs and Porsche Cayennes.
Volkswagen, Audi, On 18 September 2015, United States Environmental Protection Agency (EPA) said beginning in 2008 car maker fraudulently installed engine control unit (ECU) software determined to be a "defeat device", in violation of Clean Air Act (United States) Clean Air Act, to circumvent environmental regulations of NOx NOx emissions by diesel engine 2009–2015 model year Volkswagen and Audi cars.
Volkswagen, Audi, It had started out in 1974 as Audi 50, which was only available in certain markets and was less popular.
Volkswagen, Audi, The company's evolution of its model range was continued with Volkswagen Golf Mk4 Golf Mk4, introduced at end of 1997 (North America in 1999), its chassis spawned a host of other cars within Volkswagen Group; Volkswagen Bora (sedan known as Jetta in United States), SEAT Toledo, SEAT León, Audi A3, Audi TT, and Škoda Octavia.
Volkswagen, Audi, In November 2006 Bernd Pischetsrieder announced his resignation as Volkswagen Group CEO and was replaced by Audi worldwide CEO Martin Winterkorn at beginning of 2007.
Volkswagen, Audi, VW's ownership of Audi/Auto Union proved beneficial.
Volkswagen, Audi, Audi e tron quattro, which is expected to become brand's first mass production electric vehicle.
Volkswagen, NSU, The Type 3 and Type 4 models had sold in much smaller numbers than Beetle and NSU Motorenwerke AG NSU based K70 also failed to sell.
Volkswagen, NSU, In 1964, Volkswagen acquired Auto Union, and in 1969, NSU Motorenwerke AG (NSU).
Volkswagen, NSU, The purchase of Auto Union and NSU was a pivotal point in Volkswagen's history, as both companies yielded technological expertise that proved necessary for VW to survive when demand for its air cooled models went into decline.
Volkswagen, NSU, VW ultimately merged Auto Union and NSU to create modern Audi company, and would go on to develop it as its luxury vehicle marque.
Volkswagen, Super Beetle, Volkswagen added a "Super Beetle" (Type 131) to its lineup in 1971.
Volkswagen, Super Beetle, The Super Beetle featured a new hooded, padded dash and curved windshield (from 1973 model year on up).
Volkswagen, 28, Hedge funds desperate to cover their short (finance) short positions forced Volkswagen stock above one thousand euros per share, briefly making it world's largest company by market capitalisation on 28 October 2008.
Volkswagen, 28, On 28 May 1937, Gesellschaft zur Vorbereitung des Deutschen Volkswagens mbH ("Company for Preparation of German Volkswagen Ltd."), or Gezuvor for short, was established by Deutsche Arbeitsfront in Berlin.
Volkswagen, 28, On 9 December 2019, Environment and Climate Change Canada charged Volkswagen AG with importing nearly 128,000 cars into Canada that did not meet its emissions standards, but reached a plea deal with agency in a case involving 60 charges stemming from devices installed to defeat emissions testing.
Volkswagen, 28, On 28 June 2016, Volkswagen agreed to pay a settlement of $15.3&nbsp;billion, largest auto related consumer class action lawsuit in United States history.
Volkswagen, 28, In Germany, company Hanomag mass produced Hanomag 2/10 PS 2/10 PS "Kommissbrot", a small, cheap rear engined car, from 1925 to 1928.
Volkswagen, MacPherson, The Type 131 differed from standard Beetle in its use of a MacPherson strut front suspension (vehicle) suspension instead of usual torsion beam suspension torsion bars.
Volkswagen, model year 1975, Rack and pinion steering replaced recirculating ball steering gears in model year 1975 and up.
Volkswagen, 181, In 1973, Volkswagen introduced military themed Volkswagen 181 Type 181, or "Trekker" in Europe, "Thing" in America, recalling wartime Type 82.
Volkswagen, Trekker, In 1973, Volkswagen introduced military themed Volkswagen 181 Type 181, or "Trekker" in Europe, "Thing" in America, recalling wartime Type 82.
Volkswagen, Europe, The sixth generation Volkswagen Golf Mk6 VW Golf was launched in 2008, came runner up to Opel Insignia Opel/Vauxhall Insignia in 2009 European Car of Year, and has spawned several cousins  Volkswagen Jetta (A6)
Volkswagen, Europe, On 4 March 2005, European Commission brought an action against Federal Republic of Germany before European Court of Justice, claiming that Volkswagen Law, which prevents any shareholder in Volkswagen from executing more than 20% of total voting rights in firm, was illegally restricting flow of capital in Europe.
Volkswagen, Europe, In 1991, Volkswagen launched third generation Golf, which was European Car of Year for 1992.
Volkswagen, Europe, Volkswagen Group, as a unit, is Europe's largest motor vehicle manufacturer, with over 74,000 employees and over 7700 dealerships.
Volkswagen, Europe, Beetle sales had started to decline rapidly in European and North American markets.
Volkswagen, Europe, While Volkswagen's range of cars soon became similar to that of other large European car makers, Golf has been mainstay of Volkswagen line up since its introduction, and mechanical basis for several other cars of company.
Volkswagen, Europe, In 1973, Volkswagen introduced military themed Volkswagen 181 Type 181, or "Trekker" in Europe, "Thing" in America, recalling wartime Type 82.
Volkswagen, Europe, German politician Reinhard Bütikofer, chair of European Parliament's delegation for relations with China, criticised Volkswagen on these grounds.
Volkswagen, Europe, Europe  In 1998 company founded ADAC Volkswagen Lupo Cup, founded in 1998 (renamed Polo Cup in 2003, and Volkswagen Scirocco R Cup from 2010 to 2014), and started ADAC Volkswagen New Beetle New Beetle Cup in 2000.
Volkswagen, Europe, The Volkswagen Golf Golf traditionally has been strongest selling vehicle for brand in Europe, followed by smaller Volkswagen Polo Polo which apart from European market also has a stronghold in emerging markets.
Volkswagen, Europe, In January 2021, Volkswagen announced that its sales in 2020 dropped by 9.9% in China, 23.4% in western Europe and 17.1% in North America.
Volkswagen, Europe, Volkswagen has been one of leading manufacturer in terms of hatchback production, which traditionally has been a popular segment in Europe.
Volkswagen, Europe, It was a strong seller in West Germany and most of rest of Western Europe, being one of first foreign small cars to prove popular in Britain.
Volkswagen, Europe, In 2004, Volkswagen Commercial Vehicles entered European Truck Racing series with Volkswagen Titan truck&nbsp;– it became a back to back champion for 2004 and 2005 series.
Volkswagen, Europe, As expected, on 22 October 2007, European Court of Justice ruled in agreement with Ruiz Jarabo and law was struck down.
Volkswagen, Europe, In October 2007, European Court of Justice ruled that VW law was illegal because it was Protectionism protectionist.
Volkswagen, Europe, In Europe, estate/wagon version dominated market share for many years.
Volkswagen, Europe, It quickly spread to Europe and other parts of world.
Volkswagen, Europe, In 1995 Volkswagen Sharan Sharan was launched in Europe, result of a joint venture with Ford Motor Company Ford, which also resulted in Ford Galaxy and SEAT Alhambra.
Volkswagen, Europe, At beginning of 1988, third generation Passat was next major car launch and Volkswagen did not produce a hatchback version of this Passat, despite rising popularity of hatchback body style throughout Europe.
Volkswagen, Europe, Austria  From 1967 until 1974, Austrian sole distributor Porsche Salzburg entered VW Beetle (1500, 1302S and 1303S) in Europe wide rallies.
Volkswagen, Europe, Volkswagen has produced four winners of 50 year old European Car of Year award.
Volkswagen, Europe, The Volkswagen brand produces various models which consists of global products and regional products, specifically for large markets including Europe, China and Latin America.
Volkswagen, Europe, The sedan version of Golf was badged Vento in Europe but remained Jetta in United States.
Volkswagen, Thing, The US Thing version only sold for two years, 1973 and 1974.
Volkswagen, Thing, In 1973, Volkswagen introduced military themed Volkswagen 181 Type 181, or "Trekker" in Europe, "Thing" in America, recalling wartime Type 82.
Volkswagen, NATO, The military version was produced for NATO era German Army during Cold War years of 1970 to 1979.
Volkswagen, German Army, The military version was produced for NATO era German Army during Cold War years of 1970 to 1979.
Volkswagen, Cold War years of 1970 to 1979, The military version was produced for NATO era German Army during Cold War years of 1970 to 1979.
Volkswagen, The US Thing, The US Thing version only sold for two years, 1973 and 1974.
Volkswagen, two years, 1973, The US Thing version only sold for two years, 1973 and 1974.
Volkswagen, 1974, The pivotal model emerged as Volkswagen Golf in 1974, marketed in United States and Canada as Rabbit for 1st generation (1975–1985) and 5th generation (2006–2009).
Volkswagen, 1974, The US Thing version only sold for two years, 1973 and 1974.
Volkswagen, 1974, There have been eight generations of Volkswagen Golf, first of which was produced from summer of 1974 until autumn of 1983 (sold as Rabbit in United States and Canada and as Caribe in Latin America).
Volkswagen, 1974, In spring 1974, Volkswagen Scirocco Scirocco followed.
Volkswagen, 1974, It had started out in 1974 as Audi 50, which was only available in certain markets and was less popular.
Volkswagen, 1974, 1974–1990  Product line expansion
Volkswagen, 1974, In 1974 Volkswagen paid a $120,000 fine to settle a complaint filed by Environmental Protection Agency over use of so called "defeat devices" that disabled certain pollution control systems.
Volkswagen, 1974, Austria  From 1967 until 1974, Austrian sole distributor Porsche Salzburg entered VW Beetle (1500, 1302S and 1303S) in Europe wide rallies.
Volkswagen, late 1972, By late 1972, Volkswagen had decided to cancel nearly finished  File Volkswagen EA266 prototype Beetle replacement.
Volkswagen, EA266, By late 1972, Volkswagen had decided to cancel nearly finished  File Volkswagen EA266 prototype Beetle replacement.
Volkswagen, JPG, JPG typ 266, a project for a mid engined car to replace Beetle, and to focus on front wheel drive, water cooled cars.
Volkswagen, 266, JPG typ 266, a project for a mid engined car to replace Beetle, and to focus on front wheel drive, water cooled cars.
Volkswagen, 266, By late 1972, Volkswagen had decided to cancel nearly finished  File Volkswagen EA266 prototype Beetle replacement.
Volkswagen, Rudolf Leiding, Rudolf Leiding, recently made head of Volkswagen, cited noise, heat, and servicing problems with mid engine layout, as well as difficulty of making it a station wagon.
Volkswagen, Volkswagenwerk, On 4 July 1985, Volkswagenwerk AG was renamed to Volkswagen AG.
Volkswagen, Volkswagenwerk, More than a year later, on 16 September 1938, it was renamed to Volkswagenwerk GmbH.
Volkswagen, Volkswagenwerk, On 22 August 1960, Volkswagenwerk GmbH was renamed to Volkswagenwerk AG.
Volkswagen, 16, The Volkswagen Atlas, a large crossover (automobile) crossover sport utility vehicle SUV, began production in late 2016, and aimed to help end several years of losses for Volkswagen in United States, world's second largest auto market.
Volkswagen, 16, In January 2016, Volkswagen announced launch of a new factory in Algeria during a summit between Angela Merkel and Algerian prime minister Abdelmalek Sellal.
Volkswagen, 16, The Jetta TDI Cup is an SCCA sanctioned race series that features 25 drivers between ages of 16 and 26 driving slightly modified 2009 Jetta TDIs.
Volkswagen, 16, 2000–2016  Further expansion
Volkswagen, 16, By 1973, total production was over 16 million.
Volkswagen, 16, On 28 June 2016, Volkswagen agreed to pay a settlement of $15.3&nbsp;billion, largest auto related consumer class action lawsuit in United States history.
Volkswagen, 16, Total cumulative sales of all Volkswagen brand electric vehicle electrified cars since start of their respective production is expected to reach about 103,000 by end of 2016.
Volkswagen, 16, Founded in 1937 by German Labour Front, known for their iconic Volkswagen Beetle Beetle, it is flagship brand of Volkswagen Group, largest car maker by worldwide sales in 2016 and 2017.
Volkswagen, 16, More than a year later, on 16 September 1938, it was renamed to Volkswagenwerk GmbH.
Volkswagen, 16, In 2008, Volkswagen became third largest car maker in world, and, as of 2016, Volkswagen was second largest manufacturer worldwide.
Volkswagen, 16, In June 2016, VW launched a program to develop 30 all electric cars in 10 years, and sell 2–3&nbsp;million electric cars per year by 2025.
Volkswagen, 16, In November 2016, Volkswagen and its labour unions agreed to reduce workforce by 30,000 people until 2021 as a result of costs from violations.
Volkswagen, 16, In fall 2016, VW commissioned an expert review of situation due end of 2017.
Volkswagen, 16, On 2 November 2016, EPA issued a second notice of violation (NOV) pertaining to certain diesel 3.0 liter V6 equipped Audis, Volkswagen Touaregs and Porsche Cayennes.
Volkswagen, 16, In 2019, 3.16 million Volkswagen branded vehicles were delivered in country.
Volkswagen, 16, This was followed by a formal announcement of admission to regulators on 3 September which took place immediately after EPA threatened to withhold approval for their 2016 cars.
Volkswagen, 16, By 1967 Type 1 had a 1500cc engine, and 1600cc in 1970.
Volkswagen, 16, Volkswagen Motorsport won World Rally Championship with Sébastien Ogier and co driver Julien Ingrassia four years in a row from 2013 to 2016 in Volkswagen Polo R WRC.
Volkswagen, 16, In March 2016, US Federal Trade Commission sued Volkswagen for false advertising, because Volkswagen's "clean diesel" vehicles were less environmentally friendly than advertised.
Volkswagen, 16, The final chapters in Volkswagen Racing UK's rallying story were 'one make' Castrol Polo Challenge, and Polo GTI 'Super 1600' in 2001.
Volkswagen, 16, On 14 September 2016, Volkswagen announced its partnership with three Israeli Computer security cybersecurity experts to create a new company, Cymotive, dedicated to automotive security.
Volkswagen, 11, On 22 September 2015, a Volkswagen spokesman admitted that defeat device is installed in ~11&nbsp;million vehicles with Type EA 189 diesel engines worldwide.
Volkswagen, 11, The rear engine up! will go into production in 2011.
Volkswagen, 11, Volkswagen won 2009 Dakar Rally 2009, 2010 Dakar Rally 2010  and 2011 Dakar Rally, held in South America.
Volkswagen, 11, In 1969 larger Volkswagen Type 4 Type 4 (411 and 412) models were introduced.
Volkswagen, 11, On 11 January 2017, Volkswagen agreed to plead guilty to emissions cheating scandal and to pay $4.3&nbsp;billion in penalties.
Volkswagen, 11, In 2010, Volkswagen posted record sales of 6.29&nbsp;million vehicles, with its global market share at 11.4%.
Volkswagen, 11, In 11 years it ran, until 1982, it produced a stable of world famous Formula One drivers—names like Niki Lauda, Jochen Mass, Nelson Piquet, Jochen Rindt and Keke Rosberg.
Volkswagen, 11, The facility has produced Volkswagen cars and SUVs specifically designed for North American markets, beginning with Volkswagen Passat NMS Passat B7 in 2011.
Volkswagen, 11, Touareg Hybrid, scheduled for 2011.
Volkswagen, 11, Volkswagen agreed in December 2011 to implement a rule passed by company's works council Works Council aimed at improving work–life balance and avoiding Occupational burnout burnout by restricting company email functionality on firm's BlackBerry smartphones to working periods and half hour before and after working periods.
Volkswagen, 11, The order consisted of 12 vehicles, (3) model 11C, a black, green, and sand colour (3) 11GS, a chestnut brown and two azure blue, (2) 24A M51 in red, (1) 21A in blue, (1) 23A in blue, (1) 22A beige colour, and one ambulance.
Volkswagen, 11, In 2011, Volkswagen was named in top 25 largest companies in world by Forbes Global 2000.
Volkswagen, 11, In 2011, Greenpeace began criticising Volkswagen's opposition to legislation requiring tighter controls on CO2 emissions and energy efficiency, and launched an advertising campaign parodying VW's series of Star Wars–based commercials.
Volkswagen, 11, In July 2011 Wolfgang Dürheimer, director of Bugatti and Bentley, told German magazine Auto, Motor und Sport that "if [VW group] is at forefront of auto industry, I can imagine us competing in Formula 1 in 2018.
Volkswagen, 11, On 1 March 2011, Volkswagen has finalised purchase of Porsche Holding Salzburg (PHS), Austria's leading specialty automobile distributor, for €3.3&nbsp;billion ($4.55&nbsp;billion).
Volkswagen, 11, Consumer Reports tested a 2011 Jetta SportWagen TDI and found in emissions mode its 0–60&nbsp;mph time slowed down by 0.6 seconds and its highway fuel economy dropped from 50 mpg to 46 mpg.
Volkswagen, 11, In May 2011, Volkswagen completed Volkswagen Chattanooga Assembly Plant Chattanooga Assembly in Chattanooga, Tennessee Chattanooga, Tennessee.
Volkswagen, South Africa, The production numbers of first generation Golf has continued to grow annually in South Africa as Volkswagen Citi Golf Citi Golf, with only minor modifications to interior, engine and chassis, using tooling relocated from New Stanton, Pennsylvania plant when that site began to build Second Generation car.
Volkswagen, South Africa, In addition to plants in Germany, Volkswagen has manufacturing or assembly facilities in Mexico, United States, Slovakia, China, India, Russia, Malaysia, Brazil, Argentina, Portugal, Spain, Poland, Czech Republic, Bosnia and Herzegovina, Kenya and South Africa.
Volkswagen, Volkswagen Passat, First in series was Volkswagen Passat (Dasher in US), introduced in 1973, a fastback version of Audi 80, using many identical body and mechanical parts.
Volkswagen, Volkswagen Passat, Other models in Wolfgang Bernhard's (Volkswagen brand CEO) "product offensive" include Volkswagen Tiguan Tiguan mid sized SUV in 2008 and a Volkswagen Passat Coupé Passat Coupé.
Volkswagen, Volkswagen Passat, , Volkswagen Group offers for retails customers nine plug in electric cars, of which, three are all electric cars  Volkswagen e Up!, Volkswagen e Golf e Golf and Audi R8 e tron, and six are plug in hybrids  Volkswagen Golf GTE, Volkswagen Passat GTE Passat GTE, Audi A3 Sportback e tron, Audi Q7 e tron Q7 e tron quattro, Porsche Panamera S E Hybrid and Porsche Cayenne S E Hybrid Cayenne S E Hybrid.
Volkswagen, Volkswagen Passat, The facility has produced Volkswagen cars and SUVs specifically designed for North American markets, beginning with Volkswagen Passat NMS Passat B7 in 2011.
Volkswagen, Volkswagen Passat, Other main models during decade include Volkswagen Polo Polo, a smaller car than Golf, and larger Volkswagen Passat Passat for segment above Golf.
Volkswagen, Volkswagen Passat, In compact notchback or sedan segment, brand is represented by several China only models which include Volkswagen Jetta Sagitar, Volkswagen Lamando Lamando, Volkswagen Bora Bora, Volkswagen Santana Santana, Volkswagen Lavida Lavida, and its derivatives in other body styles, while Mid size car mid size sedan segment is represented by Volkswagen Passat (NMS) Passat and Volkswagen Magotan Magotan.
Volkswagen, 4, Short of light transport, in September 1945 British Army was persuaded to place a vital order for 20,000 cars.
Volkswagen, 4, The pivotal model emerged as Volkswagen Golf in 1974, marketed in United States and Canada as Rabbit for 1st generation (1975–1985) and 5th generation (2006–2009).
Volkswagen, 4, The US Thing version only sold for two years, 1973 and 1974.
Volkswagen, 4, Most Porsche 944 models were built there, although they used far fewer VW components.
Volkswagen, 4, Finland  In 2002, VW won Finnish Rally Championship in a7/(F2), with a Golf Mk4 KitCar, with Mikko Hirvonen.
Volkswagen, 4, The Lavida was best selling model in China of all manufacturers in 2019 with 491,000 units sold.
