Volkswagen, 75, The pivotal model emerged as Volkswagen Golf in 1974, marketed in United States and Canada as Rabbit for 1st generation (1975–1985) and 5th generation (2006–2009).
Volkswagen, 75, According to Thomas Ulbrich, VW brand production chief, carmaker has capacity to build as many as 75,000 battery electric and plug in hybrids a year if demand rises.
Volkswagen, 75, Canadian Motors, Limited brought in Canada's first shipment of Volkswagens on 10 July 1952 (shipping order 143075).
Volkswagen, 75, Within six years, around 75% of all Brazilian passenger cars were manufactured with ethanol engines.
Volkswagen, 75, As a response to 1973 oil crisis, Brazilian government began promoting bioethanol as a fuel, and Pro Álcool National Alcohol Program  Pró Álcool  (Programa Nacional do Álcool) was launched in 1975.
Volkswagen, 75, Volkswagen entered supermini market in 1975 with Volkswagen Polo, a stylish and spacious three door hatchback designed by Gruppo Bertone Bertone.
Volkswagen, 75, Rack and pinion steering replaced recirculating ball steering gears in model year 1975 and up.
Volkswagen, 75, In 1975, Volkswagen Polo followed.
Volkswagen, 75, Meanwhile, four years after signing a cooperation agreement with Spanish car maker SEAT in 1982, Hahn expanded company by purchasing a majority share of SEAT up to 75% by end of 1986, which VW bought outright in 1990.
Volkswagen, Porsche AG, The initial decision was for Volkswagen to take a 42.0% stake in Porsche AG by end of 2009, and it would also see family shareholders selling automobile trading business of Porsche Holding Salzburg to Volkswagen.
Volkswagen, More than a year later, More than a year later, on 16 September 1938, it was renamed to Volkswagenwerk GmbH.
Volkswagen, 16 September 1938, More than a year later, on 16 September 1938, it was renamed to Volkswagenwerk GmbH.
Volkswagen, Volkswagenwerk GmbH., More than a year later, on 16 September 1938, it was renamed to Volkswagenwerk GmbH.
Volkswagen, year, The Volkswagen Atlas, a large crossover (automobile) crossover sport utility vehicle SUV, began production in late 2016, and aimed to help end several years of losses for Volkswagen in United States, world's second largest auto market.
Volkswagen, year, According to Thomas Ulbrich, VW brand production chief, carmaker has capacity to build as many as 75,000 battery electric and plug in hybrids a year if demand rises.
Volkswagen, year, The US Thing version only sold for two years, 1973 and 1974.
Volkswagen, year, For 2007 model year, however, strict US government emissions regulations had forced Volkswagen to drop most diesels from their US engine lineup, but a new lineup of diesel engines (then thought) compatible to US standards returned to American market starting with Model Year 2009.
Volkswagen, year, Motor Trend named GTI its Car of Year for 1985, and Volkswagen rose in J.D. Power buyer satisfaction ratings to eighth place in 1985, up from 22nd a year earlier.
Volkswagen, year, Within six years, around 75% of all Brazilian passenger cars were manufactured with ethanol engines.
Volkswagen, year, Ferdinand Porsche, a well known designer for high end vehicles and race cars, had been trying for years to get a manufacturer interested in a small car suitable for a family.
Volkswagen, year, In order to comply with increasingly strict Greenhouse gas emissions carbon dioxide emission limits in major markets, VW Group expects to sell about one million all electric and plug in hybrid vehicles a year worldwide by 2025.
Volkswagen, year, The military version was produced for NATO era German Army during Cold War years of 1970 to 1979.
Volkswagen, year, The momentum continued for fiscal 2006, as Volkswagen's North American sales for year were 235,140 vehicles, a 4.9 percent increase over 2005, despite a slump in domestic North American manufacturer's sales.
Volkswagen, year, Volkswagens were first exhibited and sold in United States in 1949 but sold only two units in America that first year.
Volkswagen, year, More than a year later, on 16 September 1938, it was renamed to Volkswagenwerk GmbH.
Volkswagen, year, One year later, plant started to produce Volkswagen Type 2 Kombi model – 370 cars at that time, with a 50 percent local content component share.
Volkswagen, year, In June 2016, VW launched a program to develop 30 all electric cars in 10 years, and sell 2–3&nbsp;million electric cars per year by 2025.
Volkswagen, year, In 11 years it ran, until 1982, it produced a stable of world famous Formula One drivers—names like Niki Lauda, Jochen Mass, Nelson Piquet, Jochen Rindt and Keke Rosberg.
Volkswagen, year, The Gol, first launched in 1980, was best selling car in country for 27 consecutive years, up until 2013.
Volkswagen, year, In March of that year, on its fiftieth anniversary, Volkswagen do Brasil launched in local market Volkswagen Gol Gol 1.6 Total Flex, first Brazilian commercial flexible fuel vehicle capable of running on any mix of E20 fuel E20 E25 petrol and up to 100% [ethanol fuel (Common ethanol fuel mixtures#E100 E100]).
Volkswagen, year, This again opened possibility of a hostile takeover of VW and so on 26 March of same year Porsche took its holding of Volkswagen shares to 30.9%.
Volkswagen, year, Rack and pinion steering replaced recirculating ball steering gears in model year 1975 and up.
Volkswagen, year, On 18 September 2015, United States Environmental Protection Agency (EPA) said beginning in 2008 car maker fraudulently installed engine control unit (ECU) software determined to be a "defeat device", in violation of Clean Air Act (United States) Clean Air Act, to circumvent environmental regulations of NOx NOx emissions by diesel engine 2009–2015 model year Volkswagen and Audi cars.
Volkswagen, year, In Europe, estate/wagon version dominated market share for many years.
Volkswagen, year, Owing to success and rapid consumer acceptance of flex fuel versions, by 2005 VW had sold 293,523 flex fuel cars and light duty trucks, and only 53,074 petrol only automobiles, jumping to 525,838 flex fuel vehicles and only 13,572 petrol only cars and 248 petrol only light trucks in 2007, and reaching new car sales of 564,959 flex fuel vehicles in 2008, representing 96% of all new cars and light duty trucks sold in that year.
Volkswagen, year, Model year 2017 VW vehicles sold in US average 26.5 mpgUS, about 6% better than average for all manufacturers.
Volkswagen, year, The Super Beetle featured a new hooded, padded dash and curved windshield (from 1973 model year on up).
Volkswagen, year, (At least one Type 1 from this first shipment still exists, and was driven on a nationwide tour for Volkswagen Canada's 60th year of business festivities in 2012).
Volkswagen, year, Volkswagen Motorsport won World Rally Championship with Sébastien Ogier and co driver Julien Ingrassia four years in a row from 2013 to 2016 in Volkswagen Polo R WRC.
Volkswagen, year, The second generation Golf hatchback/Jetta sedan ran from October 1983 until autumn of 1991, and a North American version produced at Westmoreland Assembly went on sale at start of 1985 model year.
Volkswagen, year, In 1986, Hirst said that factory workers were, after many years of Nazi conditioning, initially reluctant to follow his orders; to counter this, he had his military uniform brought back from Britain and wore it in factory, after which he reported having no problems even though he was no longer a soldier at time but a civilian member of military government.
Volkswagen, year, Volkswagen has produced four winners of 50 year old European Car of Year award.
Volkswagen, year, In November 2020, Volkswagen announced that, trying to remain world's largest carmaker in green era, it has increased its investment in electric and self driving cars to $86 billion over next five years.
Volkswagen, year, Production of Type 1 Volkswagen Beetle increased dramatically over years, total reaching one million in 1955.
Volkswagen, year, In 2017, Volkswagen announced plans to place a considerable focus on electric vehicles (EV), with a goal to, by 2025, launch at least 30 EV models, and have 20 to 25 percent of their total yearly sales volume (2 3 million) consist of EVs.
Volkswagen, year, After an inspection of plant, William Edward Rootes, 1st Baron Rootes Sir William Rootes, head of British Rootes Group, told Hirst project would fail within two years, and that car "...is quite unattractive to average motorcar buyer, is too ugly and too noisy ...
Volkswagen, year, The EPA found beginning with 2009 model year all vehicles powered by V6 were non compliant.
Volkswagen, year, Meanwhile, four years after signing a cooperation agreement with Spanish car maker SEAT in 1982, Hahn expanded company by purchasing a majority share of SEAT up to 75% by end of 1986, which VW bought outright in 1990.
Volkswagen, 2015, On 22 September 2015, a Volkswagen spokesman admitted that defeat device is installed in ~11&nbsp;million vehicles with Type EA 189 diesel engines worldwide.
Volkswagen, 2015, Volkswagen announced in October 2015 that "it will develop a modular architecture for battery electric cars, called Volkswagen Group MEB platform MEB.
Volkswagen, 2015, In 2015, activists and former VW employees in Brazil spoke out in public accusing company of being silent about persecution of its workers, which was during Brazilian military government Brazil's military dictatorship from 1964 to 1985.
Volkswagen, 2015, On 18 September 2015, United States Environmental Protection Agency (EPA) said beginning in 2008 car maker fraudulently installed engine control unit (ECU) software determined to be a "defeat device", in violation of Clean Air Act (United States) Clean Air Act, to circumvent environmental regulations of NOx NOx emissions by diesel engine 2009–2015 model year Volkswagen and Audi cars.
Volkswagen, 2015, In 2015, activists and former VW employees in Brazil spoke out in public accused company's silence about persecution of its workers.
Volkswagen, 2015, In 2015, Volkswagen group admitted to producing certain engine models with software that instructed those models to reduce CO2 emissions during approval testing.
Volkswagen, 83, There have been eight generations of Volkswagen Golf, first of which was produced from summer of 1974 until autumn of 1983 (sold as Rabbit in United States and Canada and as Caribe in Latin America).
Volkswagen, 83, In 1983 MK2 Golf was launched.
Volkswagen, 83, In 1983 range was expanded, with introduction of a Coupe (similar to a conventional hatchback), and Classic (a 2 door saloon).
Volkswagen, 83, Owing to success and rapid consumer acceptance of flex fuel versions, by 2005 VW had sold 293,523 flex fuel cars and light duty trucks, and only 53,074 petrol only automobiles, jumping to 525,838 flex fuel vehicles and only 13,572 petrol only cars and 248 petrol only light trucks in 2007, and reaching new car sales of 564,959 flex fuel vehicles in 2008, representing 96% of all new cars and light duty trucks sold in that year.
Volkswagen, 83, The second generation Golf hatchback/Jetta sedan ran from October 1983 until autumn of 1991, and a North American version produced at Westmoreland Assembly went on sale at start of 1985 model year.
Volkswagen, 83, Argentina  Many Volkswagen models have competed in TC 2000, including 1980 to 1983 champion Hillman Avenger#Argentina Volkswagen 1500 and 1994 champion Volkswagen Gol.
Volkswagen, Erwin Komenda, Erwin Komenda, longstanding Auto Union chief designer, part of Ferdinand Porsche's hand picked team, developed car body of prototype, which was recognisably Volkswagen Beetle Beetle known today.
Volkswagen, Auto Union, In 1964, Volkswagen acquired Auto Union, and in 1969, NSU Motorenwerke AG (NSU).
Volkswagen, Auto Union, Erwin Komenda, longstanding Auto Union chief designer, part of Ferdinand Porsche's hand picked team, developed car body of prototype, which was recognisably Volkswagen Beetle Beetle known today.
Volkswagen, Auto Union, The purchase of Auto Union and NSU was a pivotal point in Volkswagen's history, as both companies yielded technological expertise that proved necessary for VW to survive when demand for its air cooled models went into decline.
Volkswagen, Auto Union, VW ultimately merged Auto Union and NSU to create modern Audi company, and would go on to develop it as its luxury vehicle marque.
Volkswagen, Auto Union, VW's ownership of Audi/Auto Union proved beneficial.
Volkswagen, today, In 2019, every fourth vehicle delivered by Volkswagen brand today is an SUV, with its top contributor being Tiguan.
Volkswagen, today, Erwin Komenda, longstanding Auto Union chief designer, part of Ferdinand Porsche's hand picked team, developed car body of prototype, which was recognisably Volkswagen Beetle Beetle known today.
Volkswagen, one, Most Porsche 944 models were built there, although they used far fewer VW components.
Volkswagen, one, Finland  In 2002, VW won Finnish Rally Championship in a7/(F2), with a Golf Mk4 KitCar, with Mikko Hirvonen.
Volkswagen, one, The 1948 Porsche 356 continued using many Volkswagen components, including a tuned engine, gearbox and suspension.
Volkswagen, one, Hedge funds desperate to cover their short (finance) short positions forced Volkswagen stock above one thousand euros per share, briefly making it world's largest company by market capitalisation on 28 October 2008.
Volkswagen, one, The Jetta TDI Cup is an SCCA sanctioned race series that features 25 drivers between ages of 16 and 26 driving slightly modified 2009 Jetta TDIs.
Volkswagen, one, Led by art director Helmut Krone, and copywriters Julian Koenig and Bob Levinson, Volkswagen advertisements became as popular as car, using crisp layouts and witty copy to lure younger, sophisticated consumers with whom car became associated.
Volkswagen, one, Volkswagen and Porsche would collaborate again in 1976 on Porsche 912 E (USA only) and Porsche 924, which used many Audi components and was built at Audi's Neckarsulm facilities.
Volkswagen, one, By March 2009, Volkswagen do Brasil had attained milestone mark of two million flex fuel vehicles produced since 2003.
Volkswagen, one, One of factory's wartime 'KdF Wagen' cars had been taken to factory for repairs and abandoned there.
Volkswagen, one, The electric motor and battery updates will be done in partnership with German company eClassics.
Volkswagen, one, The electric components used for retrofitting will be based upon those found in Volkswagen Up e up! model.
Volkswagen, one, In April 1945, KdF Stadt and its heavily bombed factory were captured by United States Armed Forces United States armed forces and subsequently handed over to British, within whose British Occupation zone in Germany occupation zone town and factory fell.
Volkswagen, one, In order to comply with increasingly strict Greenhouse gas emissions carbon dioxide emission limits in major markets, VW Group expects to sell about one million all electric and plug in hybrid vehicles a year worldwide by 2025.
Volkswagen, one, In May 2014, EPA was first alerted to issue by International Council on Clean Transportation (ICCT), reporting results of research commissioned for them by West Virginia University's Center for Alternative Fuels, Engines and Emissions (CAFEE).
Volkswagen, one, With 120,000 employees in Germany, VW is one of most well Labour movement organized labour represented companies in world and Germany.
Volkswagen, one, Hirst, for example, used his engineering experience to arrange manufacture of carburettors, original producers being effectively 'lost' in East Germany Soviet zone.
Volkswagen, one, Favourable reviews for Volkswagen's newest cars include GTI being named by Consumer Reports as top sporty car under $25,000, one of Car and Driver magazine's "Car and Driver Ten Best 10 Best" for 2007, Automobile Magazine Automobile Magazine's 2007 Car of Year, as well as a 2008 Motor Trend comparison ranking mid size Passat first in its class.
Volkswagen, one, At first, one plan was to use it for List of military vehicles military vehicle maintenance, and possibly dismantle and ship it to Britain.
Volkswagen, one, It was one of first cars designed with aid of a wind tunnel—a method used for German aircraft design since early 1920s.
Volkswagen, one, Apart from introduction of Volkswagen Type 2 commercial vehicle (van, pick up, and camper), and Volkswagen Karmann Ghia VW Karmann Ghia sports car, Nordhoff pursued one model policy until shortly before his death in 1968.
Volkswagen, one, For example, Golf is ideal model to go hybrid as Golf 1.4 TSI was recently awarded "Auto Environment Certificate" by Oko Trend Institute for Environmental Research, and was considered one of most environmentally friendly vehicles of 2007.
Volkswagen, one, The first Porsche car, Porsche 64 of 1938, used many components from Volkswagen Beetle.
Volkswagen, one, None were actually delivered to any holder of completed saving stamp books, though one Type 1 Cabriolet was presented to Hitler on 20 April 1944 (his 55th birthday).
Volkswagen, one, One year later, plant started to produce Volkswagen Type 2 Kombi model – 370 cars at that time, with a 50 percent local content component share.
Volkswagen, one, The VW car was just one of many Strength Through Joy KdF programs, which included things such as tours and outings.
Volkswagen, one, Volkswagen entered supermini market in 1975 with Volkswagen Polo, a stylish and spacious three door hatchback designed by Gruppo Bertone Bertone.
Volkswagen, one, Volkswagen has been one of leading manufacturer in terms of hatchback production, which traditionally has been a popular segment in Europe.
Volkswagen, one, It was a strong seller in West Germany and most of rest of Western Europe, being one of first foreign small cars to prove popular in Britain.
Volkswagen, one, Volkswagen agreed in December 2011 to implement a rule passed by company's works council Works Council aimed at improving work–life balance and avoiding Occupational burnout burnout by restricting company email functionality on firm's BlackBerry smartphones to working periods and half hour before and after working periods.
Volkswagen, one, In fall 2016, VW commissioned an expert review of situation due end of 2017.
Volkswagen, one, Halwart Schrader  VW Personenwagen seit 1945, Band 1, Typenkompass.
Volkswagen, one, In mid 2010s, company has decided to an SUV in every class of car that can justify one, which brand called "SUV offensive".
Volkswagen, one, The order consisted of 12 vehicles, (3) model 11C, a black, green, and sand colour (3) 11GS, a chestnut brown and two azure blue, (2) 24A M51 in red, (1) 21A in blue, (1) 23A in blue, (1) 22A beige colour, and one ambulance.
Volkswagen, one, Halwart Schrader  VW Personenwagen seit 1945, Band 2, Typenkompass.
Volkswagen, one, There is $50,000 prize money at stake over course of series in addition to $100,000 prize awarded to champion of series at conclusion of last race.
Volkswagen, one, The following day, one of indicted executives was ordered to be held without bail pending trial as it was feared that he would flee to Germany and extradition would be impossible.
Volkswagen, one, In early 1930s, cars were a luxury – most Germans could afford nothing more elaborate than a motorcycle and only one German out of 50 owned a car.
Volkswagen, one, (At least one Type 2 bus from this order still exists, and is currently in France undergoing restoration).
Volkswagen, one, The growing trend was not nascent; Béla Barényi, a pioneering automotive engineer, is credited as already having conceived basic design during mid 1920s.
Volkswagen, one, (At least one Type 1 from this first shipment still exists, and was driven on a nationwide tour for Volkswagen Canada's 60th year of business festivities in 2012).
Volkswagen, one, Hackenberg mentioned that car based on Volkswagen up!
Volkswagen, one, The whole scandal was covered in Series 1 of Netflix's 2018 series called Dirty Money in episode entitled "Hard Knox".
Volkswagen, one, Rudi Heppe  VW Personenwagen.
Volkswagen, one, In September 2020, Volkswagen announced that it signed a settlement with Brazilian state prosecutors, including compensation and donations amounting to 36 million reais (US$6.7 million), to atone for its collaboration with dictatorship.
Volkswagen, one, Production of Type 1 Volkswagen Beetle increased dramatically over years, total reaching one million in 1955.
Volkswagen, one, The final chapters in Volkswagen Racing UK's rallying story were 'one make' Castrol Polo Challenge, and Polo GTI 'Super 1600' in 2001.
Volkswagen, early 1920s, It was one of first cars designed with aid of a wind tunnel—a method used for German aircraft design since early 1920s.
Volkswagen, million miles, The car designs were put through rigorous tests and achieved a record breaking million miles of testing before being deemed finished.
Volkswagen, May 1938, The construction of new factory started in May 1938 in new town of "Stadt des KdF Wagens" (renamed Wolfsburg after war), which had been purpose built for factory workers.
Volkswagen, Stadt des KdF, The construction of new factory started in May 1938 in new town of "Stadt des KdF Wagens" (renamed Wolfsburg after war), which had been purpose built for factory workers.
Volkswagen, Wagens, The construction of new factory started in May 1938 in new town of "Stadt des KdF Wagens" (renamed Wolfsburg after war), which had been purpose built for factory workers.
Volkswagen, Wagens, Since it had been used for military production, (though not of KdF Wagens) and had been in Hirst's words, a "political animal" rather than a commercial enterprise – technically making it liable for destruction under terms of Potsdam Agreement – equipment could have been salvaged as war reparations.
Volkswagen, 1939, This factory had only produced a handful of cars by time war started in 1939.
Volkswagen, 1939, 1939–1944  Wartime production and concentration camp labour
Volkswagen, Type 1 Cabriolet, None were actually delivered to any holder of completed saving stamp books, though one Type 1 Cabriolet was presented to Hitler on 20 April 1944 (his 55th birthday).
Volkswagen, 20 April 1944, None were actually delivered to any holder of completed saving stamp books, though one Type 1 Cabriolet was presented to Hitler on 20 April 1944 (his 55th birthday).
Volkswagen, 55th, None were actually delivered to any holder of completed saving stamp books, though one Type 1 Cabriolet was presented to Hitler on 20 April 1944 (his 55th birthday).
Volkswagen, 1939–1944, 1939–1944  Wartime production and concentration camp labour
Volkswagen, 82, In 1973, Volkswagen introduced military themed Volkswagen 181 Type 181, or "Trekker" in Europe, "Thing" in America, recalling wartime Type 82.
Volkswagen, 82, In 11 years it ran, until 1982, it produced a stable of world famous Formula One drivers—names like Niki Lauda, Jochen Mass, Nelson Piquet, Jochen Rindt and Keke Rosberg.
Volkswagen, 82, Volkswagen admitted to using defeat device, and has been ordered to recall approximately 482,000 cars with four cylinder 2.0 liter Turbocharged Direct Injection TDI engines.
Volkswagen, 82, War changed production to military vehicles—Type 82 Volkswagen Kübelwagen Kübelwagen ("Bucket car") utility vehicle (VW's most common wartime model), and amphibious vehicle amphibious Volkswagen Schwimmwagen Schwimmwagen—manufactured for German forces.
Volkswagen, 82, Meanwhile, four years after signing a cooperation agreement with Spanish car maker SEAT in 1982, Hahn expanded company by purchasing a majority share of SEAT up to 75% by end of 1986, which VW bought outright in 1990.
Volkswagen, Schwimmwagen Schwimmwagen, War changed production to military vehicles—Type 82 Volkswagen Kübelwagen Kübelwagen ("Bucket car") utility vehicle (VW's most common wartime model), and amphibious vehicle amphibious Volkswagen Schwimmwagen Schwimmwagen—manufactured for German forces.
Volkswagen, One, One of factory's wartime 'KdF Wagen' cars had been taken to factory for repairs and abandoned there.
Volkswagen, One, In 1994, Volkswagen unveiled J Mays designed Volkswagen New Beetle#Concept 1 Concept One, a "retro" themed concept car with a resemblance to original Beetle, based on platform of Polo.
Volkswagen, One, One year later, plant started to produce Volkswagen Type 2 Kombi model – 370 cars at that time, with a 50 percent local content component share.
Volkswagen, One, In 11 years it ran, until 1982, it produced a stable of world famous Formula One drivers—names like Niki Lauda, Jochen Mass, Nelson Piquet, Jochen Rindt and Keke Rosberg.
Volkswagen, One, One of first foreigners to drive a Volkswagen was American war correspondent Ernie Pyle, who had use of a captured Volkswagen for a few days after Allied victory in Tunisia in May 1943.
Volkswagen, American, For 2007 model year, however, strict US government emissions regulations had forced Volkswagen to drop most diesels from their US engine lineup, but a new lineup of diesel engines (then thought) compatible to US standards returned to American market starting with Model Year 2009.
Volkswagen, American, All Golfs/Rabbits and GTIs as of 2006 are manufactured in Wolfsburg, Germany, rather than Puebla, Mexico, where Golfs and GTIs for North American market were produced from 1989 to 1998, and Brazilian factory in Curitiba, where Golfs and GTIs were produced from 1999 to 2006 (Volkswagen Jetta Jetta has been primarily manufactured in Mexico since 1989).
Volkswagen, American, It was offered to representatives from American, Australian, British, and French motor industries who all rejected it.
Volkswagen, American, Beetle sales had started to decline rapidly in European and North American markets.
Volkswagen, American, Volkswagen maintained North American sales of 224,195 in 2005.
