Title, Named Entity, Sentence
Volkswagen, Volkswagen, Also in September 2018, Volkswagen announced its $100 million investment in Silicon Valley based solid state battery startup QuantumScape, becoming startup's largest automotive investor and gaining representation on its board.
Volkswagen, Volkswagen, In 2013, Volkswagen XL1 became most fuel efficient production car in world, with a claimed combined fuel consumption of 261 mpg (0.90&nbsp;liter/100&nbsp;km).
Volkswagen, Volkswagen, Volkswagen Group of America Volkswagen of America was formed in April 1955 to standardise sales and service in United States.
Volkswagen, Volkswagen, Volkswagen
Volkswagen, Volkswagen, In February 2021, Volkswagen issued a statement that "vertical mobility" could be next step after self driving technology.
Volkswagen, Volkswagen, The Volkswagen Atlas, a large crossover (automobile) crossover sport utility vehicle SUV, began production in late 2016, and aimed to help end several years of losses for Volkswagen in United States, world's second largest auto market.
Volkswagen, Volkswagen, In January 2016, Volkswagen announced launch of a new factory in Algeria during a summit between Angela Merkel and Algerian prime minister Abdelmalek Sellal.
Volkswagen, Volkswagen, The pivotal model emerged as Volkswagen Golf in 1974, marketed in United States and Canada as Rabbit for 1st generation (1975–1985) and 5th generation (2006–2009).
Volkswagen, Volkswagen, Volkswagen's initial public response came on 20 September, when a spokesman said they would stop all US sales of diesel models affected.
Volkswagen, Volkswagen, The sixth generation Volkswagen Golf Mk6 VW Golf was launched in 2008, came runner up to Opel Insignia Opel/Vauxhall Insignia in 2009 European Car of Year, and has spawned several cousins  Volkswagen Jetta (A6)
Volkswagen, Volkswagen, For 2007 model year, however, strict US government emissions regulations had forced Volkswagen to drop most diesels from their US engine lineup, but a new lineup of diesel engines (then thought) compatible to US standards returned to American market starting with Model Year 2009.
Volkswagen, Volkswagen, Standard Superior&nbsp;– a previous attempt to produce a "Volkswagen"
Volkswagen, Volkswagen, In 2012, Volkswagen Jetta Hybrid set world record to become fastest hybrid car at 187&nbsp;mph.
Volkswagen, Volkswagen, First in series was Volkswagen Passat (Dasher in US), introduced in 1973, a fastback version of Audi 80, using many identical body and mechanical parts.
Volkswagen, Volkswagen, The 2003 Volkswagen Gol VW Gol 1.6 Total Flex was first full flexible fuel vehicle launched in Brazil, capable of running on any blend of petrol and Common ethanol fuel mixtures#E100
Volkswagen, Volkswagen, VW also announced plans to introduce diesel fuel diesel electric hybrid versions of its most popular models in 2012, beginning with new Volkswagen Jetta Jetta, followed by Volkswagen Golf Golf Hybrid in 2013 together with hybrid versions of Volkswagen Polo Passat.
Volkswagen, Volkswagen, On 22 September 2015, a Volkswagen spokesman admitted that defeat device is installed in ~11&nbsp;million vehicles with Type EA 189 diesel engines worldwide.
Volkswagen, Volkswagen, All Golfs/Rabbits and GTIs as of 2006 are manufactured in Wolfsburg, Germany, rather than Puebla, Mexico, where Golfs and GTIs for North American market were produced from 1989 to 1998, and Brazilian factory in Curitiba, where Golfs and GTIs were produced from 1999 to 2006 (Volkswagen Jetta Jetta has been primarily manufactured in Mexico since 1989).
Volkswagen, Volkswagen, The 1948 Porsche 356 continued using many Volkswagen components, including a tuned engine, gearbox and suspension.
Volkswagen, Volkswagen, In 1980s, Volkswagen's sales in United States and Canada fell dramatically, despite success of models like Golf elsewhere.
Volkswagen, Volkswagen, Hedge funds desperate to cover their short (finance) short positions forced Volkswagen stock above one thousand euros per share, briefly making it world's largest company by market capitalisation on 28 October 2008.
Volkswagen, Volkswagen, The sixth generation Passat and fifth generation Jetta both debuted in 2005, and Volkswagen announced plans to expand its lineup further by bringing back Volkswagen Scirocco Scirocco by 2008.
Volkswagen, Volkswagen, Werner Oswald  Deutsche Autos, Band 3, 1945–1990, Ford, Opel und Volkswagen. 1.
Volkswagen, Volkswagen, The first shipment for Volkswagen Canada reached Toronto in early December 1952.
Volkswagen, Volkswagen, The Volkswagen Scirocco Scirocco and later Volkswagen Corrado Corrado were both Golf based coupés.
Volkswagen, Volkswagen, Led by art director Helmut Krone, and copywriters Julian Koenig and Bob Levinson, Volkswagen advertisements became as popular as car, using crisp layouts and witty copy to lure younger, sophisticated consumers with whom car became associated.
Volkswagen, Volkswagen, Volkswagen and Porsche would collaborate again in 1976 on Porsche 912 E (USA only) and Porsche 924, which used many Audi components and was built at Audi's Neckarsulm facilities.
Volkswagen, Volkswagen, Volkswagen's introduction of such models is seen as a test of market for a subcompact and, if successful, may be beginnings of a thriving subcompact market for Volkswagen.
Volkswagen, Volkswagen, Compelled by 1979 energy crisis, and after development and testing with government fleets by Brazilian General Command for Aerospace Technology CTA at São José dos Campos, and further testing of several prototypes developed by four local carmakers, including Volkswagen do Brasil, pure ethanol vehicles were launched in Brazilian market.
Volkswagen, Volkswagen, By March 2009, Volkswagen do Brasil had attained milestone mark of two million flex fuel vehicles produced since 2003.
Volkswagen, Volkswagen, Canadian Motors, Limited brought in Canada's first shipment of Volkswagens on 10 July 1952 (shipping order 143075).
Volkswagen, Volkswagen, The car and its town changed their Second World War era names to "Volkswagen" and "Wolfsburg" respectively, and production increased.
Volkswagen, Volkswagen, Volkswagen has denied allegations.
Volkswagen, Volkswagen, As of May 2014, Volkswagen was planning to start assembling certain engines in India to increase localisation from 70% to 90%.
Volkswagen, Volkswagen, On 28 May 1937, Gesellschaft zur Vorbereitung des Deutschen Volkswagens mbH ("Company for Preparation of German Volkswagen Ltd."), or Gezuvor for short, was established by Deutsche Arbeitsfront in Berlin.
Volkswagen, Volkswagen, Motor Trend named GTI its Car of Year for 1985, and Volkswagen rose in J.D. Power buyer satisfaction ratings to eighth place in 1985, up from 22nd a year earlier.
Volkswagen, Volkswagen, On 4 March 2005, European Commission brought an action against Federal Republic of Germany before European Court of Justice, claiming that Volkswagen Law, which prevents any shareholder in Volkswagen from executing more than 20% of total voting rights in firm, was illegally restricting flow of capital in Europe.
Volkswagen, Volkswagen, The electric components used for retrofitting will be based upon those found in Volkswagen Up e up! model.
Volkswagen, Volkswagen, Volkswagen began introducing an array of new models after Bernd Pischetsrieder became Volkswagen Group CEO (responsible for all Group brands) in 2002.
Volkswagen, Volkswagen, Of 81 million vehicles produced over six decades in Brazil, 23 million of it was built by Volkswagen, which was produced by four passenger car factories in country.
Volkswagen, Volkswagen, In 1956, Volkswagen began by building a plant in São Bernardo do Campo, near São Paulo as its first manufacturing plant outside Germany as a response to Brazil's ban on import of Built up export completely assembled vehicles in 1950.
Volkswagen, Volkswagen, Volkswagen won 2009 Dakar Rally 2009, 2010 Dakar Rally 2010  and 2011 Dakar Rally, held in South America.
Volkswagen, Volkswagen, Six Volkswagen executives were charged.
Volkswagen, Volkswagen, Volkswagen Group's core markets include Germany and China.
Volkswagen, Volkswagen, In 1991, Volkswagen launched third generation Golf, which was European Car of Year for 1992.
Volkswagen, Volkswagen, Volkswagen Group, as a unit, is Europe's largest motor vehicle manufacturer, with over 74,000 employees and over 7700 dealerships.
Volkswagen, Volkswagen, On 9 December 2019, Environment and Climate Change Canada charged Volkswagen AG with importing nearly 128,000 cars into Canada that did not meet its emissions standards, but reached a plea deal with agency in a case involving 60 charges stemming from devices installed to defeat emissions testing.
Volkswagen, Volkswagen, In 1994, Volkswagen unveiled J Mays designed Volkswagen New Beetle#Concept 1 Concept One, a "retro" themed concept car with a resemblance to original Beetle, based on platform of Polo.
Volkswagen, Volkswagen, Volkswagen could now claim world production record for most produced, single make of car in history.
Volkswagen, Volkswagen, On 28 June 2016, Volkswagen agreed to pay a settlement of $15.3&nbsp;billion, largest auto related consumer class action lawsuit in United States history.
Volkswagen, Volkswagen, Volkswagen set plans to add a compact SUV with styling influences from "Concept A" concept vehicle introduced at 2006 Geneva Auto Show, and on 20 July 2006, Volkswagen announced that new vehicle called Volkswagen Tiguan Tiguan.
Volkswagen, Volkswagen, (The 914 6 had a 6 cylinder Porsche engine, and standard 914 had a Volkswagen engine.)
Volkswagen, Volkswagen, Total cumulative sales of all Volkswagen brand electric vehicle electrified cars since start of their respective production is expected to reach about 103,000 by end of 2016.
Volkswagen, Volkswagen, Volkswagen maintained North American sales of 224,195 in 2005.
Volkswagen, Volkswagen, After 15 months of denying emissions control systems were deliberately gamed and instead claiming discrepancies due to "technical" reasons, on 21 August Volkswagen acknowledged to EPA and California Air Resources Board (CARB) their emission controls systems were rigged.
Volkswagen, Volkswagen, From 1948, Volkswagen became an important element, symbolically and economically, of Wirtschaftswunder West German regeneration.
Volkswagen, Volkswagen, In October 2009 however, Volkswagen announced that its percentage in Porsche would be 49.9% for a cost of €3.9&nbsp;billion (42.0% deal would have cost €3.3&nbsp;billion).
Volkswagen, Volkswagen, The production numbers of first generation Golf has continued to grow annually in South Africa as Volkswagen Citi Golf Citi Golf, with only minor modifications to interior, engine and chassis, using tooling relocated from New Stanton, Pennsylvania plant when that site began to build Second Generation car.
Volkswagen, Volkswagen, Based on platform of not yet released Volkswagen Golf Golf, it was built at Karmann due to capacity constraints at Volkswagen.
Volkswagen, Volkswagen, While Volkswagen's range of cars soon became similar to that of other large European car makers, Golf has been mainstay of Volkswagen line up since its introduction, and mechanical basis for several other cars of company.
Volkswagen, Volkswagen, Other models in Wolfgang Bernhard's (Volkswagen brand CEO) "product offensive" include Volkswagen Tiguan Tiguan mid sized SUV in 2008 and a Volkswagen Passat Coupé Passat Coupé.
Volkswagen, Volkswagen, In September 2019 at International Motor Show Germany Frankfurt Motor Show, Volkswagen officially unveiled a refreshed logo (a thinner, two dimensional version of previous logo) and new sonic branding, which will accompany newly launched Volkswagen ID.3 ID.3 electric vehicle.
Volkswagen, Volkswagen, In 1973, Volkswagen introduced military themed Volkswagen 181 Type 181, or "Trekker" in Europe, "Thing" in America, recalling wartime Type 82.
Volkswagen, Volkswagen, Since 1985, Volkswagen has also run Volkswagen AutoMuseum in Wolfsburg, which is dedicated to history of company.
Volkswagen, Volkswagen, In 1969 larger Volkswagen Type 4 Type 4 (411 and 412) models were introduced.
Volkswagen, Volkswagen, In November 2009, Volkswagen announced it has hired Karl Thomas Neumann as its group chief officer for electric traction.
Volkswagen, Volkswagen, The momentum continued for fiscal 2006, as Volkswagen's North American sales for year were 235,140 vehicles, a 4.9 percent increase over 2005, despite a slump in domestic North American manufacturer's sales.
Volkswagen, Volkswagen, Volkswagen announced in October 2015 that "it will develop a modular architecture for battery electric cars, called Volkswagen Group MEB platform MEB.
Volkswagen, Volkswagen, German politician Reinhard Bütikofer, chair of European Parliament's delegation for relations with China, criticised Volkswagen on these grounds.
Volkswagen, Volkswagen, On 4 July 1985, Volkswagenwerk AG was renamed to Volkswagen AG.
Volkswagen, Volkswagen, On first business day after news, Volkswagen's stock price declined 20% and declined another 17% following day, same day a social media advertisement with Wired (magazine) Wired about "how diesel was re engineered" was removed as well as a series of YouTube ads titled "Diesel Old Wives' Tales".
Volkswagen, Volkswagen, Favourable reviews for Volkswagen's newest cars include GTI being named by Consumer Reports as top sporty car under $25,000, one of Car and Driver magazine's "Car and Driver Ten Best 10 Best" for 2007, Automobile Magazine Automobile Magazine's 2007 Car of Year, as well as a 2008 Motor Trend comparison ranking mid size Passat first in its class.
Volkswagen, Volkswagen, Volkswagen also expects SUVs to lead ID.
Volkswagen, Volkswagen, in March 2022, Volkswagen released Volkswagen ID.
Volkswagen, Volkswagen, Europe  In 1998 company founded ADAC Volkswagen Lupo Cup, founded in 1998 (renamed Polo Cup in 2003, and Volkswagen Scirocco R Cup from 2010 to 2014), and started ADAC Volkswagen New Beetle New Beetle Cup in 2000.
Volkswagen, Volkswagen, To remedy this, Volkswagen launched Volkswagen Routan, a badge engineering badge engineered Dodge Caravan Dodge Grand Caravan made for American and Canadian markets, in 2008.
Volkswagen, Volkswagen, The Volkswagen Golf Golf traditionally has been strongest selling vehicle for brand in Europe, followed by smaller Volkswagen Polo Polo which apart from European market also has a stronghold in emerging markets.
Volkswagen, Volkswagen, Volkswagens were first exhibited and sold in United States in 1949 but sold only two units in America that first year.
Volkswagen, Volkswagen, There have been eight generations of Volkswagen Golf, first of which was produced from summer of 1974 until autumn of 1983 (sold as Rabbit in United States and Canada and as Caribe in Latin America).
Volkswagen, Volkswagen, The brand introduced its first crossover SUV in 2002 starting from Volkswagen Touareg Touareg, a full size luxury SUV.
Volkswagen, Volkswagen, Founded in 1937 by German Labour Front, known for their iconic Volkswagen Beetle Beetle, it is flagship brand of Volkswagen Group, largest car maker by worldwide sales in 2016 and 2017.
Volkswagen, Volkswagen, Volkswagens were seen in Canada for first time at Canadian National Exhibition in August 1952 and were accepted enthusiastically.
Volkswagen, Volkswagen, Apart from introduction of Volkswagen Type 2 commercial vehicle (van, pick up, and camper), and Volkswagen Karmann Ghia VW Karmann Ghia sports car, Nordhoff pursued one model policy until shortly before his death in 1968.
Volkswagen, Volkswagen, In September 2018, Volkswagen announced that it would discontinue production of Volkswagen Beetle (A5)
Volkswagen, Volkswagen, Volkswagen stated that ID.3 signified start of a "new era" of company.
Volkswagen, Volkswagen, In 1964, Volkswagen acquired Auto Union, and in 1969, NSU Motorenwerke AG (NSU).
Volkswagen, Volkswagen, More than a year later, on 16 September 1938, it was renamed to Volkswagenwerk GmbH.
Volkswagen, Volkswagen, The court also prevented government from appointing Volkswagen board members.
Volkswagen, Volkswagen, Due to a positive response to concept, a production version was developed as Volkswagen New Beetle New Beetle, based on Golf's larger platform.
Volkswagen, Volkswagen, The first Porsche car, Porsche 64 of 1938, used many components from Volkswagen Beetle.
Volkswagen, Volkswagen, The Volkswagen 1 litre car VW XL1 began a limited production run in 2013.
Volkswagen, Volkswagen, The Volkswagen Golf Mk3 Golf Mk3 and Volkswagen Vento (A3) Jetta Mk3 arrived in North America in 1993.
Volkswagen, Volkswagen, In January 2021, Volkswagen announced that its sales in 2020 dropped by 9.9% in China, 23.4% in western Europe and 17.1% in North America.
Volkswagen, Volkswagen, About 1,150 of Volkswagen's more than 190,000 employees in Germany were affected by email restriction.
Volkswagen, Volkswagen, Volkswagen was named fourth most influential car of 20th century in 1999 Car of Century competition, for its Volkswagen Beetle Volkswagen Type 1 "Beetle" model.
Volkswagen, Volkswagen, Volkswagen do Brasil produced and sold pure ethanol powered (Common ethanol fuel mixtures#E100
Volkswagen, Volkswagen, They built basis for Volkswagen's turn around.
Volkswagen, Volkswagen, In July 2019, Volkswagen invested $2.6 billion in Argo AI, a startup focused on developing Autonomous car self driving vehicles.
Volkswagen, Volkswagen, In 2019, every fourth vehicle delivered by Volkswagen brand today is an SUV, with its top contributor being Tiguan.
Volkswagen, Volkswagen, In 2008, Volkswagen became third largest car maker in world, and, as of 2016, Volkswagen was second largest manufacturer worldwide.
Volkswagen, Volkswagen, The Porsche Cayenne, introduced in 2002, shares its entire chassis with Volkswagen Touareg and Audi Q7, and is built at same Volkswagen factory in Bratislava that other SUVs are built.
Volkswagen, Volkswagen, Volkswagen Cars Technical Information
Volkswagen, Volkswagen, Volkswagen is founding and namesake member of Volkswagen Group, a large international corporation in charge of multiple car and truck brands, including Audi, SEAT, Porsche, Lamborghini, Bentley, Bugatti, Scania AB Scania, MAN SE MAN, and Škoda Auto Škoda.
Volkswagen, Volkswagen, Erwin Komenda, longstanding Auto Union chief designer, part of Ferdinand Porsche's hand picked team, developed car body of prototype, which was recognisably Volkswagen Beetle Beetle known today.
Volkswagen, Volkswagen, In 1998 company launched new Volkswagen Lupo Lupo city car.
Volkswagen, Volkswagen, Chairman Martin Winterkorn issued an apology and said Volkswagen would cooperate with investigators.
Volkswagen, Volkswagen, On 6 March 2017 at Geneva Motor Show Volkswagen presented its prototype for a fully autonomous car, Sedric.
Volkswagen, Volkswagen, One year later, plant started to produce Volkswagen Type 2 Kombi model – 370 cars at that time, with a 50 percent local content component share.
Volkswagen, Volkswagen, Volkswagen is a market leader in China, which is Automotive industry in China largest single automotive market in world.
Volkswagen, Volkswagen, Historical vehicles built for market include Volkswagen Brasília Brasília, Volkswagen SP2 SP1 & SP2, Volkswagen Type 3#Brazilian
Volkswagen, Volkswagen, Volkswagen disputed EPA's findings, stating their software was legally permitted; however, shortly thereafter, Volkswagen issued a stop sale for EPA's disputed vehicles and additional models EPA did not question.
Volkswagen, Volkswagen, On 11 January 2017, Volkswagen agreed to plead guilty to emissions cheating scandal and to pay $4.3&nbsp;billion in penalties.
Volkswagen, Volkswagen, Volkswagen advertising
Volkswagen, Volkswagen, , Volkswagen Group offers for retails customers nine plug in electric cars, of which, three are all electric cars  Volkswagen e Up!, Volkswagen e Golf e Golf and Audi R8 e tron, and six are plug in hybrids  Volkswagen Golf GTE, Volkswagen Passat GTE Passat GTE, Audi A3 Sportback e tron, Audi Q7 e tron Q7 e tron quattro, Porsche Panamera S E Hybrid and Porsche Cayenne S E Hybrid Cayenne S E Hybrid.
Volkswagen, Volkswagen, German historians estimated that 80% of Volkswagen's wartime workforce was slave labour.
Volkswagen, Volkswagen, In 1963, Formula Vee circuit racing, with cars built from easily available Volkswagen Beetle#Power Beetle parts, started in United States.
Volkswagen, Volkswagen, Volkswagen has always had a close relationship with Porsche, Stuttgart Zuffenhausen based sports car manufacturer founded in 1931 by Ferdinand Porsche, original Volkswagen designer and Volkswagen company co founder, hired by Adolf Hitler for project.
Volkswagen, Volkswagen, Volkswagen do Brasil was accused of spying on workers during time of military dictatorship in 1970s and informing police on oppositional activities.
Volkswagen, Volkswagen, In 2010, Volkswagen posted record sales of 6.29&nbsp;million vehicles, with its global market share at 11.4%.
Volkswagen, Volkswagen, Category Volkswagen Group
Volkswagen, Volkswagen, Volkswagen entered supermini market in 1975 with Volkswagen Polo, a stylish and spacious three door hatchback designed by Gruppo Bertone Bertone.
Volkswagen, Volkswagen, Volkswagen has already produced five winners of recently developed World Car of Year award.
Volkswagen, Volkswagen, Audi influences paved way for this new generation of Volkswagens  Passat, Scirocco, Volkswagen Golf Golf, and Polo.
Volkswagen, Volkswagen, The facility has produced Volkswagen cars and SUVs specifically designed for North American markets, beginning with Volkswagen Passat NMS Passat B7 in 2011.
Volkswagen, Volkswagen, Volkswagen has been one of leading manufacturer in terms of hatchback production, which traditionally has been a popular segment in Europe.
Volkswagen, Volkswagen, In October 2013, EU Court of Justice in Luxembourg ruled that rewritten Volkswagen law "complied in full" with EU rules.
Volkswagen, Volkswagen, Volkswagen head Martin Winterkorn has confirmed company plans to build compact hybrid electric vehicles.
Volkswagen, Volkswagen, Volkswagen (; shortened to VW ) is a German Automotive industry motor vehicle manufacturer headquartered in Wolfsburg, Lower Saxony, Germany.
Volkswagen, Volkswagen, The Polo became base of Volkswagen Derby, which was introduced in 1977.
Volkswagen, Volkswagen, The introduction of second generation Golf, GTI and Jetta models helped Volkswagen briefly in North America.
Volkswagen, Volkswagen, Volkswagen Group's global headquarters are located in Volkswagen's historic home of Wolfsburg, Germany.
Volkswagen, Volkswagen, Volkswagen AG annual report in 2019 reported that best selling model under Volkswagen brand globally is Volkswagen Tiguan Tiguan, followed by B segment range of Volkswagen Polo Polo, Virtus, Vento and Ameo, and Volkswagen Golf Golf.
Volkswagen, Volkswagen, Volkswagen was first car manufacturer to apply ISO 14000 during its drafting stage and was re certified in September 2005.
Volkswagen, Volkswagen, https //en.wikipedia.org/wiki/Volkswagen
Volkswagen, Volkswagen, Relationship with Porsche and Volkswagen Law
Volkswagen, Volkswagen, The purchase of Auto Union and NSU was a pivotal point in Volkswagen's history, as both companies yielded technological expertise that proved necessary for VW to survive when demand for its air cooled models went into decline.
Volkswagen, Volkswagen, Its chassis also spawned Volkswagen Scirocco sport coupe, Volkswagen Jetta saloon/sedan, Volkswagen Golf Cabriolet (automobile) Cabriolet convertible, and Volkswagen Caddy pick up.
Volkswagen, Volkswagen, The 2007 Volkswagen Eos Eos, a hardtop convertible, is produced in a new facility in Portugal.
Volkswagen, Volkswagen, In November 2016, Volkswagen and its labour unions agreed to reduce workforce by 30,000 people until 2021 as a result of costs from violations.
Volkswagen, Volkswagen, The UK's first official Volkswagen importer, Colborne Garages of Ripley, Surrey, started business with importing parts for models brought home by soldiers returning from Germany.
Volkswagen, Volkswagen, Volkswagen admitted to using defeat device, and has been ordered to recall approximately 482,000 cars with four cylinder 2.0 liter Turbocharged Direct Injection TDI engines.
Volkswagen, Volkswagen, Volkswagen agreed in December 2011 to implement a rule passed by company's works council Works Council aimed at improving work–life balance and avoiding Occupational burnout burnout by restricting company email functionality on firm's BlackBerry smartphones to working periods and half hour before and after working periods.
Volkswagen, Volkswagen, He has stated "There will definitely be compact hybrid models, such as Volkswagen Polo Polo and Volkswagen Golf Golf, and without any great delay", with petrol and diesel engine diesel power.
Volkswagen, Volkswagen, Its expertise in front wheel drive, and water cooling water cooled engines would help Volkswagen produce a credible Beetle successor.
Volkswagen, Volkswagen, The German term Volk translates to "people", thus Volkswagen translates to "people's car".
Volkswagen, Volkswagen, In March of that year, on its fiftieth anniversary, Volkswagen do Brasil launched in local market Volkswagen Gol Gol 1.6 Total Flex, first Brazilian commercial flexible fuel vehicle capable of running on any mix of E20 fuel E20 E25 petrol and up to 100% [ethanol fuel (Common ethanol fuel mixtures#E100 E100]).
Volkswagen, Volkswagen, VW expanded its product line in 1961 with introduction of four Volkswagen Type 3 Type 3 models (Karmann Ghia, Notchback, Fastback, and Variant) based on new Type 3 mechanical underpinnings.
Volkswagen, Volkswagen, Beginning in 2008 Volkswagen introduced Jetta TDI Cup.
