Angela Merkel, 2006, German Politics & Society 2006.
Angela Merkel, 2006, Merkel topped Forbes magazine's list of "The World's 100 Most Powerful Women" in 2006, 2007, 2008, 2009, 2011, 2012, 2013, 2014, 2015, 2016, 2017, 2018, 2019 and 2020.
Angela Merkel, Russia, She was able to speak informally to Vladimir Putin in Russian, but conducted diplomatic dialogue through an interpreter.
Angela Merkel, Russia, In 2006, Merkel expressed concern about Russia in European energy sector overreliance on Russian energy, but she received little support from others in Berlin.
Angela Merkel, Russia, At school Merkel learned to speak Russian fluently, and was awarded prizes for her proficiency in Russian and mathematics.
Angela Merkel, Russia, Having grown up in East Germany, Merkel learned Russian at school and not English.
Angela Merkel, Russia, In June 2017, Merkel criticized draft of new US sanctions against Russia that target EU–Russia energy projects, including Nord Stream Nord Stream 2 gas pipeline.
Angela Merkel, Russia, Following 2022 Russian invasion of Ukraine, Merkel faced renewed criticisms that she had failed to curb Russian president Vladimir Putin's ambitions and aggression by insisting on diplomacy and détente policies.
Angela Merkel, Russia, She was best in her class in mathematics and Russian, and completed her school education with best possible average Abitur grade 1.0.
Angela Merkel, Russia, Russia
Angela Merkel, Russia, Critics argued that under her tenure, Germany and Europe was weakened by a Russia in European energy sector dependency on Russian natural gas, including Nord Stream and Nord Stream 2 pipelines, and that Bundeswehr German military was neglected by underfunding.
Angela Merkel, June 2017, In June 2017, Merkel criticized draft of new US sanctions against Russia that target EU–Russia energy projects, including Nord Stream Nord Stream 2 gas pipeline.
Angela Merkel, Nord Stream Nord, In June 2017, Merkel criticized draft of new US sanctions against Russia that target EU–Russia energy projects, including Nord Stream Nord Stream 2 gas pipeline.
Angela Merkel, U.S., During a visit of U.S. President Barack Obama in Berlin, Merkel said on 19 June 2013 in context of 2013 mass surveillance disclosures  "The Internet is uncharted territory for us all" (Das Internet ist für uns alle Neuland).
Angela Merkel, Ukraine relations#European Union Association Agreement Association, Merkel favors EU Ukraine relations#European Union Association Agreement Association Agreement between Ukraine and European Union; but stated in December 2012 that its implementation depends on reforms in Ukraine.
Angela Merkel, Ukraine, Merkel favors EU Ukraine relations#European Union Association Agreement Association Agreement between Ukraine and European Union; but stated in December 2012 that its implementation depends on reforms in Ukraine.
Angela Merkel, Ukraine, Following 2022 Russian invasion of Ukraine, Merkel faced renewed criticisms that she had failed to curb Russian president Vladimir Putin's ambitions and aggression by insisting on diplomacy and détente policies.
Angela Merkel, Ukraine, Ukrainian president Volodymyr Zelenskyy also blamed Merkel and then French president Nicolas Sarkozy's decision to block Ukraine from joining NATO in 2008 for war; Merkel released a statement that she stands by her decision.
Angela Merkel, Ukraine, * Recipient of Order of Liberty (Ukraine) Order of Liberty
Angela Merkel, December 2012, Merkel favors EU Ukraine relations#European Union Association Agreement Association Agreement between Ukraine and European Union; but stated in December 2012 that its implementation depends on reforms in Ukraine.
Angela Merkel, Israel, In October 2020, Merkel Merkel was awarded an honorary doctorate from The Technion   Israel Institute of Technology.
Angela Merkel, Israel, Category Recipients of Presidential Medal of Distinction of Israel
Angela Merkel, Israel, She telephoned Israeli Prime Minister Benjamin Netanyahu on 9 July to condemn "without reservation rocket fire on Israel".
Angela Merkel, Israel, * Recipient of President's Medal (Israel) President's Medal
Angela Merkel, Israel, Merkel expressed support for Israel's right to defend itself during 2014 Israel–Gaza conflict.
Angela Merkel, Gaza, Merkel expressed support for Israel's right to defend itself during 2014 Israel–Gaza conflict.
Angela Merkel, Israeli, She telephoned Israeli Prime Minister Benjamin Netanyahu on 9 July to condemn "without reservation rocket fire on Israel".
Angela Merkel, Benjamin Netanyahu, She telephoned Israeli Prime Minister Benjamin Netanyahu on 9 July to condemn "without reservation rocket fire on Israel".
Angela Merkel, 9 July, She telephoned Israeli Prime Minister Benjamin Netanyahu on 9 July to condemn "without reservation rocket fire on Israel".
Angela Merkel, Flight, In June 2018, Merkel said that there had been "no moral or political justification" for post war Flight and expulsion of Germans (1944–50) expulsion of ethnic Germans from Central and Eastern European countries.
Angela Merkel, 1944–50, In June 2018, Merkel said that there had been "no moral or political justification" for post war Flight and expulsion of Germans (1944–50) expulsion of ethnic Germans from Central and Eastern European countries.
Angela Merkel, Eastern European, In June 2018, Merkel said that there had been "no moral or political justification" for post war Flight and expulsion of Germans (1944–50) expulsion of ethnic Germans from Central and Eastern European countries.
Angela Merkel, Italian, * Knight Grand Cross of Order of Merit of Italian Republic
Angela Merkel, Hypo Real Estate, During financial crisis of 2007–2008, German government stepped in to assist mortgage loan mortgage company Hypo Real Estate with a bailout, which was agreed on 6 October, with German banks to contribute €30 billion and Deutsche Bundesbank Bundesbank €20 billion to a credit line.
Angela Merkel, 6 October, During financial crisis of 2007–2008, German government stepped in to assist mortgage loan mortgage company Hypo Real Estate with a bailout, which was agreed on 6 October, with German banks to contribute €30 billion and Deutsche Bundesbank Bundesbank €20 billion to a credit line.
Angela Merkel, 6 October, However, two days later, on 6 October 2008, it emerged that pledge was simply a political move that would not be backed by legislation.
Angela Merkel, €30 billion, During financial crisis of 2007–2008, German government stepped in to assist mortgage loan mortgage company Hypo Real Estate with a bailout, which was agreed on 6 October, with German banks to contribute €30 billion and Deutsche Bundesbank Bundesbank €20 billion to a credit line.
Angela Merkel, Deutsche Bundesbank, During financial crisis of 2007–2008, German government stepped in to assist mortgage loan mortgage company Hypo Real Estate with a bailout, which was agreed on 6 October, with German banks to contribute €30 billion and Deutsche Bundesbank Bundesbank €20 billion to a credit line.
Angela Merkel, Deutsche Bundesbank, This happened at a time of fierce emotional debate in Germany over a book by former Deutsche Bundesbank executive and finance senator of Berlin Thilo Sarrazin, which was critical of Muslim immigration.
Angela Merkel, Bundesbank, During financial crisis of 2007–2008, German government stepped in to assist mortgage loan mortgage company Hypo Real Estate with a bailout, which was agreed on 6 October, with German banks to contribute €30 billion and Deutsche Bundesbank Bundesbank €20 billion to a credit line.
Angela Merkel, Bundesbank, This happened at a time of fierce emotional debate in Germany over a book by former Deutsche Bundesbank executive and finance senator of Berlin Thilo Sarrazin, which was critical of Muslim immigration.
Angela Merkel, €20 billion, During financial crisis of 2007–2008, German government stepped in to assist mortgage loan mortgage company Hypo Real Estate with a bailout, which was agreed on 6 October, with German banks to contribute €30 billion and Deutsche Bundesbank Bundesbank €20 billion to a credit line.
Angela Merkel, 6 October 2008, However, two days later, on 6 October 2008, it emerged that pledge was simply a political move that would not be backed by legislation.
Angela Merkel, 4 October 2008, On 4 October 2008, following Government of Ireland Irish Government's decision to guarantee all deposits in private savings accounts, a move she strongly criticised, Merkel said there were no plans for German Government to do same.
Angela Merkel, Ireland Irish Government's, On 4 October 2008, following Government of Ireland Irish Government's decision to guarantee all deposits in private savings accounts, a move she strongly criticised, Merkel said there were no plans for German Government to do same.
Angela Merkel, Forbes, Angela Merkel collected news and commentary at Forbes
Angela Merkel, Forbes, Merkel was twice been named Forbes list of The World's Most Powerful People world's second most powerful person, following Vladimir Putin, by Forbes magazine, highest ranking ever achieved by a woman.
Angela Merkel, Forbes, Forbes list of The World's Most Powerful People Forbes list of The World's Most Powerful People ranked Merkel as world's second most powerful person in Forbes list of The World's Most Powerful People#2012 and 2015 list (top 10) 2012, highest ranking achieved by a woman since list began in 2009; she was ranked fifth in Forbes list of The World's Most Powerful People#2013 list (top 10) 2013 and Forbes list of The World's Most Powerful People#2014 list (top 10) 2014
Angela Merkel, Forbes, Merkel topped Forbes magazine's list of "The World's 100 Most Powerful Women" in 2006, 2007, 2008, 2009, 2011, 2012, 2013, 2014, 2015, 2016, 2017, 2018, 2019 and 2020.
Angela Merkel, Forbes, In 2018, Merkel was named Forbes list of The World's 100 Most Powerful Women most powerful woman in world for a record fourteenth time by Forbes.
Angela Merkel, German Government, On 4 October 2008, following Government of Ireland Irish Government's decision to guarantee all deposits in private savings accounts, a move she strongly criticised, Merkel said there were no plans for German Government to do same.
Angela Merkel, two days later, However, two days later, on 6 October 2008, it emerged that pledge was simply a political move that would not be backed by legislation.
Angela Merkel, UK, Merkel features as a main character in two of three plays that make up Europeans Trilogy (Bruges, Antwerp, and Tervuren) by Paris based UK playwright Nick Awde  Bruges (Edinburgh Festival, 2014) and Tervuren (2016).
Angela Merkel, World Economic Forum, At World Economic Forum in Davos, 2013, she said that Europe had only 7% of global population and produced only 25% of global GDP, but that it accounted for almost 50% of global social expenditure.
Angela Merkel, Davos, At World Economic Forum in Davos, 2013, she said that Europe had only 7% of global population and produced only 25% of global GDP, but that it accounted for almost 50% of global social expenditure.
Angela Merkel, only 7%, At World Economic Forum in Davos, 2013, she said that Europe had only 7% of global population and produced only 25% of global GDP, but that it accounted for almost 50% of global social expenditure.
Angela Merkel, only 25%, At World Economic Forum in Davos, 2013, she said that Europe had only 7% of global population and produced only 25% of global GDP, but that it accounted for almost 50% of global social expenditure.
Angela Merkel, almost 50%, At World Economic Forum in Davos, 2013, she said that Europe had only 7% of global population and produced only 25% of global GDP, but that it accounted for almost 50% of global social expenditure.
Angela Merkel, University of Szeged, In November 2013, she was awarded [degree Honorary Doctorate] (Honoris Causa) title by University of Szeged.
Angela Merkel, 7%, In August 2019, 67% of Germans wanted Merkel to stay till end of her term in 2021, while only 29% wanted her to step down earlier.
Angela Merkel, 7%, According to a poll conducted after List of Islamist terrorist attacks in 2016 terror attacks in Germany Merkel's approval rating dropped to 47% (August 2016).
Angela Merkel, 7%, At World Economic Forum in Davos, 2013, she said that Europe had only 7% of global population and produced only 25% of global GDP, but that it accounted for almost 50% of global social expenditure.
Angela Merkel, 7%, However, she scored well on her handling of recent euro crisis (69% rated her performance as good rather than poor), and her approval rating reached an all time high of 77% in February 2012 and again in July 2014.
Angela Merkel, 50%, At World Economic Forum in Davos, 2013, she said that Europe had only 7% of global population and produced only 25% of global GDP, but that it accounted for almost 50% of global social expenditure.
Angela Merkel, The Economist, Angela Merkel collected news and commentary at The Economist
Angela Merkel, The Economist, The international financial press has widely commented on her thesis, with The Economist saying
Angela Merkel, Margaret Thatcher, As a woman who is a politician from a centre right party and also a scientist, Merkel has been compared by many in English language press to late 20th century British Prime Minister Margaret Thatcher (Thatcher also had a science degree from Oxford University in chemistry).
Angela Merkel, Financial Times, The Financial Times commented  "Although Ms Merkel stopped short of suggesting that a ceiling on social spending might be one yardstick for measuring competitiveness, she hinted as much in light of soaring social spending in face of an ageing population.
Angela Merkel, Ms Merkel, The Financial Times commented  "Although Ms Merkel stopped short of suggesting that a ceiling on social spending might be one yardstick for measuring competitiveness, she hinted as much in light of soaring social spending in face of an ageing population.
Angela Merkel, New York, The New York Times.
Angela Merkel, New York, Following election of Donald Trump to US presidency in November 2016, Merkel was described by The New York Times as "Liberal West's Last Defender".
Angela Merkel, New York, On 21 September 2010, Leo Baeck Institute, a research institution in New York City devoted to history of German speaking Jewry, awarded Merkel Leo Baeck Medal.
Angela Merkel, New York, The New Yorker  46–63.
Angela Merkel, 13, Westend, Frankfurt am Main 2013, .
Angela Merkel, 13, Günther Lachmann, Ralf Georg Reuth  Das erste Leben der Angela M. Piper, München 2013, .
Angela Merkel, 13, In November 2013, she was awarded [degree Honorary Doctorate] (Honoris Causa) title by University of Szeged.
Angela Merkel, 13, In 2013, she received Indira Gandhi Peace Prize.
Angela Merkel, 13, In July 2013, Merkel defended PRISM (surveillance program) surveillance practices of National Security Agency, and described United States as "our truest ally throughout decades".
Angela Merkel, 13, "Get party started  The social policy of grand coalition 2013–2017."
Angela Merkel, 13, In 2013 German federal election election of September 2013, Merkel won one of most decisive victories in German history, achieving best result for CDU/CSU since reunification and coming within five seats of first absolute majority in Bundestag since 1957.
Angela Merkel, 13, Second CDU–SPD grand coalition 2013–2017
Angela Merkel, 13, The expression is credited for name of political party Alternative for Germany, which was founded in 2013.
Angela Merkel, 13, CDU–FDP coalition, 2009–2013
Angela Merkel, 13, The third Merkel cabinet third Cabinet of Angela Merkel was sworn in on 17 December 2013.
Angela Merkel, 13, At World Economic Forum in Davos, 2013, she said that Europe had only 7% of global population and produced only 25% of global GDP, but that it accounted for almost 50% of global social expenditure.
Angela Merkel, 13, On 23 May 2013, she was awarded an honorary doctorate from Radboud University Nijmegen.
Angela Merkel, 13, Forbes list of The World's Most Powerful People Forbes list of The World's Most Powerful People ranked Merkel as world's second most powerful person in Forbes list of The World's Most Powerful People#2012 and 2015 list (top 10) 2012, highest ranking achieved by a woman since list began in 2009; she was ranked fifth in Forbes list of The World's Most Powerful People#2013 list (top 10) 2013 and Forbes list of The World's Most Powerful People#2014 list (top 10) 2014
Angela Merkel, 13, During a visit of U.S. President Barack Obama in Berlin, Merkel said on 19 June 2013 in context of 2013 mass surveillance disclosures  "The Internet is uncharted territory for us all" (Das Internet ist für uns alle Neuland).
Angela Merkel, 13, Category Members of Bundestag 2013–2017
Angela Merkel, 13, "A Third Term for a Popular Chancellor  An Analysis of Voting Behaviour in 2013 German Federal Election."
Angela Merkel, 13, Hoffmann und Campe, Hamburg 2013, .
Angela Merkel, 13, German Politics and Society 31.3 (2013)  43–75.
Angela Merkel, 13, Pantheon, München 2013, .
Angela Merkel, 13, Both CDU/CSU and SPD received a significantly lower proportion of vote than they did in 2013, and attempted to form a coalition with FDP and Greens.
Angela Merkel, 13, Edition Körber Stiftung, Hamburg 2013, .
Angela Merkel, 13, Merkel topped Forbes magazine's list of "The World's 100 Most Powerful Women" in 2006, 2007, 2008, 2009, 2011, 2012, 2013, 2014, 2015, 2016, 2017, 2018, 2019 and 2020.
Angela Merkel, 13, Since mid 1990s, Merkel has publicly mentioned her Polish heritage on several occasions and described herself as a quarter Polish, but her Polish roots became better known as a result of a 2013 biography.
Angela Merkel, 13, At 2013 German federal election 2013 federal election, Merkel's CDU won a landslide victory with 41.5% of vote and formed a second grand coalition with SPD, after FDP lost all of its representation in Bundestag.
Angela Merkel, 13, Angela Merkel  A Chancellorship Forged in Crisis (2013) excerpt
Angela Merkel, 13, "The German federal election of 2013  Merkel’s triumph, disappearance of liberal party, and yet another grand coalition."
Angela Merkel, 13, On American sketch comedy Saturday Night Live, she has been parodied by Kate McKinnon since 2013.
Angela Merkel, 13, Category Members of Bundestag 2009–2013
Angela Merkel, Western, Category Members of Bundestag for Mecklenburg Western Pomerania
Angela Merkel, Welt, Die Kanzlerin und ihre Welt.
Angela Merkel, February, In February 2020, Kramp Karrenbauer announced that she would resign as party leader of CDU in summer, after party members in Thuringia defied her by voting with Alternative for Germany to support an FDP candidate for minister president.
Angela Merkel, February, * 1st Class of Order of Cross of Terra Mariana (23 February 2021)
Angela Merkel, February, As early as February 2001 her rival Friedrich Merz had made clear he intended to become Chancellor of Germany Chancellor Gerhard Schröder's main challenger in 2002 German federal election 2002 election.
Angela Merkel, February, Party Leader Wolfgang Schnur appointed her as press spokeswoman of party in February 1990.
Angela Merkel, February, However, she scored well on her handling of recent euro crisis (69% rated her performance as good rather than poor), and her approval rating reached an all time high of 77% in February 2012 and again in July 2014.
Angela Merkel, Helsinki, In May 2017, Merkel was awarded title of Doctrix Honoris Causa by University of Helsinki.
Angela Merkel, 26 March 2014, On 26 March 2014, Merkel became longest serving incumbent
Angela Merkel, December 2015, In December 2015, she was named Time (magazine)
Angela Merkel, December 2015, In December 2015, Merkel was named as Time magazine's Time Person of Year Person of Year, with magazine's cover declaring her to be "Chancellor of Free World".
Angela Merkel, Time Person, In December 2015, Merkel was named as Time magazine's Time Person of Year Person of Year, with magazine's cover declaring her to be "Chancellor of Free World".
Angela Merkel, Time Person, Category Time Person of Year
Angela Merkel, Time Person, Time magazine's Time Person of Year Person of Year.
Angela Merkel, 100, Merkel has been criticised for being personally present and involved at M100 Media Award handover to Danish cartoonist Kurt Westergaard, who had triggered Jyllands Posten Muhammad cartoons controversy Muhammad cartoons controversy.
Angela Merkel, 100, Category Time 100
Angela Merkel, 100, Merkel topped Forbes magazine's list of "The World's 100 Most Powerful Women" in 2006, 2007, 2008, 2009, 2011, 2012, 2013, 2014, 2015, 2016, 2017, 2018, 2019 and 2020.
Angela Merkel, 100, In 2018, Merkel was named Forbes list of The World's 100 Most Powerful Women most powerful woman in world for a record fourteenth time by Forbes.
Angela Merkel, years, In November 2015, there were talks inside governing coalition to stop family unification for migrants for two years, and to establish "Transit Zones" on border and – for migrants with low chances to get asylum approved – to be housed there until their application is approved.
Angela Merkel, years, Junior coalition partner, Vice Chancellor Sigmar Gabriel said that Germany could take in 500,000 refugees annually for next several years.
Angela Merkel, years, In September 2021, she referred to her party after she leaves chancellery, and said that "after 16 years one does not automatically ... return to chancellery, that was clear to everyone in CDU and CSU", describing close opinion polls about upcoming election.
Angela Merkel, years, In September 2021, after years of evading question, Merkel said she considered herself a feminist.
Angela Merkel, years, After CDU lost 1998 German federal election 1998 federal election, Merkel was elected CDU General Secretary, before becoming party's first female leader and first female Leader of Opposition two years later, in aftermath of a CDU donations scandal donations scandal that toppled Wolfgang Schäuble.
Angela Merkel, Specifically, Specifically, Politico called Merkel "leader of free world" when reporting on her meeting with President Trump.
Angela Merkel, Trump, Obama's farewell visit to Berlin in November 2016 was widely interpreted as passing of torch of global liberal leadership to Merkel as Merkel was seen by many as new standard bearer of liberal democracy since election of Donald Trump as US president.
Angela Merkel, Trump, Following election of Donald Trump, some media have described her as "new leader of free world".
Angela Merkel, Trump, Upon election of Donald Trump Merkel said that "Germany and America are tied by values of democracy, freedom and respect for law and human dignity, independent of origin, skin colour, religion, gender, sexual orientation or political views.
Angela Merkel, Trump, I offer next president of United States, Donald Trump, close cooperation on basis of these values."
Angela Merkel, Trump, Specifically, Politico called Merkel "leader of free world" when reporting on her meeting with President Trump.
Angela Merkel, Trump, Following election of Donald Trump to US presidency in November 2016, Merkel was described by The New York Times as "Liberal West's Last Defender".
Angela Merkel, State, After three occasions where this happened in June 2019, she began to sit down during performances of national anthems during State visits of Mette Frederiksen and Maia Sandu following month.
Angela Merkel, State, United States
Angela Merkel, State, I offer next president of United States, Donald Trump, close cooperation on basis of these values."
Angela Merkel, State, In July 2014 Merkel said trust between Germany and United States could only be restored by talks between two, and she would seek to have talks.
Angela Merkel, State, In July 2013, Merkel defended PRISM (surveillance program) surveillance practices of National Security Agency, and described United States as "our truest ally throughout decades".
Angela Merkel, State, Former US Secretary of State Hillary Clinton described Merkel in 2017 as "most important leader in free world".
Angela Merkel, State, In 2010, New Statesman named Merkel as one of "The World's 50 Most Influential Figures".
Angela Merkel, State, As a condition for getting job, Merkel was told she would need to agree Unofficial collaborator (Stasi) to report on her colleagues to officers of Stasi Ministry for State Security (Stasi).
Angela Merkel, State, In October 2015, Horst Seehofer, Bavarian State Premier and Christian Social Union in Bavaria CSU leader, criticised Merkel's policy of allowing in European migrant crisis hundreds of thousands of migrants from Middle East  "We're now in a state of mind without rules, without system and without order because of a German decision."
Angela Merkel, State, In 2017, Merkel received Elie Wiesel Award from United States Holocaust Memorial Museum.
Angela Merkel, Hillary Clinton, Former US Secretary of State Hillary Clinton described Merkel in 2017 as "most important leader in free world".
Angela Merkel, Harvard University's, She was named as Harvard University's commencement speaker in 2019; Harvard University President Larry Bacow described her as "one of most widely admired and broadly influential statespeople of our time".
Angela Merkel, Harvard University, In May 2019, Merkel was awarded an honorary doctorate from Harvard University.
Angela Merkel, Harvard University, She was named as Harvard University's commencement speaker in 2019; Harvard University President Larry Bacow described her as "one of most widely admired and broadly influential statespeople of our time".
