Angela Merkel, CDU, After Stoiber's defeat in 2002, in addition to her role as CDU Leader, Merkel became Leader of Opposition in Bundestag; Friedrich Merz, who had held post prior to 2002 election, was eased out to make way for Merkel.
Angela Merkel, CDU, General Secretary of CDU, 1998–2000
Angela Merkel, CDU, At 2013 German federal election 2013 federal election, Merkel's CDU won a landslide victory with 41.5% of vote and formed a second grand coalition with SPD, after FDP lost all of its representation in Bundestag.
Angela Merkel, CDU, At 2009 German federal election 2009 federal election, CDU obtained largest share of vote, and Merkel was able to form a coalition government with Free Democratic Party (Germany) Free Democratic Party (FDP).
Angela Merkel, CDU, Many MPs of Merkel's CDU party also voiced dissatisfaction with Merkel.
Angela Merkel, CDU, Following a 1999 CDU contributions scandal party funding scandal that compromised many leading figures of CDU – including Kohl himself and his successor as CDU Leader, Wolfgang Schäuble – Merkel criticised her former mentor publicly and advocated a fresh start for party without him.
Angela Merkel, CDU, After CDU lost 1998 German federal election 1998 federal election, Merkel was elected CDU General Secretary, before becoming party's first female leader and first female Leader of Opposition two years later, in aftermath of a CDU donations scandal donations scandal that toppled Wolfgang Schäuble.
Angela Merkel, CDU, A grand coalition between CDU/CSU and SPD faced challenge that both parties demanded chancellorship.
Angela Merkel, CDU, Neither SPD Green coalition nor CDU/CSU and its preferred coalition partners, Free Democratic Party (Germany) Free Democratic Party, held enough seats to form a majority in Bundestag.
Angela Merkel, Leader of Opposition, A member of Christian Democratic Union of Germany Christian Democratic Union (CDU), she previously served as Leader of Opposition (Germany) leader of Opposition from 2002 to 2005 and as Leader of Christian Democratic Union from 2000 to 2018.
Angela Merkel, Leader of Opposition, Leader of Opposition, 2002–2005
Angela Merkel, Leader of Opposition, After Stoiber's defeat in 2002, in addition to her role as CDU Leader, Merkel became Leader of Opposition in Bundestag; Friedrich Merz, who had held post prior to 2002 election, was eased out to make way for Merkel.
Angela Merkel, Leader of Opposition, After CDU lost 1998 German federal election 1998 federal election, Merkel was elected CDU General Secretary, before becoming party's first female leader and first female Leader of Opposition two years later, in aftermath of a CDU donations scandal donations scandal that toppled Wolfgang Schäuble.
Angela Merkel, 2002, A member of Christian Democratic Union of Germany Christian Democratic Union (CDU), she previously served as Leader of Opposition (Germany) leader of Opposition from 2002 to 2005 and as Leader of Christian Democratic Union from 2000 to 2018.
Angela Merkel, 2002, Category Members of Bundestag 1998–2002
Angela Merkel, 2002, Leader of Opposition, 2002–2005
Angela Merkel, 2002, As early as February 2001 her rival Friedrich Merz had made clear he intended to become Chancellor of Germany Chancellor Gerhard Schröder's main challenger in 2002 German federal election 2002 election.
Angela Merkel, 2002, Category Members of Bundestag 2002–2005
Angela Merkel, 2002, After Stoiber's defeat in 2002, in addition to her role as CDU Leader, Merkel became Leader of Opposition in Bundestag; Friedrich Merz, who had held post prior to 2002 election, was eased out to make way for Merkel.
Angela Merkel, from 2000 to 2018, A member of Christian Democratic Union of Germany Christian Democratic Union (CDU), she previously served as Leader of Opposition (Germany) leader of Opposition from 2002 to 2005 and as Leader of Christian Democratic Union from 2000 to 2018.
Angela Merkel, European Union, Merkel is in favour of a "mandatory solidarity mechanism" for European migrant crisis#Quota system (relocation) relocation of asylum seekers from Italy and Greece to other Member state of European Union EU member states as part of long term solution to Europe's migrant crisis.
Angela Merkel, European Union, Merkel favors EU Ukraine relations#European Union Association Agreement Association Agreement between Ukraine and European Union; but stated in December 2012 that its implementation depends on reforms in Ukraine.
Angela Merkel, European Union, During her tenure as Chancellor, Merkel was frequently referred to as de facto leader of European Union (EU) and most powerful woman in world.
Angela Merkel, European Union, Merkel was widely described as de facto leader of European Union throughout her tenure as Chancellor.
Angela Merkel, European Union, [of government] in European Union.
Angela Merkel, European Union, Merkel has been widely described as de facto leader of European Union throughout her tenure as Chancellor.
Angela Merkel, European Union, She criticised government's support for accession of Turkey to European Union and favoured a "privileged partnership" instead.
Angela Merkel, European Union, European Union is facing biggest test since its foundation and member states must show greater solidarity so that bloc can emerge stronger from economic crisis unleashed by pandemic".
Angela Merkel, European Union, In doing so, she reflected public opinion that grew more hostile toward Turkish membership of European Union.
Angela Merkel, European Union, Merkel feared that unilaterally sending migrants back to neighbouring countries without seeking a multilateral European agreement could endanger stability of European Union.
Angela Merkel, European Union, Some critics blamed European Union Emissions Trading System (EU ETS) and Nuclear power phase out closure of nuclear plants for contributing to 2021–2022 global energy crisis.
Angela Merkel, European Union, She negotiated 2008 European Union stimulus plan focusing on infrastructure spending and public investment to counteract Great Recession.
Angela Merkel, EU, [of government] in EU.
Angela Merkel, EU, Merkel is in favour of a "mandatory solidarity mechanism" for European migrant crisis#Quota system (relocation) relocation of asylum seekers from Italy and Greece to other Member state of European Union EU member states as part of long term solution to Europe's migrant crisis.
Angela Merkel, EU, Merkel favors EU Ukraine relations#European Union Association Agreement Association Agreement between Ukraine and European Union; but stated in December 2012 that its implementation depends on reforms in Ukraine.
Angela Merkel, EU, During her tenure as Chancellor, Merkel was frequently referred to as de facto leader of European Union (EU) and most powerful woman in world.
Angela Merkel, EU, In June 2017, Merkel criticized draft of new US sanctions against Russia that target EU–Russia energy projects, including Nord Stream Nord Stream 2 gas pipeline.
Angela Merkel, EU, Under Seehofer's plan, Germany would reject migrants who have already been deported or have an entry ban and would instruct police to turn away all migrants who have registered elsewhere in EU, no matter if these countries agreed to take them back.
Angela Merkel, EU, In Foreign policy of Angela Merkel government foreign policy, Merkel has emphasised international cooperation, both in context of EU and NATO, and strengthening Transatlantic Economic Council transatlantic economic relations.
Angela Merkel, EU, "Here we have situation where six members, or even seven if you want to add EU, stand against one.
Angela Merkel, EU, The November 2015 Paris attacks prompted a reevaluation of German officials' stance on EU's policy toward migrants.
Angela Merkel, EU, Instead Merkel announced that Germany would also process asylum applications from Syrian refugees if they had come to Germany through other EU countries.
Angela Merkel, EU, Seehofer estimated as many as 30 percent of asylum seekers arriving in Germany claiming to be from Syria are in fact from other countries, and suggested reducing EU funding for member countries that rejected mandatory refugee quotas.
Angela Merkel, EU, Some critics blamed European Union Emissions Trading System (EU ETS) and Nuclear power phase out closure of nuclear plants for contributing to 2021–2022 global energy crisis.
Angela Merkel, EU, On 1 July 2018, Seehofer rejected agreement Merkel had obtained with EU countries as too little and declared his resignation during a meeting of his party's executive, but they refused to accept it.
Angela Merkel, EU, In late August 2015, during height of European migrant crisis, Merkel's government suspended Dublin Regulation European provisions, which stipulated that asylum seekers must seek asylum in first EU country they arrive.
Angela Merkel, World, Merkel is a fervent association football football fan and has been known to listen to games while in Bundestag and to attend games of Germany national football team national team in her official capacity, including 2014 FIFA World Cup Final Germany's 1–0 victory against Argentina in 2014 World Cup Final.
Angela Merkel, World, Torild Skard Skard, Torild (2014) "Angela Merkel" in Women of Power&nbsp;– Half a Century of Female presidents and Prime Ministers Worldwide, Bristol  Policy Press,
Angela Merkel, World, In December 2015, Merkel was named as Time magazine's Time Person of Year Person of Year, with magazine's cover declaring her to be "Chancellor of Free World".
Angela Merkel, World, Merkel was twice been named Forbes list of The World's Most Powerful People world's second most powerful person, following Vladimir Putin, by Forbes magazine, highest ranking ever achieved by a woman.
Angela Merkel, World, In 2010, New Statesman named Merkel as one of "The World's 50 Most Influential Figures".
Angela Merkel, World, At World Economic Forum in Davos, 2013, she said that Europe had only 7% of global population and produced only 25% of global GDP, but that it accounted for almost 50% of global social expenditure.
Angela Merkel, World, Forbes list of The World's Most Powerful People Forbes list of The World's Most Powerful People ranked Merkel as world's second most powerful person in Forbes list of The World's Most Powerful People#2012 and 2015 list (top 10) 2012, highest ranking achieved by a woman since list began in 2009; she was ranked fifth in Forbes list of The World's Most Powerful People#2013 list (top 10) 2013 and Forbes list of The World's Most Powerful People#2014 list (top 10) 2014
Angela Merkel, World, In addition to being first female German chancellor, first to have grown up in former East Germany (though she was born in West), and youngest German chancellor since Second World War, Merkel is also first born after World War II, and first chancellor of Federal Republic with a background in natural sciences.
Angela Merkel, World, Angela Merkel  The Chancellor and Her World  The Authorized Biography (Alma Books, 2014).
Angela Merkel, World, Merkel topped Forbes magazine's list of "The World's 100 Most Powerful Women" in 2006, 2007, 2008, 2009, 2011, 2012, 2013, 2014, 2015, 2016, 2017, 2018, 2019 and 2020.
Angela Merkel, World, In 2018, Merkel was named Forbes list of The World's 100 Most Powerful Women most powerful woman in world for a record fourteenth time by Forbes.
Angela Merkel, 2018, A member of Christian Democratic Union of Germany Christian Democratic Union (CDU), she previously served as Leader of Opposition (Germany) leader of Opposition from 2002 to 2005 and as Leader of Christian Democratic Union from 2000 to 2018.
Angela Merkel, 2018, This view was confirmed when Kramp Karrenbauer – widely seen as chancellor's favourite for post – was voted to succeed Merkel as leader of CDU in December 2018.
Angela Merkel, 2018, On 29 October 2018, Merkel announced that she would not seek reelection as leader of CDU at their party conference in December 2018, but intended to remain as chancellor until 2021 German federal election was held.
Angela Merkel, 2018, The resignations followed October setbacks for CSU in 2018 Bavarian state election Bavarian state election and for CDU in 2018 Hessian state election Hessian state election.
Angela Merkel, 2018, Femina Politica–Zeitschrift für feministische Politikwissenschaft 27.2 (2018)  83–95.
Angela Merkel, 2018, 2018 asylum government crisis
Angela Merkel, 2018, In October 2018, Merkel announced that she would stand down as Leader of CDU at party convention, and would not seek a fifth term as Chancellor in 2021 German federal election 2021 federal election.
Angela Merkel, 2018, In October 2018, Merkel announced that she had decided not to run for re election in 2021 German federal election 2021 federal election.
Angela Merkel, 2018, The Fourth Merkel cabinet was sworn in on 14 March 2018.
Angela Merkel, 2018, In June 2018, Seehofer backed down from a threat to bypass her in disagreement over immigration policy until she would come back on 1 July from attempts to find a solution at European level.
Angela Merkel, 2018, Chairperson of CDU, 2000–2018
Angela Merkel, 2018, She was found in a 2018 survey to be most respected world leader internationally.
Angela Merkel, 2018, In March 2018, CSU's Horst Seehofer took over role of Interior Minister.
Angela Merkel, 2018, Third CDU–SPD grand coalition, 2018–2021
Angela Merkel, 2018, At 2017 German federal election 2017 federal election, Merkel led CDU to become largest party for fourth time; Merkel formed a third grand coalition with SPD and was sworn in for a joint record fourth term as Chancellor on 14 March 2018.
Angela Merkel, 2018, Merkel topped Forbes magazine's list of "The World's 100 Most Powerful Women" in 2006, 2007, 2008, 2009, 2011, 2012, 2013, 2014, 2015, 2016, 2017, 2018, 2019 and 2020.
Angela Merkel, 2018, In 2018, Merkel was named Forbes list of The World's 100 Most Powerful Women most powerful woman in world for a record fourteenth time by Forbes.
Angela Merkel, 2018, On 1 July 2018, Seehofer rejected agreement Merkel had obtained with EU countries as too little and declared his resignation during a meeting of his party's executive, but they refused to accept it.
Angela Merkel, 2018, In June 2018, Merkel said that there had been "no moral or political justification" for post war Flight and expulsion of Germans (1944–50) expulsion of ethnic Germans from Central and Eastern European countries.
Angela Merkel, 2018, During night of 2 July 2018, Seehofer and Merkel announced they had settled their differences and agreed to instead accept a compromise of tighter border control.
Angela Merkel, Lutheran, Instead, she was Confirmation (sacrament)#Lutheran view confirmed.
Angela Merkel, Lutheran, Merkel was born in Hamburg in then West Germany, moving to East Germany as an infant when her father, a Lutheran clergyman, received a pastorate in Perleberg.
Angela Merkel, Lutheran, Merkel's paternal grandfather was originally Catholic but entire family converted to Lutheranism during childhood of her father, who later studied Lutheran theology in Heidelberg University Heidelberg and Hamburg.
Angela Merkel, Lutheran, Angela Merkel is a Lutheran member of Evangelical Church in Berlin, Brandenburg and Silesian Upper Lusatia (link no
Angela Merkel, Lutheran, Merkel was born Angela Dorothea Kasner in 1954, in Hamburg, West Germany, daughter of Horst Kasner (1926–2011; né Kaźmierczak), a Lutheran pastor and a native of Berlin, and his wife Herlind (1928–2019; née Jentzsch), born in Free City of Danzig Danzig (now Gdańsk, Poland), a teacher of English and Latin.
Angela Merkel, Lutheran, Category German Lutherans
Angela Merkel, Lutheran, Evangelische Kirche Berlin Brandenburg schlesische Oberlausitz – EKBO), a United and uniting churches United Protestant (i.e. both Reformed tradition Reformed and Lutheran) Landeskirche church body under umbrella of Evangelical Church in Germany (EKD).
Angela Merkel, Perleberg, Merkel was born in Hamburg in then West Germany, moving to East Germany as an infant when her father, a Lutheran clergyman, received a pastorate in Perleberg.
Angela Merkel, Perleberg, In 1954, when Angela was just three months old, her father received a pastorate at church in  (a quarter of Perleberg in Brandenburg), which was then in East Germany.
Angela Merkel, quantum, Her second and current husband is quantum chemist and professor Joachim Sauer, who has largely remained out of media spotlight.
Angela Merkel, quantum, for her thesis on quantum chemistry in 1986, she worked as a researcher and published several papers.
Angela Merkel, quantum, She obtained a doctorate in quantum chemistry in 1986 and worked as a research scientist until 1989.
Angela Merkel, 1989, Merkel entered politics in wake of Revolutions of 1989, briefly serving as deputy spokesperson for first democratically elected Government of East Germany led by Lothar de Maizière.
Angela Merkel, 1989, German reunification, 1989–1991
Angela Merkel, 1989, The fall of Berlin Wall in November 1989 served as catalyst for Merkel's political career.
Angela Merkel, 1989, She obtained a doctorate in quantum chemistry in 1986 and worked as a research scientist until 1989.
Angela Merkel, Revolutions of 1989, Merkel entered politics in wake of Revolutions of 1989, briefly serving as deputy spokesperson for first democratically elected Government of East Germany led by Lothar de Maizière.
Angela Merkel, Government of East Germany, Merkel entered politics in wake of Revolutions of 1989, briefly serving as deputy spokesperson for first democratically elected Government of East Germany led by Lothar de Maizière.
Angela Merkel, Lothar de Maizière, Merkel entered politics in wake of Revolutions of 1989, briefly serving as deputy spokesperson for first democratically elected Government of East Germany led by Lothar de Maizière.
Angela Merkel, Lothar de Maizière, Merkel was therefore appointed deputy spokesperson of new and last pre German reunification unification government under Lothar de Maizière.
Angela Merkel, Merkel, Seehofer criticised Merkel's decision to allow in migrants, saying that "[they were] in a state of mind without rules, without system and without order because of a German decision."
Angela Merkel, Merkel, Merkel argued that Germany should phase out nuclear power less quickly than Schröder administration had planned.
Angela Merkel, Merkel, Merkel entered politics in wake of Revolutions of 1989, briefly serving as deputy spokesperson for first democratically elected Government of East Germany led by Lothar de Maizière.
Angela Merkel, Merkel, Nikolaus Blome  Angela Merkel – Die Zauderkünstlerin.
Angela Merkel, Merkel, Merkel is a fervent association football football fan and has been known to listen to games while in Bundestag and to attend games of Germany national football team national team in her official capacity, including 2014 FIFA World Cup Final Germany's 1–0 victory against Argentina in 2014 World Cup Final.
Angela Merkel, Merkel, In July 2021, Merkel was awarded title Doctor of Humane Letters, honoris causa from Johns Hopkins University.
Angela Merkel, Merkel, Merkel's approval rating dropped to 54% in October 2015, during European migrant crisis, lowest since 2011.
Angela Merkel, Merkel, Fourth Merkel cabinet Merkel IV (Chancellor)
Angela Merkel, Merkel, In 1990 German federal election German federal election of 1990, first to be held following reunification, Merkel successfully stood for election to Bundestag in parliamentary constituency of Stralsund&nbsp;– Nordvorpommern&nbsp;– Rügen (electoral district)
Angela Merkel, Merkel, Angela Merkel at Encyclopædia Britannica
Angela Merkel, Merkel, Merkel later said that "Life in GDR was sometimes almost comfortable in a certain way, because there were some things one simply couldn't influence.
Angela Merkel, Merkel, In 2006, Merkel expressed concern about Russia in European energy sector overreliance on Russian energy, but she received little support from others in Berlin.
Angela Merkel, Merkel, Merkel supported a substantial reform movement reform agenda for Germany's economic and social system, and was considered more pro market than her own party (CDU).
Angela Merkel, Merkel, Merkel has won international plaudits for her handling of pandemic in Germany.
Angela Merkel, Merkel, In August 2019, 67% of Germans wanted Merkel to stay till end of her term in 2021, while only 29% wanted her to step down earlier.
Angela Merkel, Merkel, Merkel's government decided to phase out both Nuclear power in Germany nuclear power and coal plants and supported European Commission's European Green Deal Green Deal plans.
Angela Merkel, Merkel, The issues are in conflict between CSU who favoured those new measures and threatened to leave coalition without them, and SPD who opposes them; Merkel agreed to measures.
Angela Merkel, Merkel, At school Merkel learned to speak Russian fluently, and was awarded prizes for her proficiency in Russian and mathematics.
Angela Merkel, Merkel, Seehofer attacked Merkel policies in sharp language, threatened to sue government in high court, and hinted that CSU might topple Merkel.
Angela Merkel, Merkel, At conclusion of May 2017 Group of Seven's leaders in Sicily, Merkel criticised American efforts to renege on earlier commitments on climate change.
Angela Merkel, Merkel, Torild Skard Skard, Torild (2014) "Angela Merkel" in Women of Power&nbsp;– Half a Century of Female presidents and Prime Ministers Worldwide, Bristol  Policy Press,
Angela Merkel, Merkel, Merkel is in favour of a "mandatory solidarity mechanism" for European migrant crisis#Quota system (relocation) relocation of asylum seekers from Italy and Greece to other Member state of European Union EU member states as part of long term solution to Europe's migrant crisis.
Angela Merkel, Merkel, Judy Dempsey  Das Phänomen Merkel – Deutschlands Macht und Möglichkeiten.
Angela Merkel, Merkel, As a woman who is a politician from a centre right party and also a scientist, Merkel has been compared by many in English language press to late 20th century British Prime Minister Margaret Thatcher (Thatcher also had a science degree from Oxford University in chemistry).
Angela Merkel, Merkel, Angela Merkel collected news and commentary at The Economist
Angela Merkel, Merkel, The result was so close, both Schröder and Merkel claimed victory.
Angela Merkel, Merkel, In 1977, at age of 23, Merkel, then Angela Kasner, married physics student Ulrich Merkel (born 1953) and took his surname.
Angela Merkel, Merkel, Angela Merkel collected news and commentary at Time (magazine) Time
Angela Merkel, Merkel, Since 2017 Merkel has been seen and filmed to shake visibly on several public occasions, recovering shortly afterwards.
Angela Merkel, Merkel, On 22 November 2005, Merkel assumed office of Chancellor of Germany following a 2005 German federal election stalemate election that resulted in a Grand coalition (Germany) grand coalition with Social Democratic Party of Germany SPD.
Angela Merkel, Merkel, On 26 March 2014, Merkel became longest serving incumbent
Angela Merkel, Merkel, This was compounded by Merkel's proposal to increase VAT to reduce Germany's deficit and fill gap in revenue from a flat tax.
Angela Merkel, Merkel, Third Merkel cabinet Merkel III (Chancellor)
Angela Merkel, Merkel, Reports at time indicated that grand coalition would pursue a mix of policies, some of which differed from Merkel's political platform as leader of opposition and candidate for Chancellor.
Angela Merkel, Merkel, In May 2016, Merkel received International Four Freedoms Award from Roosevelt Foundation in Middelburg, Netherlands.
Angela Merkel, Merkel, Midway through her second term, Merkel's approval plummeted in Germany, resulting in heavy losses in state elections for her party.
Angela Merkel, Merkel, Angela Merkel collected news and commentary at Forbes
Angela Merkel, Merkel, Stefan Kornelius  Angela Merkel.
Angela Merkel, Merkel, Following Merkel's election as CDU Leader, CDU was not able to win in subsequent state elections.
Angela Merkel, Merkel, According to Merkel, discussions were difficult and marred by dissent.
Angela Merkel, Merkel, Merkel favors EU Ukraine relations#European Union Association Agreement Association Agreement between Ukraine and European Union; but stated in December 2012 that its implementation depends on reforms in Ukraine.
Angela Merkel, Merkel, The following day, Merkel stated that government would guarantee private savings account deposits, after all.
Angela Merkel, Merkel, Merkel was born in Hamburg in then West Germany, moving to East Germany as an infant when her father, a Lutheran clergyman, received a pastorate in Perleberg.
Angela Merkel, Merkel, When announcing coalition agreement, Merkel stated that main aim of her government would be to reduce unemployment, and that it was this issue on which her government would be judged.
Angela Merkel, Merkel, On British sketch comedy Tracey Ullman's Show, comedian Tracey Ullman has parodied Merkel to international acclaim with German media dubbing her impersonation as best spoof of Merkel in world.
Angela Merkel, Merkel, In 1968, Merkel joined Free German Youth (FDJ), official communist youth movement sponsored by ruling Marxist–Leninist Socialist Unity Party of Germany.
Angela Merkel, Merkel, Merkel oversaw a string of CDU election victories in six out of seven state elections in 1999, breaking long standing SPD Green hold on Bundesrat of Germany Bundesrat.
Angela Merkel, Merkel, "A Spectre Haunting Europe  Angela Merkel and Challenges of Far Right Populism."
Angela Merkel, Merkel, Angela Merkel (2008), for middle schools online
Angela Merkel, Merkel, On 25 September 2007, Merkel met 14th Dalai Lama for "private and informal talks" in German Chancellery Chancellery in Berlin amid protest from China.
