Angela Merkel, Ukrainian, Category People of Russo Ukrainian War
Angela Merkel, Ukrainian, In 1986, she was able to travel freely to West Germany to attend a congress; she also participated in a multi week language course in Donetsk, in then Ukrainian Soviet Socialist Republic.
Angela Merkel, Ukrainian, Ukrainian president Volodymyr Zelenskyy also blamed Merkel and then French president Nicolas Sarkozy's decision to block Ukraine from joining NATO in 2008 for war; Merkel released a statement that she stands by her decision.
Angela Merkel, Socialist Republic, In 1986, she was able to travel freely to West Germany to attend a congress; she also participated in a multi week language course in Donetsk, in then Ukrainian Soviet Socialist Republic.
Angela Merkel, Wie Angela Merkel, Wie Angela Merkel Deutschland umbaut.
Angela Merkel, 1989–1991, German reunification, 1989–1991
Angela Merkel, 017, In January 2017, she was awarded title Doctor Honoris Causa jointly by Ghent University and Katholieke Universiteit Leuven.
Angela Merkel, 017, At conclusion of May 2017 Group of Seven's leaders in Sicily, Merkel criticised American efforts to renege on earlier commitments on climate change.
Angela Merkel, 017, Since 2017 Merkel has been seen and filmed to shake visibly on several public occasions, recovering shortly afterwards.
Angela Merkel, 017, She hosted twelfth meeting at 2017 G20 Hamburg summit.
Angela Merkel, 017, The migrant crisis spurred right wing electoral preferences across Germany with Alternative for Germany (AfD) gaining 12% of vote in 2017 German federal election.
Angela Merkel, 017, According to another poll taken in November 2016, 59% were to found to be in favour of a renewed Chancellor candidature of Merkel in 2017.
Angela Merkel, 017, In June 2017, Merkel criticized draft of new US sanctions against Russia that target EU–Russia energy projects, including Nord Stream Nord Stream 2 gas pipeline.
Angela Merkel, 017, Becoming Madam Chancellor  Angela Merkel and Berlin Republic (2017) excerpt
Angela Merkel, 017, Plickert, Philip (Editor) (2017) "Merkel  Eine kritische Bilanz", FinanzBuch Verlag, .
Angela Merkel, 017, "Get party started  The social policy of grand coalition 2013–2017."
Angela Merkel, 017, Former US Secretary of State Hillary Clinton described Merkel in 2017 as "most important leader in free world".
Angela Merkel, 017, Second CDU–SPD grand coalition 2013–2017
Angela Merkel, 017, In 2017 German federal election 2017 federal election, Merkel led her party to victory for fourth time.
Angela Merkel, 017, Following Group of Seven G7 Summit in Italy and NATO Summit in Brussels, Merkel stated on 28 May 2017 that US was no longer reliable partner Europe and Germany had depended on in past.
Angela Merkel, 017, Category Members of Bundestag 2017–2021
Angela Merkel, 017, Category Members of Bundestag 2013–2017
Angela Merkel, 017, At 2017 German federal election 2017 federal election, Merkel led CDU to become largest party for fourth time; Merkel formed a third grand coalition with SPD and was sworn in for a joint record fourth term as Chancellor on 14 March 2018.
Angela Merkel, 017, In May 2017, Merkel was awarded title of Doctrix Honoris Causa by University of Helsinki.
Angela Merkel, 017, Merkel topped Forbes magazine's list of "The World's 100 Most Powerful Women" in 2006, 2007, 2008, 2009, 2011, 2012, 2013, 2014, 2015, 2016, 2017, 2018, 2019 and 2020.
Angela Merkel, 017, In 2017, Merkel received Elie Wiesel Award from United States Holocaust Memorial Museum.
Angela Merkel, 017, A YouGov survey published in late December 2017 found that just 36 percent of all respondents wanted Merkel to stay at helm until 2021, while half of those surveyed voters called for a change at top before end of legislature.
Angela Merkel, 1.1, That year, nearly 1.1 million asylum seekers entered Germany.
Angela Merkel, Berlin Wall, The fall of Berlin Wall in November 1989 served as catalyst for Merkel's political career.
Angela Merkel, November 1989, The fall of Berlin Wall in November 1989 served as catalyst for Merkel's political career.
Angela Merkel, one month later, Although she did not participate in crowd celebrations night wall came down, one month later Merkel became involved in growing democracy movement, joining new party Demokratischer Aufbruch (DA, or in English "Democratic Beginning").
Angela Merkel, Demokratischer Aufbruch, Although she did not participate in crowd celebrations night wall came down, one month later Merkel became involved in growing democracy movement, joining new party Demokratischer Aufbruch (DA, or in English "Democratic Beginning").
Angela Merkel, Democratic, Category Members of Bundestag for Christian Democratic Union of Germany
Angela Merkel, Democratic, On 22 November 2005, Merkel assumed office of Chancellor of Germany following a 2005 German federal election stalemate election that resulted in a Grand coalition (Germany) grand coalition with Social Democratic Party of Germany SPD.
Angela Merkel, Democratic, A member of Christian Democratic Union of Germany Christian Democratic Union (CDU), she previously served as Leader of Opposition (Germany) leader of Opposition from 2002 to 2005 and as Leader of Christian Democratic Union from 2000 to 2018.
Angela Merkel, Democratic, Kramp Karrenbauer was succeeded by Armin Laschet at 2021 Christian Democratic Union of Germany leadership election 2021 CDU leadership election.
Angela Merkel, Democratic, The possibility was neither confirmed nor denied by Christian Democratic Union of Germany party.
Angela Merkel, Democratic, After Helmut Kohl Kohl Government was 1998 German federal election defeated at 1998 election, Merkel was appointed Secretary General of Christian Democratic Union of Germany CDU, a key position as party was no longer part of federal government.
Angela Merkel, Democratic, Her party began campaign with a 21 point lead over Social Democratic Party of Germany SPD in national opinion polls, although her personal popularity lagged behind that of incumbent.
Angela Merkel, Democratic, Her party was 2009 German federal election re elected in 2009 with an increased number of seats, and could form a governing coalition with Free Democratic Party (Germany) FDP.
Angela Merkel, Democratic, Following 2005 German federal election 2005 federal election, Merkel was appointed to succeed Gerhard Schröder as Chancellor of Germany, leading a Grand coalition (Germany) grand coalition consisting of CDU, its Bavarian sister party Christian Social Union in Bavaria Christian Social Union (CSU) and Social Democratic Party of Germany (SPD).
Angela Merkel, Democratic, On 30 May 2005, Merkel won CDU/CSU nomination as challenger to Chancellor Gerhard Schröder of Social Democratic Party of Germany SPD in 2005 German federal election 2005 national elections.
Angela Merkel, Democratic, Horst Seehofer, leader of Christian Social Union in Bavaria (CSU)sister party of Merkel's Christian Democratic Union of Germany Christian Democratic Unionand then Bavarian Minister President, attacked Merkel's policies.
Angela Merkel, Democratic, In October 2010, Merkel told a meeting of younger members of her conservative Christian Democratic Union (CDU) party at Potsdam that attempts to build a multicultural society in Germany had "utterly failed," stating that  "The concept that we are now living side by side and are happy about it" does not work and "we feel attached to Christian concept of mankind, that is what defines us.
Angela Merkel, Democratic, In April 1990, DA merged with Christian Democratic Union (East Germany) East German Christian Democratic Union, which in turn merged with its western counterpart after reunification.
Angela Merkel, Democratic, Meanwhile, Yasmin Fahimi, secretary general of Social Democratic Party of Germany Social Democratic Party (SPD), junior partner of ruling coalition, praised Merkel's policy allowing migrants in Hungary to enter Germany as "a strong signal of humanity to show that Europe's values are valid also in difficult times".
Angela Merkel, Democratic, Although she did not participate in crowd celebrations night wall came down, one month later Merkel became involved in growing democracy movement, joining new party Demokratischer Aufbruch (DA, or in English "Democratic Beginning").
Angela Merkel, Democratic, At 2009 German federal election 2009 federal election, CDU obtained largest share of vote, and Merkel was able to form a coalition government with Free Democratic Party (Germany) Free Democratic Party (FDP).
Angela Merkel, Democratic, Category Christian Democratic Union of Germany politicians
Angela Merkel, Democratic, The Democratic Beginning DA sunk as a result, only managing to elect four members to Volkskammer.
Angela Merkel, Democratic, Neither SPD Green coalition nor CDU/CSU and its preferred coalition partners, Free Democratic Party (Germany) Free Democratic Party, held enough seats to form a majority in Bundestag.
Angela Merkel, Wolfgang Schnur, Merkel had impressed de Maiziere with her adept dealing with journalists questioning role of a party leader, Wolfgang Schnur, as an "Unofficial collaborator informal co worker" with Stasi homeland security services.
Angela Merkel, Wolfgang Schnur, Party Leader Wolfgang Schnur appointed her as press spokeswoman of party in February 1990.
Angela Merkel, February 1990, Party Leader Wolfgang Schnur appointed her as press spokeswoman of party in February 1990.
Angela Merkel, Schnur, However, Schnur was revealed to have worked for Stasi just a few weeks ahead of 1990 East German general election first (and only) multi party election in 1990 and was later expelled from party.
Angela Merkel, Schnur, Merkel had impressed de Maiziere with her adept dealing with journalists questioning role of a party leader, Wolfgang Schnur, as an "Unofficial collaborator informal co worker" with Stasi homeland security services.
Angela Merkel, Schnur, Party Leader Wolfgang Schnur appointed her as press spokeswoman of party in February 1990.
Angela Merkel, just a few weeks, However, Schnur was revealed to have worked for Stasi just a few weeks ahead of 1990 East German general election first (and only) multi party election in 1990 and was later expelled from party.
Angela Merkel, East German, Merkel entered politics in wake of Revolutions of 1989, briefly serving as deputy spokesperson for first democratically elected Government of East Germany led by Lothar de Maizière.
Angela Merkel, East German, Merkel was born in Hamburg in then West Germany, moving to East Germany as an infant when her father, a Lutheran clergyman, received a pastorate in Perleberg.
Angela Merkel, East German, She did not participate in secular coming of age ceremony Jugendweihe, however, which was common in East Germany.
Angela Merkel, East German, Having grown up in East Germany, Merkel learned Russian at school and not English.
Angela Merkel, East German, The article describes Angela Merkel's life and career in East Germany and her subsequent rise to Chancellor of Germany following German reunification.
Angela Merkel, East German, However, Schnur was revealed to have worked for Stasi just a few weeks ahead of 1990 East German general election first (and only) multi party election in 1990 and was later expelled from party.
Angela Merkel, East German, Merkel stated that her favorite movie is The Legend of Paul and Paula, an East German movie released in 1973.
Angela Merkel, East German, Such an initiative was unprecedented in East Germany GDR of that period, and initially resisted by university.
Angela Merkel, East German, In April 1990, DA merged with Christian Democratic Union (East Germany) East German Christian Democratic Union, which in turn merged with its western counterpart after reunification.
Angela Merkel, East German, In addition to being first female German chancellor, first to have grown up in former East Germany (though she was born in West), and youngest German chancellor since Second World War, Merkel is also first born after World War II, and first chancellor of Federal Republic with a background in natural sciences.
Angela Merkel, East German, Category East German women in politics
Angela Merkel, East German, Merkel was first woman to be elected as Chancellor, and first Chancellor since reunification to have been raised in former East Germany.
Angela Merkel, East German, In 2016, a documentary film Angela Merkel – The Unexpected, a story about her unexpected rise to power from an East German physicist to most powerful woman in world, was produced by Broadview TV and Mitteldeutscher Rundfunk MDR in collaboration with Arte and Das Erste.
Angela Merkel, East German, In 1954, when Angela was just three months old, her father received a pastorate at church in  (a quarter of Perleberg in Brandenburg), which was then in East Germany.
Angela Merkel, East German, Religion played a key role in Kasner family's migration from West Germany to East Germany.
Angela Merkel, The Democratic Beginning DA, The Democratic Beginning DA sunk as a result, only managing to elect four members to Volkskammer.
Angela Merkel, four, In 2017 German federal election 2017 federal election, Merkel led her party to victory for fourth time.
Angela Merkel, four, Half of Germans did not want her to serve a fourth term in office compared to 42% in favor.
Angela Merkel, four, At 2017 German federal election 2017 federal election, Merkel led CDU to become largest party for fourth time; Merkel formed a third grand coalition with SPD and was sworn in for a joint record fourth term as Chancellor on 14 March 2018.
Angela Merkel, four, In 2018, Merkel was named Forbes list of The World's 100 Most Powerful Women most powerful woman in world for a record fourteenth time by Forbes.
Angela Merkel, four, The Democratic Beginning DA sunk as a result, only managing to elect four members to Volkskammer.
Angela Merkel, Volkskammer, The Democratic Beginning DA sunk as a result, only managing to elect four members to Volkskammer.
Angela Merkel, Crawford, Czuczka, Tony and Alan Crawford.
Angela Merkel, Alan, Czuczka, Tony and Alan Crawford.
Angela Merkel, 22, On 22 November 2005, Merkel assumed office of Chancellor of Germany following a 2005 German federal election stalemate election that resulted in a Grand coalition (Germany) grand coalition with Social Democratic Party of Germany SPD.
Angela Merkel, 22, Following 2022 Russian invasion of Ukraine, Merkel faced renewed criticisms that she had failed to curb Russian president Vladimir Putin's ambitions and aggression by insisting on diplomacy and détente policies.
Angela Merkel, 22, Central European Time CET on 22 November 2005.
Angela Merkel, 22, In July 2019, UN ambassadors from 22 nations, including Germany, signed a joint letter to United Nations Human Rights Council UNHRC condemning China's mistreatment of Uyghurs as well as its mistreatment of other minority groups, urging Chinese government to close Xinjiang re education camps.
Angela Merkel, 22, Women & Language. 42(1)  7 22.
Angela Merkel, 22, Merkel was elected Chancellor by majority of delegates (397 to 217) in newly assembled Bundestag on 22 November 2005, but 51 members of governing coalition voted against her.
Angela Merkel, 22, Some critics blamed European Union Emissions Trading System (EU ETS) and Nuclear power phase out closure of nuclear plants for contributing to 2021–2022 global energy crisis.
Angela Merkel, May 2017, At conclusion of May 2017 Group of Seven's leaders in Sicily, Merkel criticised American efforts to renege on earlier commitments on climate change.
Angela Merkel, May 2017, Following Group of Seven G7 Summit in Italy and NATO Summit in Brussels, Merkel stated on 28 May 2017 that US was no longer reliable partner Europe and Germany had depended on in past.
Angela Merkel, May 2017, In May 2017, Merkel was awarded title of Doctrix Honoris Causa by University of Helsinki.
Angela Merkel, April 1990, In April 1990, DA merged with Christian Democratic Union (East Germany) East German Christian Democratic Union, which in turn merged with its western counterpart after reunification.
Angela Merkel, 1991–1994, Minister for Women and Youth, 1991–1994
Angela Merkel, Nordvorpommern&nbsp, In 1990 German federal election German federal election of 1990, first to be held following reunification, Merkel successfully stood for election to Bundestag in parliamentary constituency of Stralsund&nbsp;– Nordvorpommern&nbsp;– Rügen (electoral district)
Angela Merkel, Günther Krause, She received crucial backing of then influential CDU minister and state party chairman Günther Krause.
Angela Merkel, Günther Krause, In June 1993, Merkel was elected leader of CDU in Mecklenburg Vorpommern, succeeding her former mentor Günther Krause.
Angela Merkel, 2003, She has won re election from this constituency (renamed, with slightly adjusted borders, Vorpommern Rügen – Vorpommern Greifswald I in 2003) at seven federal elections held since then.
Angela Merkel, 2003, In spring of 2003, defying strong public opposition, Merkel came out in favour of 2003 invasion of Iraq, describing it as "unavoidable" and accusing Chancellor Gerhard Schröder of anti Americanism.
Angela Merkel, seven, Merkel oversaw a string of CDU election victories in six out of seven state elections in 1999, breaking long standing SPD Green hold on Bundesrat of Germany Bundesrat.
Angela Merkel, seven, She has won re election from this constituency (renamed, with slightly adjusted borders, Vorpommern Rügen – Vorpommern Greifswald I in 2003) at seven federal elections held since then.
Angela Merkel, seven, "Here we have situation where six members, or even seven if you want to add EU, stand against one.
Angela Merkel, seven, In recognition of importance of People's Republic of China China to German economy, by 2014 Merkel had led seven trade delegations to China since assuming office in 2005.
Angela Merkel, Time, Angela Merkel collected news and commentary at Time (magazine) Time
Angela Merkel, Time, The Asia Times reported that "Unlike certain of her European counterparts, her China diplomacy has focused on non interference in Beijing’s internal affairs.
Angela Merkel, Time, In December 2015, she was named Time (magazine)
Angela Merkel, Time, "The Best of Times, Worst of Times  Angela Merkel, Grand Coalition, and 'Majority Rule' in Germany."
Angela Merkel, Time, In December 2015, Merkel was named as Time magazine's Time Person of Year Person of Year, with magazine's cover declaring her to be "Chancellor of Free World".
Angela Merkel, Time, Category Time Person of Year
Angela Merkel, Time, The Financial Times commented  "Although Ms Merkel stopped short of suggesting that a ceiling on social spending might be one yardstick for measuring competitiveness, she hinted as much in light of soaring social spending in face of an ageing population.
Angela Merkel, Time, The New York Times.
Angela Merkel, Time, Central European Time CET on 22 November 2005.
Angela Merkel, Time, Category Time 100
Angela Merkel, Time, Following election of Donald Trump to US presidency in November 2016, Merkel was described by The New York Times as "Liberal West's Last Defender".
Angela Merkel, Time, Time magazine's Time Person of Year Person of Year.
Angela Merkel, May 2019, In May 2019, Merkel was awarded an honorary doctorate from Harvard University.
Angela Merkel, 1 December 2014, George Packer Packer, George (1 December 2014).
Angela Merkel, New Yorker, The New Yorker  46–63.
Angela Merkel, 9 December 2014, Archived from original on 9 December 2014.
Angela Merkel, 9 December 2014, Retrieved 9 December 2014.
Angela Merkel, one, The ministry was smallest and least powerful one of three ministries that were created from old Ministry for Health, Seniors, Family and Youth.
Angela Merkel, one, Merkel later said that "Life in GDR was sometimes almost comfortable in a certain way, because there were some things one simply couldn't influence.
Angela Merkel, one, In November 2015, there were talks inside governing coalition to stop family unification for migrants for two years, and to establish "Transit Zones" on border and – for migrants with low chances to get asylum approved – to be housed there until their application is approved.
Angela Merkel, one, Merkel has a fear of dogs after being attacked by one in 1995.
Angela Merkel, one, Merkel compared NSA to Stasi when it became known that her mobile phone was tapped by that agency.
Angela Merkel, one, In 1986, she was able to travel freely to West Germany to attend a congress; she also participated in a multi week language course in Donetsk, in then Ukrainian Soviet Socialist Republic.
Angela Merkel, one, In 2019, media outlets speculated that Kramp Karrenbauer might take over Merkel's position as Chancellor of Germany Chancellor sooner than planned if current Grand coalition (Germany) governing coalition proved unsustainable.
Angela Merkel, one, In 2013 German federal election election of September 2013, Merkel won one of most decisive victories in German history, achieving best result for CDU/CSU since reunification and coming within five seats of first absolute majority in Bundestag since 1957.
Angela Merkel, one, The Financial Times commented  "Although Ms Merkel stopped short of suggesting that a ceiling on social spending might be one yardstick for measuring competitiveness, she hinted as much in light of soaring social spending in face of an ageing population.
Angela Merkel, one, In 2010, New Statesman named Merkel as one of "The World's 50 Most Influential Figures".
Angela Merkel, one, She telephoned Israeli Prime Minister Benjamin Netanyahu on 9 July to condemn "without reservation rocket fire on Israel".
Angela Merkel, one, "Here we have situation where six members, or even seven if you want to add EU, stand against one.
Angela Merkel, one, Eurozone crisis
Angela Merkel, one, In September 2021, she referred to her party after she leaves chancellery, and said that "after 16 years one does not automatically ... return to chancellery, that was clear to everyone in CDU and CSU", describing close opinion polls about upcoming election.
Angela Merkel, one, She was named as Harvard University's commencement speaker in 2019; Harvard University President Larry Bacow described her as "one of most widely admired and broadly influential statespeople of our time".
Angela Merkel, one, Although she did not participate in crowd celebrations night wall came down, one month later Merkel became involved in growing democracy movement, joining new party Demokratischer Aufbruch (DA, or in English "Democratic Beginning").
Angela Merkel, one, Since mid 1990s, Merkel has publicly mentioned her Polish heritage on several occasions and described herself as a quarter Polish, but her Polish roots became better known as a result of a 2013 biography.
Angela Merkel, one, After one such occasion she attributed shaking to dehydration, saying that she felt better after a drink of water.
Angela Merkel, one, Anyone who doesn't accept that is in wrong place here."
Angela Merkel, one, As one of Kohl's protégées and his youngest Cabinet Minister, she was frequently referred to by Kohl as mein Mädchen ("my girl").
Angela Merkel, three, The ministry was smallest and least powerful one of three ministries that were created from old Ministry for Health, Seniors, Family and Youth.
Angela Merkel, three, However, after three weeks of negotiation (process) negotiations, two parties reached a deal whereby Merkel would become Chancellor and SPD would hold 8 of 16 seats in cabinet.
Angela Merkel, three, After three occasions where this happened in June 2019, she began to sit down during performances of national anthems during State visits of Mette Frederiksen and Maia Sandu following month.
Angela Merkel, three, Merkel features as a main character in two of three plays that make up Europeans Trilogy (Bruges, Antwerp, and Tervuren) by Paris based UK playwright Nick Awde  Bruges (Edinburgh Festival, 2014) and Tervuren (2016).
Angela Merkel, three, In 1954, when Angela was just three months old, her father received a pastorate at church in  (a quarter of Perleberg in Brandenburg), which was then in East Germany.
Angela Merkel, Ministry for Health, The ministry was smallest and least powerful one of three ministries that were created from old Ministry for Health, Seniors, Family and Youth.
Angela Merkel, Youth, The ministry was smallest and least powerful one of three ministries that were created from old Ministry for Health, Seniors, Family and Youth.
Angela Merkel, Youth, In 1968, Merkel joined Free German Youth (FDJ), official communist youth movement sponsored by ruling Marxist–Leninist Socialist Unity Party of Germany.
Angela Merkel, Youth, Minister for Women and Youth, 1991–1994
Angela Merkel, Youth, Fourth Kohl cabinet Kohl IV (Federal Ministry of Family Affairs, Senior Citizens, Women and Youth Minister for Women and Youth)
Angela Merkel, Youth, Almost immediately following her entry into parliament, Merkel was appointed by Chancellor of Germany Chancellor Helmut Kohl to serve as Federal Ministry of Family Affairs, Senior Citizens, Women and Youth Minister for Women and Youth in Cabinet of Germany federal cabinet.
Angela Merkel, Youth, As protégée of Chancellor Helmut Kohl, Merkel was appointed as Federal Ministry of Family Affairs, Senior Citizens, Women and Youth Minister for Women and Youth in 1991, later becoming Federal Ministry for Environment, Nature Conservation and Nuclear Safety Minister for Environment, Nature Conservation and Nuclear Safety in 1994.
Angela Merkel, November 1991, In November 1991, Merkel, with support of federal CDU, ran for leadership of neighboring CDU in Brandenburg.
Angela Merkel, Ulf Finke, She lost to Ulf Finke; this has been only election to date Merkel has lost.
