Bill Gates, Windows 9x#Windows, The operating system Windows 9x#Windows prior to 95 grew out of DOS in an organic fashion over a decade, until with Windows 95 DOS text screen was relegated to closet.
Bill Gates, 95, The operating system Windows 9x#Windows prior to 95 grew out of DOS in an organic fashion over a decade, until with Windows 95 DOS text screen was relegated to closet.
Bill Gates, 95, , Bill and Melinda Gates were second most generous philanthropists in America, having given over $28&nbsp;billion to charity; couple plan to eventually donate 95% of their wealth to charity.
Bill Gates, 95, William Henry Gates III  (born October 28, 1955) is an American business magnate, software developer, investor, author, and philanthropist.
Bill Gates, 95, Category 1955 births
Bill Gates, 95, Since 1987, Gates has been included in Forbes The World's Billionaires list and was wealthiest person from 1995 to 1996, 1998 to 2007, 2009, and held spot until 2018 before being overtaken by Jeff Bezos.
Bill Gates, 95, The Road Ahead, written with Microsoft executive Nathan Myhrvold and journalist Peter Rinearson, was published in November 1995.
Bill Gates, 95, From 1995 to 2017, he held Forbes title of richest person in world every year except from 2010 to 2013.
Bill Gates, 95, Bill Gates was born in Seattle, Washington (state) Washington on October 28, 1955.
Bill Gates, a decade, The operating system Windows 9x#Windows prior to 95 grew out of DOS in an organic fashion over a decade, until with Windows 95 DOS text screen was relegated to closet.
Bill Gates, a decade, How to Avoid a Climate Disaster (February 2021) presents what Gates learned in over a decade of studying climate change and investing in innovations to address climate problems.
Bill Gates, one year, Windows XP, released one year after Gates stepped down as Microsoft CEO, reportedly was first to not be based on DOS.
Bill Gates, 10, Bill and Melinda Gates have said that they intend to leave their three children $10&nbsp;million each as their inheritance.
Bill Gates, 10, 2010  The Social Network, a film that chronicles development of Facebook.
Bill Gates, 10, Gates received 2010 Bower Award for Business Leadership from The Franklin Institute for his achievements at Microsoft and his philanthropic work.
Bill Gates, 10, In 2010, Gates and Warren Buffett founded The Giving Pledge, whereby they and other billionaires pledge to give at least half of their wealth to philanthropy.
Bill Gates, 10, The Virtual Revolution (2010)
Bill Gates, 10, Gates has also urged rich nations to shift to 100% synthetic beef industries to reduce greenhouse gas emissions from food production.
Bill Gates, 10, Waiting for "Superman" (2010)
Bill Gates, 10, Gates and his wife invited Joan Salwen to Seattle to speak about what family had done, and on December 9, 2010, Bill and Melinda Gates and investor Warren Buffett each signed a commitment they called "Giving Pledge", which is a commitment by all three to donate at least half of their wealth, over course of time, to charity.
Bill Gates, 10, One of these systems was a PDP 10 belonging to Computer Center Corporation (CCC) which banned Gates, Paul Allen, Ric Weiland, and Gates's best friend and first business partner Kent Evans, for summer after it caught them exploiting bugs in operating system to obtain free computer time.
Bill Gates, 10, Mologic, British diagnostic technology company that Gates purchased, along with Soros Economic Development Fund, "which has developed 10 minute Covid lateral flow tests that it aims to make for as little as $1."
Bill Gates, 10, Upside Elite 100 in 1999, and was included in The Guardian as one of "Top 100 influential people in media" in 2001.
Bill Gates, 10, Time magazine named Gates Time 100  The Most Important People of Century one of 100 people who most influenced 20th century, as well as Time 100 one of 100 most influential people of 2004, 2005, and 2006.
Bill Gates, 10, In March 2010, Gates was second wealthiest person after  Carlos Slim, but regained top position in 2013, according to Bloomberg Billionaires List.
Bill Gates, 10, He has not officially been on a development team since working on TRS 80 Model 100, but he wrote code that shipped with company's products as late as 1989.
Bill Gates, 10, In 2011, he said  "If you gave me choice between picking next 10 presidents or ensuring that energy is environmentally friendly and a quarter as costly, I'd pick energy thing.
Bill Gates, 10, Category Time 100
Bill Gates, 10, In response to a question about his greatest fear when he looks 50 years into future, Gates stated  "there'll be some really bad things that'll happen in next 50 or 100 years, but hopefully none of them on scale of, say, a million people that you didn't expect to die from a pandemic, or Nuclear weapon nuclear or bioterrorism."
Bill Gates, 10, From 1995 to 2017, he held Forbes title of richest person in world every year except from 2010 to 2013.
Bill Gates, 10, Also in 2010, he was honored with Silver Buffalo Award by Boy Scouts of America, its highest award for adults, for his service to youth.
Bill Gates, 10, In 1999, his wealth briefly surpassed US$101&nbsp;billion.
Bill Gates, John W. Thompson, Windows 8.1 was last version of OS released before Gates left chair of firm to John W. Thompson on February 5, 2014.
Bill Gates, February 5, 2014, Windows 8.1 was last version of OS released before Gates left chair of firm to John W. Thompson on February 5, 2014.
Bill Gates, Nadella, On February 4, 2014, Gates stepped down as chairman of Microsoft to become "technology advisor" at firm, alongside CEO Satya Nadella.
Bill Gates, Nadella, He stepped down as chairman of board of Microsoft in February 2014 and assumed a new post as technology adviser to support newly appointed CEO Satya Nadella.
Bill Gates, 2021, In June 2021, Gates's company TerraPower and Warren Buffett's PacifiCorp announced first sodium nuclear reactor in Wyoming.
Bill Gates, 2021, In August 2021, Gates said reason he had meetings with Epstein was because Gates hoped Epstein could provide money for philanthropic work, though nothing came of idea.
Bill Gates, 2021, His foundation did, however, establish COVID 19 Therapeutics Accelerator in 2020 to hasten development and evaluation of new and repurposed drugs and biologics to treat patients for COVID 19, and, as of February 2021, Gates expressed that he and Anthony Fauci frequently talk and collaborate on matters including vaccines and other medical innovations to fight pandemic.
Bill Gates, 2021, In 2021, Bill Gates was nominated at 11th annual Streamy Awards for crossover for his personal YouTube channel.
Bill Gates, 2021, The divorce was finalized on August 2, 2021.
Bill Gates, 2021, As of 2021, latest release of OS is known as Windows 11.
Bill Gates, 2021, On February 18, 2021, after Facebook and Twitter had banned Donald Trump from their platforms as a result of 2020 United States presidential election which led to 2021 United States Capitol attack, Gates said a permanent ban of Trump "would be a shame" and would be an "extreme measure".
Bill Gates, 2021, In April 2021, during COVID 19 pandemic, Gates was criticized for suggesting that pharmaceutical companies should hold onto patents for COVID 19 vaccines.
Bill Gates, 2021, Still another shift in public opinion came in 2021 with announcement that he and Melinda were divorcing.
Bill Gates, 2021, On May 3, 2021, Gateses announced they had decided to divorce after 27 years of marriage and 34 years as a couple.
Bill Gates, 2021, How to Avoid a Climate Disaster (February 2021) presents what Gates learned in over a decade of studying climate change and investing in innovations to address climate problems.
Bill Gates, Windows 11, As of 2021, latest release of OS is known as Windows 11.
Bill Gates, 2006, Gates had primary responsibility for Microsoft's product strategy from company's founding from 1975 until 2006.
Bill Gates, 2006, In May 2006, Gates remarked that he wished that he were not richest man in world because he disliked attention it brought.
Bill Gates, 2006, Gates has several investments outside Microsoft, which in 2006 paid him a salary of US$616,667 and US$350,000 bonus totalling US$966,667.
Bill Gates, 2006, In November 2006, he was awarded Order of Aztec Eagle Placard of Order of Aztec Eagle, together with his wife Melinda who was awarded Insignia of same order, both for their philanthropic work around world in areas of health and education, particularly in Mexico, and specifically in program "Un país de lectores".
Bill Gates, 2006, Time magazine named Gates Time 100  The Most Important People of Century one of 100 people who most influenced 20th century, as well as Time 100 one of 100 most influential people of 2004, 2005, and 2006.
Bill Gates, 2006, In January 2006, he was awarded Order of Prince Henry Grand Cross of Order of Prince Henry by President of Portugal Jorge Sampaio
Bill Gates, 2006, On June 15, 2006, Gates announced that he would transition out of his role at Microsoft to dedicate more time to philanthropy.
Bill Gates, 2006, In 2006, he was voted eighth in list of "Heroes of our time".
Bill Gates, 2006, He was given 2006 James C. Morgan Global Humanitarian Award from Tech Awards.
Bill Gates, 80, IBM, leading supplier of computer equipment to commercial enterprises at time, approached Microsoft in July 1980 concerning software for its upcoming personal computer, IBM PC, after Bill Gates's mother, Mary Maxwell Gates, mentioned Microsoft to John Opel, IBM's CEO.
Bill Gates, 80, He was a major entrepreneur of Home computer microcomputer revolution of 1970s and 1980s.
Bill Gates, 80, He has not officially been on a development team since working on TRS 80 Model 100, but he wrote code that shipped with company's products as late as 1989.
Bill Gates, 80, At 17, Gates formed a venture with Allen called Traf O Data to make traffic counters based on Intel 8008 processor.
Bill Gates, 80, In 1975, MITS Altair 8800 was released based on Intel 8080 CPU, and Gates and Allen saw opportunity to start their own computer software company.
Bill Gates, 80, Gates read January 1975 issue of Popular Electronics which demonstrated Altair 8800, and he contacted Micro Instrumentation and Telemetry Systems (MITS) to inform them that he and others were working on a BASIC interpreter for platform.
Bill Gates, 80, In early 1980s, while business partner Paul Allen was undergoing treatments for cancer, Gates — according to Allen — conspired to reduce Allen's share in Microsoft  by issuing himself stock options.
Bill Gates, 49, He is 49th largest private owner of land in US.
Bill Gates, Atari, An Atari executive recalled that he showed Gates a game and defeated him 35 of 37 times.
Bill Gates, 35, Gates has several investments outside Microsoft, which in 2006 paid him a salary of US$616,667 and US$350,000 bonus totalling US$966,667.
Bill Gates, 35, Ginkgo Bioworks, a Biotechnology biotech startup that received $350 million in venture funding in 2019, in part from Gates's investment firm Cascade Investment.
Bill Gates, 35, Gates participated in a $35&nbsp;million round of financing along with other investors.
Bill Gates, 35, An Atari executive recalled that he showed Gates a game and defeated him 35 of 37 times.
Bill Gates, 37, An Atari executive recalled that he showed Gates a game and defeated him 35 of 37 times.
Bill Gates, a month later, When they met again a month later, Gates "won or tied every game.
Bill Gates, early 1980s, In early 1980s, while business partner Paul Allen was undergoing treatments for cancer, Gates — according to Allen — conspired to reduce Allen's share in Microsoft  by issuing himself stock options.
Bill Gates, Bill Gates's, IBM, leading supplier of computer equipment to commercial enterprises at time, approached Microsoft in July 1980 concerning software for its upcoming personal computer, IBM PC, after Bill Gates's mother, Mary Maxwell Gates, mentioned Microsoft to John Opel, IBM's CEO.
Bill Gates, Bill Gates's, The family's Bill Gates's house residence is an Earth sheltering earth sheltered mansion in side of a hill overlooking Lake Washington in Medina, Washington.
Bill Gates, Time, Gates was listed in London Sunday Times power list in 1999, named CEO of year by Chief Executive Officers magazine in 1994, ranked number one in "Top 50 Cyber Elite" by Time in 1998, ranked number two in Upside (magazine)
Bill Gates, Time, Time magazine named Gates Time 100  The Most Important People of Century one of 100 people who most influenced 20th century, as well as Time 100 one of 100 most influential people of 2004, 2005, and 2006.
Bill Gates, Time, Time also collectively named Gates, his wife Melinda and U2's lead singer Bono as 2005 Time Person of Year Persons of Year for their humanitarian efforts.
Bill Gates, Time, Category Time 100
Bill Gates, Time, Financial Times 1 (2013).
Bill Gates, Time, A New York Times article reported that Gates's relationship with convicted sex offender Jeffrey Epstein started in 2011, just a few years after Epstein's conviction, and continued for some years, including a visit to Epstein's house with Melinda in fall of 2013, despite her declared discomfort.
Bill Gates, Time, In 2007, Los Angeles Times criticized foundation for investing its assets in companies that have been accused of worsening poverty, pollution and pharmaceutical firms that do not sell to developing countries.
Bill Gates, Peace Corps, He interrupted presentations with such comments as "that's stupidest thing I've ever heard" and "why don't you just give up your Employee stock option options and join Peace Corps?"
Bill Gates, The Wall Street Journal, The Wall Street Journal reported that Melinda had been meeting with divorce attorneys since 2019, citing interviews that suggested Bill's ties with Jeffrey Epstein was at least one of her concerns.
Bill Gates, over weekend, When subordinates appeared to be procrastinating, he was known to remark sarcastically, "I'll do it over weekend."
Bill Gates, BBC, Gates told BBC, "I've paid more tax than any individual ever, and gladly so&nbsp;... I've paid over $6 billion in taxes."
Bill Gates, BBC, Gates was guest on BBC Radio 4's Desert Island Discs on January 31, 2016, in which he talked about his relationships with his William H. Gates Sr. father and Steve Jobs, meeting Melinda Gates Melinda Ann French, start of Microsoft and some of his habits (for example reading The Economist "from cover to cover every week").
Bill Gates, early years, During Microsoft's early years, Gates was an active software developer, particularly in company's programming language products, but his primary role in most of company's history was as a manager and executive.
Bill Gates, TRS 80 Model 100, He has not officially been on a development team since working on TRS 80 Model 100, but he wrote code that shipped with company's products as late as 1989.
Bill Gates, as late as 1989, He has not officially been on a development team since working on TRS 80 Model 100, but he wrote code that shipped with company's products as late as 1989.
Bill Gates, 1985, Microsoft and Gates launched their first retail version of Microsoft Windows on November 20, 1985, in an attempt to fend off competition from Apple Inc.
Bill Gates, 1985, Jerry Pournelle wrote in 1985 when Gates announced Microsoft Excel  "Bill Gates likes program, not because it's going to make him a lot of money (although I'm sure it will do that), but because it's a neat [(programmer subculture) hack].
Bill Gates, Excel, Jerry Pournelle wrote in 1985 when Gates announced Microsoft Excel  "Bill Gates likes program, not because it's going to make him a lot of money (although I'm sure it will do that), but because it's a neat [(programmer subculture) hack].
Bill Gates, Pournelle, Jerry Pournelle wrote in 1985 when Gates announced Microsoft Excel  "Bill Gates likes program, not because it's going to make him a lot of money (although I'm sure it will do that), but because it's a neat [(programmer subculture) hack].
Bill Gates, June 15, 2006, On June 15, 2006, Gates announced that he would transition out of his role at Microsoft to dedicate more time to philanthropy.
Bill Gates, Ray Ozzie, He gradually divided his responsibilities between two successors when he placed Ray Ozzie in charge of management and Craig Mundie in charge of long term product strategy.
Bill Gates, Craig Mundie, He gradually divided his responsibilities between two successors when he placed Ray Ozzie in charge of management and Craig Mundie in charge of long term product strategy.
Bill Gates, Ozzie, The process took two years to fully transfer his duties to Ozzie and Mundie, and was completed on June 27, 2008.
Bill Gates, Ozzie, He gradually divided his responsibilities between two successors when he placed Ray Ozzie in charge of management and Craig Mundie in charge of long term product strategy.
Bill Gates, Mundie, The process took two years to fully transfer his duties to Ozzie and Mundie, and was completed on June 27, 2008.
Bill Gates, Mundie, He gradually divided his responsibilities between two successors when he placed Ray Ozzie in charge of management and Craig Mundie in charge of long term product strategy.
Bill Gates, June 27, 2008, The process took two years to fully transfer his duties to Ozzie and Mundie, and was completed on June 27, 2008.
Bill Gates, United States, The foundation is organized into five program areas  Global Development Division, Global Health Division, United States Division, and Global Policy & Advocacy Division.
Bill Gates, United States, Gates approved of many decisions that led to United States antitrust law antitrust litigation over Microsoft's business practices.
Bill Gates, United States, *Gates is top private owner of farmland in United States with landholdings owned via Cascade Investment totalling 242,000 acres across 19 states.
Bill Gates, United States, On February 18, 2021, after Facebook and Twitter had banned Donald Trump from their platforms as a result of 2020 United States presidential election which led to 2021 United States Capitol attack, Gates said a permanent ban of Trump "would be a shame" and would be an "extreme measure".
Bill Gates, United States, Category Members of United States National Academy of Engineering
Bill Gates, United States, In 1998, Gates rejected need for regulation of software industry in testimony before United States Senate.
Bill Gates, United States, In 1998 United States v. Microsoft case, Gates gave Deposition (law) deposition testimony that several journalists characterized as evasive.
Bill Gates, United States, Cascade Investment LLC, a private investment and holding company incorporated in United States, founded and controlled by Gates and headquartered in Kirkland, Washington.
Bill Gates, 1998, Gates was listed in London Sunday Times power list in 1999, named CEO of year by Chief Executive Officers magazine in 1994, ranked number one in "Top 50 Cyber Elite" by Time in 1998, ranked number two in Upside (magazine)
Bill Gates, 1998, He was named Honorary Member of American Library Association in 1998.
Bill Gates, 1998, Since 1987, Gates has been included in Forbes The World's Billionaires list and was wealthiest person from 1995 to 1996, 1998 to 2007, 2009, and held spot until 2018 before being overtaken by Jeff Bezos.
Bill Gates, 1998, In 1998, he reportedly paid $30 million for original 1885 maritime painting Lost on Grand Banks, at time a record price for an American painting.
Bill Gates, 1998, In 1998, Gates rejected need for regulation of software industry in testimony before United States Senate.
Bill Gates, 1998, In 1998 United States v. Microsoft case, Gates gave Deposition (law) deposition testimony that several journalists characterized as evasive.
Bill Gates, 1998, Nerds 2.0.1 (1998)
Bill Gates, David Boies, He argued with examiner David Boies over contextual meaning of words such as "compete", "concerned", and "we".
Bill Gates, Later in year, Later in year, when portions of videotaped deposition were played back in court, judge was seen laughing and shaking his head.
Bill Gates, Boies, Gates later said that he had simply resisted attempts by Boies to mischaracterize his words and actions.
Bill Gates, Boies, "Did I fence with Boies?&nbsp;...
Bill Gates, Boies, I plead guilty&nbsp;... rudeness to Boies in first degree."
Bill Gates, Boies, He argued with examiner David Boies over contextual meaning of words such as "compete", "concerned", and "we".
Bill Gates, guilty&nbsp, I plead guilty&nbsp;... rudeness to Boies in first degree."
Bill Gates, Wired (, Category Wired (magazine) people
Bill Gates, Bloomberg Billionaires Index, According to Bloomberg Billionaires Index, Gates was world's highest earning billionaire in 2013, as his net worth increased by US$15.8&nbsp;billion to US$78.5&nbsp;billion.
Bill Gates, US$15.8&nbsp;billion, According to Bloomberg Billionaires Index, Gates was world's highest earning billionaire in 2013, as his net worth increased by US$15.8&nbsp;billion to US$78.5&nbsp;billion.
Bill Gates, 78.5&nbsp;billion, According to Bloomberg Billionaires Index, Gates was world's highest earning billionaire in 2013, as his net worth increased by US$15.8&nbsp;billion to US$78.5&nbsp;billion.
Bill Gates, Four Seasons Hotels and Resorts, , most of Gates's assets are held in Cascade Investment LLC, an entity through which he owns stakes in numerous businesses, including Four Seasons Hotels and Resorts, and Corbis Corporation Corbis Corp.
Bill Gates, Corbis Corporation Corbis Corp., , most of Gates's assets are held in Cascade Investment LLC, an entity through which he owns stakes in numerous businesses, including Four Seasons Hotels and Resorts, and Corbis Corporation Corbis Corp.
Bill Gates, February 4, 2014, On February 4, 2014, Gates stepped down as chairman of Microsoft to become "technology advisor" at firm, alongside CEO Satya Nadella.
Bill Gates, 4, 2014, On February 4, 2014, Gates stepped down as chairman of Microsoft to become "technology advisor" at firm, alongside CEO Satya Nadella.
Bill Gates, March 27, 2014, Gates provided his perspective on a range of issues in a substantial interview that was published in March 27, 2014, issue of Rolling Stone magazine.
Bill Gates, Rolling Stone, In an interview with Rolling Stone, Gates said in regard to his faith  "The moral systems of religion, I think, are super important.
Bill Gates, Rolling Stone, Gates provided his perspective on a range of issues in a substantial interview that was published in March 27, 2014, issue of Rolling Stone magazine.
Bill Gates, America, Federer and Gates played against John Isner, top ranked American player for much of this decade, and Mike McCready, lead guitarist for Pearl Jam.
Bill Gates, America, Category 20th century American businesspeople
Bill Gates, America, Category American corporate directors
Bill Gates, America, In interview, Gates provided his perspective on climate change, his charitable activities, various tech companies and people involved in them, and state of America.
Bill Gates, America, Category American technology company founders
Bill Gates, America, Category American people of German descent
Bill Gates, America, Category American computer programmers
Bill Gates, America, Category American people of English descent
Bill Gates, America, Category American investors
Bill Gates, America, Category American nonprofit chief executives
Bill Gates, America, Category American humanitarians
Bill Gates, America, Gates also identified innovation as "real driver of progress" and pronounced that "America's way better today than it's ever been.
Bill Gates, America, His father was a prominent lawyer, and his mother served on board of directors for First Interstate BancSystem and United Way of America.
Bill Gates, America, Category American people of Scottish descent
Bill Gates, America, 2015  Steve Jobs vs. Bill Gates  The Competition to Control Personal Computer, 1974–1999  Original film from National Geographic Channel for American Genius series.
Bill Gates, America, List of richest Americans in history
Bill Gates, America, , Bill and Melinda Gates were second most generous philanthropists in America, having given over $28&nbsp;billion to charity; couple plan to eventually donate 95% of their wealth to charity.
Bill Gates, America, He was named Honorary Member of American Library Association in 1998.
Bill Gates, America, Category American billionaires
Bill Gates, America, William Henry Gates III  (born October 28, 1955) is an American business magnate, software developer, investor, author, and philanthropist.
Bill Gates, America, Category American philanthropists
Bill Gates, America, In 1987, Gates was listed as a billionaire in Forbes magazine's 400 Richest People in America issue, worth $1.25&nbsp;billion at time, and was world's youngest self made billionaire.
Bill Gates, America, Category American software engineers
Bill Gates, America, I mean, you know, we ask you to wear pants, and no American says, or very few Americans say, that that's, like, some terrible thing.
Bill Gates, America, Category American chairpersons of corporations
Bill Gates, America, Category American people of Scotch Irish descent
Bill Gates, America, Their opponents were Jack Sock, one of top American players and a grand slam winner in doubles, and Savannah Guthrie, a co anchor for NBC's Today (U.S. TV program)
Bill Gates, America, Category American inventors
Bill Gates, America, Category 21st century American businesspeople
Bill Gates, America, In 1998, he reportedly paid $30 million for original 1885 maritime painting Lost on Grand Banks, at time a record price for an American painting.
Bill Gates, America, Also in 2010, he was honored with Silver Buffalo Award by Boy Scouts of America, its highest award for adults, for his service to youth.
