Bill Gates, 19, During COVID 19 pandemic, Gates has widely been looked at by media outlets as an expert on issue, despite him not being a Official public official or having any prior Medical education medical training.
Bill Gates, 19, Bloomberg News reported him as saying he argued that Oxford University should not give away rights to its COVID 19 information, as it had announced, but instead sell it to a single industry partner, as it did.
Bill Gates, 19, Entomology Entomologists named Bill Gates' flower fly, Eristalis gatesi, in his honor in 1997.
Bill Gates, 19, They met in 1987 after Melinda began working at Microsoft.
Bill Gates, 19, They dropped hyphen within a year and officially registered trade name "Microsoft" with Secretary of State of New Mexico on November 26, 1976.
Bill Gates, 19, In February 1976, he wrote an Open Letter to Hobbyists in MITS newsletter in which he asserted that more than 90% of users of Microsoft Altair BASIC had not paid Microsoft for it and Altair "hobby market" was in danger of eliminating incentive for any professional developers to produce, distribute, and maintain high quality software.
Bill Gates, 19, The arrangement with CCC continued until 1970 when company went out of business.
Bill Gates, 19, Gates was listed in London Sunday Times power list in 1999, named CEO of year by Chief Executive Officers magazine in 1994, ranked number one in "Top 50 Cyber Elite" by Time in 1998, ranked number two in Upside (magazine)
Bill Gates, 19, Microsoft became independent of MITS in late 1976, and it continued to develop programming language software for various systems.
Bill Gates, 19, Gates purchased Codex Leicester, a collection of scientific writings by Leonardo da Vinci, for US$30.8&nbsp;million at an auction in 1994.
Bill Gates, 19, The Machine That Changed World (1990)
Bill Gates, 19, Gates has received honorary doctorates from Nyenrode Business Universiteit (1996), KTH Royal Institute of Technology (2002), Waseda University (2005), Tsinghua University (2007), Harvard University (2007), Karolinska Institute (2007), and Cambridge University (2009).
Bill Gates, 19, Gates studied work of Andrew Carnegie and John D. Rockefeller, and donated some of his Microsoft stock in 1994 to create "William H. Gates Foundation".
Bill Gates, 19, Jerry Pournelle wrote in 1985 when Gates announced Microsoft Excel  "Bill Gates likes program, not because it's going to make him a lot of money (although I'm sure it will do that), but because it's a neat [(programmer subculture) hack].
Bill Gates, 19, His foundation did, however, establish COVID 19 Therapeutics Accelerator in 2020 to hasten development and evaluation of new and repurposed drugs and biologics to treat patients for COVID 19, and, as of February 2021, Gates expressed that he and Anthony Fauci frequently talk and collaborate on matters including vaccines and other medical innovations to fight pandemic.
Bill Gates, 19, This information and his response to COVID 19 pandemic resulted in some deterioration of his public image, going from "a lovable nerd who was out to save world."
Bill Gates, 19, In 1972, he served as a congressional page in House of Representatives.
Bill Gates, 19, Overdrive  Bill Gates and Race to Control Cyberspace (John Wiley & Sons, Inc., 1997).
Bill Gates, 19, He was a National Merit Scholarship Program National Merit Scholar when he graduated from Lakeside School in 1973.
Bill Gates, 19, During late 1990s, he was Criticism of Microsoft criticized for his business tactics, which have been considered Anti competitive practices anti competitive.
Bill Gates, 19, 2015  Steve Jobs vs. Bill Gates  The Competition to Control Personal Computer, 1974–1999  Original film from National Geographic Channel for American Genius series.
Bill Gates, 19, Upside Elite 100 in 1999, and was included in The Guardian as one of "Top 100 influential people in media" in 2001.
Bill Gates, 19, He was a major entrepreneur of Home computer microcomputer revolution of 1970s and 1980s.
Bill Gates, 19, Gates was number one on Forbes 400 list from 1993 through to 2007, 2009, and 2014 through 2017.
Bill Gates, 19, MITS hired Allen, and Gates took a leave of absence from Harvard to work with him at MITS in November 1975.
Bill Gates, 19, The company moved from Albuquerque to Bellevue, Washington on January 1, 1979.
Bill Gates, 19, In early 1983, Allen left company after receiving a Hodgkin lymphoma diagnosis, effectively ending formal business partnership between Gates and Allen, which had been strained months prior due to a contentious dispute over Microsoft equity.
Bill Gates, 19, Since 1987, Gates has been included in The World's Billionaires Forbes list of world's wealthiest people.
Bill Gates, 19, Inside Bill's Brain  Decoding Bill Gates (2019)
Bill Gates, 19, In 1999, Gates donated $20&nbsp;million to Massachusetts Institute of Technology for construction of a computer laboratory named "William H. Gates Building" that was designed by architect Frank Gehry.
Bill Gates, 19, He was named Honorary Member of American Library Association in 1998.
Bill Gates, 19, In 1975, he and Allen founded Microsoft in Albuquerque, New Mexico.
Bill Gates, 19, DONKEY.BAS, is a computer game written in 1981 and included with early versions of PC DOS operating system distributed with original IBM PC.
Bill Gates, 19, Speed of Thought was published in 1999, and discusses how business and technology are integrated, and shows how digital infrastructures and information networks can help to get an edge on competition.
Bill Gates, 19, He has not officially been on a development team since working on TRS 80 Model 100, but he wrote code that shipped with company's products as late as 1989.
Bill Gates, 19, William Henry Gates III  (born October 28, 1955) is an American business magnate, software developer, investor, author, and philanthropist.
Bill Gates, 19, 1999  Pirates of Silicon Valley, a film that chronicles rise of Apple Inc. Apple and Microsoft from early 1970s to 1997.
Bill Gates, 19, He scored 1590 out of 1600 on SAT Scholastic Aptitude Tests (SAT) and enrolled at Harvard College in autumn of 1973.
Bill Gates, 19, Category 1955 births
Bill Gates, 19, Since 1987, Gates has been included in Forbes The World's Billionaires list and was wealthiest person from 1995 to 1996, 1998 to 2007, 2009, and held spot until 2018 before being overtaken by Jeff Bezos.
Bill Gates, 19, In 1987, Gates was listed as a billionaire in Forbes magazine's 400 Richest People in America issue, worth $1.25&nbsp;billion at time, and was world's youngest self made billionaire.
Bill Gates, 19, *Gates is top private owner of farmland in United States with landholdings owned via Cascade Investment totalling 242,000 acres across 19 states.
Bill Gates, 19, In June 2019, Gates admitted that losing mobile operating system race to Android (operating system)
Bill Gates, 19, Despite his wealth and extensive business travel, Gates flew coach class coach (economy class) in commercial aircraft until 1997, when he bought a private jet.
Bill Gates, 19, He also appeared in a cameo role in 2019 on series finale of Silicon Valley (TV series) Silicon Valley.
Bill Gates, 19, He is son of William H. Gates Sr. (1925–2020) and Mary Maxwell Gates (1929–1994).
Bill Gates, 19, The Wall Street Journal reported that Melinda had been meeting with divorce attorneys since 2019, citing interviews that suggested Bill's ties with Jeffrey Epstein was at least one of her concerns.
Bill Gates, 19, Gates favours normalization of COVID 19 masks.
Bill Gates, 19, In April 2021, during COVID 19 pandemic, Gates was criticized for suggesting that pharmaceutical companies should hold onto patents for COVID 19 vaccines.
Bill Gates, 19, Patents for COVID 19 vaccines
Bill Gates, 19, Gates married Melinda Gates Melinda French on Hawaiian Island of Lanai on January 1, 1994.
Bill Gates, 19, The Road Ahead, written with Microsoft executive Nathan Myhrvold and journalist Peter Rinearson, was published in November 1995.
Bill Gates, 19, From 1995 to 2017, he held Forbes title of richest person in world every year except from 2010 to 2013.
Bill Gates, 19, In 1998, he reportedly paid $30 million for original 1885 maritime painting Lost on Grand Banks, at time a record price for an American painting.
Bill Gates, 19, Gates remained in contact with Paul Allen and joined him at Honeywell during summer of 1974.
Bill Gates, 19, Ginkgo Bioworks, a Biotechnology biotech startup that received $350 million in venture funding in 2019, in part from Gates's investment firm Cascade Investment.
Bill Gates, 19, However, in an interview in 2019 Gates completely denied any connection between Epstein and Gates Foundation or his philanthropy generally.
Bill Gates, 19, In 1994, he was honored as 20th Distinguished Fellow of British Computer Society (DFBCS).
Bill Gates, 19, In 1998, Gates rejected need for regulation of software industry in testimony before United States Senate.
Bill Gates, 19, As of 2019, Gates is largest single shareholder of CN stock.
Bill Gates, 19, Bill Gates was born in Seattle, Washington (state) Washington on October 28, 1955.
Bill Gates, 19, In 1999, his wealth briefly surpassed US$101&nbsp;billion.
Bill Gates, 19, In 1975, MITS Altair 8800 was released based on Intel 8080 CPU, and Gates and Allen saw opportunity to start their own computer software company.
Bill Gates, 19, In 1998 United States v. Microsoft case, Gates gave Deposition (law) deposition testimony that several journalists characterized as evasive.
Bill Gates, 19, Triumph of Nerds (1996)
Bill Gates, 19, Gates read January 1975 issue of Popular Electronics which demonstrated Altair 8800, and he contacted Micro Instrumentation and Telemetry Systems (MITS) to inform them that he and others were working on a BASIC interpreter for platform.
Bill Gates, 19, Nerds 2.0.1 (1998)
Bill Gates, 19, In early 1980s, while business partner Paul Allen was undergoing treatments for cancer, Gates — according to Allen — conspired to reduce Allen's share in Microsoft  by issuing himself stock options.
Bill Gates, 19, On November 15, 2019, he once again became richest person in world after a 48% increase in Microsoft shares, surpassing Bezos.
Bill Gates, 19, Gates was elected Member of US National Academy of Engineering in 1996 "for contributions to founding and development of personal computing".
Bill Gates, 19, In 2019, he began to Fossil fuel divestment divest from fossil fuels.
Bill Gates, US, In October 2017, he was surpassed by Amazon (company) Amazon founder and CEO Jeff Bezos, who had an estimated net worth of US$90.6&nbsp;billion compared to Gates's net worth of US$89.9&nbsp;billion at time.
Bill Gates, US, Between 2009 and 2014, his wealth doubled from US$40&nbsp;billion to more than US$82&nbsp;billion.
Bill Gates, US, Gates has several investments outside Microsoft, which in 2006 paid him a salary of US$616,667 and US$350,000 bonus totalling US$966,667.
Bill Gates, US, Gates purchased Codex Leicester, a collection of scientific writings by Leonardo da Vinci, for US$30.8&nbsp;million at an auction in 1994.
Bill Gates, US, According to Bloomberg Billionaires Index, Gates was world's highest earning billionaire in 2013, as his net worth increased by US$15.8&nbsp;billion to US$78.5&nbsp;billion.
Bill Gates, US, In 2009, property taxes on mansion were reported to be US$1.063&nbsp;million, on a total assessed value of US$147.5&nbsp;million.
Bill Gates, US, He is 49th largest private owner of land in US.
Bill Gates, US, In 1999, his wealth briefly surpassed US$101&nbsp;billion.
Bill Gates, US, Tara Van Ho of University of Essex stated, "Gates speaks as if all lives being lost in India are inevitable but eventually West will help when in reality US & UK are holding their feet on neck of developing states by refusing to break [intellectual property rights] protections.
Bill Gates, US, Gates was elected Member of US National Academy of Engineering in 1996 "for contributions to founding and development of personal computing".
Bill Gates, US, As of April 2022, Gates had an estimated net worth of US$132&nbsp;billion, making him fourth richest person in world.
Bill Gates, 2020, On March 13, 2020, Microsoft announced Gates would be leaving his board positions at Berkshire Hathaway and Microsoft to dedicate his efforts in philanthropic endeavors such as climate change, global health and development, and education.
Bill Gates, 2020, Gates delivered his thoughts in a fireside chat moderated by journalist and news anchor Shereen Bhan virtually at Singapore FinTech Festival on December 8, 2020, on topic, "Building Infrastructure for Resilience  What COVID 19 pandemic COVID 19 Response Can Teach Us About How to Scale Financial Inclusion".
Bill Gates, 2020, His foundation did, however, establish COVID 19 Therapeutics Accelerator in 2020 to hasten development and evaluation of new and repurposed drugs and biologics to treat patients for COVID 19, and, as of February 2021, Gates expressed that he and Anthony Fauci frequently talk and collaborate on matters including vaccines and other medical innovations to fight pandemic.
Bill Gates, 2020, In December 2020, he called for U.S. federal government to create institutes for clean energy research, analogous to National Institutes of Health.
Bill Gates, 2020, In a November 2020 interview, he said  "What are these, like, nudists?
Bill Gates, 2020, In March 2020, Gates left his board positions at Microsoft and Berkshire Hathaway to focus on his philanthropic efforts including climate change, global health and development, and education.
Bill Gates, 2020, He is son of William H. Gates Sr. (1925–2020) and Mary Maxwell Gates (1929–1994).
Bill Gates, 2020, On February 18, 2021, after Facebook and Twitter had banned Donald Trump from their platforms as a result of 2020 United States presidential election which led to 2021 United States Capitol attack, Gates said a permanent ban of Trump "would be a shame" and would be an "extreme measure".
Bill Gates, Warren Buffett, In June 2021, Gates's company TerraPower and Warren Buffett's PacifiCorp announced first sodium nuclear reactor in Wyoming.
Bill Gates, Warren Buffett, In 2010, Gates and Warren Buffett founded The Giving Pledge, whereby they and other billionaires pledge to give at least half of their wealth to philanthropy.
Bill Gates, Warren Buffett, Creative Capitalism  A Conversation With Bill Gates, Warren Buffett, and Other Economic Leaders (Simon and Schuster, 2009).
Bill Gates, Warren Buffett, Gates and his wife invited Joan Salwen to Seattle to speak about what family had done, and on December 9, 2010, Bill and Melinda Gates and investor Warren Buffett each signed a commitment they called "Giving Pledge", which is a commitment by all three to donate at least half of their wealth, over course of time, to charity.
Bill Gates, Warren Buffett, In 2004, he became a director of Berkshire Hathaway, investment company headed by long time friend Warren Buffett.
Bill Gates, at least half, In 2010, Gates and Warren Buffett founded The Giving Pledge, whereby they and other billionaires pledge to give at least half of their wealth to philanthropy.
Bill Gates, at least half, Gates and his wife invited Joan Salwen to Seattle to speak about what family had done, and on December 9, 2010, Bill and Melinda Gates and investor Warren Buffett each signed a commitment they called "Giving Pledge", which is a commitment by all three to donate at least half of their wealth, over course of time, to charity.
Bill Gates, William H. Gates, Gates studied work of Andrew Carnegie and John D. Rockefeller, and donated some of his Microsoft stock in 1994 to create "William H. Gates Foundation".
Bill Gates, William H. Gates, In 1999, Gates donated $20&nbsp;million to Massachusetts Institute of Technology for construction of a computer laboratory named "William H. Gates Building" that was designed by architect Frank Gehry.
Bill Gates, William H. Gates, He is son of William H. Gates Sr. (1925–2020) and Mary Maxwell Gates (1929–1994).
Bill Gates, William H. Gates, Gates was guest on BBC Radio 4's Desert Island Discs on January 31, 2016, in which he talked about his relationships with his William H. Gates Sr. father and Steve Jobs, meeting Melinda Gates Melinda Ann French, start of Microsoft and some of his habits (for example reading The Economist "from cover to cover every week").
Bill Gates, 1925–2020, He is son of William H. Gates Sr. (1925–2020) and Mary Maxwell Gates (1929–1994).
Bill Gates, Mary Maxwell Gates, IBM, leading supplier of computer equipment to commercial enterprises at time, approached Microsoft in July 1980 concerning software for its upcoming personal computer, IBM PC, after Bill Gates's mother, Mary Maxwell Gates, mentioned Microsoft to John Opel, IBM's CEO.
Bill Gates, Mary Maxwell Gates, He is son of William H. Gates Sr. (1925–2020) and Mary Maxwell Gates (1929–1994).
Bill Gates, 1929–1994, He is son of William H. Gates Sr. (1925–2020) and Mary Maxwell Gates (1929–1994).
Bill Gates, German, Category American people of German descent
Bill Gates, German, His ancestry includes English, German, and Irish/Scots Irish.
Bill Gates, Irish, Category American people of Scotch Irish descent
Bill Gates, Irish, His ancestry includes English, German, and Irish/Scots Irish.
Bill Gates, First Interstate BancSystem, His father was a prominent lawyer, and his mother served on board of directors for First Interstate BancSystem and United Way of America.
Bill Gates, United Way of America, His father was a prominent lawyer, and his mother served on board of directors for First Interstate BancSystem and United Way of America.
Bill Gates, J. W. Maxwell, Gates's maternal grandfather was J. W. Maxwell, a national bank president.
Bill Gates, Libby, Gates has an older sister Kristi (Kristianne) and a younger sister Libby.
Bill Gates, William Gates III, He is fourth of his name in his family but is known as William Gates III or "Trey" (i.e., three) because his father had "II" suffix.
Bill Gates, three, Bill and Melinda have three children  Jennifer, Rory and Phoebe.
Bill Gates, three, Bill and Melinda Gates have said that they intend to leave their three children $10&nbsp;million each as their inheritance.
Bill Gates, three, He is fourth of his name in his family but is known as William Gates III or "Trey" (i.e., three) because his father had "II" suffix.
Bill Gates, three, Gates and his wife invited Joan Salwen to Seattle to speak about what family had done, and on December 9, 2010, Bill and Melinda Gates and investor Warren Buffett each signed a commitment they called "Giving Pledge", which is a commitment by all three to donate at least half of their wealth, over course of time, to charity.
Bill Gates, three, Gates has written three books
Bill Gates, three, In 2000, Gates and his wife combined three family foundations and Gates donated stock valued at $5&nbsp;billion to create charitable Bill & Melinda Gates Foundation, which was identified by Funds for NGOs company in 2013, as world's wealthiest charitable foundation, with assets reportedly valued at more than $34.6&nbsp;billion.
Bill Gates, 15, It was founded by Gates in 2015.
Bill Gates, 15, In early 2015, he also appeared with Jimmy Fallon on The Tonight Show and challenged him to see if he could taste difference between this reclaimed water or bottled water.
Bill Gates, 15, Gates spearheaded two initiatives that he announced at 2015 United Nations Climate Change Conference in Paris.
Bill Gates, 15, In 2015, he wrote about challenge of transitioning world's energy system from one based primarily on fossil fuels to one based on sustainable energy sources.
Bill Gates, 15, In an interview that was held at TED (conference) TED conference in March 2015, with Baidu's CEO, Robin Li, Gates said he would "highly recommend" Nick Bostrom's recent work, Superintelligence  Paths, Dangers, Strategies.
Bill Gates, 15, According to Bloomberg Billionaires Index, Gates was world's highest earning billionaire in 2013, as his net worth increased by US$15.8&nbsp;billion to US$78.5&nbsp;billion.
Bill Gates, 15, 2015  Steve Jobs vs. Bill Gates  The Competition to Control Personal Computer, 1974–1999  Original film from National Geographic Channel for American Genius series.
Bill Gates, 15, On June 15, 2006, Gates announced that he would transition out of his role at Microsoft to dedicate more time to philanthropy.
Bill Gates, 15, He scored 1590 out of 1600 on SAT Scholastic Aptitude Tests (SAT) and enrolled at Harvard College in autumn of 1973.
Bill Gates, 15, In 2015, Gates and his wife Melinda received Padma Bhushan, India's third highest civilian award for their social work in country.
Bill Gates, 15, "He started by calling Yao's ideas socialistic," recalls a source familiar with July 15 meeting, "and as he got angrier and angrier and louder and louder, he got into calling them Communistic.
Bill Gates, 15, On November 15, 2019, he once again became richest person in world after a 48% increase in Microsoft shares, surpassing Bezos.
Bill Gates, Sand Point, The family lived in Sand Point, Seattle Sand Point area of Seattle in a home that was damaged by a rare tornado when Gates was seven years old.
Bill Gates, Seattle Sand Point, The family lived in Sand Point, Seattle Sand Point area of Seattle in a home that was damaged by a rare tornado when Gates was seven years old.
Bill Gates, seven years old, The family lived in Sand Point, Seattle Sand Point area of Seattle in a home that was damaged by a rare tornado when Gates was seven years old.
Bill Gates, 100, Gates has also urged rich nations to shift to 100% synthetic beef industries to reduce greenhouse gas emissions from food production.
Bill Gates, 100, Upside Elite 100 in 1999, and was included in The Guardian as one of "Top 100 influential people in media" in 2001.
Bill Gates, 100, Time magazine named Gates Time 100  The Most Important People of Century one of 100 people who most influenced 20th century, as well as Time 100 one of 100 most influential people of 2004, 2005, and 2006.
Bill Gates, 100, He has not officially been on a development team since working on TRS 80 Model 100, but he wrote code that shipped with company's products as late as 1989.
Bill Gates, 100, Category Time 100
Bill Gates, 100, In response to a question about his greatest fear when he looks 50 years into future, Gates stated  "there'll be some really bad things that'll happen in next 50 or 100 years, but hopefully none of them on scale of, say, a million people that you didn't expect to die from a pandemic, or Nuclear weapon nuclear or bioterrorism."
Bill Gates, 47, In 2009, property taxes on mansion were reported to be US$1.063&nbsp;million, on a total assessed value of US$147.5&nbsp;million.
Bill Gates, Congregational, When he was young, his family regularly attended a church of Congregational Christian Churches, a Protestant Reformed denomination.
Bill Gates, Philanthropist, Category Philanthropists from Washington (state)
Bill Gates, 12, According to Forbes, Gates was ranked as fourth most powerful person in world in 2012, up from fifth in 2011.
Bill Gates, 12, The goal of foundation is to provide 120&nbsp;million women and girls, in poorest countries, with high quality contraceptive information and services, with longer term goal of universal access to voluntary family planning.
Bill Gates, 12, * SCoPEx, Keith's academic venture in "sun dimming" geoengineering, which Gates provided most of $12 million for.
Bill Gates, 12, A shareholder agreement in 2012 allowed him to own up to 25% of company, but this agreement was removed.
Bill Gates, World, By 2017, Gates had held top spot on list of The World's Billionaires for 18 out of previous 23 years.
Bill Gates, World, The Machine That Changed World (1990)
Bill Gates, World, Since 1987, Gates has been included in The World's Billionaires Forbes list of world's wealthiest people.
Bill Gates, World, Since 1987, Gates has been included in Forbes The World's Billionaires list and was wealthiest person from 1995 to 1996, 1998 to 2007, 2009, and held spot until 2018 before being overtaken by Jeff Bezos.
Bill Gates, World, The Machine That Changed World (miniseries)
Bill Gates, first, In June 2021, Gates's company TerraPower and Warren Buffett's PacifiCorp announced first sodium nuclear reactor in Wyoming.
Bill Gates, first, Microsoft and Gates launched their first retail version of Microsoft Windows on November 20, 1985, in an attempt to fend off competition from Apple Inc.
Bill Gates, first, One of these systems was a PDP 10 belonging to Computer Center Corporation (CCC) which banned Gates, Paul Allen, Ric Weiland, and Gates's best friend and first business partner Kent Evans, for summer after it caught them exploiting bugs in operating system to obtain free computer time.
Bill Gates, first, IBM first proposed that Microsoft write BASIC interpreter.
Bill Gates, first, While Microsoft had previously given financial support to institution, this was first personal donation received from Gates.
Bill Gates, first, He wrote his first computer program on this machine, an implementation of tic tac toe that allowed users to play games against computer.
Bill Gates, first, The first employee Gates and Allen hired was their high school collaborator Ric Weiland.
Bill Gates, first, Although two companies successfully developed first version of new system, partnership deteriorated due to mounting creative differences.
Bill Gates, first, At first he was perceived as a brilliant but ruthless "robber baron", a "nerd turned tycoon".
Bill Gates, first, Gates said he personally reviewed and often rewrote every line of code that company produced in its first five years.
Bill Gates, first, I plead guilty&nbsp;... rudeness to Boies in first degree."
Bill Gates, first, Lakeside prep school, where he wrote his first software program.
