Bill Gates, Gate, In early 1983, Allen left company after receiving a Hodgkin lymphoma diagnosis, effectively ending formal business partnership between Gates and Allen, which had been strained months prior due to a contentious dispute over Microsoft equity.
Bill Gates, Gate, Since 1987, Gates has been included in The World's Billionaires Forbes list of world's wealthiest people.
Bill Gates, Gate, Gates, who had already invested $1 billion of his own money in innovative energy startups, committed a further $1 billion to Breakthrough Energy.
Bill Gates, Gate, Starting in 2000 with foundation of Bill and Melinda Gates Foundation, and particularly after he stepped down as head of Microsoft, he turned his attention to philanthropy, spending more than $50 billion on causes like health, poverty, and education.
Bill Gates, Gate, , Bill and Melinda Gates were second most generous philanthropists in America, having given over $28&nbsp;billion to charity; couple plan to eventually donate 95% of their wealth to charity.
Bill Gates, Gate, Gates told BBC, "I've paid more tax than any individual ever, and gladly so&nbsp;... I've paid over $6 billion in taxes."
Bill Gates, Gate, bgC3 LLC, a think tank and research company founded by Gates.
Bill Gates, Gate, In March 2020, Gates left his board positions at Microsoft and Berkshire Hathaway to focus on his philanthropic efforts including climate change, global health and development, and education.
Bill Gates, Gate, Inside Bill's Brain  Decoding Bill Gates (2019)
Bill Gates, Gate, In 1999, Gates donated $20&nbsp;million to Massachusetts Institute of Technology for construction of a computer laboratory named "William H. Gates Building" that was designed by architect Frank Gehry.
Bill Gates, Gate, William Henry Gates III  (born October 28, 1955) is an American business magnate, software developer, investor, author, and philanthropist.
Bill Gates, Gate, Bill and Melinda Gates Foundation
Bill Gates, Gate, Gates then turned to Allen who helped him finish system for Lakeside.
Bill Gates, Gate, Since 1987, Gates has been included in Forbes The World's Billionaires list and was wealthiest person from 1995 to 1996, 1998 to 2007, 2009, and held spot until 2018 before being overtaken by Jeff Bezos.
Bill Gates, Gate, Gates approved of many decisions that led to United States antitrust law antitrust litigation over Microsoft's business practices.
Bill Gates, Gate, Gates was a major stake holder early on in project.
Bill Gates, Gate, Gates is a large financial backer.
Bill Gates, Gate, Gates said he personally reviewed and often rewrote every line of code that company produced in its first five years.
Bill Gates, Gate, In October 2017, Gates was surpassed by Amazon (company) Amazon founder Jeff Bezos as richest person in world.
Bill Gates, Gate, In 1987, Gates was listed as a billionaire in Forbes magazine's 400 Richest People in America issue, worth $1.25&nbsp;billion at time, and was world's youngest self made billionaire.
Bill Gates, Gate, In reality, Gates and Allen did not have an Altair and had not written code for it; they merely wanted to gauge MITS's interest.
Bill Gates, Gate, 2017  Half Girlfriend (film) Half Girlfriend, a digitally superimposed likeness of Gates appears in movie in scenes where he comes to visit Madhav's village in Bihar.
Bill Gates, Gate, *Gates is top private owner of farmland in United States with landholdings owned via Cascade Investment totalling 242,000 acres across 19 states.
Bill Gates, Gate, In June 2019, Gates admitted that losing mobile operating system race to Android (operating system)
Bill Gates, Gate, Carbon Engineering, a for profit venture founded by David Keith (scientist) David Keith, which Gates helped fund.
Bill Gates, Gate, This letter was unpopular with many computer hobbyists, but Gates persisted in his belief that software developers should be able to demand payment.
Bill Gates, Gate, Despite his wealth and extensive business travel, Gates flew coach class coach (economy class) in commercial aircraft until 1997, when he bought a private jet.
Bill Gates, Gate, He is son of William H. Gates Sr. (1925–2020) and Mary Maxwell Gates (1929–1994).
Bill Gates, Gate, Branded Entertainment Network Corbis (originally named Interactive Home Systems and now known as Branded Entertainment Network), a digital image licensing and rights services company founded and chaired by Gates.
Bill Gates, Gate, On April 29, 2017, Gates partnered with Swiss tennis legend Roger Federer in playing in Match for Africa#Match for Africa 4 Match for Africa 4, a noncompetitive tennis match at a sold out Key Arena in Seattle.
Bill Gates, Gate, On February 18, 2021, after Facebook and Twitter had banned Donald Trump from their platforms as a result of 2020 United States presidential election which led to 2021 United States Capitol attack, Gates said a permanent ban of Trump "would be a shame" and would be an "extreme measure".
Bill Gates, Gate, Gates considers climate change and Energy access global access to energy to be critical, interrelated issues.
Bill Gates, Gate, Gates said in 2011 about Epstein  "His lifestyle is very different and kind of intriguing although it would not work for me".
Bill Gates, Gate, Gates has a multi billion dollar investment portfolio with stake in various sectors and has participated in several entrepreneurial ventures beyond Microsoft, including
Bill Gates, Gate, Time also collectively named Gates, his wife Melinda and U2's lead singer Bono as 2005 Time Person of Year Persons of Year for their humanitarian efforts.
Bill Gates, Gate, Bill Gates
Bill Gates, Gate, Gates favours normalization of COVID 19 masks.
Bill Gates, Gate, This rapid transition, according to Gates, would depend on increased government funding for basic research and financially risky private sector investment, to enable innovation in diverse areas such as Nuclear power nuclear energy, grid energy storage to facilitate greater use of solar and wind energy, and solar fuels.
Bill Gates, Gate, Also in attendance were representatives of International Peace Institute which has received millions in grants from Gates Foundation, including a $2.5 million "community engagement" grant in October 2013.
Bill Gates, Gate, In April 2021, during COVID 19 pandemic, Gates was criticized for suggesting that pharmaceutical companies should hold onto patents for COVID 19 vaccines.
Bill Gates, Gate, After Mothers Club donation was exhausted, Gates and other students sought time on systems including Digital Equipment Corporation DEC Programmed Data Processor PDP minicomputers.
Bill Gates, Gate, Gates has been accused of bullying Microsoft employees.
Bill Gates, Gate, At 17, Gates formed a venture with Allen called Traf O Data to make traffic counters based on Intel 8008 processor.
Bill Gates, Gate, Gates married Melinda Gates Melinda French on Hawaiian Island of Lanai on January 1, 1994.
Bill Gates, Gate, In response to a question about his greatest fear when he looks 50 years into future, Gates stated  "there'll be some really bad things that'll happen in next 50 or 100 years, but hopefully none of them on scale of, say, a million people that you didn't expect to die from a pandemic, or Nuclear weapon nuclear or bioterrorism."
Bill Gates, Gate, That same year, Gates became an advisory board member of Bloomberg L.P.#Bloomberg New Economy Forum Bloomberg New Economy Forum.
Bill Gates, Gate, Early in his life, Gates observed that his parents wanted him to pursue a law career.
Bill Gates, Gate, The following year, Gates and Federer returned to play in Match for Africa#Match for Africa 5 Match for Africa 5 on March 5, 2018, at San Jose's SAP Center.
Bill Gates, Gate, Melinda Gates suggested that people should emulate philanthropic efforts of Salwen family, who sold their home and gave away half of its value, as detailed in their book, The Power of Half.
Bill Gates, Gate, In 2015, Gates and his wife Melinda received Padma Bhushan, India's third highest civilian award for their social work in country.
Bill Gates, Gate, Gates remained in contact with Paul Allen and joined him at Honeywell during summer of 1974.
Bill Gates, Gate, Gates guest starred as himself in The Simpsons episode "Das Bus".
Bill Gates, Gate, In 2000, Gates and his wife combined three family foundations and Gates donated stock valued at $5&nbsp;billion to create charitable Bill & Melinda Gates Foundation, which was identified by Funds for NGOs company in 2013, as world's wealthiest charitable foundation, with assets reportedly valued at more than $34.6&nbsp;billion.
Bill Gates, Gate, Ginkgo Bioworks, a Biotechnology biotech startup that received $350 million in venture funding in 2019, in part from Gates's investment firm Cascade Investment.
Bill Gates, Gate, Gates says he remembers episode differently.
Bill Gates, Gate, Gates has been criticised for holding a large stake in Signature Aviation, a company that services emissions intensive private jets.
Bill Gates, Gate, Gates left Harvard after two years while Ballmer stayed and graduated magna cum laude.
Bill Gates, Gate, However, in an interview in 2019 Gates completely denied any connection between Epstein and Gates Foundation or his philanthropy generally.
Bill Gates, Gate, https //en.wikipedia.org/wiki/Bill_Gates
Bill Gates, Gate, Gates has an older sister Kristi (Kristianne) and a younger sister Libby.
Bill Gates, Gate, In June 2008, Gates transitioned to a part time role at Microsoft and full time work at Bill & Melinda Gates Foundation, private charitable foundation he and his then wife, Melinda Gates, established in 2000.
Bill Gates, Gate, Despite Gates's denials, judge ruled that Microsoft had committed monopolization, tying (commerce) tying and blocking competition, each in violation of Sherman Antitrust Act.
Bill Gates, Gate, Gates never returned to Harvard to complete his studies.
Bill Gates, Gate, In 1998, Gates rejected need for regulation of software industry in testimony before United States Senate.
Bill Gates, Gate, Category Bill Gates
Bill Gates, Gate, To raise awareness for topic of sanitation and possible solutions, Gates drank water that was "produced from human feces" in 2014&nbsp;– it was produced from a sewage sludge treatment process called Omni Processor.
Bill Gates, Gate, Gates had not offered to transfer copyright on operating system to IBM because he believed that other personal computer makers would clone IBM's PC hardware.
Bill Gates, Gate, As of 2019, Gates is largest single shareholder of CN stock.
Bill Gates, Gate, Bill Gates was born in Seattle, Washington (state) Washington on October 28, 1955.
Bill Gates, Gate, Gates's public image has changed over years.
Bill Gates, Gate, He has given sizable amounts of money to various charitable organizations and scientific research programs through Bill & Melinda Gates Foundation, reported to be world's largest Private foundation private charity.
Bill Gates, Gate, Rather than using system remotely via Teleprinter Teletype, Gates went to CCC's offices and studied source code for various programs that ran on system, including Fortran, Lisp (programming language) Lisp, and machine language.
Bill Gates, Gate, On February 4, 2014, Gates stepped down as chairman of Microsoft to become "technology advisor" at firm, alongside CEO Satya Nadella.
Bill Gates, Gate, Windows XP, released one year after Gates stepped down as Microsoft CEO, reportedly was first to not be based on DOS.
Bill Gates, Gate, Combined with shares owned by Foundation, Gates owns 11.6% of company.
Bill Gates, Gate, Gates participated in a $35&nbsp;million round of financing along with other investors.
Bill Gates, Gate, In 1975, MITS Altair 8800 was released based on Intel 8080 CPU, and Gates and Allen saw opportunity to start their own computer software company.
Bill Gates, Gate, 2009−   Gates has given numerous TED (Conference) TED talks on current concerns such as innovation, education and fighting global diseases
Bill Gates, Gate, In 1998 United States v. Microsoft case, Gates gave Deposition (law) deposition testimony that several journalists characterized as evasive.
Bill Gates, Gate, Tara Van Ho of University of Essex stated, "Gates speaks as if all lives being lost in India are inevitable but eventually West will help when in reality US & UK are holding their feet on neck of developing states by refusing to break [intellectual property rights] protections.
Bill Gates, Gate, "An exclusive interview with Bill Gates".
Bill Gates, Gate, Gates was made an Honorary Order of British Empire Knight Commander of Order of British Empire (KBE) by Queen Elizabeth II in 2005.
Bill Gates, Gate, Cascade Investment LLC, a private investment and holding company incorporated in United States, founded and controlled by Gates and headquartered in Kirkland, Washington.
Bill Gates, Gate, Gates's maternal grandfather was J. W. Maxwell, a national bank president.
Bill Gates, Gate, Gates read January 1975 issue of Popular Electronics which demonstrated Altair 8800, and he contacted Micro Instrumentation and Telemetry Systems (MITS) to inform them that he and others were working on a BASIC interpreter for platform.
Bill Gates, Gate, At time of their marriage, Gates was given permission by Melinda to spend limited time with his ex girlfriend, businesswoman Ann Winblad.
Bill Gates, Gate, On May 3, 2021, Gateses announced they had decided to divorce after 27 years of marriage and 34 years as a couple.
Bill Gates, Gate, How to Avoid a Climate Disaster (February 2021) presents what Gates learned in over a decade of studying climate change and investing in innovations to address climate problems.
Bill Gates, Gate, In early 1980s, while business partner Paul Allen was undergoing treatments for cancer, Gates — according to Allen — conspired to reduce Allen's share in Microsoft  by issuing himself stock options.
Bill Gates, Gate, An Atari executive recalled that he showed Gates a game and defeated him 35 of 37 times.
Bill Gates, Gate, Gates was guest on BBC Radio 4's Desert Island Discs on January 31, 2016, in which he talked about his relationships with his William H. Gates Sr. father and Steve Jobs, meeting Melinda Gates Melinda Ann French, start of Microsoft and some of his habits (for example reading The Economist "from cover to cover every week").
Bill Gates, Gate, A New York Times article reported that Gates's relationship with convicted sex offender Jeffrey Epstein started in 2011, just a few years after Epstein's conviction, and continued for some years, including a visit to Epstein's house with Melinda in fall of 2013, despite her declared discomfort.
Bill Gates, Gate, Allen would also recall that Gates was prone to shouting episodes.
Bill Gates, Gate, Gates was elected Member of US National Academy of Engineering in 1996 "for contributions to founding and development of personal computing".
Bill Gates, Gate, In 2017, François Hollande awarded Bill and Melinda Gates with France's highest national order, Legion of Honour Commander of Legion of Honour, for their charity efforts.
Bill Gates, Gate, Since 2005, Gates and his foundation have taken an interest in solving global sanitation problems.
Bill Gates, Gate, As of April 2022, Gates had an estimated net worth of US$132&nbsp;billion, making him fourth richest person in world.
Bill Gates, Gate, Gates, through his foundation, also donated $20&nbsp;million to Carnegie Mellon University for a new building to be named Gates Center for Computer Science which opened in 2009.
Bill Gates, Gate, Gates added, "It was a huge mistake to spend time with him, to give him credibility of being there."
Bill Gates, Gate, IBM's representatives also mentioned that they needed an operating system, and Gates referred them to Digital Research (DRI), makers of widely used CP/M operating system.
Bill Gates, Gate, When they met again a month later, Gates "won or tied every game.
Bill Gates, 8, 2021, On February 18, 2021, after Facebook and Twitter had banned Donald Trump from their platforms as a result of 2020 United States presidential election which led to 2021 United States Capitol attack, Gates said a permanent ban of Trump "would be a shame" and would be an "extreme measure".
Bill Gates, June 2021, In June 2021, Gates's company TerraPower and Warren Buffett's PacifiCorp announced first sodium nuclear reactor in Wyoming.
Bill Gates, Warren Buffett's, In June 2021, Gates's company TerraPower and Warren Buffett's PacifiCorp announced first sodium nuclear reactor in Wyoming.
Bill Gates, PacifiCorp, In June 2021, Gates's company TerraPower and Warren Buffett's PacifiCorp announced first sodium nuclear reactor in Wyoming.
Bill Gates, Wyoming, In June 2021, Gates's company TerraPower and Warren Buffett's PacifiCorp announced first sodium nuclear reactor in Wyoming.
Bill Gates, Wyoming, Wyoming Senator John Barrasso also said that it could boost state's once active uranium mining industry.
Bill Gates, Wyoming, Wyoming Governor Mark Gordon (politician) Mike Gordon hailed project as a step toward carbon negative nuclear power.
Bill Gates, Mark Gordon, Wyoming Governor Mark Gordon (politician) Mike Gordon hailed project as a step toward carbon negative nuclear power.
Bill Gates, Mike Gordon, Wyoming Governor Mark Gordon (politician) Mike Gordon hailed project as a step toward carbon negative nuclear power.
Bill Gates, John Barrasso, Wyoming Senator John Barrasso also said that it could boost state's once active uranium mining industry.
Bill Gates, United States Senate, In 1998, Gates rejected need for regulation of software industry in testimony before United States Senate.
Bill Gates, FTC, During Federal Trade Commission's (FTC) investigation of Microsoft in 1990s, Gates was reportedly upset at Commissioner Dennis Yao for "float[ing] a line of hypothetical questions suggesting possible curbs on Microsoft's growing monopoly power".
Bill Gates, 1990s, During Federal Trade Commission's (FTC) investigation of Microsoft in 1990s, Gates was reportedly upset at Commissioner Dennis Yao for "float[ing] a line of hypothetical questions suggesting possible curbs on Microsoft's growing monopoly power".
Bill Gates, 1990s, During late 1990s, he was Criticism of Microsoft criticized for his business tactics, which have been considered Anti competitive practices anti competitive.
Bill Gates, Dennis Yao, During Federal Trade Commission's (FTC) investigation of Microsoft in 1990s, Gates was reportedly upset at Commissioner Dennis Yao for "float[ing] a line of hypothetical questions suggesting possible curbs on Microsoft's growing monopoly power".
Bill Gates, Yao, During Federal Trade Commission's (FTC) investigation of Microsoft in 1990s, Gates was reportedly upset at Commissioner Dennis Yao for "float[ing] a line of hypothetical questions suggesting possible curbs on Microsoft's growing monopoly power".
Bill Gates, Yao, "He started by calling Yao's ideas socialistic," recalls a source familiar with July 15 meeting, "and as he got angrier and angrier and louder and louder, he got into calling them Communistic.
Bill Gates, July 15, "He started by calling Yao's ideas socialistic," recalls a source familiar with July 15 meeting, "and as he got angrier and angrier and louder and louder, he got into calling them Communistic.
Bill Gates, Communistic, "He started by calling Yao's ideas socialistic," recalls a source familiar with July 15 meeting, "and as he got angrier and angrier and louder and louder, he got into calling them Communistic.
Bill Gates, Donald Trump Facebook, Donald Trump Facebook ban
Bill Gates, February 18, 2021, On February 18, 2021, after Facebook and Twitter had banned Donald Trump from their platforms as a result of 2020 United States presidential election which led to 2021 United States Capitol attack, Gates said a permanent ban of Trump "would be a shame" and would be an "extreme measure".
Bill Gates, Donald Trump, Donald Trump Facebook ban
Bill Gates, Donald Trump, On February 18, 2021, after Facebook and Twitter had banned Donald Trump from their platforms as a result of 2020 United States presidential election which led to 2021 United States Capitol attack, Gates said a permanent ban of Trump "would be a shame" and would be an "extreme measure".
Bill Gates, Trump, Donald Trump Facebook ban
Bill Gates, Trump, On February 18, 2021, after Facebook and Twitter had banned Donald Trump from their platforms as a result of 2020 United States presidential election which led to 2021 United States Capitol attack, Gates said a permanent ban of Trump "would be a shame" and would be an "extreme measure".
Bill Gates, Max, IBM, leading supplier of computer equipment to commercial enterprises at time, approached Microsoft in July 1980 concerning software for its upcoming personal computer, IBM PC, after Bill Gates's mother, Mary Maxwell Gates, mentioned Microsoft to John Opel, IBM's CEO.
Bill Gates, Max, The Maxwell Dworkin Laboratory of Harvard John A. Paulson School of Engineering and Applied Sciences is named after mothers of both Gates and Microsoft President Steven A. Ballmer, both of whom were students (Ballmer was a member of school's graduating class of 1977, while Gates left his studies for Microsoft), and donated funds for laboratory's construction.
Bill Gates, Max, He is son of William H. Gates Sr. (1925–2020) and Mary Maxwell Gates (1929–1994).
Bill Gates, Max, Gates's maternal grandfather was J. W. Maxwell, a national bank president.
Bill Gates, Tara Van Ho, Tara Van Ho of University of Essex stated, "Gates speaks as if all lives being lost in India are inevitable but eventually West will help when in reality US & UK are holding their feet on neck of developing states by refusing to break [intellectual property rights] protections.
Bill Gates, University of Essex, Tara Van Ho of University of Essex stated, "Gates speaks as if all lives being lost in India are inevitable but eventually West will help when in reality US & UK are holding their feet on neck of developing states by refusing to break [intellectual property rights] protections.
Bill Gates, India, On August 25, 2018, Gates distributed $600,000 through his foundation via UNICEF which is helping flood affected victims in Kerala, India.
Bill Gates, India, In 2015, Gates and his wife Melinda received Padma Bhushan, India's third highest civilian award for their social work in country.
Bill Gates, India, Tara Van Ho of University of Essex stated, "Gates speaks as if all lives being lost in India are inevitable but eventually West will help when in reality US & UK are holding their feet on neck of developing states by refusing to break [intellectual property rights] protections.
Bill Gates, West, Tara Van Ho of University of Essex stated, "Gates speaks as if all lives being lost in India are inevitable but eventually West will help when in reality US & UK are holding their feet on neck of developing states by refusing to break [intellectual property rights] protections.
Bill Gates, UK, Tara Van Ho of University of Essex stated, "Gates speaks as if all lives being lost in India are inevitable but eventually West will help when in reality US & UK are holding their feet on neck of developing states by refusing to break [intellectual property rights] protections.
Bill Gates, Bloomberg News, Bloomberg News reported him as saying he argued that Oxford University should not give away rights to its COVID 19 information, as it had announced, but instead sell it to a single industry partner, as it did.
Bill Gates, Oxford University, Bloomberg News reported him as saying he argued that Oxford University should not give away rights to its COVID 19 information, as it had announced, but instead sell it to a single industry partner, as it did.
Bill Gates, COVID 19, Gates delivered his thoughts in a fireside chat moderated by journalist and news anchor Shereen Bhan virtually at Singapore FinTech Festival on December 8, 2020, on topic, "Building Infrastructure for Resilience  What COVID 19 pandemic COVID 19 Response Can Teach Us About How to Scale Financial Inclusion".
Bill Gates, COVID 19, During conference, Gates warned that world was not prepared for next pandemic, a situation that would come to pass in late 2019 when COVID 19 pandemic began.
Bill Gates, COVID 19, During COVID 19 pandemic, Gates has widely been looked at by media outlets as an expert on issue, despite him not being a Official public official or having any prior Medical education medical training.
Bill Gates, COVID 19, Bloomberg News reported him as saying he argued that Oxford University should not give away rights to its COVID 19 information, as it had announced, but instead sell it to a single industry partner, as it did.
Bill Gates, COVID 19, His foundation did, however, establish COVID 19 Therapeutics Accelerator in 2020 to hasten development and evaluation of new and repurposed drugs and biologics to treat patients for COVID 19, and, as of February 2021, Gates expressed that he and Anthony Fauci frequently talk and collaborate on matters including vaccines and other medical innovations to fight pandemic.
Bill Gates, COVID 19, This information and his response to COVID 19 pandemic resulted in some deterioration of his public image, going from "a lovable nerd who was out to save world."
Bill Gates, COVID 19, Gates favours normalization of COVID 19 masks.
Bill Gates, COVID 19, In April 2021, during COVID 19 pandemic, Gates was criticized for suggesting that pharmaceutical companies should hold onto patents for COVID 19 vaccines.
Bill Gates, COVID 19, Patents for COVID 19 vaccines
Bill Gates, Melinda Gates Foundation, Category Bill & Melinda Gates Foundation people
