Title, Named Entity, Sentence
Sundar Pichai, Sundar Pichai, On December 11, 2018, Sundar Pichai was questioned by U.S. House Judiciary Committee on a range of Google related issues such as possible political bias on Google's platforms, company's alleged plans for a "censored search app" in China, and its privacy practices.
Sundar Pichai, Sundar Pichai, Pichai Sundararajan (born June 10, 1972), better known as Sundar Pichai (), is an Indian American business executive.
Sundar Pichai, Sundar Pichai, Sundar Pichai
Sundar Pichai, Sundar Pichai, "Sundar Pichai's rise to fame in 90 seconds", Tech Gurus, The Daily Telegraph
Sundar Pichai, Indian American, Pichai Sundararajan (born June 10, 1972), better known as Sundar Pichai (), is an Indian American business executive.
Sundar Pichai, American, Category American businesspeople of Indian descent
Sundar Pichai, American, Pichai Sundararajan (born June 10, 1972), better known as Sundar Pichai (), is an Indian American business executive.
Sundar Pichai, American, Category American people of Tamil descent
Sundar Pichai, 2020, If we can do that, 2020 will be remembered not as end of world, but beginning of a world that works better for everyone.
Sundar Pichai, 2020, In October 2020, United States Senate Committee on Commerce, Science, and Transportation unanimously voted in favor of, and on a bipartisan basis, to subpoena Pichai, along with CEOs of Facebook and Twitter, to testify before committee in response to lawmakers' concerns over technology industry's exemption from Section 230 of Communications Decency Act of 1934.
Sundar Pichai, 2020, Pichai was included in Time (magazine) Time's Time 100 annual list of 100 most influential people in 2016 and 2020.
Sundar Pichai, 2020, In December 2020, Pichai delivered a speech virtually at Singapore FinTech Festival emphasizing inclusive digital economy.
Sundar Pichai, 2020, Southeast Asia's Internet economy is currently on verge of a massive transformation......more than 40 million people in region connected to Internet for first time in 2020 – four times as many as year before......while Covid has accelerated use of digital tools, it's also exposed how many people are still left behind......some 1.7 billion people around world are still unbanked, a huge portion of African households do not have access to broadband and millions of women entrepreneurs lack same access to opportunity as their male counterparts.
Sundar Pichai, Pichai Sundararajan, Pichai Sundararajan (born June 10, 1972), better known as Sundar Pichai (), is an Indian American business executive.
Sundar Pichai, Madurai, Born in Madurai, India, Pichai earned his degree from IIT Kharagpur in metallurgical engineering.
Sundar Pichai, Madurai, Category Businesspeople from Madurai
Sundar Pichai, Tamil Nadu, Category People from Tamil Nadu
Sundar Pichai, Tamil Nadu, Pichai was born in Madras (now Chennai), Tamil Nadu, India.
Sundar Pichai, India, Pichai was born in Madras (now Chennai), Tamil Nadu, India.
Sundar Pichai, India, In 2022, Pichai received Padma Bhushan from Government of India, its third highest civilian award.
Sundar Pichai, India, Category American businesspeople of Indian descent
Sundar Pichai, India, Born in Madurai, India, Pichai earned his degree from IIT Kharagpur in metallurgical engineering.
Sundar Pichai, India, Category Indian emigrants to United States
Sundar Pichai, India, Pichai Sundararajan (born June 10, 1972), better known as Sundar Pichai (), is an Indian American business executive.
Sundar Pichai, United States, In October 2020, United States Senate Committee on Commerce, Science, and Transportation unanimously voted in favor of, and on a bipartisan basis, to subpoena Pichai, along with CEOs of Facebook and Twitter, to testify before committee in response to lawmakers' concerns over technology industry's exemption from Section 230 of Communications Decency Act of 1934.
Sundar Pichai, United States, Category Indian emigrants to United States
Sundar Pichai, United States, Moving to United States, he attained an Master of Science M.S. from Stanford University in materials science and engineering and further attained an MBA from Wharton School of University of Pennsylvania, where he was named a Siebel Scholars Siebel Scholar and a Palmer Scholar, respectively.
Sundar Pichai, Alphabet Inc., On October 24, 2015, he stepped into new position at completion of formation of Alphabet Inc., new [company] for Google company family.
Sundar Pichai, Alphabet Inc., Alphabet Inc.
Sundar Pichai, Alphabet Inc., In December 2019, Pichai became CEO of Alphabet Inc.
Sundar Pichai, Alphabet Inc., He is chief executive officer (CEO) of Alphabet Inc. and its subsidiary Google.
Sundar Pichai, Alphabet Inc., Category Alphabet Inc.
Sundar Pichai, Alphabet Inc, On October 24, 2015, he stepped into new position at completion of formation of Alphabet Inc., new [company] for Google company family.
Sundar Pichai, Alphabet Inc, Alphabet Inc.
Sundar Pichai, Alphabet Inc, In December 2019, Pichai became CEO of Alphabet Inc.
Sundar Pichai, Alphabet Inc, He is chief executive officer (CEO) of Alphabet Inc. and its subsidiary Google.
Sundar Pichai, Alphabet Inc, Category Alphabet Inc.
Sundar Pichai, one, If we can do that, 2020 will be remembered not as end of world, but beginning of a world that works better for everyone.
Sundar Pichai, one, On December 11, 2018, Sundar Pichai was questioned by U.S. House Judiciary Committee on a range of Google related issues such as possible political bias on Google's platforms, company's alleged plans for a "censored search app" in China, and its privacy practices.
Sundar Pichai, one, His father also had a manufacturing plant that produced electrical components.
Sundar Pichai, Anjali Pichai, Pichai is married to Anjali Pichai and has two children.
Sundar Pichai, IIT Kharagpur, Born in Madurai, India, Pichai earned his degree from IIT Kharagpur in metallurgical engineering.
Sundar Pichai, IIT Kharagpur, Category IIT Kharagpur alumni
Sundar Pichai, IIT Kharagpur, He earned his degree from IIT Kharagpur in metallurgical engineering and is a distinguished alumnus from that institution.
Sundar Pichai, Pennsylvania, Moving to United States, he attained an Master of Science M.S. from Stanford University in materials science and engineering and further attained an MBA from Wharton School of University of Pennsylvania, where he was named a Siebel Scholars Siebel Scholar and a Palmer Scholar, respectively.
Sundar Pichai, Pennsylvania, He holds an Master of Science M.S. from Stanford University in materials science and engineering, and an MBA from Wharton School of University of Pennsylvania, where he was named a Siebel Scholars Siebel Scholar and a Palmer Scholar, respectively.
Sundar Pichai, Pennsylvania, Category Wharton School of University of Pennsylvania alumni
Sundar Pichai, Alphabet, On October 24, 2015, he stepped into new position at completion of formation of Alphabet Inc., new [company] for Google company family.
Sundar Pichai, Alphabet, Alphabet Inc.
Sundar Pichai, Alphabet, In December 2019, Pichai became CEO of Alphabet Inc.
Sundar Pichai, Alphabet, He was appointed to Alphabet Board of Directors in 2017.
Sundar Pichai, Alphabet, He is chief executive officer (CEO) of Alphabet Inc. and its subsidiary Google.
Sundar Pichai, Alphabet, Category Alphabet Inc.
Sundar Pichai, Google, On October 24, 2015, he stepped into new position at completion of formation of Alphabet Inc., new [company] for Google company family.
Sundar Pichai, Google, Following a short stint at management consulting firm McKinsey & Co., Pichai joined Google in 2004, where he led product management and innovation efforts for a suite of Google's client software products, including Google Chrome and Chrome OS, as well as being largely responsible for Google Drive.
Sundar Pichai, Google, On December 11, 2018, Sundar Pichai was questioned by U.S. House Judiciary Committee on a range of Google related issues such as possible political bias on Google's platforms, company's alleged plans for a "censored search app" in China, and its privacy practices.
Sundar Pichai, Google, In response, Pichai informed committee that Google employees cannot influence search results.
Sundar Pichai, Google, In addition, he went on to oversee development of other applications such as Gmail and Google Maps.
Sundar Pichai, Google, Pichai was selected to become next CEO of Google on August 10, 2015 after previously being appointed Product Chief by CEO, Larry Page.
Sundar Pichai, Google, Pichai joined Google in 2004, where he led product management and innovation efforts for a suite of Google's client software products, including Google Chrome and Chrome OS, as well as being largely responsible for Google Drive.
Sundar Pichai, Google, In August 2017, Pichai drew publicity for firing a Google employee who wrote a ten page Google's Ideological Echo Chamber manifesto criticizing company's diversity policies and arguing that "distribution of preferences and abilities of men and women differ in part due to biological causes and ... these differences may explain why we don't see equal representation of women in tech and leadership".
Sundar Pichai, Google, Category Google employees
Sundar Pichai, Google, In December 2017, Pichai was a speaker at World Internet Conference in China, where he stated that "a lot of work Google does is to help Chinese companies.
Sundar Pichai, Google, There are many small and medium sized businesses in China who take advantage of Google to get their products to many other countries outside of China."
Sundar Pichai, Google, While noting that manifesto raised a number of issues that are open to debate, Pichai said in a memo to Google employees that "to suggest a group of our colleagues have traits that make them less biologically suited to that work is offensive and not OK".
Sundar Pichai, Google, He went on to oversee development of other applications such as Gmail and Google Maps.
Sundar Pichai, Google, Android to list of Google products that he oversaw.
Sundar Pichai, Google, He is chief executive officer (CEO) of Alphabet Inc. and its subsidiary Google.
Sundar Pichai, Google, Pichai was selected to become next CEO of Google on August 10, 2015, after previously being appointed Chief Product Officer Product Chief by CEO Larry Page.
Sundar Pichai, Google, In 2010, Pichai also announced open sourcing of new video codec VP8 by Google and introduced new video format, WebM.
Sundar Pichai, Google, He also stated that Google users can opt out of having their data collected and that "there are no current plans for a censored search engine" in China.
Sundar Pichai, Google, On May 20, 2010, he announced open sourcing of new video codec VP8 by Google and introduced new video format, WebM.
Sundar Pichai, June 10, 1972, Pichai Sundararajan (born June 10, 1972), better known as Sundar Pichai (), is an Indian American business executive.
Sundar Pichai, 5, On October 24, 2015, he stepped into new position at completion of formation of Alphabet Inc., new [company] for Google company family.
Sundar Pichai, 5, Pichai was selected to become next CEO of Google on August 10, 2015 after previously being appointed Product Chief by CEO, Larry Page.
Sundar Pichai, 5, Pichai was selected to become next CEO of Google on August 10, 2015, after previously being appointed Chief Product Officer Product Chief by CEO Larry Page.
Sundar Pichai, 1, On October 24, 2015, he stepped into new position at completion of formation of Alphabet Inc., new [company] for Google company family.
Sundar Pichai, 1, The Chromebook was released in 2012.
Sundar Pichai, 1, On March 13, 2013, Pichai added Android (operating system)
Sundar Pichai, 1, On December 11, 2018, Sundar Pichai was questioned by U.S. House Judiciary Committee on a range of Google related issues such as possible political bias on Google's platforms, company's alleged plans for a "censored search app" in China, and its privacy practices.
Sundar Pichai, 1, In October 2020, United States Senate Committee on Commerce, Science, and Transportation unanimously voted in favor of, and on a bipartisan basis, to subpoena Pichai, along with CEOs of Facebook and Twitter, to testify before committee in response to lawmakers' concerns over technology industry's exemption from Section 230 of Communications Decency Act of 1934.
Sundar Pichai, 1, Category 1972 births
Sundar Pichai, 1, On November 19, 2009, Pichai gave a demonstration of Chrome OS; Chromebook was released for trial and testing in 2011, and released to public in 2012.
Sundar Pichai, 1, In December 2019, Pichai became CEO of Alphabet Inc.
Sundar Pichai, 1, Pichai was selected to become next CEO of Google on August 10, 2015 after previously being appointed Product Chief by CEO, Larry Page.
Sundar Pichai, 1, In August 2017, Pichai drew publicity for firing a Google employee who wrote a ten page Google's Ideological Echo Chamber manifesto criticizing company's diversity policies and arguing that "distribution of preferences and abilities of men and women differ in part due to biological causes and ... these differences may explain why we don't see equal representation of women in tech and leadership".
Sundar Pichai, 1, Pichai was included in Time (magazine) Time's Time 100 annual list of 100 most influential people in 2016 and 2020.
Sundar Pichai, 1, In December 2017, Pichai was a speaker at World Internet Conference in China, where he stated that "a lot of work Google does is to help Chinese companies.
Sundar Pichai, 1, Pichai had been suggested as a contender for Microsoft's CEO in 2014, a position that was eventually given to Satya Nadella.
Sundar Pichai, 1, Pichai Sundararajan (born June 10, 1972), better known as Sundar Pichai (), is an Indian American business executive.
Sundar Pichai, 1, In 2013, Pichai added Android (operating system)
Sundar Pichai, 1, He was appointed to Alphabet Board of Directors in 2017.
Sundar Pichai, 1, Southeast Asia's Internet economy is currently on verge of a massive transformation......more than 40 million people in region connected to Internet for first time in 2020 – four times as many as year before......while Covid has accelerated use of digital tools, it's also exposed how many people are still left behind......some 1.7 billion people around world are still unbanked, a huge portion of African households do not have access to broadband and millions of women entrepreneurs lack same access to opportunity as their male counterparts.
Sundar Pichai, 1, Category Time 100
Sundar Pichai, 1, In May 2021, Pichai talked about technology and AI with Marques Brownlee aka MKBHD.
Sundar Pichai, 1, Pichai was selected to become next CEO of Google on August 10, 2015, after previously being appointed Chief Product Officer Product Chief by CEO Larry Page.
Sundar Pichai, 1, In 2010, Pichai also announced open sourcing of new video codec VP8 by Google and introduced new video format, WebM.
Sundar Pichai, 1, He was a director of Jive Software from April 2011 to July 30, 2013.
Sundar Pichai, 1, On May 20, 2010, he announced open sourcing of new video codec VP8 by Google and introduced new video format, WebM.
Sundar Pichai, Android, On March 13, 2013, Pichai added Android (operating system)
Sundar Pichai, Android, In 2013, Pichai added Android (operating system)
Sundar Pichai, Android, Android to list of Google products that he oversaw.
Sundar Pichai, Android, Android was formerly managed by Andy Rubin.
Sundar Pichai, Sundar Pichai', "Sundar Pichai's rise to fame in 90 seconds", Tech Gurus, The Daily Telegraph
Sundar Pichai, Stanford University, Category Stanford University School of Engineering alumni
Sundar Pichai, Stanford University, Moving to United States, he attained an Master of Science M.S. from Stanford University in materials science and engineering and further attained an MBA from Wharton School of University of Pennsylvania, where he was named a Siebel Scholars Siebel Scholar and a Palmer Scholar, respectively.
Sundar Pichai, Stanford University, He holds an Master of Science M.S. from Stanford University in materials science and engineering, and an MBA from Wharton School of University of Pennsylvania, where he was named a Siebel Scholars Siebel Scholar and a Palmer Scholar, respectively.
Sundar Pichai, MBA, Moving to United States, he attained an Master of Science M.S. from Stanford University in materials science and engineering and further attained an MBA from Wharton School of University of Pennsylvania, where he was named a Siebel Scholars Siebel Scholar and a Palmer Scholar, respectively.
Sundar Pichai, MBA, He holds an Master of Science M.S. from Stanford University in materials science and engineering, and an MBA from Wharton School of University of Pennsylvania, where he was named a Siebel Scholars Siebel Scholar and a Palmer Scholar, respectively.
Sundar Pichai, Wharton School of University of Pennsylvania, Moving to United States, he attained an Master of Science M.S. from Stanford University in materials science and engineering and further attained an MBA from Wharton School of University of Pennsylvania, where he was named a Siebel Scholars Siebel Scholar and a Palmer Scholar, respectively.
Sundar Pichai, Wharton School of University of Pennsylvania, He holds an Master of Science M.S. from Stanford University in materials science and engineering, and an MBA from Wharton School of University of Pennsylvania, where he was named a Siebel Scholars Siebel Scholar and a Palmer Scholar, respectively.
Sundar Pichai, Wharton School of University of Pennsylvania, Category Wharton School of University of Pennsylvania alumni
Sundar Pichai, a Siebel Scholars Siebel Scholar, Moving to United States, he attained an Master of Science M.S. from Stanford University in materials science and engineering and further attained an MBA from Wharton School of University of Pennsylvania, where he was named a Siebel Scholars Siebel Scholar and a Palmer Scholar, respectively.
Sundar Pichai, a Siebel Scholars Siebel Scholar, He holds an Master of Science M.S. from Stanford University in materials science and engineering, and an MBA from Wharton School of University of Pennsylvania, where he was named a Siebel Scholars Siebel Scholar and a Palmer Scholar, respectively.
Sundar Pichai, a Palmer Scholar, Moving to United States, he attained an Master of Science M.S. from Stanford University in materials science and engineering and further attained an MBA from Wharton School of University of Pennsylvania, where he was named a Siebel Scholars Siebel Scholar and a Palmer Scholar, respectively.
Sundar Pichai, a Palmer Scholar, He holds an Master of Science M.S. from Stanford University in materials science and engineering, and an MBA from Wharton School of University of Pennsylvania, where he was named a Siebel Scholars Siebel Scholar and a Palmer Scholar, respectively.
Sundar Pichai, McKinsey & Co., Following a short stint at management consulting firm McKinsey & Co., Pichai joined Google in 2004, where he led product management and innovation efforts for a suite of Google's client software products, including Google Chrome and Chrome OS, as well as being largely responsible for Google Drive.
Sundar Pichai, Pichai, On March 13, 2013, Pichai added Android (operating system)
Sundar Pichai, Pichai, Following a short stint at management consulting firm McKinsey & Co., Pichai joined Google in 2004, where he led product management and innovation efforts for a suite of Google's client software products, including Google Chrome and Chrome OS, as well as being largely responsible for Google Drive.
Sundar Pichai, Pichai, On December 11, 2018, Sundar Pichai was questioned by U.S. House Judiciary Committee on a range of Google related issues such as possible political bias on Google's platforms, company's alleged plans for a "censored search app" in China, and its privacy practices.
Sundar Pichai, Pichai, Pichai began his career as a materials engineer.
Sundar Pichai, Pichai, In response, Pichai informed committee that Google employees cannot influence search results.
Sundar Pichai, Pichai, In October 2020, United States Senate Committee on Commerce, Science, and Transportation unanimously voted in favor of, and on a bipartisan basis, to subpoena Pichai, along with CEOs of Facebook and Twitter, to testify before committee in response to lawmakers' concerns over technology industry's exemption from Section 230 of Communications Decency Act of 1934.
Sundar Pichai, Pichai, Pichai was born in Madras (now Chennai), Tamil Nadu, India.
Sundar Pichai, Pichai, On November 19, 2009, Pichai gave a demonstration of Chrome OS; Chromebook was released for trial and testing in 2011, and released to public in 2012.
Sundar Pichai, Pichai, In 2022, Pichai received Padma Bhushan from Government of India, its third highest civilian award.
Sundar Pichai, Pichai, In December 2019, Pichai became CEO of Alphabet Inc.
Sundar Pichai, Pichai, Born in Madurai, India, Pichai earned his degree from IIT Kharagpur in metallurgical engineering.
Sundar Pichai, Pichai, Pichai was selected to become next CEO of Google on August 10, 2015 after previously being appointed Product Chief by CEO, Larry Page.
Sundar Pichai, Pichai, Pichai joined Google in 2004, where he led product management and innovation efforts for a suite of Google's client software products, including Google Chrome and Chrome OS, as well as being largely responsible for Google Drive.
Sundar Pichai, Pichai, In August 2017, Pichai drew publicity for firing a Google employee who wrote a ten page Google's Ideological Echo Chamber manifesto criticizing company's diversity policies and arguing that "distribution of preferences and abilities of men and women differ in part due to biological causes and ... these differences may explain why we don't see equal representation of women in tech and leadership".
Sundar Pichai, Pichai, Pichai was included in Time (magazine) Time's Time 100 annual list of 100 most influential people in 2016 and 2020.
Sundar Pichai, Pichai, Pichai is married to Anjali Pichai and has two children.
Sundar Pichai, Pichai, In December 2017, Pichai was a speaker at World Internet Conference in China, where he stated that "a lot of work Google does is to help Chinese companies.
Sundar Pichai, Pichai, In December 2020, Pichai delivered a speech virtually at Singapore FinTech Festival emphasizing inclusive digital economy.
Sundar Pichai, Pichai, Pichai had been suggested as a contender for Microsoft's CEO in 2014, a position that was eventually given to Satya Nadella.
Sundar Pichai, Pichai, Pichai Sundararajan (born June 10, 1972), better known as Sundar Pichai (), is an Indian American business executive.
Sundar Pichai, Pichai, His mother, Lakshmi, was a stenographer, and his father, Regunatha Pichai, was an electrical engineer at General Electric Company GEC, British Conglomerate (company) conglomerate.
Sundar Pichai, Pichai, https //en.wikipedia.org/wiki/Sundar_Pichai
Sundar Pichai, Pichai, While noting that manifesto raised a number of issues that are open to debate, Pichai said in a memo to Google employees that "to suggest a group of our colleagues have traits that make them less biologically suited to that work is offensive and not OK".
Sundar Pichai, Pichai, In 2013, Pichai added Android (operating system)
Sundar Pichai, Pichai, Sundar Pichai
Sundar Pichai, Pichai, Pichai completed schooling in Jawahar Vidyalaya Senior Secondary School in Ashok Nagar, Chennai and completed Class XII from Vanavani Matriculation Higher Secondary School Vana Vani school at IIT Madras.
Sundar Pichai, Pichai, Wired (magazine) Wired's Issie Lapowsky characterized Pichai's appearance before committee as a "major missed opportunity," since, as she wrote, its members "staked out opposite sides of a partisan battle".
Sundar Pichai, Pichai, In May 2021, Pichai talked about technology and AI with Marques Brownlee aka MKBHD.
Sundar Pichai, Pichai, Pichai said at conclusion of his speech,
Sundar Pichai, Pichai, Pichai worked in engineering and product management at Applied Materials and in management consulting at McKinsey & Company.
Sundar Pichai, Pichai, Pichai was selected to become next CEO of Google on August 10, 2015, after previously being appointed Chief Product Officer Product Chief by CEO Larry Page.
Sundar Pichai, Pichai, "Sundar Pichai's rise to fame in 90 seconds", Tech Gurus, The Daily Telegraph
Sundar Pichai, Pichai, In 2010, Pichai also announced open sourcing of new video codec VP8 by Google and introduced new video format, WebM.
Sundar Pichai, 2004, Following a short stint at management consulting firm McKinsey & Co., Pichai joined Google in 2004, where he led product management and innovation efforts for a suite of Google's client software products, including Google Chrome and Chrome OS, as well as being largely responsible for Google Drive.
Sundar Pichai, 2004, Pichai joined Google in 2004, where he led product management and innovation efforts for a suite of Google's client software products, including Google Chrome and Chrome OS, as well as being largely responsible for Google Drive.
Sundar Pichai, Gmail, In addition, he went on to oversee development of other applications such as Gmail and Google Maps.
Sundar Pichai, Gmail, He went on to oversee development of other applications such as Gmail and Google Maps.
Sundar Pichai, Google Maps, In addition, he went on to oversee development of other applications such as Gmail and Google Maps.
Sundar Pichai, Google Maps, He went on to oversee development of other applications such as Gmail and Google Maps.
Sundar Pichai, 2010, In 2010, Pichai also announced open sourcing of new video codec VP8 by Google and introduced new video format, WebM.
Sundar Pichai, 2010, On May 20, 2010, he announced open sourcing of new video codec VP8 by Google and introduced new video format, WebM.
