Sundar Pichai, 1934, In October 2020, United States Senate Committee on Commerce, Science, and Transportation unanimously voted in favor of, and on a bipartisan basis, to subpoena Pichai, along with CEOs of Facebook and Twitter, to testify before committee in response to lawmakers' concerns over technology industry's exemption from Section 230 of Communications Decency Act of 1934.
Sundar Pichai, Commerce, In October 2020, United States Senate Committee on Commerce, Science, and Transportation unanimously voted in favor of, and on a bipartisan basis, to subpoena Pichai, along with CEOs of Facebook and Twitter, to testify before committee in response to lawmakers' concerns over technology industry's exemption from Section 230 of Communications Decency Act of 1934.
Sundar Pichai, 2022, In 2022, Pichai received Padma Bhushan from Government of India, its third highest civilian award.
Sundar Pichai, Padma Bhushan, In 2022, Pichai received Padma Bhushan from Government of India, its third highest civilian award.
Sundar Pichai, Padma Bhushan, Category Recipients of Padma Bhushan in trade and industry
Sundar Pichai, third, In 2022, Pichai received Padma Bhushan from Government of India, its third highest civilian award.
Sundar Pichai, two, Pichai is married to Anjali Pichai and has two children.
